Column1,index,symbol,long name,currency,exchange,industry,description,sector,country,ipo date,shorter name,Type,Industries,Similar Companies,price,mktCap,name raw,currency symbol,robinhood name,short name,Warrant,shortest name,url name, smart_order ,random csv equations,pure name,shortest - pure diff,order,first_letter
3470.0,9758.0,HLIT,Harmonic Inc,USD,NASDAQ,Communication Equipment,"Harmonic, Inc. engages in the development and sale of video delivery software, products, system solutions, and services. The company is headquartered in San Jose, California and currently employs 814 full-time employees. The firm has two segments: Video and Cable Edge. Harmonic provides technical support and professional services to its customers around the world. The Video segment sells video processing and production, and playout solutions and services to broadcast and media companies, streaming media companies, cable operators, and satellite and telecommunications (telco), and pay television (TV) service providers. Its Cable Edge business sells cable edge solutions and related services to cable operators around the world. The Video segment offers a range of products and solutions, as well as software-based media processing platforms. The firm's Narrowcast Services Gateway (NSG) products are integrated edge gateway products that integrate routing, multiplexing, scrambling and modulation into a single package for the delivery of narrowcast services to subscribers over cable networks.",Technology,US,5/22/1995,Harmonic,Stock,"['Technology', 'Communication Equipment']",['XLK'],6.25,610923780.0,Harmonic Inc,$,Harmonic,Harmonic,False,Harmonic,harmonic,"$900,000,000,610,923,000.00 ",,Harmonic,0.0,3471,H
3471.0,11578.0,HLX,Helix Energy Solutions Group Inc,USD,NYSE,Oil & Gas Equipment & Services,"Helix Energy Solutions Group, Inc. is an international offshore energy company. The company is headquartered in Houston, Texas and currently employs 1,546 full-time employees. The firm provides services to the offshore energy industry, with a focus on well intervention and robotics operations. The firm operates in three segments: Well Intervention, Robotics and Production Facilities. Its Well Intervention segment includes the Company's vessels and equipment used to perform well intervention services primarily in the Gulf of Mexico and North Sea regions. Its Robotics segment includes remotely operated vehicles (ROVs), trenchers and ROVDrills designed to complement offshore construction and well intervention services, and operates chartered ROV support vessels. Its Production Facilities segment includes the Helix Producer I (the HP I), a floating production vessel, the Helix Fast Response System (the HFRS), and its ownership interest in Independence Hub, LLC (Independence Hub).",Energy,US,7/1/1997,Helix Energy Solutions,Stock,"['Energy', 'Oil & Gas Equipment & Services', 'Oil & Gas - Services']","['SPN', 'HAL', 'EPD', 'OII', 'TTI']",2.99,448981376.0,Helix Energy Solutions Group Inc,$,0,Helix Energy Solutions,False,Helix Energy Solutions,helix-energy,"$900,000,000,448,981,000.00 ",,Helix Energy Solutions,0.0,3472,H
3472.0,7712.0,HMHC,Houghton Mifflin Harcourt Co,USD,NASDAQ,Education & Training Services,"Houghton Mifflin Harcourt Co. engages in the provision of pre-K-12 education solutions, delivering content, technology, services, and media. The company is headquartered in Boston, Massachusetts and currently employs 3,600 full-time employees. The firm operates through two segments: Education and Trade Publishing. As of December 31, 2016, the Company delivered content, services and technology to both educational institutions and consumers, reaching over 50 million students in approximately 150 countries across the world. The company sells its products and services across multiple media and distribution channels. Its Education segment provides educational content, services and technology solutions to meet the diverse needs of classrooms. Its Trade Publishing segment develops, markets and sells consumer books in print and digital formats, and licenses book rights to other publishers and electronic businesses in the United States and abroad.",Consumer Defensive,US,11/14/2013,Houghton Mifflin Harcourt,Stock,"['Consumer Defensive', 'Education & Training Services', 'Education']",[],2.44,307074016.0,Houghton Mifflin Harcourt Co,$,0,Houghton Mifflin Harcourt,False,Houghton Mifflin Harcourt,houghton-mifflin,"$900,000,000,307,074,000.00 ",,Houghton Mifflin Harcourt,0.0,3473,H
3473.0,235.0,HMI,Huami each,CNY,NYSE,Scientific & Technical Instruments,"Huami Corp. engages in the development, manufacture, and sale of smart wearable technology devices. The company is headquartered in Hefei, Anhui and currently employs 694 full-time employees. The firm designs and develops biometric and activity data-driven fitness and smart watches. The firm markets its products under the brand name, Amazfit and is the sole partner for Xiaomi wearable products. The Amazfit range of products includes Amazfit BIP, Amazfit pace, Amazfit equator, Amazfit ARC, and accessories, such as sports bands, watch straps, ear buds, charging units, and core trackers. The smart watches provides features that include activity tracking, sleep tracking, smart notifications from mobile devices, GPS, heart rate sensing, water resistance, wireless syncing with mobile phones. The company also provides a mobile application to keep track of the fitness information, set alarms and receive call notifications on the smart watch. The firm is the sole partner of Xiaomi wearables, including the Mi band series.",Technology,CN,2/8/2018,Huami Corp,Stock,[],['XLK'],12.65,788726210.0,Huami each representing four,CNY,Huami,Huami,False,Huami,huami,"$900,000,000,788,726,000.00 ",,Huami,0.0,3474,H
3474.0,29.0,HMLP,Hoegh LNG Partners LP,USD,NYSE,Oil & Gas Midstream,"Höegh LNG Partners LP engages in undertaking of floating storage and re-gasification units (FSRUs). The firm's segments include Majority held FSRUs, Joint venture FSRUs and other. The Majority held FSRUs segment includes the direct financing lease related to the PT Perusahaan Gas Negara (Persero) Tbk (PGN) FSRU Lampung and the operating lease related to the Hoegh Gallant. The Joint venture FSRUs segment includes approximately two FSRUs, including the GDF Suez LNG Supply S.A. (GDF Suez) Neptune and the GDF Suez Cape Ann, which operate under long term time charters. The firm intends to acquire newbuilding FSRUs on long-term charters, rather than FSRUs based on retrofitted, first-generation LNG carriers. The PGN FSRU Lampung is located offshore in the Lampung province at the southeast coast of Sumatra, Indonesia.",Energy,BM,8/7/2014,Hoegh LNG Partners LP,Stock,"['Industrials', 'Shipping & Ports', 'Transportation & Logistics']",[],12.36,400246464.0,Hoegh LNG Partners LP representing Limited Partner Interests,$,Hoegh LNG,Hoegh LNG,False,Hoegh LNG,hoegh-lng,"$900,000,000,400,246,000.00 ",,Hoegh LNG,0.0,3475,H
3475.0,9569.0,HMST,HomeStreet Inc,USD,NASDAQ,Banks Regional,"HomeStreet, Inc. is a holding company, which engages in the provision of commercial and consumer banking and real estate lending services. The company is headquartered in Seattle, Washington and currently employs 2,036 full-time employees. The firm is principally engaged in real estate lending, including mortgage banking activities, and commercial and consumer banking. The firm's operating segments include Commercial and Consumer Banking, and Mortgage Banking. The company provides financial products and services to its commercial and consumer customers through retail deposit branches and commercial lending centers, automated teller machines (ATMs), and online, mobile and telephone banking. The firm originates single family residential mortgage loans for sale in the secondary markets. Its mortgage loans are sold to or securitized by Fannie Mae, The Federal Home Loan Mortgage Corporation (Freddie Mac) or The Government National Mortgage Association (Ginnie Mae), while it retains the right to service these loans. The company also provides insurance products and services for consumers and businesses.",Financial Services,US,2/10/2012,HomeStreet,Stock,"['Financial Services', 'Savings & Cooperative Banks', 'Banks']","['UBSI', 'FBC', 'WSBF', 'UBSH']",33.3,725537020.0,HomeStreet Inc,$,HomeStreet,HomeStreet,False,HomeStreet,homestreet,"$900,000,000,725,537,000.00 ",,HomeStreet,0.0,3476,H
3476.0,11619.0,HMTV,Hemisphere Media Group Inc,USD,NASDAQ,Entertainment,"Hemisphere Media Group, Inc. engages in the operation of networks and content production platform, which includes movie and telenovela channels. The company is headquartered in Coral Gables, Florida and currently employs 305 full-time employees. As of December 31, 2016, the Company served the United States Hispanic and Latin American markets with five Spanish-language cable television networks distributed in the United States, two Spanish-language cable television networks distributed in Latin America, and a broadcast television network in Puerto Rico. As of December 31, 2016, the Company owned and operated the Spanish language networks and content production platform, including movie and telenovela channels, two Hispanic entertainment genres, and the cable television networks. The firm's United States Hispanic groups include Cinelatino, WAPA, WAPA America, Pasiones, Centroamerica TV and Television Dominicana. WAPA is an independent broadcast television network. WAPA is distributed by various cable, satellite and telecommunication service providers in Puerto Rico.",Communication Services,US,4/4/2013,Hemisphere Media,Stock,"['Communication Services', 'Pay TV']","['CMCSA', 'DISCA', 'TV', 'DIS', 'AMCX', 'VIAB', 'FOXA']",11.0,439577600.0,Hemisphere Media Group Inc,$,0,Hemisphere Media,False,Hemisphere Media,hemisphere-media,"$900,000,000,439,577,000.00 ",,Hemisphere Media,0.0,3477,H
3477.0,3321.0,HNGR,Hanger Inc,USD,NYSE,Medical Care Facilities,"Hanger, Inc. provides orthotic and prosthetic patient care products and services. The company is headquartered in Austin, Texas and currently employs 4,600 full-time employees. The firm delivers orthotic and prosthetic (O&P) patient care, products, services and therapeutic solutions. The firm offers advanced prosthetics and orthotics, clinically differentiated programs and unsurpassed customer service. The firm comprises nine business units that serve various segments of the O&P industry. The firm's segments include Patient Care, and Products & Services. The Patient Care segment includes Hanger Clinic and Linkia. The Hanger Clinic specializes in orthotic and prosthetic services and products. Linkia is a specialty healthcare company, which is engaged in the O&P management and care. The Products & Services segment includes Southern Prosthetic Supply (SPS), Accelerated Care Plus (ACP), SureFit, Innovative Neurotronics, Inc. and SPS National Labs.",Healthcare,US,2/21/1986,Hanger Inc,Stock,,,21.09,803727230.0,Hanger Inc,$,Hanger,Hanger,False,Hanger,hanger,"$900,000,000,803,727,000.00 ",,Hanger,0.0,3478,H
3478.0,10625.0,HOFT,Hooker Furniture Corp,USD,NASDAQ,"Furnishings, Fixtures & Appliances","Hooker Furniture Corp. is a home furnishings marketing and logistics company. The company is headquartered in Martinsville, Virginia and currently employs 1,263 full-time employees. The firm operates through three segments: casegoods furniture, upholstered furniture and all other. The firm's casegoods product categories include accents, home office, dining, bedroom and home entertainment furniture under the Hooker Furniture brand. Its residential upholstered seating companies include Bradington-Young, which is engaged in upscale motion and stationary leather furniture, and Sam Moore Furniture, which is engaged in upscale occasional chairs, settees, sofas and sectional seating with a focus on cover-to-frame customization. The company also markets a line of imported leather upholstery under the Hooker Upholstery trade name. All other segment operates under the H Contract and Homeware brands.",Consumer Cyclical,US,4/12/2001,Hooker Furniture,Stock,"['Consumer Cyclical', 'Home Furnishings & Fixtures', 'Manufacturing - Apparel & Furniture']","['BSET', 'FLXS', 'LZB', 'NTZ', 'NVFY', 'SNBR']",30.46,362169376.0,Hooker Furniture Corp,$,0,Hooker Furniture,False,Hooker Furniture,hooker-furniture,"$900,000,000,362,169,000.00 ",,Hooker Furniture,0.0,3479,H
3479.0,8010.0,HOLI,Hollysys Automation Technologies Ltd,USD,NASDAQ,Electrical Equipment & Parts,"HollySys Automation Technologies Ltd. is a holding company, which engages in the provision of automation control system solutions. The company is headquartered in Beijing, Beijing and currently employs 3,301 full-time employees. The firm's segments include Industrial Automation (IA), Rail Transportation (rail), Mechanical and Electrical (M&E), and Miscellaneous. Its technologies are applied through its industrial automation solution suite, including the Distributed Control Systems, Programmable Logic Controller, Real-time Management Information System, HolliAS Asset Management System, Operator Training System, Batch Application Package, Advanced Process Control Package (HolliAS APC Suite), Safety Instrumentation System (SIS), railway signaling system of Train Control Center, Automatic Train Protection, Subway Supervisory and Control platform, nuclear power non-safety automation and control system HolliAs-NMS DCS and other products. The company serves customers in the industrial, railway, subway, nuclear power, and mechanical and electronic industries in China, Southeast Asia, India, Europe and the Middle East.",Industrials,CN,8/1/2008,Hollysys Automation Technologies,Stock,"['Industrials', 'Diversified Industrials', 'Industrial Products']","['PRCP', 'ROK', 'EMR', 'ABB']",12.1,732498940.0,Hollysys Automation Technologies Ltd,$,Hollysys Automation Technologies,Hollysys Automation Technologies,False,Hollysys Automation Tech,hollysys-automation,"$900,000,000,732,498,000.00 ",,Hollysys Automation Tech,0.0,3480,H
3480.0,11678.0,HOME,At Home Group Inc,USD,NYSE,Specialty Retail,"At Home Group, Inc. operates home decor superstores. The company is headquartered in Plano, Texas and currently employs 5,364 full-time employees. The firm is focused on providing a range of assortment of products for any room, in any style, for any budget. As of July 30, 2016, the Company offered over 50,000 stock keeping units (SKUs) throughout its stores. As of July 30, 2016, the Company's store base is consisted of 115 format stores across 29 states and 65 markets, averaging approximately 120,000 square feet per store.",Consumer Cyclical,US,8/4/2016,At Home,Stock,"['Consumer Cyclical', 'Specialty Retail', 'Retail - Apparel & Specialty']",[],14.63,940275970.0,At Home Group Inc,$,0,At Home,False,At Home,at-home,"$900,000,000,940,275,000.00 ",,At Home,0.0,3481,H
3481.0,8941.0,HONE,HarborOne Bancorp Inc,USD,NASDAQ,Banks Regional,"HarborOne Bancorp, Inc. is a bank holding company, which engages in the provision of co-operative banking services through its subsidiary HarborOne Bank. The company is headquartered in Brockton, Massachusetts and currently employs 658 full-time employees. The firm's principal subsidiary is HarborOne Bank (the Bank), a state chartered co-operative bank whose primary subsidiary is a residential mortgage company, Merrimack Mortgage Company, LLC (Merrimack Mortgage). The firm operates through two segments: HarborOne Bank and Merrimack Mortgage. The Bank segment provides consumer and business banking products and services to customers. Consumer products include loan and deposit products, and business banking products include loans for working capital, inventory and general corporate use, commercial real estate construction loans and deposit accounts. The Merrimack Mortgage segment consists of originating residential mortgage loans primarily for sale in the secondary market. The firm's subsidiary, Legion Parkway Company LLC, is a security company.",Financial Services,US,6/30/2016,HarborOne Bancorp,Stock,"['Financial Services', 'Savings & Cooperative Banks', 'Banks']",[],9.98,582258110.0,HarborOne Bancorp Inc,$,HarborOne Bancorp,HarborOne Bancorp,False,HarborOne Bancorp,harborone-ban,"$900,000,000,582,258,000.00 ",,HarborOne Bancorp,0.0,3482,H
3482.0,3416.0,HOOK,HOOKIPA Pharma Inc,USD,NASDAQ,Biotechnology,"HOOKIPA Pharma, Inc. engages in the development of immunotherapeutics, targeting infectious diseases and cancers based on its proprietary arenavirus platform that is designed to reprogram the body's immune system. The company is headquartered in New York City, New York and currently employs 60 full-time employees. The firm is developing products to prevent and cure infectious diseases and cancer. The firm's infectious and oncology product candidates HB-101, HB-201 and HB-202. The infectious disease product candidate, HB-101, is in a randomized, double-blinded Phase II clinical trial in cytomegalovirus-negative patients awaiting kidney transplantation from cytomegalovirus-positive donors. Its lead oncology product candidates, HB-201 and HB-202, are in development for the treatment of human papillomavirus-positive cancers. The firm offers VaxWave technology, which is designed to induce a robust CD8+ T cell and pathogen neutralizing response to fight disease. VaxWave technology supports the benefits of our arenavirus platform approach.",Healthcare,US,4/18/2019,HOOKIPA Pharma Inc,Stock,,,11.09,284507296.0,HOOKIPA Pharma Inc,$,Hookipa Pharma Inc,Hookipa Pharma Inc,False,Hookipa Pharma ,hookipa-pharma-inc,"$900,000,000,284,507,000.00 ",,Hookipa Pharma,1.0,3483,H
3483.0,8533.0,HOV,Hovnanian Enterprises Inc,USD,NYSE,Residential Construction,"Hovnanian Enterprises, Inc. is a homebuilding company, which engages in the design, construct, market, and sell single-family attached town homes and condominiums, urban infill, and planned residential developments. The company is headquartered in Red Bank New Jersey, New Jersey and currently employs 1,868 full-time employees. The firm designs, constructs, markets and sells single-family detached homes, attached townhomes and condominiums, urban infill and active lifestyle homes in planned residential developments. The firm has two distinct operations: homebuilding and financial services. Its homebuilding operations consist of six segments: Northeast: New Jersey and Pennsylvania; Mid-Atlantic: Delaware, Maryland, Virginia, Washington, District of Columbia, and West Virginia; Midwest: Illinois and Ohio; Southeast: Florida, Georgia and South Carolina; Southwest: Arizona and Texas, and West: California. Its financial services operations provide mortgage loans and title services to the customers of its homebuilding operations. The firm markets and builds homes for first-time buyers, first-time and second-time move-up buyers, luxury buyers, active lifestyle buyers and empty nesters.",Consumer Cyclical,US,9/8/1983,Hovnanian Enterprises,Stock,"['Consumer Cyclical', 'Residential Construction', 'Homebuilding & Construction']","['CVCO', 'PHM', 'NVR', 'DHI', 'LEN', 'MDC', 'TOL', 'KBH', 'CHCI']",37.68,231434336.0,Hovnanian Enterprises Inc,$,Hovnanian Enterprises,Hovnanian Enterprises,False,Hovnanian Enterprises,hovnanian-enterprises,"$900,000,000,231,434,000.00 ",,Hovnanian Enterprises,0.0,3484,H
3484.0,276.0,HPF,John Hancock Pfd Income Fund II Pfd Income Fund II,USD,NYSE,Asset Management,"John Hancock Preferred Income Fund II is a closed-end management investment company. The Fund's primary investment objective is to provide a high level of current income consistent with preservation of capital. The Fund's secondary investment objective is to provide growth of capital to the extent consistent with its primary investment objective. The Fund seeks to achieve its objectives by investing in a diversified portfolio of securities that may be undervalued relative to similar securities in the marketplace. Under market conditions, the Fund invests at least 80% of its assets in preferred stocks and other preferred securities, including convertible preferred securities; 25% or more of its total assets in industries comprising the utilities sector. The Fund's portfolio sector includes financials, utilities, energy, telecommunication services, healthcare, consumer staples, industrials and short-term investments. John Hancock Advisers, LLC serves as investment advisor for the Fund.",Financial Services,US,11/26/2002,John Hancock Preferred Income Fund II,Stock,"['Financial Services', 'Asset Management']",[],18.13,387488832.0,John Hancock Pfd Income Fund II Pfd Income Fund II,$,John Hancock Preferred Income Fund II,John Hancock Preferred Income Fund II,False,John Hancock Preferred ome Fund II,john-hancock-income,"$900,000,000,387,488,000.00 ",,John Hancock Preferred ome Fund II,0.0,3485,H
3485.0,91.0,HPS,John Hancock Preferred Income Fund III Preferred Income Fund III,USD,NYSE,Asset Management,"John Hancock Preferred Income Fund III is a closed-end management investment company. The Fund seeks to provide a high level of current income consistent with preservation of capital. The Fund's secondary investment objective is to provide growth of capital to the extent consistent with its primary objective. It invests approximately 80% of its assets (net assets plus borrowings for investment purposes) in preferred stocks and other preferred securities, including convertible preferred securities. In addition, the Fund invests approximately 25% or more of its total assets in the industries comprising the utilities sector. Its portfolio includes preferred securities-United States, Preferred securities-Foreign, common stocks, corporate bonds, and short term investments and other. It invests in various sectors, including financials, utilities, energy, healthcare and consumer staples. John Hancock Advisers, LLC serves as investment advisor for the Fund.",Financial Services,US,6/17/2003,John Hancock Preferred Income Fund III,Stock,"['Financial Services', 'Asset Management']",[],16.45,521420608.0,John Hancock Preferred Income Fund III Preferred Income Fund III,$,John Hancock Preferred Income Fund III,John Hancock Preferred Income Fund III,False,John Hancock Preferred ome Fund III,john-hancock-income,"$900,000,000,521,420,000.00 ",,John Hancock Preferred ome Fund III,0.0,3486,H
3486.0,11522.0,HQCL,Hanwha Q CELLS Co. Ltd.,USD,NASDAQ,Semiconductors,,Technology,,,Hanwha Q CELLS,Stock,"['Technology', 'Solar', 'Semiconductors']",['XLK'],9.84,816305000.0,Hanwha Q CELLS Co. Ltd.,$,0,Hanwha Q CELLS,False,Hanwha Q CELLS,hanwha-q-cells,"$900,000,000,816,305,000.00 ",,Hanwha Q CELLS,0.0,3487,H
3487.0,6674.0,HQH,Tekla Healthcare Investors,USD,NYSE,Asset Management,"Tekla Healthcare Investors is a non-diversified closed-end healthcare fund. The Fund's investment objective is to seek long-term capital appreciation by investing primarily in securities of healthcare companies. It seeks to provide regular distribution of realized capital gains. It may invest up to 20% of its net assets in securities of foreign issuers, located primarily in Western Europe, Canada and Japan, and securities of United States issuers that are traded in foreign markets. It invests in healthcare industries and is focused on the smaller, emerging companies, investing a maximum of 40% of the Fund's assets in restricted securities of both public and private companies. The Fund invests in subsectors, such as biotechnology, pharmaceuticals, healthcare equipment, healthcare supplies, life science tools and services, healthcare distributors, managed healthcare, healthcare technology, and healthcare facilities. Tekla Capital Management LLC is the advisor of the Fund.",Financial Services,US,4/23/1987,Tekla Healthcare Investors,Stock,"['Financial Services', 'Asset Management']",[],21.2,913361730.0,Tekla Healthcare Investors,$,Tekla Healthcare Investors,Tekla Healthcare Investors,False,Tekla Healthcare Investors,tekla-healthcare,"$900,000,000,913,361,000.00 ",,Tekla Healthcare Investors,0.0,3488,H
3488.0,3402.0,HQI,Hirequest Inc,USD,NASDAQ,Staffing & Employment Services,"HireQuest, Inc. engages in providing temporary staffing services. The company is headquartered in Goose Creek, South Carolina and currently employs 30 full-time employees. The firm provides back-office and operational support for HireQuest Direct and HireQuest franchised branch locations across the United States. HireQuest Direct provides temporary staffing services, which includes general labor, industrial and construction personnel. HireQuest provides temporary staffing services, which includes skilled, semi-skilled and general labor industrial personnel, as well as clerical and secretarial personnel. The firm provides employment in the areas of construction, manufacturing, hospitality, warehousing, janitorial services, waste management and recycling companies, and special events. The firm operates a network of more than 146 franchised and Company owned branch offices in 31 states and the District of Columbia. The company provides training and ongoing support on compensation and tools.",Industrials,US,5/7/2002,Hirequest Inc,Stock,,,8.32,113067128.0,Hirequest Inc,$,HireQuest,HireQuest,False,HireQuest,hirequest,"$900,000,000,113,067,000.00 ",,HireQuest,0.0,3489,H
