Column1,index,symbol,long name,currency,exchange,industry,description,sector,country,ipo date,shorter name,Type,Industries,Similar Companies,price,mktCap,name raw,currency symbol,robinhood name,short name,Warrant,shortest name,url name, smart_order ,random csv equations,pure name,shortest - pure diff,order,first_letter
,,HAW.AX,Hawthorn Resources Ltd,AUD,ASX,Materials,"Hawthorn Resources Limited, together with its subsidiaries, explores for gold and base metal deposits in Western Australia. It holds interest in the Trouser Legs Mine gold project located in the Eastern Goldfields of Western Australia. The company was incorporated in 1985 and is based in Melbourne, Australia.",Metals & Mining,AU,7/3/1986,Hawthorn Resources Ltd,,,,0.09,30016442.0,Hawthorn Resources Ltd,A$,Hawthorn Resources Ltd,Hawthorn Resources Ltd,,Hawthorn Resources Ltd,haw.ax,,,Hawthorn Resources Ltd,,14467,H
,,HAW.DE,Hawesko Holding AG,EUR,XETRA,Food & Staples Retailing,"Hawesko Holding AG, together with its subsidiaries, engages in the trading and sale of wines, champagnes, and other alcoholic drinks in Germany, rest of Europe, and internationally. The company operates through three segments: Retail, B2B, and E-commerce. It operates a network of retail outlets under the Jacques' Wein-Depot and Wein & Co. brand name. The company sells its products to end customers, various sales channels, catering trade, and retailers through specialty retail stores and wholesale operations/distribution, as well as through distance selling primarily under the Hawesko and Vinos names. As of December 31, 2019, it operated 320 Jacques' Wein-Depot outlets, as well as 20 branches of Wein & Co. in Austria. The company was founded in 1964 and is headquartered in Hamburg, Germany. Hawesko Holding AG is a subsidiary of Tocos Beteiligung GmbH.",Retail,DE,5/27/1998,Hawesko Holding AG,,,,44.7,401557984.0,Hawesko Holding AG,,Hawesko Holding AG,Hawesko Holding AG,,Hawesko Holding AG,haw.de,,,Hawesko Holding AG,,14468,H
,,HAYD.L,Haydale Graphene Industries PLC,GBP,LSE,Materials,"Haydale Graphene Industries plc, through its subsidiaries, functionalizes graphene and other nanomaterials in the United Kingdom, Europe, the United States, China, Thailand, South Korea, Japan, and internationally. It operates through Resins, Polymers, Composites & Inks; and Advanced Materials segments. The company offers composites; elastomers; graphene and silver-based complex fluids for radio frequency identification market; piezo resistive nanomaterial enhanced inks graphene-based sensor systems; flexible electronics; and test strips for self-diagnostic biomedical sensor device. It also provides silicon carbide whiskers for ceramic cutting tools, technical ceramics, protective coatings, ceramic and metal matrix coatings, fiber reinforced plastics, and plant cell transformation applications, as well as consulting services. The company was formerly known as Innovative Carbon Limited and changed its name to Haydale Graphene Industries PLC in March 2014. Haydale Graphene Industries PLC was incorporated in 2010 and is headquartered in Ammanford, the United Kingdom.",Chemicals,GB,4/14/2014,Haydale Graphene Industries PLC,,,,7.75,32959202.0,Haydale Graphene Industries PLC,,Haydale Graphene Industries PLC,Haydale Graphene Industries PLC,,Haydale Graphene Industries PLC,hayd.l,,,Haydale Graphene Industries PLC,,14469,H
,,HBC1.DE,HSBC Holdings PLC,EUR,XETRA,Banks,"HSBC Holdings plc provides banking and financial products and services worldwide. The company operates through Retail Banking and Wealth Management, Commercial Banking, Global Banking and Markets, and Global Private Banking segments. The Retail Banking and Wealth Management segment offers personal banking products and services, such as current and savings accounts, mortgages and personal loans, credit and debit cards, and local and international payment services; and wealth management services, including insurance and investment products, global asset management services, and financial planning services. The Commercial Banking segment provides credit and lending, treasury management, payment, cash management, commercial insurance, and investment services, as well as commercial cards, and international trade and receivables finance services; and foreign exchange products, and capital raising and advisory services to small and medium sized enterprises, mid-market enterprises, and corporates. The Global Banking and Markets segment is involved in the provision of financing, advisory, and transaction services, including credit, rates, foreign exchange, equities, money markets, and securities services, as well as principal investment activities to government, corporate and institutional clients, and private investors. The Global Private Banking segment provides a range of services to high net worth individuals and families with complex and international needs. HSBC Holdings plc was founded in 1865 and is headquartered in London, the United Kingdom.",Banking,GB,6/11/1992,HSBC Holdings PLC,,,,4.57,93592682000.0,HSBC Holdings PLC,,HSBC Holdings PLC,HSBC Holdings PLC,,HSBC Holdings PLC,hbc1.de,,,HSBC Holdings PLC,,14470,H
,,HBH3.SW,Hornbach Holding AG & Co KGaA,CHF,SIX,Retailing,"HORNBACH Holding AG & Co. KGaA, through its subsidiaries, operates do-it-yourself (DIY) megastores with garden centers in Germany and other European countries. The company's stores offer approximately 50,000 articles in various divisions, including hardware/electrical, paint/wallpaper/flooring, construction materials/timber/prefabricated components, sanitary/tiles, and garden. It also provides a range of construction materials and tools stocked and supply services, as well as professional advice for various product ranges and lines of trade, including shell construction and roofing; interior fittings and facades; and civil engineering, and garden and landscape construction materials for construction, conversion, or refurbishment projects. In addition, the company develops and rents retail real estate properties. As of February 29, 2020, it operated 160 DIY megastores, including 96 stores in Germany; and 14 stores in Austria, 15 stores in the Netherlands, 1 store in Luxembourg, 10 stores in the Czech Republic, 7 stores in Switzerland, 7 stores in Sweden, 7 stores in Slovakia, and 6 stores in Romania, as well as 34 builders' merchant outlets in south-western Germany, and two locations in France. The company also operates HORNBACH online stores. HORNBACH Holding AG & Co. KGaA was founded in 1877 and is based in Neustadt an der Weinstraße, Germany.",Retail,DE,10/12/2015,Hornbach Holding AG & Co KGaA,,,,54.6,870869950.0,Hornbach Holding AG & Co KGaA,CHF,Hornbach Holding AG & Co KGaA,Hornbach Holding AG & Co KGaA,,Hornbach Holding AG & Co KGaA,hbh3.sw,,,Hornbach Holding AG & Co KGaA,,14471,H
,,HBH.DE,Hornbach Holding AG & Co KGaA,EUR,XETRA,Retailing,"HORNBACH Holding AG & Co. KGaA, through its subsidiaries, operates do-it-yourself (DIY) megastores with garden centers in Germany and other European countries. The company's stores offer approximately 50,000 articles in various divisions, including hardware/electrical, paint/wallpaper/flooring, construction materials/timber/prefabricated components, sanitary/tiles, and garden. It also provides a range of construction materials and tools stocked and supply services, as well as professional advice for various product ranges and lines of trade, including shell construction and roofing; interior fittings and facades; and civil engineering, and garden and landscape construction materials for construction, conversion, or refurbishment projects. In addition, the company develops and rents retail real estate properties. As of February 29, 2020, it operated 160 DIY megastores, including 96 stores in Germany; and 14 stores in Austria, 15 stores in the Netherlands, 1 store in Luxembourg, 10 stores in the Czech Republic, 7 stores in Switzerland, 7 stores in Sweden, 7 stores in Slovakia, and 6 stores in Romania, as well as 34 builders' merchant outlets in south-western Germany, and two locations in France. The company also operates HORNBACH online stores. HORNBACH Holding AG & Co. KGaA was founded in 1877 and is based in Neustadt an der Weinstraße, Germany.",Retail,DE,10/12/2015,Hornbach Holding AG & Co KGaA,,,,76.0,1212199940.0,Hornbach Holding AG & Co KGaA,,Hornbach Holding AG & Co KGaA,Hornbach Holding AG & Co KGaA,,Hornbach Holding AG & Co KGaA,hbh.de,,,Hornbach Holding AG & Co KGaA,,14472,H
,,HCXZ,"Hercules Capital, Inc.",USD,NYSE,,,Industrials,US,,"Hercules Capital, Inc.",,,,25.05,1304541310.0,"Hercules Capital, Inc.",$,"Hercules Capital, Inc.","Hercules Capital, Inc.",,"Hercules Capital, Inc.",hcxz,,,"Hercules Capital, Inc.",,14473,H
,,HBIA,Hills Bancorporation,USD,PNK,Banks,"Hills Bancorporation operates as the bank holding company for Hills Bank and Trust Company that provides commercial banking services to individuals, businesses, governmental units, and institutional customers. The company accepts various deposits, such as demand, savings, and time deposits. Its loan products include real estate loans comprising mortgage and construction loans; commercial and financial loans; agricultural loans; and personal, automobile, installment, and other consumer loans. The company also maintains night and safe deposit facilities; and provides collection, exchange, and other banking services. In addition, it administers estates, personal trusts, and pension plans; offers farm management, investment advisory, and custodial services for individuals, corporations, and nonprofit organizations; and originates mortgages that are sold in the secondary residential real estate market without mortgage servicing rights being retained. The company operates through its main office and its 18 full service branches in the Iowa counties of Johnson, Linn, and Washington. Hills Bancorporation was founded in 1904 and is headquartered in Hills, Iowa.",Financial Services,US,,Hills Bancorporation,,,,62.0,579200256.0,Hills Bancorporation,$,Hills Bancorporation,Hills Bancorporation,,Hills Bancorporation,hbia,,,Hills Bancorporation,,14474,H
,,HBLN.SW,Hypothekarbank Lenzburg AG,CHF,SIX,Banks,"Hypothekarbank Lenzburg AG provides various banking services and products to private customers and companies in Switzerland. It offers savings accounts; real estate and lease financing; credit and debit cards; investment products; and planning, foreign exchange, retirement, succession, and digital banking services. The company was founded in 1868 and is headquartered in Lenzburg, Switzerland.",Financial Services,CH,8/2/1996,Hypothekarbank Lenzburg AG,,,,4340.0,311499168.0,Hypothekarbank Lenzburg AG,CHF,Hypothekarbank Lenzburg AG,Hypothekarbank Lenzburg AG,,Hypothekarbank Lenzburg AG,hbln.sw,,,Hypothekarbank Lenzburg AG,,14475,H
,,HBLPOWER.NS,HBL Power Systems Ltd,INR,NSE,Capital Goods,"HBL Power Systems Limited manufactures and sells batteries, power electronics, and spun concrete products in India and internationally. The company offers lead acid batteries, including pure lead tin VRLA, tubular gel VRLA, tubular plate vented, and flat plate VRLA batteries; nickel-cadmium batteries, such as pocket plate, sintered plate, and fiber plate batteries; and silver zinc aircraft, missile, torpedo, and reserve batteries. It also provides power electronics comprising thyristor battery chargers, battery monitoring systems, and earth leakage monitors; and engineering solutions, such as training simulators, as well as integrated power supply products, data loggers, audio frequency track circuits, electronic interlocking systems, train collision avoidance systems, and digital axle counters for railways. In addition, the company offers renewable energy products, including off-grid solar systems, such as solar pumps and rooftop systems, as well as concrete products comprising spun concrete poles and piles, and concrete telecom towers. It serves defense, telecom, railways, oil and gas, power utilities, UPS and inverter batteries, and solar power industries. The company was founded in 1977 and is headquartered in Hyderabad, India. HBL Power Systems Limited is a subsidiary of Aluru Family Private Trust.",Electrical Equipment,IN,1/4/2007,HBL Power Systems Ltd,,,,37.0,10256215000.0,HBL Power Systems Ltd,?,HBL Power Systems Ltd,HBL Power Systems Ltd,,HBL Power Systems Ltd,hblpower.ns,,,HBL Power Systems Ltd,,14476,H
,,HCYT,"H-CYTE, Inc.",USD,PNK,Medical Devices,"H-CYTE, Inc., a medical biosciences company, develops and implements various treatment options in regenerative medicine to treat chronic lung diseases. It engages in the development of L-CYTE-01 for the treatment of chronic obstructive pulmonary diseases. The company is headquartered in Tampa, Florida.",Healthcare,US,,"H-CYTE, Inc.",,,,0.05255,6538060.0,"H-CYTE, Inc.",$,"H-CYTE, Inc.","H-CYTE, Inc.",,"H-CYTE, Inc.",hcyt,,,"H-CYTE, Inc.",,14477,H
,,HBM.DE,Hornbach Baumarkt AG,EUR,XETRA,Retailing,"HORNBACH Baumarkt AG operates as a do-it-yourself (DIY) retail company in Germany, Austria, the Czech Republic, Luxembourg, the Netherlands, Romania, Slovakia, Sweden, and Switzerland. It operates through Retail and Real Estate segments. The company offers various DIY goods, home improvement goods, and gardening products in hardware/electrical, paint/wallpaper/flooring, construction materials/timber/prefabricated components, sanitary/tiles, and garden divisions. As of February 28, 2020, the company operated 160 DIY megastores with garden centers in 9 countries. The company was founded in 1877 and is based in Bornheim, Germany. HORNBACH Baumarkt AG is a subsidiary of Hornbach Holding AG & Co. KGaA.",Retail,DE,11/15/1993,Hornbach Baumarkt AG,,,,34.45,1095751170.0,Hornbach Baumarkt AG,,Hornbach Baumarkt AG,Hornbach Baumarkt AG,,Hornbach Baumarkt AG,hbm.de,,,Hornbach Baumarkt AG,,14478,H
,,HBMN.SW,HBM Healthcare Investments AG,CHF,SIX,Diversified Financials,"HBM Healthcare Investments AG is a Switzerland-based venture capital company investing in emerging companies, mainly from the biotechnology and human medicine, diagnostics, as well as medical technology sectors. The Company focuses on unlisted companies, with two-thirds of assets being invested in private companies that offer high value-creation potential. As a holding company, it is involved in the acquisition, disposal and management of a diversified portfolio, as well as in financing and supporting the portfolio firms as a key partner. It focuses on companies with products either at an advanced stage of development or already available on the market. The primary investment areas are Western Europe and the United States. The Company's portfolio includes approximately 25 companies. As of March 31, 2012, the Company had six wholly owned subsidiaries, including three subsidiaries on Cayman Islands, two Barbados-based subsidiaries and a subsidiary in the United States.",Financial Services,CH,2/14/2008,HBM Healthcare Investments AG,,,,351.0,2441938690.0,HBM Healthcare Investments AG,CHF,HBM Healthcare Investments AG,HBM Healthcare Investments AG,,HBM Healthcare Investments AG,hbmn.sw,,,HBM Healthcare Investments AG,,14479,H
,,HBRN.IR,Hibernia REIT Plc,EUR,ISE,REIT—Diversified,"Hibernia REIT plc is an Irish Real Estate Investment Trust (?REIT?), listed on Euronext Dublin and the London Stock Exchange. Hibernia owns and develops property and specialises in Dublin city centre offices.",Real Estate,IE,,Hibernia REIT Plc,,,,1.09,721206208.0,Hibernia REIT Plc,,Hibernia REIT Plc,Hibernia REIT Plc,,Hibernia REIT Plc,hbrn.ir,,,Hibernia REIT Plc,,14480,H
,,HBRN.L,Hibernia REIT PLC,EUR,LSE,Real Estate,"Hibernia REIT plc is an Irish Real Estate Investment Trust (?REIT?), listed on Euronext Dublin and the London Stock Exchange. Hibernia owns and develops property and specialises in Dublin city centre offices.",Real Estate,IE,12/6/2013,Hibernia REIT PLC,,,,1.06,709178180.0,Hibernia REIT PLC,,Hibernia REIT PLC,Hibernia REIT PLC,,Hibernia REIT PLC,hbrn.l,,,Hibernia REIT PLC,,14481,H
,,HBSL.NS,HB Stockholdings Ltd,INR,NSE,Diversified Financials,"HB Stockholdings Limited, a non-banking financial company, engages in the investment and finance activities in India. It is involved in the investment, purchase, and sale of securities. The company was formerly known as HB Portfolio Leasing Limited and changed its name to HB Stockholdings Limited in February 1997. HB Stockholdings Limited was incorporated in 1985 and is based in Gurugram, India.",Financial Services,IN,2/1/1993,HB Stockholdings Ltd,,,,8.95,72549144.0,HB Stockholdings Ltd,?,HB Stockholdings Ltd,HB Stockholdings Ltd,,HB Stockholdings Ltd,hbsl.ns,,,HB Stockholdings Ltd,,14482,H
,,HBUV,Hubilu Venture Corporation,USD,PNK,Real Estate Services,"Hubilu Venture Corporation operates as a real estate consulting, asset management, and business acquisition company. The company assists real estate investor professionals and established companies with advisory and consulting services focused on providing research, analysis, and acquisition opportunities. The company was founded in 2015 and is based in Beverly Hills, California.",Real Estate,US,,Hubilu Venture Corporation,,,,0.17,4460307.0,Hubilu Venture Corporation,$,Hubilu Venture Corporation,Hubilu Venture Corporation,,Hubilu Venture Corporation,hbuv,,,Hubilu Venture Corporation,,14483,H
,,HCCHW,HL Acquisition Corp. WT EXP 062123,USD,NASDAQ,,,Industrials,US,,HL Acquisition Corp. WT EXP 062123,,,,9.67,0.0,HL Acquisition Corp. WT EXP 062123,$,HL Acquisition Corp. WT EXP 062123,HL Acquisition Corp. WT EXP 062123,,HL Acquisition Corp. WT EXP 062123,hcchw,,,HL Acquisition Corp. WT EXP 062123,,14485,H
,,HDFCAMC.NS,HDFC Asset Management Company Ltd,INR,NSE,Diversified Financials,"HDFC Asset Management Company Limited is a publically owned investment manager. The firm launches and manages equity, fixed income, and balanced mutual funds for its clients. It manages equity, fixed income, balanced, and real estate portfolios. The firm invests in public equity and fixed income markets. The firm employs fundamental analysis to make its investments. HDFC Asset Management Company Limited was founded on December 10, 1999 and is based in Mumbai, Maharashtra. HDFC Asset Management Company Limited operates as a subsidiary of Housing Development Finance Corporation Limited.",Financial Services,IN,8/6/2018,HDFC Asset Management Company Ltd,,,,2998.4,638000000000.0,HDFC Asset Management Company Ltd,?,HDFC Asset Management Company Ltd,HDFC Asset Management Company Ltd,,HDFC Asset Management Company Ltd,hdfcamc.ns,,,HDFC Asset Management Company Ltd,,14486,H
,,HCC.NS,Hindustan Construction Company Ltd,INR,NSE,Capital Goods,"Hindustan Construction Company Limited, together with its subsidiaries, primarily provides engineering and construction services in India. It constructs dams, barrages, surface and underground power houses, and water conductor systems, such as tunnels, shafts, penstocks, etc.; and thermal power and nuclear plants, as well undertakes hydro power projects on EPC basis. The company also undertakes irrigation projects comprising canals and lift irrigation projects; and integrated water supply and sanitation projects, such as water and sewage treatment plants, and bulk water transmission projects. In addition, it is involved in building transportation projects, including transport systems, bridges, highways, roads; and rail bridges, metro lines, underground/semi-underground railway station buildings, and support infrastructure, such as rail coach factories, as well as constructs ports and harbors on EPC basis. Further, the company constructs process plants, ancillary buildings, factories, workshops, and pumping stations, as well as develops and constructs residential, commercial, and institutional buildings, and smart cities and townships; and engages in real estate development activities. Additionally, it provides insurance auxiliary services, as well as information technology consulting, toll management, aircraft, hospitality, power development, entertainment, educational, adventure sports, hostel, tourism, and parking services; and operates watersport operations, wineries, and clubs. The company also engages in the manufacture and sale of bamboo articles; retail and leasing businesses; and city management activities. Hindustan Construction Company Limited was founded in 1926 and is based in Mumbai, India.",Construction,IN,1/28/1926,Hindustan Construction Company Ltd,,,,8.55,12876556300.0,Hindustan Construction Company Ltd,?,Hindustan Construction Company Ltd,Hindustan Construction Company Ltd,,Hindustan Construction Company Ltd,hcc.ns,,,Hindustan Construction Company Ltd,,14487,H
,,HCD.AX,Hydrocarbon Dynamics Ltd,AUD,ASX,Energy,"Hydrocarbon Dynamics Ltd. engages in the acquisition, exploration, and development of oil and gas prospects. The company is headquartered in Melbourne, Victoria. The Company’s products are Multi-Flow, Tank Clean, HCD EOR and Soil Remediation product.",Energy ,AU,4/21/2006,Hydrocarbon Dynamics Ltd,,,,0.024,10566960.0,Hydrocarbon Dynamics Ltd,A$,Hydrocarbon Dynamics Ltd,Hydrocarbon Dynamics Ltd,,Hydrocarbon Dynamics Ltd,hcd.ax,,,Hydrocarbon Dynamics Ltd,,14488,H
,,HCDI,"Harbor Custom Development, Inc.",USD,NASDAQ,Real Estate,"Harbor Custom Development, Inc. engages in the real estate development business in Western Washington's Puget Sound region. The company undertakes projects, such as residential lots, home communities, and single family and multi-family properties. It is involved in the land development cycle activities, including land acquisition, entitlements, construction of project infrastructure, home building, marketing, sales, and management of various residential projects. The company was formerly known as Harbor Custom Homes, Inc. and changed its name to Harbor Custom Development, Inc. in August 2019. Harbor Custom Development, Inc. was founded in 2014 and is headquartered in Gig Harbor, Washington.",Real Estate,US,8/28/2020,"Harbor Custom Development, Inc.",,,,3.85,57087800.0,"Harbor Custom Development, Inc.",$,"Harbor Custom Development, Inc.","Harbor Custom Development, Inc.",,"Harbor Custom Development, Inc.",hcdi,,,"Harbor Custom Development, Inc.",,14489,H
,,HCFT,Hunt Companies Finance Trust Inc,USD,NYSE,REIT Mortgage,"Hunt Companies Finance Trust, Inc., a real estate investment trust, focuses on investing in, financing, and managing a portfolio of commercial real estate debt investments in the United States. It primarily invests in transitional floating rate commercial mortgage loans on middle market multi-family assets; and other commercial real estate, including mezzanine loans, preferred equity, commercial mortgage-backed securities, fixed rate loans, construction loans, and other commercial real estate debt instruments. The company is qualified as a real estate investment trust (REIT) under the Internal Revenue Code. As a REIT, it would not be subject to federal income taxes if it distributes at least 90% of its taxable income to its stockholders. The company was formerly known as Five Oaks Investment Corp. and changed its name to Hunt Companies Finance Trust, Inc. in May 2018. Hunt Companies Finance Trust, Inc. was founded in 2012 and is headquartered in New York, New York.",Real Estate,US,3/22/2013,Hunt Companies Finance Trust Inc,,,,3.46,86304168.0,Hunt Companies Finance Trust Inc,$,Hunt Companies Finance Trust Inc,Hunt Companies Finance Trust Inc,,Hunt Companies Finance Trust Inc,hcft,,,Hunt Companies Finance Trust Inc,,14490,H
,,HCFT.L,Highcroft Investments PLC,GBP,LSE,Real Estate,Highcroft Investments PLC is a Real Estate Investment Trust with a premium listing on the main market of the London Stock Exchange (Stock Code: HCFT). The group owns a portfolio of commercial properties based in England and Wales. Highcroft aims to deliver sustainable income and capital growth for its shareholders through accretive asset management initiatives and the recycling of capital.,Real Estate,GB,1/27/1986,Highcroft Investments PLC,,,,695.0,35967500.0,Highcroft Investments PLC,,Highcroft Investments PLC,Highcroft Investments PLC,,Highcroft Investments PLC,hcft.l,,,Highcroft Investments PLC,,14491,H
,,HCG.NS,Healthcare Global Enterprises Ltd,INR,NSE,Health Care Equipment & Services,"HealthCare Global Enterprises Limited, together with its subsidiaries, provides healthcare services focusing on cancer. The company offers cancer diagnosis and treatment services through radiation therapy, medical oncology, and surgery; and fertility treatment services, as well as reproductive medicine services, including assisted reproduction, gynecological endoscopy, and fertility preservation under the Milann brand. It also operates four multi-specialty hospitals, including three under the HCG brand in Ahmedabad, Bhavnagar, and Rajkot in the state of Gujarat, as well as one under operations and management contract in Hubli in the state of Karnataka that primarily provide cardiology, neurology, orthopedics, gastroenterology, urology, internal medicine, and pulmonary and critical care. In addition, the company offers medical diagnostic services, including scientific testing and consultancy services in the pharmaceutical and medical sector. As of March 31, 2020, it operated 22 cancer centers, including 1 center of excellence in Bengaluru, 3 freestanding diagnostic centers, and 1 day care chemotherapy center across India, as well as 1 center in Africa. The company was founded in 1989 and is based in Bengaluru, India.",Health Care,IN,3/30/2016,Healthcare Global Enterprises Ltd,,,,150.4,18852790300.0,Healthcare Global Enterprises Ltd,?,Healthcare Global Enterprises Ltd,Healthcare Global Enterprises Ltd,,Healthcare Global Enterprises Ltd,hcg.ns,,,Healthcare Global Enterprises Ltd,,14492,H
