Unnamed: 0,index,symbol,long name,currency,exchange,industry,description,sector,country,ipo date,shorter name,Type,Industries,Similar Companies,price,mktCap,name raw,currency symbol,robinhood name,short name,Warrant,shortest name,url name, smart_order ,random csv equations,pure name,shortest - pure diff,first_letter
,,1488.HK,Best Food Holding Company Ltd,HKD,HKSE,Consumer Services,"Best Food Holding Company Limited, an investment holding company, engages in the operation of a chain of restaurants. It operates Chinese fast food and hot pot restaurants. The company also provides management and administration services, as well as leasing and business services; holds properties in Thailand; manufactures condiments; and manufactures and sells handbags. It has operations in the United States, the People's Republic of China, other Asian countries, Italy, Canada, the Netherlands, other European countries, the United Kingdom, Germany, South American countries, the Middle East, and Africa. The company was formerly known as Lee & Man Handbags Holding Limited and changed its name to Best Food Holding Company Limited in October 2016. The company was incorporated in 2011 and is based in Central, Hong Kong. Best Food Holding Company Limited is a subsidiary of Sonic Tycoon Limited.","Hotels, Restaurants & Leisure",HK,6/27/2011,Best Food Holding Company Ltd,,,,0.71,1120848510.0,Best Food Holding Company Ltd,HKD,Best Food Holding Company Ltd,Best Food Holding Company Ltd,,Best Food Holding Company Ltd,1488.hk,,,Best Food Holding Company Ltd,,1
,,1492.HK,China Zhongdi Dairy Holdings Co Ltd,HKD,HKSE,"Food, Beverage & Tobacco","China ZhongDi Dairy Holdings Company Limited, an investment holding company, operates dairy farms in the People's Republic of China. The company operates in two segments, Dairy Farming Business and Import Trading Business. It raises and breeds dairy cows; produces raw milk; and sells reproduced heifers. The company is also involved in the import and sale of cows, alfalfa hay, breeding stock, and other animal husbandry-related products, as well as the provision of import agency services. As of December 31, 2019, it owned and operated eight dairy farms, including Beijing ZhongDi Farm, Inner Mongolia ZhongDi Diary, Helan ZhongDi Farm, Ningxia ZhongDi Farm, Kuandian ZhongDi Farm, Langfang ZhongDi Farm, Tianzhen ZhongDi Farm, and Tianjin ZhongDi Farm. China ZhongDi Dairy Holdings Company Limited was founded in 2002 and is headquartered in Beijing, the People's Republic of China.",Food Products,CN,12/2/2015,China Zhongdi Dairy Holdings Co Ltd,,,,1.1,2867392000.0,China Zhongdi Dairy Holdings Co Ltd,HKD,China Zhongdi Dairy Holdings Co Ltd,China Zhongdi Dairy Holdings Co Ltd,,China Zhongdi Dairy Holdings Co Ltd,1492.hk,,,China Zhongdi Dairy Holdings Co Ltd,,1
,,1495.HK,Jiyi Household International Holdings Ltd,HKD,HKSE,Capital Goods,"Jiyi Holdings Limited, an investment holding company, sells and distributes building and home improvement materials and furnishings in the People's Republic of China. The company operates in two segments, Sale and Distribution of Merchandise, and Provision of Interior Design and Building Engineering Services. It offers building materials, home improvement materials, and furnishings. The company provides its products to customers through direct sales, tenders, and sales outlets. It has 15 sales outlets. The company was formerly known as Jiyi Household International Holdings Limited and changed its name to Jiyi Holdings Limited in August 2020. The company was founded in 1997 and is headquartered in Meizhou, China. Jiyi Holdings Limited is a subsidiary of Xinling Limited.",Trading Companies & Distributors,CN,11/6/2015,Jiyi Household International Holdings Ltd,,,,0.7,544492220.0,Jiyi Household International Holdings Ltd,HKD,Jiyi Household International Holdings Ltd,Jiyi Household International Holdings Ltd,,Jiyi Household International Holdings Ltd,1495.hk,,,Jiyi Household International Holdings Ltd,,1
,,1496.HK,AP Rentals Holdings Ltd,HKD,HKSE,Capital Goods,"AP Rentals Holdings Limited, an investment holding company, engages in the rental of construction, electrical and mechanical (E&M) engineering, and event and entertainment equipment in Hong Kong, Macau, Singapore, and internationally. It operates through Leasing and Trading segments. The company offers equipment planning consultation, transportation, installation, operation, refueling and maintenance, disassembly, outdoor and service station, and other technical support services, as well as various value-added services. Its rental equipment primarily comprise power and energy equipment, high-reach equipment, and material handling equipment, as well as other equipment, such as lifting, earth moving, foundation, road and transportation, tunneling, demolition, and small equipment. The company also sells, trades in, and leases machinery and parts, and construction machinery; and offers repair and maintenance, and delivery services. It serves clients in the construction, E&M engineering, and event and entertainment sectors. The company was founded in 2004 and is headquartered in Tsim Sha Tsui East, Hong Kong.",Trading Companies & Distributors,HK,4/8/2016,AP Rentals Holdings Ltd,,,,0.155,133920000.0,AP Rentals Holdings Ltd,HKD,AP Rentals Holdings Ltd,AP Rentals Holdings Ltd,,AP Rentals Holdings Ltd,1496.hk,,,AP Rentals Holdings Ltd,,1
,,1498.HK,PuraPharm Corp Ltd,HKD,HKSE,"Pharmaceuticals, Biotechnology & Life Sciences","PuraPharm Corporation Limited, an investment holding company, researches, develops, produces, and sells concentrated Chinese medicine granule (CCMG) and Chinese healthcare products in Hong Kong, Mailand China, and internationally. The company operates through five segments: China CCMG, Hong Kong CCMG, Chinese Healthcare Products, Clinics, and Plantation. It offers holistic products under the PuraGold, Haveron, CardioClear, PuraPharm Lingzhi, and Arashi Kuni names; and various therapeutic products under the Nong's, Oncozac, and Immuzac names for Chinese medicine practitioners. It also provides Chinese medicine clinic management system for general clinic management; and operates Chinese medicine clinics under the Nong's name that provide Chinese medicine services and concentrated Chinese medicine granules (CCMG) products. In addition, the company engages in the plantation and trading of raw Chinese herbs; and manufacture and sale of traditional Chinese medicine decoction pieces. Further, it researches, develops, and trades in modernized Chinese medicines; and provides Chinese medical diagnostic services. The company sells its products to hospitals, medical institutions, and medicine practitioners, as well as operates an online store. As of December 31, 2019, the company operated 67 Nong's clinics in Hong Kong and 1 Nong's clinic in Guangxi, China. The company was founded in 1998 and is headquartered in Central, Hong Kong.",Pharmaceuticals,HK,7/8/2015,PuraPharm Corp Ltd,,,,0.74,292220832.0,PuraPharm Corp Ltd,HKD,PuraPharm Corp Ltd,PuraPharm Corp Ltd,,PuraPharm Corp Ltd,1498.hk,,,PuraPharm Corp Ltd,,1
,,1499.HK,Okg Technology Holdings Ltd,HKD,HKSE,Capital Goods,"OKG Technology Holdings Limited, formerly LEAP Holdings Group Ltd., is an investment holding company principally engaged in the provision of foundation works related business. Along with subsidiaries, the Company operates its business through five segments. Foundation works and ancillary services segment is involved in the provision of site formation works, excavation and lateral support, piling construction, pile caps or footing construction and reinforced concrete structure works, ancillary services and the leasing services of machinery. Money Lending segment is involved in the money lending business. Technology Services segment is involved in the development of digital currency trading platform, the providing of technology support and system testing service. Construction Wastes Handling segment is involved in the management and operation of public fill reception facilities. Securities Investments segment is mainly involved the investment of listed securities.",Construction,HK,9/2/2015,Okg Technology Holdings Ltd,,,,0.395,2121351420.0,Okg Technology Holdings Ltd,HKD,Okg Technology Holdings Ltd,Okg Technology Holdings Ltd,,Okg Technology Holdings Ltd,1499.hk,,,Okg Technology Holdings Ltd,,1
,,14D.AX,1414 Degrees Ltd,AUD,ASX,Capital Goods,"1414 Degrees Limited offers thermal energy storage systems for networks and industries in Australia. It provides heat and electricity from renewable energy sources, such as electricity or biogas. The company was formerly known as Latent Heat Storage Pty Ltd and changed its name to 1414 Degrees Limited in December 2016. 1414 Degrees Limited was founded in 2009 and is based in Wayville, Australia.",Electrical Equipment,AU,9/12/2018,1414 Degrees Ltd,,,,0.265,52996020.0,1414 Degrees Ltd,AUD,1414 Degrees Ltd,1414 Degrees Ltd,,1414 Degrees Ltd,14d.ax,,,1414 Degrees Ltd,,1
,,1501.HK,Shanghai Kindly Medical Instruments Co Ltd,HKD,HKSE,Health Care Equipment & Services,"Shanghai Kindly Medical Instruments Co., Ltd. engages in the research and development, manufacture, and sale of cardiovascular interventional medical devices in Mainland China, Europe, the United States, and internationally. It offers interventions products, which includes guiding catheter used to provide a channel for introducing balloon catheter, guidewire or other treatment devices; microcatheter to support the placement of guide wires; guidewire used in percutaneous transluminal angioplasty (PTA) surgical procedures; angiography catheter used to inject and infuse contrast media and fluid; Y-connector pack used in PTCA surgery; inflation device used to inflate the balloon of dilating the vessel or placing the stent in the vessel; manifold for single use; manifold kit; pressure bandage used to assist compression hemostasis; angiography syringe for single use; stopcocks used for pressure monitoring tubing during surgery; sterile seldinger needle used to puncture into the artery; introducer set; pressure transducer for single use; extension tube for pressure monitoring; and introducer tool kit used in percutaneous vertebroplasty. The company also provides medical accessories, such as check value, needle free connector, male Luer locks, bi-stopper, Heparian cap, flush device, and flow regulator; other products, including vaginal dilator used during a vaginal examination, foley catheter, infusion pumps, disposable automatic umbilical cord clamps, infusion connector and accessory for single use, and burette infusion sets without a needle. It serves medical device manufacturers and other customers. The company was founded in 2006 and is headquartered in Shanghai, China. Shanghai Kindly Medical Instruments Co., Ltd. is a subsidiary of Shanghai Kindly Enterprise Development Group Co., Ltd.",Health Care,CN,11/8/2019,Shanghai Kindly Medical Instruments Co Ltd,,,,46.7,7752200200.0,Shanghai Kindly Medical Instruments Co Ltd,HKD,Shanghai Kindly Medical Instruments Co Ltd,Shanghai Kindly Medical Instruments Co Ltd,,Shanghai Kindly Medical Instruments Co Ltd,1501.hk,,,Shanghai Kindly Medical Instruments Co Ltd,,1
,,1503.HK,China Merchants Commercial Real Estate Investment Trust,HKD,HKSE,Real Estate,China Merchants Commercial REIT is a Hong Kong collective investment scheme constituted as a unit trust and authorised under section 104 of the SFO. China Merchants Commercial REIT is a REIT formed to primarily own and invest in high quality income-generating commercial properties in the PRC (including Hong Kong and Macao but excluding the CML Cities).,Real Estate,HK,12/10/2019,China Merchants Commercial Real Estate Investment Trust,,,,2.49,2808271870.0,China Merchants Commercial Real Estate Investment Trust,HKD,China Merchants Commercial Real Estate Investment Trust,China Merchants Commercial Real Estate Investment Trust,,China Merchants Commercial Real Estate Investment Trust,1503.hk,,,China Merchants Commercial Real Estate Investment Trust,,1
,,1508.HK,China Reinsurance Group Corp,HKD,HKSE,Insurance,"China Reinsurance (Group) Corporation, together with its subsidiaries, operates as a reinsurance company in the People's Republic of China and internationally. It operates through Property and Casualty Reinsurance, Life and Health Reinsurance, Primary Property and Casualty Insurance, Asset Management, and Others segments. The company offers reinsurance products, including motor, commercial and household property, engineering, marine hull, cargo, liability, credit and guarantee, personal accident, health, agriculture, space and aviation, energy, nuclear, etc. It also provides asset management, insurance brokerage, risk evaluation and management, underwriting agency, and investment management services; invests in private equities, debts/debt investment plans/trusts, and loans; and issues bonds. In addition, the company is involved in the e-commerce business; and offers consulting services. It offers its insurance products for individual and corporate customers. The company was founded in 1949 and is headquartered in Beijing, the People's Republic of China. China Reinsurance (Group) Corporation is a subsidiary of Central Huijin Investment Ltd.",Insurance,CN,10/26/2015,China Reinsurance Group Corp,,,,0.84,35683033000.0,China Reinsurance Group Corp,HKD,China Reinsurance Group Corp,China Reinsurance Group Corp,,China Reinsurance Group Corp,1508.hk,,,China Reinsurance Group Corp,,1
,,1515.HK,China Resources Medical Holdings Company Ltd,HKD,HKSE,Health Care Equipment & Services,"China Resources Medical Holdings Company Limited, an investment holding company, provides general healthcare, and hospital management and consulting services in the People's Republic of China. The company also offers group purchasing organization and other hospital-derived services. In addition, it manages and operates third-party hospitals and clinics under the invest-operate-transfer model. In addition, it sells pharmaceuticals, medical devices, and medical consumables and equipment. The company was formerly known as China Resources Phoenix Healthcare Holdings Company Limited and changed its name to China Resources Medical Holdings Company Limited in October 2018. The company was founded in 2007 and is headquartered in Beijing, the People's Republic of China.",Health Care,CN,11/29/2013,China Resources Medical Holdings Company Ltd,,,,7.76,10062236700.0,China Resources Medical Holdings Company Ltd,HKD,China Resources Medical Holdings Company Ltd,China Resources Medical Holdings Company Ltd,,China Resources Medical Holdings Company Ltd,1515.hk,,,China Resources Medical Holdings Company Ltd,,1
,,1516.HK,SUNAC SERVICES,HKD,HKSE,Real Estate Services,"Sunac Services Holdings Limited provides property management services, value-added services to non-property owners, and community value-added services in the People's Republic of China. The company's property management services comprise a range of services to property owners and residents, as well as property developers, including security, cleaning, greening, gardening, and repair and maintenance services for the operation of common area facilities. Its property management portfolio covers residential properties, primarily mid- to high-end ones, and non-residential properties, such as commercial, public, and other properties. The company's value-added services comprise sales assistance services to property developers to assist with their sales and marketing activities at property sales venues and display units; consultancy and other value-added services to non-property owners, such as consultancy, pre-delivery, and engineering services, principally to property developers with a small portion to other property management companies; and property agency services to property developers primarily in respect of tourism and vacation projects. Its community value-added services include property interior decoration services, community space operation services, real estate brokerage services, and sale of use rights of car park spaces; and community living services, such as housekeeping, group purchase, and tourism services to property owners and residents of its managed properties to address their daily lifestyle needs. The company was founded in 2004 and is headquartered in Tianjin, China.",Real Estate,CN,11/12/2020,SUNAC SERVICES,,,,25.0,77587497000.0,SUNAC SERVICES,HKD,SUNAC SERVICES,SUNAC SERVICES,,SUNAC SERVICES,1516.hk,,,SUNAC SERVICES,,1
,,1518.HK,New Century Healthcare Holding Co Ltd,HKD,HKSE,Health Care Equipment & Services,"New Century Healthcare Holding Co. Limited, an investment holding company, provides healthcare services to women and children in the People's Republic of China. It offers pediatric, obstetric, and gynecologic services; and hospital consulting services. The company operates three hospitals and seven clinics under the New Century Healthcare name. It also offers marketing and online healthcare services; and operates cafeteria and gift shop at its medical institutions. The company was founded in 2002 and is headquartered in Beijing, the People's Republic of China.",Health Care,CN,1/18/2017,New Century Healthcare Holding Co Ltd,,,,1.64,833042880.0,New Century Healthcare Holding Co Ltd,HKD,New Century Healthcare Holding Co Ltd,New Century Healthcare Holding Co Ltd,,New Century Healthcare Holding Co Ltd,1518.hk,,,New Century Healthcare Holding Co Ltd,,1
,,1520.HK,CEFC Hong Kong Financial Investment Company Ltd,HKD,HKSE,Consumer Durables & Apparel,"CEFC Hong Kong Financial Investment Company Limited, an investment holding company, designs, manufactures, and trades in apparels in the United States, Hong Kong, and internationally. The company provides its products under private labels and own brands. It also provides designing, marketing, and advertising services; and money lending services to individual consumers and small businesses. The company was formerly known as Runway Global Holdings Company Limited and changed its name to CEFC Hong Kong Financial Investment Company Limited in October 2017. CEFC Hong Kong Financial Investment Company Limited was founded in 2001 and is headquartered in Wanchai, Hong Kong.","Textiles, Apparel & Luxury Goods",HK,12/3/2013,CEFC Hong Kong Financial Investment Company Ltd,,,,0.117,197730000.0,CEFC Hong Kong Financial Investment Company Ltd,HKD,CEFC Hong Kong Financial Investment Company Ltd,CEFC Hong Kong Financial Investment Company Ltd,,CEFC Hong Kong Financial Investment Company Ltd,1520.hk,,,CEFC Hong Kong Financial Investment Company Ltd,,1
,,1521.HK,Frontage Holdings Corp,HKD,HKSE,"Pharmaceuticals, Biotechnology & Life Sciences","Frontage Holdings Corporation, a contract research organization, provides research, analytical, and development services to pharmaceutical, biotechnology, and agrochemical companies, as well as bioequivalence studies. The company offers laboratory services that support drug discovery and development, such as drug metabolism and pharmacokinetics, safety and toxicology, and bioanalytical services, as well as chemistry, manufacturing, and controls; agrochemical services; and associated services supporting clinical studies, including early stage clinical and biometrics. It operates in the United States, Canada, the People's Republic of China, Europe, India, Japan, Korea, Israel, and Australia. The company was incorporated in 2018 and is headquartered in Exton, Pennsylvania. Frontage Holdings Corporation is a subsidiary of Hong Kong Tigermed Co., Limited.",Life Sciences Tools & Services,US,5/30/2019,Frontage Holdings Corp,,,,6.61,13402767400.0,Frontage Holdings Corp,HKD,Frontage Holdings Corp,Frontage Holdings Corp,,Frontage Holdings Corp,1521.hk,,,Frontage Holdings Corp,,1
,,1522.HK,Bii Railway Transportation Technology Holdings Co Ltd,HKD,HKSE,Software & Services,"BII Railway Transportation Technology Holdings Company Limited, an investment holding company, designs, produces, implements, sells, and maintains application solutions in the People's Republic of China. The company's Intelligent Railway Transportation Services segment designs, produces, implements, sells, and maintains application solution services, including related software, hardware, and spare parts in railway transportation areas; sells hardware and spare parts relating to railway transportation application solution systems; and repairs and maintains application solution systems. Its products include network-level and Auto Fare Collection (AFC) route-level systems, including AFC systems, such as AFC Clearing Center, Automatic Fare Collection Network Control Centre, and Coordination and Command Centre systems; Passenger Info Systems (PIS), such as ground PIS and on-board PIS; and Environmental monitoring systems, as well as hardware and spare parts. The company's Infrastructure information segment offers civil communication information transmission services and related software, hardware and spare parts in utility tunnel areas. Its Business Development Investment segment manages the equity investments in railway transportation areas. The company also leases civil communication transmission systems to telecommunication companies. The company was formerly known as China City Railway Transportation Technology Holdings Company Limited and changed its name to BII Railway Transportation Technology Holdings Company Limited in August 2017. The company was incorporated in 2011 and is headquartered in Beijing, the People's Republic of China. BII Railway Transportation Technology Holdings Company Limited is a subsidiary of Beijing Infrastructure Investment (Hong Kong) Limited.",Technology,HK,5/16/2012,Bii Railway Transportation Technology Holdings Co Ltd,,,,0.65,1363147390.0,Bii Railway Transportation Technology Holdings Co Ltd,HKD,Bii Railway Transportation Technology Holdings Co Ltd,Bii Railway Transportation Technology Holdings Co Ltd,,Bii Railway Transportation Technology Holdings Co Ltd,1522.hk,,,Bii Railway Transportation Technology Holdings Co Ltd,,1
,,1523.HK,Plover Bay Technologies Ltd,HKD,HKSE,Technology Hardware & Equipment,"Plover Bay Technologies Limited, an investment holding company, designs, develops, markets, and sells software defined wide area network (SD-WAN) routers worldwide. It also provides software licences, and warranty and support services. The company markets and sells its products under the Peplink and Pepwave brands through third party distributors, and resellers. In addition, it is involved in property holding activities. The company serves maritime and ground transport, public safety, education, and retail sectors, as well as enterprises. Plover Bay Technologies Limited was founded in 2006 and is headquartered in Lai Chi Kok, Hong Kong.",Communications,HK,7/13/2016,Plover Bay Technologies Ltd,,,,1.24,1328945150.0,Plover Bay Technologies Ltd,HKD,Plover Bay Technologies Ltd,Plover Bay Technologies Ltd,,Plover Bay Technologies Ltd,1523.hk,,,Plover Bay Technologies Ltd,,1
,,1525.HK,Shanghai Gench Education Group Ltd,HKD,HKSE,Consumer Services,"Shanghai Gench Education Group Limited, an investment holding company, provides higher education services in the People's Republic of China. The company primarily operates a private university in Shanghai. It provides education services to its students with a focus on applied sciences. The company also provides common undergraduate education services. As of September 30, 2019, Shanghai Jian Qiao University offered 54 majors and concentrations in its formal undergraduate program in a range of areas and 13 majors in its junior college program. The company was founded in 1999 and is headquartered in Shanghai, China.",Diversified Consumer Services,CN,1/16/2020,Shanghai Gench Education Group Ltd,,,,6.54,2714099970.0,Shanghai Gench Education Group Ltd,HKD,Shanghai Gench Education Group Ltd,Shanghai Gench Education Group Ltd,,Shanghai Gench Education Group Ltd,1525.hk,,,Shanghai Gench Education Group Ltd,,1
,,1526.HK,Rici Healthcare Holdings Ltd,HKD,HKSE,Health Care Equipment & Services,"Rici Healthcare Holdings Limited, an investment holding company, operates general hospitals, specialty hospitals, medical examination centers, and clinics in the People's Republic of China. As of December 31, 2019, the company had 59 medical examination centers. It also offers health counselling, nursing, diagnosis, and financial leasing services. The company was founded in 2000 and is headquartered in Shanghai, the People's Republic of China.",Health Care,CN,10/6/2016,Rici Healthcare Holdings Ltd,,,,0.84,1335868800.0,Rici Healthcare Holdings Ltd,HKD,Rici Healthcare Holdings Ltd,Rici Healthcare Holdings Ltd,,Rici Healthcare Holdings Ltd,1526.hk,,,Rici Healthcare Holdings Ltd,,1
