Column1,index,symbol,long name,currency,exchange,industry,description,sector,country,ipo date,shorter name,Type,Industries,Similar Companies,price,mktCap,name raw,currency symbol,robinhood name,short name,Warrant,shortest name,url name, smart_order ,random csv equations,pure name,shortest - pure diff,order,first_letter
,,HMLH.L,HML Holdings PLC,GBP,LSE,Real Estate,"HML Holdings Plc engages in the provision of property management and related services. The company is headquartered in Richmond, Surrey and currently employs 549 full-time employees. The firm's segments include property management, professional services and insurance services. Its property management segment is engaged in residential property management. Its professional services segment is engaged in chartered surveying services. Its insurance services segment is involved in insurance broking intermediary services. Its surveying services include building surveys and inspection, project management, lease extensions and right to manage. Its ancillary services include company secretarial, management of site staff, and health and safety. The company works with housebuilders and developers, and provides a range of services, including a review of the plans and specification, preparation of service charge structure and indication of costs and preparation of a management plan or strategy. Its residential property management services include accounts preparation and routine inspections.",Real Estate,GB,6/30/2006,HML Holdings PLC,,,,36.5,17435648.0,HML Holdings PLC,,HML Holdings PLC,HML Holdings PLC,,HML Holdings PLC,hmlh.l,,,HML Holdings PLC,,14625,H
,,HMMR,Hammer Fiber Optics Holdings Corp.,USD,PNK,Telecom Services,"Hammer Fiber Optics Holdings Corp., a telecommunications company, engages in investing in wireless technology. The company develops high speed fixed wireless service for residential, small business, and enterprise clients using its wireless fiber platform, Hammer Wireless AIR, as well as mobility networks, such as 4G/LTE; and over-the-top services comprising voice, SMS, and collaboration. It is also involved in the provision of hosting services, including cloud and colocation. The company was incorporated in 2010 and is based in Point Pleasant Beach, New Jersey.",Communication Services,US,,Hammer Fiber Optics Holdings Corp.,,,,0.321,16228091.0,Hammer Fiber Optics Holdings Corp.,$,Hammer Fiber Optics Holdings Corp.,Hammer Fiber Optics Holdings Corp.,,Hammer Fiber Optics Holdings Corp.,hmmr,,,Hammer Fiber Optics Holdings Corp.,,14626,H
,,HMSB.DE,H & M Hennes & Mauritz AB,EUR,XETRA,Retailing,"H & M Hennes & Mauritz AB (publ) provides clothing, accessories, footwear, cosmetics, home textiles, and homeware for women, men, teenagers, children, and babies worldwide. It offers sportswear, shoes, bags, beauty products, stationery, and ready-to-wear; and interior products, including bed linens, dinnerware, textiles, furniture, and lamps. The company provides its products under the H&M, H&M HOME, COS, & Other Stories, Monki, Weekday, ARKET, Afound, and Sellpy brands. As of September 30, 2020, the company had 51 online markets and approximately 5,000 stores in 74 markets, including franchise markets. H & M Hennes & Mauritz AB (publ) was founded in 1947 and is headquartered in Stockholm, Sweden.",Retail,SE,5/27/1905,H & M Hennes & Mauritz AB,,,,17.925,33067323400.0,H & M Hennes & Mauritz AB,,H & M Hennes & Mauritz AB,H & M Hennes & Mauritz AB,,H & M Hennes & Mauritz AB,hmsb.de,,,H & M Hennes & Mauritz AB,,14627,H
,,HMSG.L,HMS Hydraulic Machines & Systems Group PLC,RUB,LSE,Capital Goods,"HMS Hydraulic Machines & Systems Group Plc is a holding company, which produces pumps and oil gas equipment, and also producers compressors. The company is headquartered in Moscow, Moscow and currently employs 15,000 full-time employees. The principal business activities of the Company and its subsidiaries are the manufacture and repair of pumps and pumping units, compressors, modular equipment, including oil and gas equipment, engineering and construction services mainly for oil and gas companies. These products and services are sold both in the Russian Federation and abroad. The firm's manufacturing facilities are primarily located in Orel, Vladimir, Tomsk, Ulyanovsk, Tumen regions and the Republic of Tatarstan of the Russian Federation, Sumy in Ukraine, Minsk and Bobruisk in Belorussia, Goessnitz (Thuringia) in Germany. The firm's subsidiaries mainly operate in the Russian Federation.",Machinery,RU,2/14/2011,HMS Hydraulic Machines & Systems Group PLC,,,,4.7,93.0,HMS Hydraulic Machines & Systems Group PLC,RUB,HMS Hydraulic Machines & Systems Group PLC,HMS Hydraulic Machines & Systems Group PLC,,HMS Hydraulic Machines & Systems Group PLC,hmsg.l,,,HMS Hydraulic Machines & Systems Group PLC,,14628,H
,,HMSO.L,Hammerson PLC,GBP,LSE,Real Estate,"Hammerson Plc provides property investment and development services. The firm is an owner, manager and developer of retail destinations in Europe. The firm's segments include United Kingdom, France and Ireland. The firm's portfolio includes investments in approximately 20 prime shopping centers in the United Kingdom, France and Ireland, over 20 convenient retail parks in the United Kingdom and approximately 20 premium outlets across Europe. The firm's portfolio includes the United Kingdom shopping centers, France, Ireland, the United Kingdom retail parks, premium outlets, and developments and other. The United Kingdom shopping centers include Highcross, Leicester; Union Square, Aberdeen, and Victoria, Leeds. The United Kingdom retail parks include Abbey Retail Park, Belfast; Abbotsinch Retail Park, Glasgow; Cleveland Retail Park, Middlesbrough; Cyfarthfa Retail Park and Methyr Tydfil.",Real Estate,GB,5/31/1945,Hammerson PLC,,,,21.21,860553280.0,Hammerson PLC,,Hammerson PLC,Hammerson PLC,,Hammerson PLC,hmso.l,,,Hammerson PLC,,14629,H
,,HMT.NS,HMT Ltd,INR,NSE,Capital Goods,"HMT Limited manufactures and sells food processing machines in India and internationally. The company offers machine tools, including turning machines, grinding machines, gear manufacturing machines, machining centers, special application machines, die casting and plastic injection molding machines, precision ball screws, presses, CNC systems, and other GPMs. Its food processing machines comprise butter making and packing machines, plate heat exchangers, centrifugal pumps and separators, oil purification and clarification systems, and homogenizers. In addition, the company provides printing machinery, watches, tractors, and bearings. Further, the company offers various services, including refurbishing, testing and inspection services, precision tooling solutions, and project and consultancy services. HMT Limited was founded in 1949 and is headquartered in Bengaluru, India.",Machinery,IN,3/6/1995,HMT Ltd,,,,24.4,8592117800.0,HMT Ltd,?,HMT Ltd,HMT Ltd,,HMT Ltd,hmt.ns,,,HMT Ltd,,14630,H
,,HMU.DE,HMS Bergbau AG,EUR,XETRA,Capital Goods,"HMS Bergbau AG distributes coal and other energy raw materials to power plants, cement manufacturers, and industrial consumers worldwide. The company offers steam coal, coking coal and coke, and anthracite and PCI coal; wood pellets, wood chips, and other biomass; iron ore, including pellets, iron lumps, fines, and other ores; cement and cementitious products, such as clinker, fly ash, etc.; and sea, rail, and road logistics services. It also provides consulting services in the areas of power plant design and construction, harbor planning and configuration, coal mine operation, and on-site optimization of raw materials logistics. In addition, the company charters sea going vessels and inland barges; and organizes logistics by barge, train, or truck; and provides logistics solutions comprising harbor operations, storage management, and technical oversight. It supplies its products to power plant companies, as well as steel and cement manufacturers; and industrial companies, such as glassworks, paper mills, and waste processing plants. HMS Bergbau AG was founded in 1995 and is headquartered in Berlin, Germany.",Trading Companies & Distributors,DE,12/8/2008,HMS Bergbau AG,,,,21.4,94709552.0,HMS Bergbau AG,,HMS Bergbau AG,HMS Bergbau AG,,HMS Bergbau AG,hmu.de,,,HMS Bergbau AG,,14631,H
,,HMVL.NS,Hindustan Media Ventures Ltd,INR,NSE,Media & Entertainment,"Hindustan Media Ventures Limited engages in the printing and publication of newspapers and periodicals in India. The company's product line includes Hindustan, a daily newspaper that provides news relating to politics, business, entertainment, sports, and other general interests; and LiveHindustan.com, a Hindi news Website. It also provides Nandan, a monthly children's magazine that offers traditional and modern stories, poems, interactive columns and facts, and various educative columns; and Kadambini, a monthly socio-cultural magazine, which covers various subjects, including literature, art, culture, health, technology, fashion, travel, beauty, etc. The company was formerly known as Searchlight Publishing House Limited and changed its name to Hindustan Media Ventures Limited in November 2008. The company was founded in 1918 and is based in New Delhi, India. Hindustan Media Ventures Limited is a subsidiary of HT Media Limited.",Media,IN,7/21/2010,Hindustan Media Ventures Ltd,,,,54.0,3978261250.0,Hindustan Media Ventures Ltd,?,Hindustan Media Ventures Ltd,Hindustan Media Ventures Ltd,,Hindustan Media Ventures Ltd,hmvl.ns,,,Hindustan Media Ventures Ltd,,14632,H
,,HMX.AX,Hammer Metals Ltd,AUD,ASX,Materials,"Hammer Metals Limited engages in the exploration and extraction of mineral resources in Australia. It primarily explores for iron oxide, copper, and gold, as well as for lead, zinc, cobalt, silver, molybdenum, and rhenium ores. The company holds tenement position covering approximately 2,200 square kilometers within the Mount Isa mining district, with 100% interests in the Kalman deposit, the Overlander North and Overlander South deposits, and the Elaine-Dorothy deposit, as well as a 51% interest in the Jubilee deposit. It also holds a 100% interest in the Bronzewing South gold project located in the Yilgarn Province of Western Australia. The company was formerly known as Midas Resources Limited and changed its name to Hammer Metals Limited in April 2014. Hammer Metals Limited is based in Mount Lawley, Australia.",Metals & Mining,AU,2/25/2003,Hammer Metals Ltd,,,,0.085,63757392.0,Hammer Metals Ltd,A$,Hammer Metals Ltd,Hammer Metals Ltd,,Hammer Metals Ltd,hmx.ax,,,Hammer Metals Ltd,,14633,H
,,HN9.DE,HanesBrands Inc,EUR,XETRA,Consumer Durables & Apparel,"Hanesbrands, Inc. is a consumer goods company, which engages in the design, manufacture, sourcing, and sale of everyday basic innerwear and activewear apparel in the Americas, Europe, Australia and Asia Pacific. The company is headquartered in Winston Salem, North Carolina and currently employs 68,000 full-time employees. The firm operates through three segments: Innerwear, Activewear and International. The Innerwear segment focuses on core apparel products, such as intimate apparel, men's underwear, women's panties, children's underwear, socks and hosiery. The firm operates in the activewear market through its Champion, Hanes and JMS/Just My Size brands. The International segment includes products that primarily span across the innerwear and activewear segments.","Textiles, Apparel & Luxury Goods",US,8/16/2006,HanesBrands Inc,,,,15.4,5813768200.0,HanesBrands Inc,,HanesBrands Inc,HanesBrands Inc,,HanesBrands Inc,hn9.de,,,HanesBrands Inc,,14634,H
,,HNCKF,Giga Metals Corporation,CAD,PNK,Other Industrial Metals & Mining,"Giga Metals Corporation acquires, explores for, and develops mineral properties in Canada. The company explores for nickel and cobalt sulphide deposits. It owns a 100% interest in the Turnagain property comprising 71 contiguous mineral claims covering an area of 38,000 hectares located in the Liard Mining Division of northern British Columbia. The company was formerly known as Hard Creek Nickel Corporation and changed its name to Giga Metals Corporation in August 2017. Giga Metals Corporation was founded in 1983 and is headquartered in Vancouver, Canada.",Basic Materials,CA,,Giga Metals Corporation,,,,0.53,36864360.0,Giga Metals Corporation,CAD,Giga Metals Corporation,Giga Metals Corporation,,Giga Metals Corporation,hnckf,,,Giga Metals Corporation,,14635,H
,,HNDFDS.NS,Hindustan Foods Ltd,INR,NSE,"Food, Beverage & Tobacco","Hindustan Foods Limited engages in the business of contract manufacturing of FMCG products in India. The company offers extruded cereals and snacks, such as breakfast cereals, instant porridges, rice crispies; hot and cold beverages, and energy drink concentrates comprising carbonated soft drinks, tea, coffee, malt based foods, soups, glucose powder, and dry mix powder; and leather and accessories that consists of men's, women's, and juniors' footwear, and uppers. It also provides fabric care products, including liquid and powder detergent; home care products, which include surface, glass, and toilet cleaner, as well as liquid dish wash; and pest control products, such as coils, aerosols, liquid vaporizers, mosquito mats, and activ cards. In addition, the company offers hair care products that include hair oil, food, gel, cream, oil treatment, and shampoo; toiletries, which comprise talc, shaving cream, and hand wash; baby care products, including creams, shampoo, lotions, baby oil, and powder; and fragrances comprising eau de parfum, eau de toilette, and deodorant body spray. Further, it provides skin care products, such as body lotion, moisturizer, creams, petroleum jelly, shower gel, face wash, face scrub, body scrub, wipes, dusting powder, and bubble bath products. The company also exports its products. Hindustan Foods Limited was incorporated in 1984 and is headquartered in Mumbai, India.",Food Products,IN,8/19/2019,Hindustan Foods Ltd,,,,1841.8,39056105000.0,Hindustan Foods Ltd,?,Hindustan Foods Ltd,Hindustan Foods Ltd,,Hindustan Foods Ltd,hndfds.ns,,,Hindustan Foods Ltd,,14636,H
,,HNE.L,Henderson Eurotrust PLC,GBP,LSE,,"Henderson EuroTrust plc is a United Kingdom-based investment company. The Company invests predominantly in large and medium-sized companies, which are perceived to be undervalued in view of their growth prospects or on account of significant changes in management or structure. The Company aims to achieve a total return from a portfolio of European investments. The Company focuses on a portfolio of approximately 50 stocks. The Company's portfolio of investments include various sectors, including healthcare, food producers, air freight and logistics, software and computer services, support services, construction and materials, financial services, industrial transportation, telecommunications, media, personal goods, beverages, catering services, automobiles and parts, oil and gas producers, Pharmaceuticals and biotechnology, application software, industrial engineering and insurance. Henderson Investment Funds Limited serves as an alternative investment fund manager for the Company.",,GB,7/7/1992,Henderson Eurotrust PLC,,,,1495.0,316723232.0,Henderson Eurotrust PLC,,Henderson Eurotrust PLC,Henderson Eurotrust PLC,,Henderson Eurotrust PLC,hne.l,,,Henderson Eurotrust PLC,,14637,H
,,HNG.AX,HGL Ltd,AUD,ASX,Capital Goods,"HGL Limited imports and distributes branded products for in Australia and internationally. It operates through Retail Marketing, Building Product, and Personal Care, and Healthcare segments. The Retail Marketing segment provides standard and customized shelving product solutions to brand owners and retailers. The Building Product segment distributes architectural lightings for the commercial markets. The Personal Care segment distributes cosmetics and skincare products through salon, spa, and retail markets. The Healthcare segment rents and distributes medical equipment into hospitals, aged care facilities, and the retail market. HGL Limited offers architectural lighting products under the Modular, LTS, Hubbell, Meyer, and Intralux brands. The company was formerly known as Hancock & Gore Ltd and changed its name to HGL Limited in June 2002. HGL Limited was founded in 1867 and is headquartered in Macquarie Park, Australia.",Trading Companies & Distributors,AU,6/9/1994,HGL Ltd,,,,0.215,23372220.0,HGL Ltd,A$,HGL Ltd,HGL Ltd,,HGL Ltd,hng.ax,,,HGL Ltd,,14638,H
,,HNIB.DE,IAC/Interactivecorp,EUR,XETRA,Media & Entertainment,"IAC/Interactivecorp., formerly IAC Holdings Inc., is a media and Internet company. The Company operates its business through six segments: ANGI Homeservices, Vimeo, Dotdash, Applications, Ask Media Group and Emerging & Others. The Company’s ANGI Homeservices connects of home service professionals across 500 different categories, from repairing and remodeling to cleaning and landscaping, with consumers through category-transforming products under brands such as HomeAdvisor, Angie's List, Handy and Fixd Repair. The Company’s Vimeo segment operates a global video platform for creative professionals, small and medium businesses, organizations and enterprises to connect with their audiences, customers and employees. The Dotdash is a portfolio of digital brands providing information and inspiration in select vertical content categories. Its Applications segment consists of Desktop, which includes its direct-to-consumer downloadable desktop applications.",Media,US,7/1/2020,IAC/Interactivecorp,,,,285.25,22590441500.0,IAC/Interactivecorp,,IAC/Interactivecorp,IAC/Interactivecorp,,IAC/Interactivecorp,hnib.de,,,IAC/Interactivecorp,,14639,H
,,HNK1.DE,Heineken NV,EUR,XETRA,"Food, Beverage & Tobacco","Heineken N.V. engages in brewing and selling beer and cider. The company operates through Europe; Americas; Africa, Middle East & Eastern Europe; and Asia Pacific segments. It offers beer, cider, soft drinks, and water. The company offers its beers under the Heineken, Amstel, Desperados, Sol, Tiger, Birra Moretti, Affligem, Lagunitas, and Mort Subite brands, as well as under various other regional and local brands; and cider under the Strongbow Apple Ciders, Orchard Thieves, Cidrerie Stassen, Bulmers, Old Mout, and Blind Pig brands. It offers its products to retailers, bars, and restaurants through distributors. The company was founded in 1864 and is headquartered in Amsterdam, the Netherlands. Heineken N.V. is a subsidiary of Heineken Holding N.V.",Beverages,NL,1/1/1939,Heineken NV,,,,86.3,49633546000.0,Heineken NV,,Heineken NV,Heineken NV,,Heineken NV,hnk1.de,,,Heineken NV,,14640,H
,,HNL.DE,Dr Hoenle AG,EUR,XETRA,Capital Goods,"Dr. Hönle AG operates in the UV market worldwide. It operates through three segments: Equipment & Systems, Glass & Lamps, and Adhesives. The Equipment & Systems segment offers UV equipment and systems, LED-UV units, IR units, inert systems, disinfection systems, solar simulation systems and light fixtures, lighting systems, UV measuring technology products, UV-adhesives, and components and replacement parts. This segment also provides hot air systems, and powder spraying and extraction systems for sheet-fed offset printing; UV dryers for Web printing; UV systems with nitrogen inertisation; and drying systems. Its products are used for drying inks and coatings, curing adhesives and plastics, disinfecting surfaces, and sunlight simulation. The Glass & Lamps segment offers UV low and medium pressure lamps; infrared emitters; electronic power supplies; UV sensors and measuring technology products; UV measuring devices; and submersible and immersion tube systems, as well as accessories. This segment also provides UV bulbs; and quartz glass tubing and rods for the lamp, automotive, semiconductor, and fiber cable industries. The Adhesives segment offers industrial, UV, medical grade, and conductive adhesives; dosing systems; potting and sealing compounds; and UV curing units. Dr. Hönle AG was founded in 1976 and is headquartered in Gräfelfing, Germany.",Electrical Equipment,DE,2/25/2008,Dr Hoenle AG,,,,53.7,325521344.0,Dr Hoenle AG,,Dr Hoenle AG,Dr Hoenle AG,,Dr Hoenle AG,hnl.de,,,Dr Hoenle AG,,14641,H
,,HNM.DE,Ormat Technologies Inc,EUR,XETRA,Utilities,"Ormat Technologies, Inc. is a holding company, which engages in the provision of geothermal and recovered energy power business. The company is headquartered in Reno, Nevada and currently employs 1,346 full-time employees. The firm designs, develops, builds, owns and operates geothermal and recovered energy-based power plants. The firm's equipment manufacturing operations are located in Israel. The firm conducts its business activities in two business segments: Electricity segment and Product segment. The firm also manufactures products that produce electricity from recovered energy or so-called waste heat. The company also constructs, owns and operates recovered energy-based power plants.",Utilities,US,11/11/2004,Ormat Technologies Inc,,,,104.0,5136594900.0,Ormat Technologies Inc,,Ormat Technologies Inc,Ormat Technologies Inc,,Ormat Technologies Inc,hnm.de,,,Ormat Technologies Inc,,14642,H
,,HOLUU,Holicity Inc.,USD,NASDAQ,Shell Companies,"Holicity Inc. intends to effect a merger, capital stock exchange, asset acquisition, stock purchase, reorganization, or similar business combination with one or more businesses. The company was founded in 2020 and is based in Kirkland, Washington.",Financial Services,US,,Holicity Inc.,,,,21.5,,Holicity Inc.,$,Holicity Inc.,Holicity Inc.,,Holicity Inc.,holuu,,,Holicity Inc.,,14643,H
,,HNR1.DE,Hannover Rueck SE,EUR,XETRA,Insurance,"Hannover Rück SE, together with its subsidiaries, provides reinsurance products and services worldwide. It operates through Property & Casualty Reinsurance, and Life & Health Reinsurance segments. The Property & Casualty Reinsurance segment offers specialty lines comprising marine, aviation, facultative and direct business, credit, surety, and political risks reinsurance products; and treaty, catastrophe XL, and structured reinsurance, as well as insurance-linked securities. This segment also provides risk solutions for casualty and property, as well as for agricultural, livestock, and bloodstock businesses; aviation and space business; and offshore energy business. The Life & Health Reinsurance segment offers credit life, enhanced annuities, group life and health, and Sharia-compliant Takaful reinsurance products. This segment also provides risk solutions in the areas of critical illness, disability, health, longevity, long term care, and mortality and morbidity, as well as underwriting services. In addition, it offers various financial solutions, including new-business financing; monetization of embedded value; reserve and solvency relief; and divestiture of non-core businesses. The company was formerly known as Hannover Rückversicherung AG and changed its name to Hannover Rück SE in March 2013. The company was founded in 1966 and is headquartered in Hanover, Germany. Hannover Rück SE is a subsidiary of Talanx AG.",Insurance,DE,11/30/1994,Hannover Rueck SE,,,,142.0,17124773900.0,Hannover Rueck SE,,Hannover Rueck SE,Hannover Rueck SE,,Hannover Rueck SE,hnr1.de,,,Hannover Rueck SE,,14644,H
,,HNR1.SW,Hannover Rueck SE,CHF,SIX,Insurance,"Hannover Rück SE, together with its subsidiaries, provides reinsurance products and services worldwide. It operates through Property & Casualty Reinsurance, and Life & Health Reinsurance segments. The Property & Casualty Reinsurance segment offers specialty lines comprising marine, aviation, facultative and direct business, credit, surety, and political risks reinsurance products; and treaty, catastrophe XL, and structured reinsurance, as well as insurance-linked securities. This segment also provides risk solutions for casualty and property, as well as for agricultural, livestock, and bloodstock businesses; aviation and space business; and offshore energy business. The Life & Health Reinsurance segment offers credit life, enhanced annuities, group life and health, and Sharia-compliant Takaful reinsurance products. This segment also provides risk solutions in the areas of critical illness, disability, health, longevity, long term care, and mortality and morbidity, as well as underwriting services. In addition, it offers various financial solutions, including new-business financing; monetization of embedded value; reserve and solvency relief; and divestiture of non-core businesses. The company was formerly known as Hannover Rückversicherung AG and changed its name to Hannover Rück SE in March 2013. The company was founded in 1966 and is headquartered in Hanover, Germany. Hannover Rück SE is a subsidiary of Talanx AG.",Insurance,DE,11/30/1994,Hannover Rueck SE,,,,159.0,18358458400.0,Hannover Rueck SE,CHF,Hannover Rueck SE,Hannover Rueck SE,,Hannover Rueck SE,hnr1.sw,,,Hannover Rueck SE,,14645,H
,,HNR.AX,Hannans Ltd,AUD,ASX,Materials,"Hannans Limited engages in the mineral exploration and project development activities in Australia. The company explores for cobalt, gold, nickel, and lithium deposits. It holds a 100% interest in the Forrestania Nickel project south of Southern Cross and east of Hyden in the Goldfields region of Western Australia; and the Mt Holland project located to the west and east of the Earl Grey lithium deposit, Western Australia. The company was formerly known as Hannans Reward Limited and changed its name to Hannans Limited in May 2016. Hannans Limited was founded in 2002 and is based in Perth, Australia.",Metals & Mining,AU,12/5/2003,Hannans Ltd,,,,0.007,16519861.0,Hannans Ltd,A$,Hannans Ltd,Hannans Ltd,,Hannans Ltd,hnr.ax,,,Hannans Ltd,,14646,H
