Column1,index,symbol,long name,currency,exchange,industry,description,sector,country,ipo date,shorter name,Type,Industries,Similar Companies,price,mktCap,name raw,currency symbol,robinhood name,short name,Warrant,shortest name,url name, smart_order ,random csv equations,pure name,shortest - pure diff,order,first_letter
,,KAYS,"Kaya Holdings, Inc.",USD,PNK,Drug Manufacturers,"Kaya Holdings, Inc., through its subsidiary, Marijuana Holdings Americas, Inc., engages in the legal recreational and medical marijuana business in the United States. The company is involved in growing, cultivation, harvesting, and manufacturing medical marijuana. It also operates four retail outlets for the sale of recreational and medical cannabis under the Kaya Shack brand name in Oregon, as well as offers strain specific cannabis cigarettes under the Kaya Buddies name. The company was formerly known as Alternative Fuels America, Inc. and changed its name to Kaya Holdings, Inc. in April 2015. Kaya Holdings, Inc. was incorporated in 1993 and is based in Fort Lauderdale, Florida.",Healthcare,US,,"Kaya Holdings, Inc.",,,,0.49,6989409.0,"Kaya Holdings, Inc.",$,"Kaya Holdings, Inc.","Kaya Holdings, Inc.",,"Kaya Holdings, Inc.",kays,,,"Kaya Holdings, Inc.",,15376,K
,,KAZ.L,Kaz Minerals PLC,GBP,LSE,Materials,"KAZ Minerals PLC, together with its subsidiaries, engages in mining and processing copper and other metals primarily in Kazakhstan and Kyrgyzstan. It operates through Bozshakol, Aktogay, and East Region and Bozymchak segments. The company operates the Aktogay and Bozshakol open pit copper mines in the east region and Pavlodar region of Kazakhstan; three underground mines and in the east region of Kazakhstan; and the Bozymchak copper-gold mine in Kyrgyzstan. It also develops greenfield metal deposits and processing facilities; and produces and sells various by-products, such as gold, silver, molybdenum, and zinc. In addition, the company supplies and distributes heat, water, and electricity; and offers construction services. The company was formerly known as Kazakhmys PLC and changed its name to KAZ Minerals PLC in October 2014. KAZ Minerals PLC was founded in 1930 and is based in London, the United Kingdom.",Metals & Mining,GB,10/7/2005,Kaz Minerals PLC,,,,804.4,3800685570.0,Kaz Minerals PLC,,Kaz Minerals PLC,Kaz Minerals PLC,,Kaz Minerals PLC,kaz.l,,,Kaz Minerals PLC,,15377,K
,,KAZT.ME,KuybyshevAzot PAO,RUB,MCX,Materials,"Public Joint Stock Company KuibyshevAzot, together with its subsidiaries, engages in the manufacture, distribution, and sale of various chemicals in Russia, Asia, rest of Europe, and internationally. The company operates through Caprolactam and Derivatives, and Ammonia and Nitrogen Fertilizers segments. It offers anhydrous ammonia, ammonium nitrate, urea, ammonium sulphate, and UAN, capolactam, polyamide 6 chips, engineering plastics, polyamide 6 recylced. The company also provides industrial yarn and cord fabrics, cyclohexanone, and cyclohexane chemical substances. The company is also involved in the transportation of goods; trade of construction materials; sale of electric power; production of engineering plastics and synthetic fibers; and the provision of rental services. The company was formerly known as KuibyshevAzot Joint Stock Company and changed its name to Public Joint Stock Company KuibyshevAzot in November 2016. Public Joint Stock Company KuibyshevAzot was founded in 1961 and is based in Togliatti, Russia.",Chemicals,RU,10/6/2008,KuybyshevAzot PAO,,,,177.2,31567292400.0,KuybyshevAzot PAO,RUB,KuybyshevAzot PAO,KuybyshevAzot PAO,,KuybyshevAzot PAO,kazt.me,,,KuybyshevAzot PAO,,15378,K
,,KBC.AX,Keybridge Capital Ltd,AUD,ASX,Diversified Financials,Jam Development Capital Ltd is engaged in investment in Australian small and medium enterprises.,Financial Services,AU,12/23/1999,Keybridge Capital Ltd,,,,0.068,13891449.0,Keybridge Capital Ltd,A$,Keybridge Capital Ltd,Keybridge Capital Ltd,,Keybridge Capital Ltd,kbc.ax,,,Keybridge Capital Ltd,,15379,K
,,KBNT,"Kubient, Inc.",USD,NASDAQ,Software,"Kubient, Inc. develops a cloud-based software platform for digital advertising industry. The company develops Audience Cloud, a platform for real-time trading of programmatic advertising. Its platform allows advertisers (ad space buyers) and publishers (ad space sellers) the ability to use machine learning during programmatic ad space auction. The company was founded in 2017 and is based in New York, New York.",Technology,US,,"Kubient, Inc.",,,,7.59,89228800.0,"Kubient, Inc.",$,"Kubient, Inc.","Kubient, Inc.",,"Kubient, Inc.",kbnt,,,"Kubient, Inc.",,15380,K
,,KBPH,"Kyto Technology and Life Science, Inc.",USD,PNK,Asset Management,"Kyto Technology and Life Science, Inc. is a venture capital firm specializing in startups and early stage companies. Its investments are either in the form of secured convertible debt paying interest and offering a discount upon conversion to preferred shares, or directly into preferred shares. The firm seeks to invest in technology and life science companies. It does not lead financing transactions. The firm makes 50% investments in the United States and the remaining in Canada and Israel. KYTO Technology and Life Science, Inc. was formerly known as Kyto BioPharma, Inc. and changed its name in April 2018. Kyto Technology and Life Science, Inc. was founded in 1999 and is based in Los Altos Hills, California with an additional office in Scotts Valley, California.",Financial Services,US,,"Kyto Technology and Life Science, Inc.",,,,2.0,11673660.0,"Kyto Technology and Life Science, Inc.",$,"Kyto Technology and Life Science, Inc.","Kyto Technology and Life Science, Inc.",,"Kyto Technology and Life Science, Inc.",kbph,,,"Kyto Technology and Life Science, Inc.",,15381,K
,,KBRS,"KBS Real Estate Investment Trust II, Inc.",USD,PNK,,"KBS Real Estate Investment Trust II, Inc. was formed on July 12, 2007 as a Maryland corporation that elected to be taxed as a real estate investment trust beginning with the taxable year ended December 31, 2008. The Company conducts its business primarily through KBS Limited Partnership II, a Delaware limited partnership formed on August 23, 2007, and its subsidiaries. The Company is the sole general partner of and directly owns a 0.1% partnership interest in the Operating Partnership. The Company's wholly-owned subsidiary, KBS REIT Holdings II LLC, a Delaware limited liability company formed on August 23, 2007, owns the remaining 99.9% partnership interest in the Operating Partnership and is its sole limited partner. As of September 30, 2020, the Company owned four office properties and an office campus consisting of two office buildings. Subject to certain restrictions and limitations, the business of the Company is managed by KBS Capital Advisors LLC. On November 13, 2019, in connection with a review of potential strategic alternatives available to the Company, a special committee composed of all of the Company's independent directors and the board of directors unanimously approved the sale of all of the Company's assets and the dissolution of the Company pursuant to the terms of the plan of complete liquidation and dissolution. The principal purpose of the Plan of Liquidation is to provide liquidity to the Company's stockholders by selling the Company's assets, paying its debts and distributing the net proceeds from liquidation to the Company's stockholders. On March 5, 2020, the Company's stockholders approved the Plan of Liquidation.",,US,,"KBS Real Estate Investment Trust II, Inc.",,,,0.5,0.0,"KBS Real Estate Investment Trust II, Inc.",$,"KBS Real Estate Investment Trust II, Inc.","KBS Real Estate Investment Trust II, Inc.",,"KBS Real Estate Investment Trust II, Inc.",kbrs,,,"KBS Real Estate Investment Trust II, Inc.",,15382,K
,,KBSB.ME,TNS Energo Kuban' PAO,RUB,MCX,Utilities,"Public Joint Stock Company 'TNS energo Kuban' purchases, sells, and supplies electricity in the Krasnodar Territory and the Republic of Adygeya. The company purchases electricity from the wholesale and retail electrical energy markets; and sells it to consumers and network companies in the wholesale and retail electrical energy markets. It is also involved in the preservation and expansion of the market for electric energy; and development, organization, and conduct of energy saving measures. The company was formerly known as Kubanenergosbyt OJSC and changed its name to Public Joint Stock Company 'TNS energo Kuban' in August 2017. The company was founded in 2006 and is based in Krasnodar, Russia. Public Joint Stock Company 'TNS energo Kuban' is a subsidiary of Public Joint Stock Company Group of Companies TNS energo.",Utilities,RU,2/8/2008,TNS Energo Kuban' PAO,,,,131.0,2340891390.0,TNS Energo Kuban' PAO,RUB,TNS Energo Kuban' PAO,TNS Energo Kuban' PAO,,TNS Energo Kuban' PAO,kbsb.me,,,TNS Energo Kuban' PAO,,15383,K
,,KBTK.ME,Kuzbasskaya Toplivnaya Kompaniya PAO,RUB,MCX,Energy,"Public Joint Stock Company 'Kuzbasskaya Toplivnaya Company', together with its subsidiaries, engages in the extraction and production of thermal coal. The company operates through four segments: Domestic Sales of Produced Coal, Export Sales of Produced Coal, Resale of Purchased Coal, and Other Operations. It operates open-pit mines located in the territory of the Kemerovo region in Russia. The company is also involved in the wholesale supply of coal in Russia and internationally. In addition, it engages in the retail sale of coal to households, and municipal and commercial boilers through its distribution networks located in the Kemerovo, Omsk, Novosibirsk, and Altai regions, as well as in Poland. Further, the company is involved in the resale of coal purchased from other coal producers; generation of electricity, heat power, and hot water; provision of storage and railroad transportation services; and lease of land. It has operations in Russia, the European Union, and Asia. The company was founded in 2000 and is headquartered in Kemerovo, Russia. As of February 27, 2020, Public Joint Stock Company 'Kuzbasskaya Toplivnaya Company' operates as a subsidiary of Kilton Overseas Limited.",Energy ,RU,5/7/2010,Kuzbasskaya Toplivnaya Kompaniya PAO,,,,170.0,16860175400.0,Kuzbasskaya Toplivnaya Kompaniya PAO,RUB,Kuzbasskaya Toplivnaya Kompaniya PAO,Kuzbasskaya Toplivnaya Kompaniya PAO,,Kuzbasskaya Toplivnaya Kompaniya PAO,kbtk.me,,,Kuzbasskaya Toplivnaya Kompaniya PAO,,15384,K
,,KBT.L,K3 Business Technology Group PLC,GBP,LSE,Software & Services,"K3 Business Technology Group plc, together with its subsidiaries, provides integrated business solutions to retailers, manufacturers, and distributors in the supply chain sector primarily in the United Kingdom. It operates through Own IP and Supply Chain Solutions & Managed Services segments. The company offers enterprise resource planning and customer relationship management software, as well as point solutions, and hosting and managed services. It also provides computer software supply and consultancy services. The company supplies solutions comprising software products, such as Microsoft Dynamics, NAV, and CRM, as well as K3 Syspro, Sage, and Pebblestone Fashion. It also operates in the Netherlands, Ireland, rest of Europe, the Middle East, Asia, the United States, and internationally. K3 Business Technology Group plc was incorporated in 1991 and is headquartered in Manchester, the United Kingdom.",Technology,GB,12/8/1994,K3 Business Technology Group PLC,,,,118.0,50677104.0,K3 Business Technology Group PLC,,K3 Business Technology Group PLC,K3 Business Technology Group PLC,,K3 Business Technology Group PLC,kbt.l,,,K3 Business Technology Group PLC,,15385,K
,,KBX.DE,Knorr Bremse AG,EUR,XETRA,Capital Goods,"Knorr-Bremse Aktiengesellschaft develops, produces, markets, and services braking and other systems for rail and commercial vehicles worldwide. It offers intelligence entrance, HVAC, auxiliary power supply, control component and windscreen wiper, and driver assistance systems, as well as platform screen doors, friction materials, and control technology products for mass transit and long distance rail vehicles. The company also provides electronic brake controls, as well as driver assistance, air supply, and powertrain systems for trucks, buses, trailers, and agricultural machinery. In addition, it offers leasing, holding, logistics, and media and IT services. The company is headquartered in Munich, Germany. Knorr-Bremse Aktiengesellschaft is a subsidiary of KB Holding GmbH.",Machinery,DE,10/12/2018,Knorr Bremse AG,,,,107.38,17341763600.0,Knorr Bremse AG,,Knorr Bremse AG,Knorr Bremse AG,,Knorr Bremse AG,kbx.de,,,Knorr Bremse AG,,15386,K
,,KBX.SW,Knorr Bremse AG,CHF,SIX,Capital Goods,"Knorr-Bremse Aktiengesellschaft develops, produces, markets, and services braking and other systems for rail and commercial vehicles worldwide. It offers intelligence entrance, HVAC, auxiliary power supply, control component and windscreen wiper, and driver assistance systems, as well as platform screen doors, friction materials, and control technology products for mass transit and long distance rail vehicles. The company also provides electronic brake controls, as well as driver assistance, air supply, and powertrain systems for trucks, buses, trailers, and agricultural machinery. In addition, it offers leasing, holding, logistics, and media and IT services. The company is headquartered in Munich, Germany. Knorr-Bremse Aktiengesellschaft is a subsidiary of KB Holding GmbH.",Machinery,DE,10/12/2018,Knorr Bremse AG,,,,106.9,18407219200.0,Knorr Bremse AG,CHF,Knorr Bremse AG,Knorr Bremse AG,,Knorr Bremse AG,kbx.sw,,,Knorr Bremse AG,,15387,K
,,KC4.DE,Kone Oyj,EUR,XETRA,Capital Goods,"KONE Oyj, together with its subsidiaries, engages in the elevator and escalator business worldwide. It offers elevators, escalators, auto walks, and automatic building doors. The company also provides maintenance services under the KONE Care and KONE 24/7 Connected name; modernization solutions; various residential solutions; KONE Access, an access control system, which is integrated with elevator system and building doors; destination control system that reduce waiting and travel times; KONE infotainment, a communication channel for building tenants and visitors; and monitoring solutions that enable real-time inspection of elevators and escalators. In addition, it offers people flow planning and consulting services; and solutions for special buildings and large projects. The company was founded in 1910 and is based in Espoo, Finland.",Machinery,FI,6/1/2005,Kone Oyj,,,,71.12,36619190000.0,Kone Oyj,,Kone Oyj,Kone Oyj,,Kone Oyj,kc4.de,,,Kone Oyj,,15388,K
,,KCAC,Kensington Capital Acquisition Corp.,USD,NYSE,,"Kensington Capital Acquisition Corp. is a blank check company that focuses on effecting merger, capital stock exchange, asset acquisition, stock purchase, and reorganization. The company was founded in 2020 and is based in Westbury, New York.",,US,,Kensington Capital Acquisition Corp.,,,,23.5,675625020.0,Kensington Capital Acquisition Corp.,$,Kensington Capital Acquisition Corp.,Kensington Capital Acquisition Corp.,,Kensington Capital Acquisition Corp.,kcac,,,Kensington Capital Acquisition Corp.,,15389,K
,,KCHE.ME,Kamchatskenergo PAO,RUB,MCX,Utilities,"Public Joint Stock Company Kamchatskenergo engages in the generation, transmission, distribution, and sale of electric and thermal energy in Russia. It also provides services for the operation of energy facilities; and undertakes other activities. The company is based in Petropavlovsk-Kamchatsky, Russia. Public Joint Stock Company Kamchatskenergo is a subsidiary of PJSC 'RusHydro'.",Utilities,RU,7/23/2007,Kamchatskenergo PAO,,,,0.209,10254773200.0,Kamchatskenergo PAO,RUB,Kamchatskenergo PAO,Kamchatskenergo PAO,,Kamchatskenergo PAO,kche.me,,,Kamchatskenergo PAO,,15390,K
,,KCN.AX,Kingsgate Consolidated Ltd,AUD,ASX,Materials,"Kingsgate Consolidated Limited engages in the exploration, development, and mining of gold and silver mineral properties. It holds a 100% interest in the Nueva Esperanza gold/silver project located in the Atacama region of northern Chile; and Chatree gold mine located in central Thailand. The company was incorporated in 1970 and is based in Sydney, Australia.",Metals & Mining,AU,4/21/1998,Kingsgate Consolidated Ltd,,,,0.935,211521312.0,Kingsgate Consolidated Ltd,A$,Kingsgate Consolidated Ltd,Kingsgate Consolidated Ltd,,Kingsgate Consolidated Ltd,kcn.ax,,,Kingsgate Consolidated Ltd,,15391,K
,,KCO.DE,Kloeckner & Co SE,EUR,XETRA,Capital Goods,"Klöckner & Co SE, through its subsidiaries, distributes steel and metal products. It operates through Kloeckner Metals US, Kloeckner Metals Services Europe, Kloeckner Metals Switzerland, and Kloeckner Metals Distribution Europe segments. The company's product portfolio includes flat steel products, such as thin sheet and strips, as well as thick sheets; long steel products comprising merchant bars, sectional steel, and beams; tubes and hollow sections that include structural hollow sections, precision tubes, and seamless heavy-wall pipes; stainless steel and high-grade steel, including sheet, profiles, and tubes; aluminum profiles, sheets, strips, and plates; and special products for building installations, roof and wall construction, and water supply. It also provides various services, including cutting and splitting of steel strips; forming and manufacturing of pressed parts; CNC turning/milling; 2D/3D tube laser cutting; laser and water jet cutting; processing of structural steel; plasma and oxy-fuel cutting; shot blasting and primer painting; and sawing/drilling/rounding off. In addition, the company offers warehousing, logistics, and materials management services. It serves small to medium-sized steel and metal consumers, primarily from the construction industry, as well as machinery and mechanical engineering industries; and supplies intermediate products for the automotive, shipbuilding, and consumer goods industries. The company was founded in 1906 and is headquartered in Duisburg, Germany.",Trading Companies & Distributors,DE,6/28/2006,Kloeckner & Co SE,,,,8.61,858847490.0,Kloeckner & Co SE,,Kloeckner & Co SE,Kloeckner & Co SE,,Kloeckner & Co SE,kco.de,,,Kloeckner & Co SE,,15392,K
,,KCP.NS,KCP Ltd,INR,NSE,Materials,"The KCP Limited engages in the cement, heavy engineering, power generation, and hospitality businesses in India and Vietnam. It operates through Cement unit, Engineering Unit, Power Generation unit, and Hotel segments. The company manufactures and sells cement; a range of heavy equipment for various industries, such as cement, sugar, power, mining (minerals), mineral processing, metal, oil and gas, chemicals and fertilizers, defense, space, industrial gases, and general engineering. In addition, it operates a 30 MW power co-generation plant in Son Hoa, Vietnam and sells it to the National Grid in Vietnam. Further, the company manufactures sugar; and operates Mercure Hyderabad KCP hotel in Hyderabad, India. The KCP Limited was founded in 1941 and is based in Chennai, India.",Construction,IN,8/24/1995,KCP Ltd,,,,76.2,9823779800.0,KCP Ltd,?,KCP Ltd,KCP Ltd,,KCP Ltd,kcp.ns,,,KCP Ltd,,15393,K
,,KCPSUGIND.NS,KCP Sugar and Industries Corp Ltd,INR,NSE,"Food, Beverage & Tobacco","K.C.P. Sugar and Industries Corporation Limited, together with its subsidiaries, manufactures and sells sugar and allied products in India and internationally. It also provides bio fertilizers; chemicals comprising industrial alcohol, carbon dioxide, and calcium lactate, as well as organic manure and mycorrhiza vam products; and rectified spirit, extra neutral alcohol, and ethanol. In addition, the company manufactures liquid?solid separation equipment for industrial and environmental applications; and offers research services related to agriculture. Further, it operates cogeneration plants in Vuyyuru and Lakshmipuram, Krishna District, Andhra Pradesh. K.C.P. Sugar and Industries Corporation Limited was incorporated in 1995 and is based in Chennai, India.",Food Products,IN,3/19/2002,KCP Sugar and Industries Corp Ltd,,,,15.75,1791483780.0,KCP Sugar and Industries Corp Ltd,?,KCP Sugar and Industries Corp Ltd,KCP Sugar and Industries Corp Ltd,,KCP Sugar and Industries Corp Ltd,kcpsugind.ns,,,KCP Sugar and Industries Corp Ltd,,15394,K
,,KCR.L,KCR Residential REIT PLC,GBP,LSE,Real Estate,"KCR Residential REIT Plc engages in the business of acquiring and managing residential property. The firm is engaged in the business of acquiring and managing residential property in the United Kingdom for letting to third parties on long and short leases. Its property acquisitions are focused on London, primarily on locations, such as Kensington & Chelsea, Westminster and the surrounding area. Its properties include Coleherne Road, London (SW10), which is a residential building, and retirement developments, such as Heathside, Finchley Road, London (NW11); Osprey Court, Finchley Road, London (NW3); Challoner Court, Bromley Road, Shortlands (Kent); Town Mill, Marlborough (Wiltshire); Chymeddan, Newquay (Cornwall); Manor House Court, Old Isleworth (Middlesex), and Millside Place, Old Isleworth (Middlesex).",Real Estate,GB,7/3/2015,KCR Residential REIT PLC,,,,23.5,6478855.0,KCR Residential REIT PLC,,KCR Residential REIT PLC,KCR Residential REIT PLC,,KCR Residential REIT PLC,kcr.l,,,KCR Residential REIT PLC,,15395,K
,,KCT.L,Kin and Carta PLC,GBP,LSE,Media & Entertainment,"Kin and Carta plc provides digital transformation services in the United Kingdom, the United States, and internationally. The company helps its clients to invent, operate, and market digital products and services. It offers market landscaping, data intelligence, research and insights, customer journey mapping, and innovation strategy. The company also provides mobile, Web app, smart TV, and VR/AR/MR development, as well as IoT and connected products, and intelligent experience and automation services. In addition, it offers creative communication, Web design and build, SEO/SEM, CRM, PR, social media strategy and execution, and commerce strategy services. Further, the company provides digital maturity assessment, agile transformation, digital governance and operation, e-commerce platform integration, enterprise content platform integration, and cloud native platform integration services. It serves healthcare, financial services, transportation, industrial and agriculture, retail and distribution, and other sectors. The company was formerly known as St Ives plc and changed its name to Kin and Carta plc in October 2018. Kin and Carta plc was incorporated in 1981 and is headquartered in London, the United Kingdom.",Media,GB,1/3/1986,Kin and Carta PLC,,,,153.5,259178624.0,Kin and Carta PLC,,Kin and Carta PLC,Kin and Carta PLC,,Kin and Carta PLC,kct.l,,,Kin and Carta PLC,,15396,K
,,KDCE,Kid Castle Educational Corporation,USD,PNK,,"Kid Castle Educational Corporation operates and manages a portfolio of biopharmaceutical, agricultural, and pure-play cannabidiol (CBD) assets in the United States of America. It extracts, purchases, and distributes bulk pure CBD, isolate, hemp oil, THC-free CBD distillate, and crude CBD Oil. The company was formerly known as King Ball International Technology Corporation and changed its name to Kid Castle Educational Corporation in August 2002. Kid Castle Educational Corporation was founded in 1986 and is based in Torrance, California.",,US,,Kid Castle Educational Corporation,,,,0.003,360000.0,Kid Castle Educational Corporation,$,Kid Castle Educational Corporation,Kid Castle Educational Corporation,,Kid Castle Educational Corporation,kdce,,,Kid Castle Educational Corporation,,15397,K
,,KDDL.NS,KDDL Ltd,INR,NSE,Consumer Durables & Apparel,"KDDL Limited, together with its subsidiaries, manufactures and markets watch dials and hands, progressive tools, precision engineering components, and sub-assemblies in India. It operates through four segments: Precision and Watch Components, Watch and Accessories, Marketing and Other Support Services, and Others. The company operates and manages retail stores for Swiss watches; trades in watches and accessories; manufactures and distributes packaging boxes; and offers IT-based business solutions. KDDL Limited also exports its products. The company was formerly known as Kamla Dials & Devices Ltd. KDDL Limited was incorporated in 1981 and is headquartered in Chandigarh, India.","Textiles, Apparel & Luxury Goods",IN,3/23/2016,KDDL Ltd,,,,258.3,2992327940.0,KDDL Ltd,?,KDDL Ltd,KDDL Ltd,,KDDL Ltd,kddl.ns,,,KDDL Ltd,,15398,K
,,KDNC.L,Cadence Minerals PLC,GBP,LSE,Materials,"Cadence Minerals Plc engages in the identification, investment, and development of lithium and rare earth assets. The firm invests across the globe, principally in lithium mining projects. The firm focuses on economic stakes in upstream exploration and development assets within strategic metals. Its projects include Sonora Lithium, Cinovec Lithium, Karibib Lithium, Yangibana Rare Earth Project, Greenland Rare Earth Project and Macarthur Minerals Projects. The Sonora Lithium Project consists of over 10 concessions, which confer rights for exploration, mining and production. The Cinovec Lithium Project hosts tin deposit. The Karibib Lithium Project consist of five existing Exclusive Prospecting Licenses (EPLs) in the region. The Yangibana Project hosts extensive rare earths-bearing ferrocarbonatite/ironstone veins. The Cadence Project has four Exploration Licenses covering an area of over 210 square kilometers.",Metals & Mining,GB,3/24/2005,Cadence Minerals PLC,,,,19.75,29298926.0,Cadence Minerals PLC,,Cadence Minerals PLC,Cadence Minerals PLC,,Cadence Minerals PLC,kdnc.l,,,Cadence Minerals PLC,,15399,K
