Unnamed: 0,index,symbol,long name,currency,exchange,industry,description,sector,country,ipo date,shorter name,Type,Industries,Similar Companies,price,mktCap,name raw,currency symbol,robinhood name,short name,Warrant,shortest name,url name, smart_order ,random csv equations,pure name,shortest - pure diff,first_letter
,,8069.HK,WWPKG Holdings Company Ltd,HKD,HKSE,Consumer Services,"WWPKG Holdings Company Limited operates as a travel agent in Hong Kong and Macau. It designs, develops, and sells package tours; and sells air tickets and hotel accommodations, as well as ancillary travel related products and services under the WWPKG brand, as well as invests in tourism and travel technology related businesses. The company was founded in 1979 and is headquartered in Kowloon, Hong Kong. WWPKG Holdings Company Limited is a subsidiary of WWPKG Investment Holdings Limited.","Hotels, Restaurants & Leisure",HK,1/12/2017,WWPKG Holdings Company Ltd,,,,0.27,108000008.0,WWPKG Holdings Company Ltd,HKD,WWPKG Holdings Company Ltd,WWPKG Holdings Company Ltd,,WWPKG Holdings Company Ltd,8069.hk,,,WWPKG Holdings Company Ltd,,8
,,8076.HK,Sing Lee Software (Group) Ltd,HKD,HKSE,Software & Services,"Sing Lee Software (Group) Limited, an investment holding company, develops and sells information and network technologies and services to the financial industry in the People's Republic of China. It engages in the development and sale of software products; sale of related hardware products; and provision of technical support services. The company was founded in 1993 and is headquartered in Wan Chai, Hong Kong. Sing Lee Software (Group) Limited is a subsidiary of Goldcorp Industrial Limited.",Technology,HK,9/5/2001,Sing Lee Software (Group) Ltd,,,,0.067,88255088.0,Sing Lee Software (Group) Ltd,HKD,Sing Lee Software (Group) Ltd,Sing Lee Software (Group) Ltd,,Sing Lee Software (Group) Ltd,8076.hk,,,Sing Lee Software (Group) Ltd,,8
,,8041.HK,Luxey International (Holdings) Ltd,HKD,HKSE,Consumer Durables & Apparel,"Luxey International (Holdings) Ltd. is an investment company, which engages in the provision of online shopping services. The company employs 711 full-time employees The firm operates through two business segments. The Swimwear and Garment segment is engaged in the manufacturing and trading of swimwear and garment products. The On-line Shopping and Advertising segment is engaged in the provision of on-line shopping, advertising and media related services.","Textiles, Apparel & Luxury Goods",HK,7/7/2000,Luxey International (Holdings) Ltd,,,,0.375,296154752.0,Luxey International (Holdings) Ltd,HKD,Luxey International (Holdings) Ltd,Luxey International (Holdings) Ltd,,Luxey International (Holdings) Ltd,8041.hk,,,Luxey International (Holdings) Ltd,,8
,,8392.HK,Satu Holdings Ltd,HKD,HKSE,Consumer Durables & Apparel,"Satu Holdings Limited, an investment holding company, designs, develops, produces, and trades in homeware products. The company offers home decorations, bathroom accessories, and kitchenware and tableware under the Satu Brown brand name. It serves brand owners and licensee, chain supermarkets, and department stores through a third party e-commerce platform in the United Kingdom, United States, Denmark, France, Poland, Australia, Germany, Switzerland, Italy, and internationally. The company was founded in 2000 and is headquartered in Kwun Tong, Hong Kong.",Consumer products,HK,10/16/2017,Satu Holdings Ltd,,,,0.097,97000000.0,Satu Holdings Ltd,HKD,Satu Holdings Ltd,Satu Holdings Ltd,,Satu Holdings Ltd,8392.hk,,,Satu Holdings Ltd,,8
,,8042.HK,KOS International Holdings Ltd,HKD,HKSE,Commercial  & Professional Services,"KOS International Holdings Limited provides human resources (HR) services to clients from various industries in Hong Kong, Macau, and the People's Republic of China. It offers recruitment services, and secondment and payroll services. Its recruitment services include for various positions at all levels, including administrative, executive, managerial, and professional. The company also assists in payroll and other administration services at its clients' requests. KOS International Holdings Limited was founded in 2009 and is headquartered in Tsim Sha Tsui, Hong Kong. KOS International Holdings Limited is a subsidiary of KJE Limited.",Professional Services,HK,10/12/2018,KOS International Holdings Ltd,,,,0.044,35200000.0,KOS International Holdings Ltd,HKD,KOS International Holdings Ltd,KOS International Holdings Ltd,,KOS International Holdings Ltd,8042.hk,,,KOS International Holdings Ltd,,8
,,8001.HK,Orient Securities International Holdings Ltd,HKD,HKSE,Diversified Financials,"Orient Securities International Holdings Limited, an investment holding company, provides brokerage, and underwriting and placing services in Hong Kong. It also offers margin financing and money lending, securities trading, nominee, and initial public offering financing services. The company was incorporated in 2009 and is headquartered in Central, Hong Kong.",Financial Services,HK,1/15/2014,Orient Securities International Holdings Ltd,,,,0.22,95040000.0,Orient Securities International Holdings Ltd,HKD,Orient Securities International Holdings Ltd,Orient Securities International Holdings Ltd,,Orient Securities International Holdings Ltd,8001.hk,,,Orient Securities International Holdings Ltd,,8
,,8395.HK,Tree Holdings Ltd,HKD,HKSE,Retailing,"Tree Holdings Limited is a holding company principally engaged in the sale of furniture and home accessories. The Company operating its business under the brand name of TREE. The Company’s products portfolio includes furniture and home accessories such as tables, chairs, storage products, sofas, beds, kitchenware, bed and bathroom related products, jars, cushions, mattresses, utensils and baskets, among others. The Company also engaged in the provision of styling and consulting services, consignment sales services, the distribution and licensing of its intellectual property rights, and operation of the cafe inside its retail shop.",Distributors,HK,1/25/2018,Tree Holdings Ltd,,,,0.6,950400060.0,Tree Holdings Ltd,HKD,Tree Holdings Ltd,Tree Holdings Ltd,,Tree Holdings Ltd,8395.hk,,,Tree Holdings Ltd,,8
,,8003.HK,Great World Company Holdings Ltd,HKD,HKSE,Materials,"Great World Company Holdings Ltd, an investment holding company, engages in property, forestry, and general trading, and advertising businesses in the People's Republic of China. It is involved in the property investment and development activities; and operation and management of residential and commercial properties. The company also cultivates forestry and wood material products, Chinese herbal medicine ingredients and specialty agricultural byproducts; sells processed and prepackaged food; and offers information consultation services. In addition, it engages in the provision of mobile advertising media services for property market customers; railroad magazine distribution; and e-commerce platform management. Additionally, the company distributes information technology products, industrial consumer products, as well as engages in related research and development, and product manufacturing activities. The company was formerly known as T S Telecom Technologies Limited and changed its name to Great World Company Holdings Ltd in November 2008. Great World Company Holdings Ltd was founded in 1991 and is headquartered in Wanchai, Hong Kong.",Paper & Forest,HK,12/2/1999,Great World Company Holdings Ltd,,,,0.079,256964896.0,Great World Company Holdings Ltd,HKD,Great World Company Holdings Ltd,Great World Company Holdings Ltd,,Great World Company Holdings Ltd,8003.hk,,,Great World Company Holdings Ltd,,8
,,8005.HK,Yuxing Infotech Investment Holdings Ltd,HKD,HKSE,Consumer Durables & Apparel,"Yuxing InfoTech Investment Holdings Limited, an investment holding company, primarily manufactures, sells, and distributes information home appliances and complementary products to consumer markets in the People's Republic of China, Hong Kong, the United States, Australia, and internationally. It operates through Information Home Appliances, Internet Data Centre (IDC), Investing, Leasing, and Other Operations segments. The company provides broadband internet digital audio and video products; and develops, constructs, operates, merges, acquires, and leases properties that are used as IDC. It also offers high digital set-top box (STB), hybrid dual mode STB, over-the-top /Internet protocol television STB, STB equipped with an Android system products, etc. In addition, the company trades in securities; invests in financial instruments; provides investment consultancy and trustee services; and holds and leases properties. Further, it is involved in the manufacture, sale, and trade of electronic components and miscellaneous products; provision of asset management services; research and development of software and hardware, and network technology services; and research and development, and software designing activities. The company was incorporated in 1999 and is headquartered in Beijing, the People's Republic of China.",Consumer products,HK,1/31/2000,Yuxing Infotech Investment Holdings Ltd,,,,0.45,1119464960.0,Yuxing Infotech Investment Holdings Ltd,HKD,Yuxing Infotech Investment Holdings Ltd,Yuxing Infotech Investment Holdings Ltd,,Yuxing Infotech Investment Holdings Ltd,8005.hk,,,Yuxing Infotech Investment Holdings Ltd,,8
,,8006.HK,Sino Splendid Holdings Ltd,HKD,HKSE,Media & Entertainment,"Sino Splendid Holdings Limited, an investment holding company, engages in publishing and events organizing business in Singapore and Hong Kong. It operates through four segments: Travel Media Business, Financial Magazine Business, Securities Investment, and Money Lending. The Travel Media Business segment provides advertising services through the Internet and travel magazines; organizes events; and publishes magazines. The Financial Magazine Business segment offers contents and advertising services in a financial magazine distributed in the People's Republic of China. The Securities Investment segment invests in securities. The Money Lending segment provides funds to clients and receives loan interest income in return. The company was formerly known as China.com Inc. and changed its name to Sino Splendid Holdings Limited in October 2013. Sino Splendid Holdings Limited was founded in 1974 and is headquartered in Sheung Wan, Hong Kong.",Media,HK,3/9/2000,Sino Splendid Holdings Ltd,,,,0.08,37038480.0,Sino Splendid Holdings Ltd,HKD,Sino Splendid Holdings Ltd,Sino Splendid Holdings Ltd,,Sino Splendid Holdings Ltd,8006.hk,,,Sino Splendid Holdings Ltd,,8
,,8007.HK,Global Strategic Group Ltd,HKD,HKSE,Capital Goods,"Global Strategic Group Limited, an investment holding company, engages in the copper trading business in the People's Republic of China. It operates through four segments: Trading of Copper, Trading of Petrochemicals, Natural Gas Operations, and Leasing Business. It also invests in natural gas projects; sells natural gas, natural gas cooking appliances, and accessories; and provides pipeline installation services. In addition, the company offers leasing services for steel support axial force servo system and technology support. Further, it offers internet and e-commerce solutions, IT consulting and technical services; commodity trading services; and designs and constructs energy power generation equipment, energy storage systems, and power equipment, as well as provides technology development, technical, and technology transfer services. The company was formerly known as DIGITALHONGKONG.COM and changed its name to Global Strategic Group Limited in January 2015. Global Strategic Group Limited is based in Wan Chai, Hong Kong.",Trading Companies & Distributors,HK,4/17/2000,Global Strategic Group Ltd,,,,0.19,17322680.0,Global Strategic Group Ltd,HKD,Global Strategic Group Ltd,Global Strategic Group Ltd,,Global Strategic Group Ltd,8007.hk,,,Global Strategic Group Ltd,,8
,,8009.HK,Chinese Energy Holdings Ltd,HKD,HKSE,Capital Goods,"Chinese Energy Holdings Ltd. operates as an investment company which engages in the provision of management services, investment in financial and investment products. The company employs 19 full-time employees The firm's subsidiaries include Growwise Holdings Limited, Top Connect Holdings Limited and First Top Finance Limited.",Trading Companies & Distributors,HK,3/31/2000,Chinese Energy Holdings Ltd,,,,0.445,26210944.0,Chinese Energy Holdings Ltd,HKD,Chinese Energy Holdings Ltd,Chinese Energy Holdings Ltd,,Chinese Energy Holdings Ltd,8009.hk,,,Chinese Energy Holdings Ltd,,8
,,8133.HK,Jete Power Holdings Ltd,HKD,HKSE,Capital Goods,"Jete Power Holdings Limited, an investment holding company, manufactures and sells cast metal products in Germany, Hong Kong, the People's Republic of China, the United States, and internationally. It operates through two segments, Metal Casting and Entertainment. The company provides pump, filter, valve, and food machinery components made from stainless steel, carbon steel, bronze, and/or grey iron. It serves suppliers of flow control devices, electromechanical equipment, and industrial machinery and equipment. The company also organizes concerts and events. Jete Power Holdings Limited was incorporated in 2014 and is headquartered in Sheung Wan, Hong Kong.",Machinery,HK,4/30/2015,Jete Power Holdings Ltd,,,,0.013,54080000.0,Jete Power Holdings Ltd,HKD,Jete Power Holdings Ltd,Jete Power Holdings Ltd,,Jete Power Holdings Ltd,8133.hk,,,Jete Power Holdings Ltd,,8
,,8011.HK,Polyard Petroleum International Group Ltd,HKD,HKSE,Energy,"Polyard Petroleum International Group Limited, an investment holding company, engages in the exploration, exploitation, and development of oil and natural gas in the Philippines. The company holds interests in the Central Luzon gas project that covers approximately 6,840 square kilometers located in Central Luzon; and the South Cebu oil and gas project covering an area of 1,970 square kilometers located in Cebu Island. It also provides technical services; and consultancy services for oil and gas exploration and development, as well as trades in minerals, energy, and petroleum-related products. The company was formerly known as Kanstar Environmental Paper Products Holdings Limited and changed its name to Polyard Petroleum International Group Limited in November 2007. Polyard Petroleum International Group Limited is based in Wan Chai, Hong Kong. Polyard Petroleum International Group Limited is a subsidiary of Silver Star Enterprises Holdings Inc.",Energy ,HK,7/12/2002,Polyard Petroleum International Group Ltd,,,,0.115,441252704.0,Polyard Petroleum International Group Ltd,HKD,Polyard Petroleum International Group Ltd,Polyard Petroleum International Group Ltd,,Polyard Petroleum International Group Ltd,8011.hk,,,Polyard Petroleum International Group Ltd,,8
,,8013.HK,ECI Technology Holdings Ltd,HKD,HKSE,Commercial  & Professional Services,"ECI Technology Holdings Limited is engaged in the provision of extra-low voltage (ELV) solutions. The Company's solutions include central control monitoring systems such as security system, car park system and clubhouse management system, and telecommunications and broadcasting services systems, such as CABD System and SMATV System. It sources hardware, such as security cameras, display devices, cables and wires, and electronic and electrical components, as well as systems such as smartcard and access control systems from local and overseas suppliers. It provides total security solutions, including access control, burglar alarm, time attendance, elevator control and door phone entry system. Its customers in the private sector are property developers and property management companies in Hong Kong. Its customers in the public sector are government departments, such as drainage services department, leisure and cultural services department, electrical and mechanical services department.",Commercial Services & Supplies,HK,3/10/2017,ECI Technology Holdings Ltd,,,,0.053,84800000.0,ECI Technology Holdings Ltd,HKD,ECI Technology Holdings Ltd,ECI Technology Holdings Ltd,,ECI Technology Holdings Ltd,8013.hk,,,ECI Technology Holdings Ltd,,8
,,8017.HK,TradeGo FinTech Ltd,HKD,HKSE,Diversified Financials,"TradeGo FinTech Limited, an investment holding company, provides integrated securities trading platform services to brokerage firms and their clients in Hong Kong and the People's Republic of China. The company engages in the development of TradeGo Pro, a securities trading platform software. It offers front office trading system services to support trading of a range of financial instruments, including equities, ETFs, futures, options, warrants, and derivatives; value-added services; and other services, such as simulation trading platform, online account opening appointment, two-factor authentication, customized software development, cloud infrastructure and hosting, and online advertising services. In addition, the company holds market data vendor licenses from five stock and future exchanges, as well as provides a range of real-time market data feeds from these exchanges. Further, it develops computer hardware and software technology. The company was founded in 2011 and is headquartered in Hong Kong, Hong Kong.",Financial Services,HK,9/28/2018,TradeGo FinTech Ltd,,,,0.48,240000000.0,TradeGo FinTech Ltd,HKD,TradeGo FinTech Ltd,TradeGo FinTech Ltd,,TradeGo FinTech Ltd,8017.hk,,,TradeGo FinTech Ltd,,8
,,8018.HK,Finsoft Financial Investment Holdings Ltd,HKD,HKSE,Software & Services,"Finsoft Financial Investment Holdings Limited, an investment holding company, primarily develops and sells financial trading software solutions. The company operates through Financial Trading Software Solutions, Other IT and Internet Financial Platforms Services, Money Lending, Assets Investments, and Others segments. The Financial Trading Software Solutions segment provides trading and settlement systems of financial products for financial institutions. The Other IT and Internet Financial Platforms Services offers e-commerce platforms, other online consultancy services, IT services, and other financial information. The Money Lending segment provides loan financing products. The Assets Investments segment trades in listed securities and invests in properties for rental income. The Others segment offers referral services to source, identify, and refer deal opportunities to interested parties; and corporate finance advisory services. This segment also trades in gaming products, as well as offers related marketing services. In addition, the company provides administrative support services; invests in securities and equity; and develops mobile e-commerce platform. It primarily serves financial institutions that conduct brokerage business of financial products traded in Hong Kong. The company was formerly known as Finsoft Corporation and changed its name to Finsoft Financial Investment Holdings Limited in June 2015. Finsoft Financial Investment Holdings Limited was incorporated in 2012 and is headquartered in North Point, Hong Kong.",Technology,HK,9/26/2013,Finsoft Financial Investment Holdings Ltd,,,,0.05,63029000.0,Finsoft Financial Investment Holdings Ltd,HKD,Finsoft Financial Investment Holdings Ltd,Finsoft Financial Investment Holdings Ltd,,Finsoft Financial Investment Holdings Ltd,8018.hk,,,Finsoft Financial Investment Holdings Ltd,,8
,,8019.HK,Hao Wen Holdings Ltd,HKD,HKSE,Diversified Financials,"Hao Wen Holdings Limited is an investment holding company principally engaged in the manufacture and trading of biomass fuel in the People’s Republic of China. The Company is also engaged in the money lending business and the sale of biodegradable food containers and disposable industrial packaging for consumer products in Hong Kong. The Company’s subsidiaries include Perfect Take Group Limited, Smart Courage Limited and Earth Buddy (Intellectual Property) Limited.",Financial Services,HK,7/20/2001,Hao Wen Holdings Ltd,,,,0.25,64393000.0,Hao Wen Holdings Ltd,HKD,Hao Wen Holdings Ltd,Hao Wen Holdings Ltd,,Hao Wen Holdings Ltd,8019.hk,,,Hao Wen Holdings Ltd,,8
,,8146.HK,Grace Wine Holdings Ltd,HKD,HKSE,"Food, Beverage & Tobacco","Grace Wine Holdings Limited, an investment holding company, engages in the production and distribution of wine products under the Grace Vineyard brand name in the People's Republic of China. It offers red, white, and sparkling types of wine. The company also engages in the plantation of vines; and sale of wine grapes. Grace Wine Holdings Limited was founded in 1997 and is based in Quarry Bay, Hong Kong.",Beverages,CN,6/27/2018,Grace Wine Holdings Ltd,,,,0.25,200000000.0,Grace Wine Holdings Ltd,HKD,Grace Wine Holdings Ltd,Grace Wine Holdings Ltd,,Grace Wine Holdings Ltd,8146.hk,,,Grace Wine Holdings Ltd,,8
,,8020.HK,Unitas Holdings Ltd,HKD,HKSE,Diversified Financials,"Unitas Holdings Limited, an investment holding company, provides corporate finance advisory services primarily to listed and non-listed companies in Hong Kong, the People's Republic of China, and internationally. It operates through Corporate Finance Advisory Service; Dry Bulk Shipping and Logistic Services; and IP Automation and Entertainment Business segments. The company advises on the listing rules, growth enterprise market (GEM) listing rules, and takeovers codes; mergers and acquisitions activities; other corporate activities, such as fund raising exercises; and corporate resumptions, as well as acts as an independent financial adviser to transactions of listed issuers that are under the listing rules, GEM listing rules, and takeovers codes. It also provides automation gift machines, thematic game machines, and carnival game booths, as well as retails outlet. The company was formerly known as Chanceton Financial Group Limited and changed its name to Unitas Holdings Limited in October 2016. Unitas Holdings Limited was incorporated in 2011 and is headquartered in Tsim Sha Tsui, Hong Kong.",Financial Services,HK,10/12/2011,Unitas Holdings Ltd,,,,0.038,93972480.0,Unitas Holdings Ltd,HKD,Unitas Holdings Ltd,Unitas Holdings Ltd,,Unitas Holdings Ltd,8020.hk,,,Unitas Holdings Ltd,,8
,,8021.HK,WLS Holdings Ltd,HKD,HKSE,Capital Goods,"WLS Holdings Ltd. engages in the provision of construction services. The company employs 93 full-time employees The firm is also engaged in the provision of gondolas, parapet railings and access equipment installation and maintenance services. The Company’s subsidiaries include Bright Advantage Limited, Conkar Investments Limited and First Occasion Limited.",Construction,HK,12/7/2001,WLS Holdings Ltd,,,,0.029,416645888.0,WLS Holdings Ltd,HKD,WLS Holdings Ltd,WLS Holdings Ltd,,WLS Holdings Ltd,8021.hk,,,WLS Holdings Ltd,,8
,,8022.HK,Evershine Group Holdings Ltd,HKD,HKSE,Capital Goods,"Evershine Group Holdings Ltd. engages in the investment business. The company employs 46 full-time employees Along with subsidiaries, the Company operates its business through five segments. The Property Development and Investment segment is mainly engaged in building construction, property development and construction materials trading and related consulting services and property leasing business in Turkey and Hong Kong. The Money Lending segment is engaged in money lending business in Hong Kong. The Trading segment is engaged in the trading of Onyx marbles and red wine. The Cemetery segment is engaged in the construction and operation of the cemeteries in Mainland China. The Mobile Application segment is engaged in development of mobile games, game publishing, applications, related intellectual property and platform, and provision of related solutions.",Trading Companies & Distributors,HK,8/13/2001,Evershine Group Holdings Ltd,,,,0.011,23806752.0,Evershine Group Holdings Ltd,HKD,Evershine Group Holdings Ltd,Evershine Group Holdings Ltd,,Evershine Group Holdings Ltd,8022.hk,,,Evershine Group Holdings Ltd,,8
,,8023.HK,Kwong Man Kee Group Ltd,HKD,HKSE,Capital Goods,"Kwong Man Kee Group Limited, an investment holding company, provides engineering services to the car park flooring industry in Hong Kong. The company offers flooring services, including application of proprietary floor coating products for providing a colorful, slip-resistance, and hard wearing surface that is resistant against water and petrochemicals; and ancillary services comprising specialized texture painting and waterproofing works. It also offers screeding and anti-skid surfacing services. The company was founded in 2002 and is headquartered in Kowloon, Hong Kong. Kwong Man Kee Group Limited is a subsidiary of Sage City Investments Limited.",Construction,HK,10/13/2016,Kwong Man Kee Group Ltd,,,,0.35,210000000.0,Kwong Man Kee Group Ltd,HKD,Kwong Man Kee Group Ltd,Kwong Man Kee Group Ltd,,Kwong Man Kee Group Ltd,8023.hk,,,Kwong Man Kee Group Ltd,,8
,,8025.HK,Asian Capital Resources Holdings Ltd,HKD,HKSE,Diversified Financials,"Asian Capital Resources (Holdings) Limited is an investment holding company principally engaged in private securities investment, private equity investment, venture capital investment and the provision of business consultation services and private investment fund management services. The Company’s subsidiaries include Shanghai Zero2ipo M&A Fund Management Co., Ltd and Kasun Asian Capital Resources Management Limited.",Financial Services,HK,12/16/1999,Asian Capital Resources Holdings Ltd,,,,0.48,96432960.0,Asian Capital Resources Holdings Ltd,HKD,Asian Capital Resources Holdings Ltd,Asian Capital Resources Holdings Ltd,,Asian Capital Resources Holdings Ltd,8025.hk,,,Asian Capital Resources Holdings Ltd,,8
