Column1,index,symbol,long name,currency,exchange,industry,description,sector,country,ipo date,shorter name,Type,Industries,Similar Companies,price,mktCap,name raw,currency symbol,robinhood name,short name,Warrant,shortest name,url name, smart_order ,random csv equations,pure name,shortest - pure diff,order,first_letter
38.0,9568.0,HD,Home Depot Inc,USD,NYSE,Home Improvement Retail,"The Home Depot, Inc. engages in the sale of building materials and home improvement products. The company is headquartered in Atlanta, Georgia and currently employs 413,000 full-time employees. The firm sells an assortment of building materials, home improvement products, and lawn and garden products, and provides various services. The Home Depot stores serves three primary customer groups: do-it-yourself (DIY) customers, do-it-for-me (DIFM) customers and professional customers. Its DIY customers are home owners purchasing products and completing their own projects and installations. The firm assists these customers with specific product and installation questions both in its stores and through online resources and other media designed to provide product and project knowledge. Its DIFM customers are home owners purchasing materials themselves and hiring third parties to complete the project or installation. Professional Customers are primarily professional renovators/remodelers, general contractors, repairmen, installers, small business owners and tradesmen.",Consumer Cyclical,US,4/19/1984,Home Depot,Stock,"['Consumer Cyclical', 'Home Improvement Stores', 'Retail - Apparel & Specialty']","['BLDR', 'LOW', 'LL', 'SHOS']",277.75,313000000000.0,Home Depot Inc,$,0,Home Depot,False,Home Depot,home-depot,"$900,000,000,313,000,000,000.00 ",,Home Depot,0.0,39,H
39.0,11499.0,HDB,HDFC Bank Limited,USD,NYSE,Banks,,Financial Services,,,HDFC Bank,Stock,"['Financial Services', 'Banks - Regional - Asia', 'Banks']",['IBN'],66.49,102000000000.0,HDFC Bank Limited,$,0,HDFC Bank,False,HDFC Bank,hdfc-bank,"$900,000,000,102,000,000,000.00 ",,HDFC Bank,0.0,40,H
40.0,8356.0,HON,Honeywell International Inc,USD,NYSE,Specialty Industrial Machinery,"Honeywell International, Inc. is a software industrial company, which offers industry specific solutions to aerospace and automotive products and services. The company is headquartered in Charlotte, North Carolina and currently employs 114,000 full-time employees. The firm operates through four segments: Aerospace, Home and Building Technologies, Performance Materials and Technologies, and Safety and Productivity Solutions. The firm's Aerospace segment supplies products, software and services for aircraft and vehicles that it sells to original equipment manufacturers (OEMs) and other customers. The Home and Building Technologies segment provides products, software, solutions and technologies that help owners of homes stay connected and in control of their comfort, security and energy use. The Performance Materials and Technologies segment is engaged in developing and manufacturing materials, process technologies and automation solutions. The Safety and Productivity Solutions segment is engaged in providing products, software and connected solutions to customers that manage productivity, workplace safety and asset performance.",Industrials,US,9/19/1985,Honeywell International,Stock,"['Industrials', 'Diversified Industrials', 'Industrial Products']",[],199.29,140000000000.0,Honeywell International Inc,$,Honeywell,Honeywell,False,Honeywell,honeywell,"$900,000,000,140,000,000,000.00 ",,Honeywell,0.0,41,H
41.0,9251.0,HSBC,HSBC Holdings plc.,USD,NYSE,Banks Diversified,,Financial Services,GB,,HSBC Holdings.,Stock,"['Financial Services', 'Banks - Global', 'Banks']","['TD', 'BCS', 'SAN', 'BAC', 'DB', 'JPM', 'BBD', 'ITUB', 'C']",25.31,104000000000.0,HSBC Holdings plc.,$,0,HSBC Holdings.,False,HSBC Holdings.,hsbc,"$900,000,000,104,000,000,000.00 ",,HSBC Holdings.,0.0,42,H
413.0,7813.0,HAL,Halliburton Co,USD,NYSE,Oil & Gas Equipment & Services,"Halliburton Co. engages in the provision of services and products to the energy industry related to the exploration, development, and production of oil and natural gas. The company is headquartered in Houston, Texas and currently employs 60,000 full-time employees. The company operates through two segments: the Completion and Production segment, and the Drilling and Evaluation segment. The Completion and Production segment delivers cementing, stimulation, intervention, pressure control, specialty chemicals, artificial lift and completion services. The Drilling and Evaluation segment provides field and reservoir modeling, drilling, evaluation and wellbore placement solutions that enable customers to model, measure, drill and optimize their well construction activities. The company serves national and independent oil and natural gas companies. As of December 31, 2016, it had conducted business in approximately 70 countries around the world.",Energy,US,9/15/1948,Halliburton,Stock,"['Energy', 'Oil & Gas Equipment & Services', 'Oil & Gas - Services']","['CKH', 'SPN', 'NOV', 'SLB', 'NR', 'OII', 'RES', 'TTI', 'RDS.A', 'BHGE']",14.18,12535219200.0,Halliburton Co,$,Halliburton,Halliburton,False,Halliburton,halliburton,"$90,000,000,012,535,200,000.00 ",,Halliburton,0.0,414,H
414.0,9961.0,HAS,Hasbro Inc,USD,NASDAQ,Leisure,"Hasbro, Inc. engages in the provision of children and family leisure time products and services with a portfolio of brands and entertainment properties. The company is headquartered in Pawtucket, Rhode Island and currently employs 5,800 full-time employees. The firm's operating segments include the U.S. and Canada, International, and Entertainment and Licensing. From toys and games to content development, including television programming, motion pictures, digital gaming and a consumer products licensing program, Hasbro fulfills the fundamental need for play and connection for children and families around the world. The firm's U.S. and Canada segment is engaged in the marketing and sale of its products in the United States and Canada. The International segment is engaged in the marketing and sale of the Company's product categories to retailers and wholesalers in most countries in Europe, Latin and South America, and the Asia Pacific region and through distributors in those countries where it has no direct presence. The Entertainment and Licensing segment includes the Company's consumer products licensing, digital gaming, television and movie entertainment operations.",Consumer Cyclical,US,6/23/1999,Hasbro,Stock,"['Consumer Cyclical', 'Leisure', 'Travel & Leisure']","['JAKK', 'EA', 'MAT', 'SGMS', 'ATVI', 'DIS', 'VIAB', 'PTE']",86.53,11856601100.0,Hasbro Inc,$,0,Hasbro,False,Hasbro,hasbro,"$90,000,000,011,856,600,000.00 ",,Hasbro,0.0,415,H
415.0,8534.0,HBAN,Huntington Bancshares Inc,USD,NASDAQ,Banks Regional,"Huntington Bancshares, Inc. operates as a bank holding company. The company is headquartered in Columbus, Ohio and currently employs 15,659 full-time employees. Through its subsidiaries, including its bank subsidiary, The Huntington National Bank (the Bank), the Company provides commercial and consumer banking services, mortgage banking services, automobile financing, recreational vehicle and marine financing, equipment leasing, investment management, trust services, brokerage services, insurance programs, and other financial products and services. Its segments include Consumer and Business Banking, Commercial Banking, Commercial Real Estate and Vehicle Finance, Regional Banking and The Huntington Private Client Group, Home Lending and Treasury/Other. The Bank offers commercial and consumer loans. Its consumer loans include automobile, home equity, residential mortgage, and recreational vehicle (RV) and marine finance loans. The company offers demand deposits-noninterest-bearing, demand deposits-interest-bearing, money market deposits, and savings and other domestic deposits.",Financial Services,US,9/18/2009,Huntington Bancshares,Stock,"['Financial Services', 'Banks - Regional - US', 'Banks']","['OVBC', 'UBOH', 'FITB', 'FFBC', 'WSBC', 'BBT', 'BAC', 'FNB', 'PRK', 'LCNB']",11.64,11841488900.0,Huntington Bancshares Inc,$,Huntington Bank,Huntington Bank,False,Huntington Bank,huntington-bank,"$90,000,000,011,841,400,000.00 ",,Huntington Bank,0.0,416,H
416.0,11973.0,HBANO,Huntington Bancshares Incorporated Depositary Shares,USD,NASDAQ,Banks Regional,,Financial Services,US,,Huntington Bancshares Depositary Shares,Stock,"['Financial Services', 'Banks - Regional - US', 'Banks']",[],25.67,13331047400.0,Huntington Bancshares Incorporated Depositary Shares,$,0,Huntington Bancshares Depositary Shares,False,Huntington Bancshares Depositary Shares,huntington-banc,"$90,000,000,013,331,000,000.00 ",,Huntington Bancshares Depositary Shares,0.0,417,H
417.0,9245.0,HCA,HCA Healthcare Inc,USD,NYSE,Medical Care Facilities,"HCA Healthcare, Inc. is a health care services company, which engages in operating hospitals, freestanding surgery centers and emergency rooms, and urgent care centers. The company is headquartered in Nashville, Tennessee and currently employs 262,000 full-time employees. The Company, through its subsidiaries, owns and operates hospitals and related healthcare entities. As of December 31, 2016, the Company operated in two geographically organized groups, including the National and American Groups. As of December 31, 2016, the National Group included 84 hospitals, which were located in Alaska, California, Florida, southern Georgia, Idaho, Indiana, northern Kentucky, Nevada, New Hampshire, South Carolina, Utah and Virginia. As of December 31, 2016, the American Group included 80 hospitals, which were located in Colorado, northern Georgia, Kansas, southern Kentucky, Louisiana, Mississippi, Missouri, Oklahoma, Tennessee and Texas. As of December 31, 2016, the Company operated six hospitals in England. The firm owns, manages or operates hospitals, freestanding surgery centers and freestanding emergency care facilities, walk-in clinics, diagnostic and imaging centers, among others.",Healthcare,US,3/10/2011,HCA Healthcare,Stock,"['Healthcare', 'Medical Care', 'Health Care Providers']","['LPNT', 'UHS', 'CYH', 'THC', 'XLV']",145.47,49223414000.0,HCA Healthcare Inc,$,0,HCA Healthcare,False,HCA Healthcare,hca-healthcare,"$90,000,000,049,223,400,000.00 ",,HCA Healthcare,0.0,418,H
418.0,11271.0,HCP,HCP Inc.,USD,NYSE,REITs,,Real Estate,,,HCP,Stock,"['Real Estate', 'REIT - Healthcare Facilities', 'REITs']","['VTR', 'UHT', 'SBRA', 'DOC', 'TIPT', 'HTA', 'WELL']",31.57,15089923100.0,HCP Inc.,$,0,HCP,False,HCP,hcp,"$90,000,000,015,089,900,000.00 ",,HCP,0.0,419,H
419.0,11215.0,HEI,HEICO Corp,USD,NYSE,Aerospace & Defense,"HEICO Corp. engages in the design, manufacture, and sale of aerospace, defense, and electronic related products and services. The company is headquartered in Hollywood, Florida and currently employs 5,900 full-time employees. The firm also manufactures various types of electronic equipment for the aviation, medical, telecommunications and electronics industries. The company operates through two segments: Flight Support Group (FSG) and Electronic Technologies Group (ETG). The FSG segment consists of HEICO Aerospace Holdings Corp. and HEICO Flight Support Corp. and their collective subsidiaries. The FSG segment designs and manufactures jet engine and aircraft component replacement parts. The ETG segment consists of HEICO Electronic Technologies Corp. and its subsidiaries. The ETG segment designs and produces mission-critical subcomponents for various markets, which are utilized in larger systems, including targeting, tracking, identification, testing, communications, telecom and computer systems.",Industrials,US,4/24/1998,Heico,Stock,"['Industrials', 'Aerospace & Defense']","['TGI', 'ESL', 'GE', 'SIF', 'UTX', 'WAIR']",126.68,16211619800.0,HEICO Corp,$,0,Heico,False,Heico,heico,"$90,000,000,016,211,600,000.00 ",,Heico,0.0,420,H
420.0,3369.0,HEI-A,HEICO Corp.,USD,NYSE,Aerospace & Defense,,Industrials,US,,HEICO Corp.,Stock,,,115.33,16153351200.0,HEICO Corporation,$,0,HEICO Corp.,False,HEICO ,heico,"$90,000,000,016,153,300,000.00 ",,HEICO,1.0,421,H
421.0,11246.0,HES,Hess Corp,USD,NYSE,Oil & Gas E&P,"Hess Corp is an exploration and production company, which engages in exploration, development, production, transportation, purchase & sale of crude oil, natural gas liquids and natural gas with production operations. The company is headquartered in New York City, New York and currently employs 1,708 full-time employees. The firm is engaged in exploration, development, production, transportation, purchase and sale of crude oil, natural gas liquids (NGL) and natural gas. The firm's segments include Exploration and Production, and Midstream. Its Exploration and Production segment explores for, develops, produces, purchases and sells crude oil, NGLs and natural gas with production operations primarily in the United States, Denmark, the Malaysia/Thailand Joint Development Area (JDA), Malaysia and Norway. The Midstream segment provides fee-based services, including crude oil and natural gas gathering, processing of natural gas and the fractionation of NGLs, transportation of crude oil by rail car, terminaling and loading crude oil and NGLs, and the storage and terminaling of propane, primarily in the Bakken shale play of North Dakota.",Energy,US,3/15/1926,Hess,Stock,"['Energy', 'Oil & Gas E&P', 'Oil & Gas - E&P']","['TOT', 'XOM', 'APC', 'OXY', 'BP', 'SNP', 'CVX', 'MRO', 'COP', 'RDS.A']",44.0,13511387100.0,Hess Corp,$,0,Hess,False,Hess,hess,"$90,000,000,013,511,300,000.00 ",,Hess,0.0,422,H
422.0,11564.0,HIG,Hartford Financial Services Group Inc,USD,NYSE,Insurance Diversified,"The Hartford Financial Services Group, Inc. is an insurance and financial services company. The company is headquartered in Hartford, Connecticut and currently employs 18,500 full-time employees. The firm's segments include Commercial Lines, which provides workers' compensation, property, automobile, marine, livestock, liability and umbrella coverages primarily throughout the United States; Personal Lines, which provides automobile, homeowners and personal umbrella coverages to individuals across the United States; Group Benefits, which provides group life, accident and disability coverage, and other products and services; Property & Casualty Other Operations, which includes certain property and casualty operations, and Mutual Funds, which provides investment management, administration, product distribution and related services to investors.",Financial Services,US,12/9/1985,Hartford Financial Services,Stock,"['Financial Services', 'Insurance - Diversified', 'Insurance']","['SIGI', 'ACGL', 'HALL', 'AEG', 'AFG', 'RLI', 'AIZ', 'GNW']",45.21,16200097800.0,Hartford Financial Services Group Inc,$,0,Hartford Financial Services,False,Hartford Financial Services,hartford-financial,"$90,000,000,016,200,000,000.00 ",,Hartford Financial Services,0.0,423,H
423.0,12038.0,HLT,Hilton Worldwide Holdings Inc,USD,NYSE,Lodging,"Hilton Worldwide Holdings, Inc. engages in the provision of hospitality businesses. The company is headquartered in Mc Lean, Virginia and currently employs 169,000 full-time employees. The firm is engaged in owning, leasing, managing and franchising hotels and resorts. The firm's segments include ownership, and management and franchise. Its global portfolio of owned and leased properties includes a range of hotels in gateway cities, such as New York City, London, San Francisco, Chicago, Sao Paolo and Tokyo. The firm's management and franchise segment manages hotels and licenses its brands to franchisees. Its brand portfolio includes Hilton Hotels & Resorts, Waldorf Astoria Hotels & Resorts, Conrad Hotels & Resorts, Canopy by Hilton, Curio-A Collection by Hilton, DoubleTree by Hilton, Embassy Suites by Hilton, Hilton Garden Inn, Hampton by Hilton, Tru by Hilton, Homewood Suites by Hilton and Home2 Suites by Hilton. As of December 31, 2016, the Company owned, leased, managed or franchised 4,875 hotel and resort properties, totaling 796,440 rooms in 104 countries and territories.",Consumer Cyclical,US,12/12/2013,Hilton Worldwide,Stock,"['Consumer Cyclical', 'Lodging', 'Travel & Leisure']","['CHH', 'WYND', 'H', 'MAR', 'IHG']",103.75,28770807800.0,Hilton Worldwide Holdings Inc,$,0,Hilton Worldwide,False,Hilton Worldwide,hilton-worldwide,"$90,000,000,028,770,800,000.00 ",,Hilton Worldwide,0.0,424,H
424.0,12089.0,HMC,Honda Motor Company Ltd.,USD,NYSE,Auto Manufacturers,,Consumer Cyclical,JP,,Honda Motor,Stock,"['Consumer Cyclical', 'Auto Manufacturers', 'Autos']","['TM', 'F', 'TTM', 'GM']",28.36,48584933000.0,Honda Motor Company Ltd.,$,0,Honda Motor,False,Honda Motor,honda-motor,"$90,000,000,048,584,900,000.00 ",,Honda Motor,0.0,425,H
425.0,9852.0,HOLX,Hologic Inc,USD,NASDAQ,Medical Instruments & Supplies,"Hologic, Inc. engages in the development, manufacture, and supply of diagnostics products, medical imaging systems, and surgical products dedicated to serve the healthcare needs of women. The company is headquartered in Marlborough, Massachusetts and currently employs 6,478 full-time employees. The firm operates through four segments: Diagnostics, Breast Health, GYN Surgical and Skeletal Health. The diagnostics products include Aptima family of assays, ThinPrep system, the Rapid Fetal Fibronectin Test and Procleix blood screening assays. The company offers viral load assays for the quantitation of Hepatitis B Virus (HBV), Hepatitis C Virus (HCV) and Human Immunodeficiency Virus-1 (HIV-1). The Breast Health products include breast imaging and related products and accessories, including digital mammography systems, computer-aided detection (CAD) and breast biopsy guidance systems. The GYN Surgical products include NovaSure Endometrial Ablation System and MyoSure Hysteroscopic Tissue Removal System. The Skeletal Health segment offers Discovery and Horizon X-ray bone densitometers and mini C-arm imaging systems.",Healthcare,US,3/1/1990,Hologic,Stock,"['Healthcare', 'Medical Instruments & Supplies', 'Medical Instruments & Equipment']","['DGX', 'ABT', 'BDX', 'BSX', 'GE', 'JNJ', 'TMO', 'PHG', 'XLV']",69.84,18087510000.0,Hologic Inc,$,Hologic,Hologic,False,Hologic,hologic,"$90,000,000,018,087,500,000.00 ",,Hologic,0.0,426,H
426.0,7705.0,HPE,Hewlett Packard Enterprise Co,USD,NYSE,Communication Equipment,"Hewlett Packard Enterprise Co. engages in the provision of information technology, technology and enterprise products, solutions, and services. The company is headquartered in San Jose, California and currently employs 61,600 full-time employees. The Company’s segments include: Enterprise Group, Software, Financial Services and Corporate Investments. The Enterprise Group segment provides its customers with the technology infrastructure they need to optimize traditional information technology (IT). The Software segment allows its customers to automate IT operations to simplify, accelerate and secure business processes and drives the analytics that turn raw data into actionable knowledge. The Financial Services segment enables flexible IT consumption models, financial architectures and customized investment solutions for its customers. The Corporate Investments segment includes Hewlett Packard Labs and certain business incubation projects, among others.",Technology,US,10/19/2015,Hewlett Packard Enterprise,Stock,"['Technology', 'Communication Equipment']",['XLK'],9.95,12799480800.0,Hewlett Packard Enterprise Co,$,HP Enterprise,HP Enterprise,False,HP Enterprise,hp-enterprise,"$90,000,000,012,799,400,000.00 ",,HP Enterprise,0.0,427,H
427.0,10148.0,HPQ,HP Inc,USD,NYSE,Computer Hardware,"HP Inc. enages in the provision of personal computing and other access devices, imaging and printing products, and related technologies, solutions, and services. The company is headquartered in Palo Alto, California and currently employs 56,000 full-time employees. The firm provides personal computing and other access devices, imaging and printing products, and related technologies, solutions and services. Its segments include Personal Systems, Printing and Corporate Investments. The Personal Systems segment provides Commercial personal computers (PCs), Consumer PCs, workstations, thin clients, Commercial tablets and mobility devices, retail point-of-sale systems, displays and other accessories, software, support and services for the commercial and consumer markets. The Printing segment provides consumer and commercial printer hardware, supplies, media, solutions and services, as well as scanning devices. The Corporate Investments segment includes the operations of HP Labs and certain business incubation projects.",Technology,US,3/17/1961,HP,Stock,"['Technology', 'Computer Systems', 'Computer Hardware']",['XLK'],19.36,26590961700.0,HP Inc,$,0,HP,False,HP,hp,"$90,000,000,026,590,900,000.00 ",,HP,0.0,428,H
428.0,3479.0,HRG,HRG Group Inc.,USD,NYSE,Conglomerates,,Industrials,,,HRG Group Inc.,Stock,,,13.42,11268600000.0,HRG Group Inc.,$,0,HRG Group Inc.,False,HRG  .,hrg-inc,"$90,000,000,011,268,600,000.00 ",,HRG,3.0,429,H
429.0,10839.0,HRL,Hormel Foods Corp,USD,NYSE,Packaged Foods,"Hormel Foods Corp. engages in the production of meat and food products. The company is headquartered in Austin, Minnesota and currently employs 18,800 full-time employees. The firm operates through four segments: Grocery Products, which is engaged in the processing, marketing and sale of shelf-stable food products sold for the retail market and health and also consists of nutrition products, including Muscle Milk protein products. ; Refrigerated Foods, which consists of the processing, marketing and sale of branded and unbranded pork, beef, chicken and turkey products for retail, foodservice and fresh product customers; Jennie-O Turkey Store (JOTS), which consists of the processing, marketing and sale of branded and unbranded turkey products for retail, foodservice and fresh product customers; and International & Other, which includes Hormel Foods International Corporation, which manufactures, markets and sells the Company products internationally.",Consumer Defensive,US,1/16/1990,Hormel Foods,Stock,"['Consumer Defensive', 'Packaged Foods', 'Consumer Packaged Goods']",[],51.96,28038031400.0,Hormel Foods Corp,$,0,Hormel Foods,False,Hormel Foods,hormel-foods,"$90,000,000,028,038,000,000.00 ",,Hormel Foods,0.0,430,H
430.0,11950.0,HRS,Harris Corp.,USD,NYSE,Communication Equipment,,Technology,,,Harris,Stock,"['Technology', 'Communication Equipment']","['VSAT', 'CMTL', 'GD', 'NOC', 'RTN', 'COL', 'MSI', 'ITT', 'LLL', 'XLK']",196.9,23377129522.0,Harris Corporation,$,0,Harris,False,Harris,harris,"$90,000,000,023,377,100,000.00 ",,Harris,0.0,431,H
431.0,462.0,HSY,The Hershey,USD,NYSE,Confectioners,"The Hershey Co. engages in the manufacture and market of chocolate and sugar confectionery products. The company is headquartered in Hershey, Pennsylvania and currently employs 14,930 full-time employees. The firm's principal product offerings include chocolate and non-chocolate confectionery products; gum and mint refreshment products; pantry items, such as baking ingredients and beverages, and snack items, such as spreads, meat snacks, bars and snack bites and mixes. Its segments include North America, and International and Other. The North America segment includes its chocolate and non-chocolate confectionery business, as well as its grocery and snacks business. This includes developing and growing its business in chocolate and non-chocolate confectionery, pantry, food service and other snacking product lines. The firm distributes and sells confectionery products in export markets of Asia, Latin America, the Middle East, Europe, Africa and other regions. As of December 31, 2016, the Company marketed, sold and distributed its products under more than 80 brand names in approximately 70 countries across the world.",Consumer Defensive,US,12/1/1927,Hershey Co,Stock,"['Consumer Defensive', 'Confectioners', 'Consumer Packaged Goods']","['JBSS', 'HAIN', 'GIS', 'MDLZ', 'RMCF']",153.66,31983407100.0,The Hershey,$,Hershey,Hershey,False,Hershey,hershey,"$90,000,000,031,983,400,000.00 ",,Hershey,0.0,432,H
432.0,9854.0,HUBS,HubSpot Inc,USD,NYSE,Software Application,"HubSpot, Inc. provides cloud-based marketing and sales software platform that enables businesses to deliver an inbound experience. The company is headquartered in Cambridge, Massachusetts and currently employs 3,204 full-time employees. The firm's software platform features integrated applications to help businesses attract visitors to their Websites, convert visitors into leads, close leads into customers and delight customers so that they become promoters of those businesses. These integrated applications include social media, search engine optimization, blogging, Website content management, marketing automation, e-mail, sales productivity, customer relationship management (CRM), analytics and reporting. The firm's products include HubSpot Marketing, HubSpot CRM and HubSpot Sales. The firm offers Professional Services and support. The company offers professional services to educate and train customers on how to leverage its software platform and inbound marketing methodology to transform how their business attracts, engages and delights customers.",Technology,US,10/9/2014,HubSpot,Stock,"['Technology', 'Software - Application', 'Application Software']","['DMRC', 'PRO', 'PAYC', 'ZEN', 'XLK']",345.0,15831222300.0,HubSpot Inc,$,HubSpot,HubSpot,False,HubSpot,hubspot,"$90,000,000,015,831,200,000.00 ",,HubSpot,0.0,433,H
