Column1,index,symbol,long name,currency,exchange,industry,description,sector,country,ipo date,shorter name,Type,Industries,Similar Companies,price,mktCap,name raw,currency symbol,robinhood name,short name,Warrant,shortest name,url name, smart_order ,random csv equations,pure name,shortest - pure diff,order,first_letter
58.0,9265.0,NEE,Nextera Energy Inc,USD,NYSE,Utilities Regulated Electric,"NextEra Energy, Inc. is an electric power and energy infrastructure company. The company is headquartered in Juno Beach, Florida and currently employs 9,100 full-time employees. The firm is an electric power companies in North America and, through its subsidiary NextEra Energy Resources, LLC (NEER) and its affiliated entities, is the generator of renewable energy from the wind and sun. NEE also owns and/or operates generation, transmission and distribution facilities to support its services to retail and wholesale customers, and has investments in gas infrastructure assets. Its segments include FPL and NEER. Florida Power & Light Company (FPL) is a rate-regulated electric utility engaged primarily in the generation, transmission, distribution and sale of electric energy in Florida. NEER is a diversified clean energy company with a business strategy that emphasizes the development, acquisition and operation of long-term contracted assets with a focus on renewable projects. NEER owns, develops, constructs, manages and operates electric generation facilities in wholesale energy markets.",Utilities,US,2/15/1950,NextEra Energy,Stock,"['Utilities', 'Utilities - Regulated Electric', 'Utilities - Regulated']","['ETR', 'FE', 'SO', 'EXC', 'D', 'SCG', 'PPL', 'DUK', 'ES', 'XEL', 'XLU']",77.54,152000000000.0,Nextera Energy Inc,$,NextEra Energy,NextEra Energy,False,NextEra Energy,nextera-energy,"$900,000,000,152,000,000,000.00 ",,NextEra Energy,0.0,59,N
59.0,9871.0,NFLX,Netflix Inc,USD,NASDAQ,Entertainment,"Netflix, Inc. is a streaming entertainment service company, which provides subscription service streaming movies and television episodes over the Internet and sending DVDs by mail. The company is headquartered in Los Gatos, California and currently employs 7,100 full-time employees. The firm operates through three segments: Domestic streaming, International streaming and Domestic DVD. The Domestic streaming segment includes services that streams content to its members in the United States. The International streaming segment includes services that streams content to its members outside the United States. The Domestic DVD segment includes services, such as digital optical disc (DVD)-by-mail. The firm's members can watch original series, documentaries, feature films, as well as television shows and movies directly on their Internet-connected screen, televisions, computers and mobile devices. The company offers its streaming services both domestically and internationally. In the United States, its members can receive DVDs delivered to their homes. The firm had members streaming in over 190 countries, as of December 31, 2016.",Communication Services,US,5/29/2002,Netflix,Stock,"['Consumer Cyclical', 'Media - Diversified', 'Entertainment']","['BCE', 'AMZN', 'CMCSA', 'DISH', 'DIS', 'P', 'VIAB', 'FOXA']",490.76,217000000000.0,Netflix Inc,$,Netflix,Netflix,False,Netflix,netflix,"$900,000,000,217,000,000,000.00 ",,Netflix,0.0,60,N
60.0,10105.0,NKE,Nike Inc,USD,NYSE,Footwear & Accessories,"NIKE, Inc. engages in the design, development, marketing, and sale of athletic footwear, apparel, accessories, equipment, and services. The company is headquartered in Beaverton, Oregon and currently employs 76,700 full-time employees. The firm's operating segments include North America, Western Europe, Central & Eastern Europe, Greater China, Japan and Emerging Markets. Its portfolio brands include the NIKE Brand, Jordan Brand, Hurley and Converse. As of May 31, 2016, the Company focused its NIKE brand product offerings in nine categories: Running, NIKE Basketball, the Jordan Brand, Football (Soccer), Men's Training, Women's Training, Action Sports, Sportswear (its sports-inspired lifestyle products) and Golf. Men's Training includes its baseball and American football product offerings. The company also markets products designed for kids, as well as for other athletic and recreational uses, such as cricket, lacrosse, tennis, volleyball, wrestling, walking and outdoor activities. The firm sells a range of performance equipment and accessories under the NIKE Brand name.",Consumer Cyclical,US,10/17/1990,Nike,Stock,"['Consumer Cyclical', 'Footwear & Accessories', 'Manufacturing - Apparel & Furniture']","['SHOO', 'CROX', 'SKX', 'UAA', 'DECK']",127.66,200000000000.0,Nike Inc,$,0,Nike,False,Nike,nike,"$900,000,000,200,000,000,000.00 ",,Nike,0.0,61,N
61.0,11171.0,NVDA,NVIDIA Corp,USD,NASDAQ,Semiconductors,"NVIDIA Corp. engages in the design and manufacture of computer graphics processors, chipsets, and related multimedia software. The company is headquartered in Santa Clara, California and currently employs 13,277 full-time employees. The company operates through two segments: GPU and Tegra Processor. Its GPU product brands are aimed at specialized markets, including GeForce for gamers; Quadro for designers; Tesla and DGX for AI data scientists and big data researchers; and GRID for cloud-based visual computing users. Its Tegra brand integrates an entire computer onto a single chip, and incorporates GPUs and multi-core central processing units (CPUs) to drive supercomputing for mobile gaming and entertainment devices, as well as autonomous robots, drones and cars. The firm's processor has created platforms that address four markets: Gaming, Professional Visualization, Datacenter, and Automotive. Its offerings include NVIDIA DGX AI supercomputer, the NVIDIA DRIVE AI car computing platform and the GeForce NOW cloud gaming service.",Technology,US,1/22/1999,NVIDIA,Stock,"['Technology', 'Semiconductors']","['INTC', 'MSFT', 'QCOM', 'STM', 'TXN', 'AMBA', 'AMD', 'XLK']",536.72,332000000000.0,NVIDIA Corp,$,0,NVIDIA,False,NVIDIA,nvidia,"$900,000,000,332,000,000,000.00 ",,NVIDIA,0.0,62,N
62.0,5172.0,NVO,Novo Nordisk A/S,USD,NYSE,Biotechnology,,Healthcare,DK,,Novo Nordisk A/S,Stock,"['Healthcare', 'Biotechnology']","['BMY', 'LLY', 'PFE', 'SNY', 'XLV']",67.7,155000000000.0,Novo Nordisk A/S,$,Novo Nordisk,Novo Nordisk,False,Novo Nordisk,novo-nordisk,"$900,000,000,155,000,000,000.00 ",,Novo Nordisk,0.0,63,N
63.0,5169.0,NVS,Novartis AG,USD,NYSE,Drug Manufacturers General,,Healthcare,,,Novartis AG,Stock,"['Healthcare', 'Drug Manufacturers - Major', 'Drug Manufacturers']","['GSK', 'ABT', 'BMY', 'JNJ', 'PFE', 'SNY', 'MRK', 'TEVA', 'XLV']",86.0,197000000000.0,Novartis AG,$,Novartis,Novartis,False,Novartis,novartis,"$900,000,000,197,000,000,000.00 ",,Novartis,0.0,64,N
560.0,9984.0,NDAQ,Nasdaq Inc,USD,NASDAQ,Financial Data & Stock Exchanges,"Nasdaq, Inc. is a holding company, which engages in trading, clearing, exchange technology, regulatory, securities listing, information and public & private company services. The company is headquartered in New York, New York and currently employs 4,339 full-time employees. The firm is a provider of trading, clearing, exchange technology, regulatory, securities listing, information and public company services. The company manages, operates and provides its products and services through four segments: Market Services, Corporate Services, Information Services and Market Technology. Its global offerings include trading and clearing across various asset classes, trade management services, data products, financial indexes, capital formation solutions, corporate solutions, and market technology products and services. Its technology markets across the globe, supporting equity derivative trading, clearing and settlement, cash equity trading, fixed income trading and various other functions. Its Market Services segment include its equity derivative trading and clearing, cash equity trading, fixed income clearing corporation and trade management services businesses. Its Corporate Solutions business serves corporate clients.",Financial Services,US,7/1/2002,Nasdaq,Stock,"['Financial Services', 'Financial Exchanges', 'Brokers & Exchanges']","['MKTX', 'CME', 'CBOE']",129.79,21319045100.0,Nasdaq Inc,$,0,Nasdaq,False,Nasdaq,nasdaq,"$90,000,000,021,319,000,000.00 ",,Nasdaq,0.0,561,N
561.0,11097.0,NDSN,Nordson Corp,USD,NASDAQ,Specialty Industrial Machinery,"Nordson Corp. engages in the engineering, manufacture and market of products and systems used for adhesives, coatings, sealants, biomaterials and other materials. The company is headquartered in Westlake, Ohio and currently employs 7,579 full-time employees. The firm's segments include Adhesive Dispensing Systems, Advanced Technology Systems and Industrial Coating Systems. The Adhesive Dispensing Systems segment delivers its precision dispensing and processing technology to various markets. The Advanced Technology Systems segment integrates its product technologies found in progressive stages of a customer's production process, such as surface treatment, precisely controlled automated, and post-dispense bond testing, optical inspection and X-ray inspection. The Industrial Coating Systems segment provides equipment used primarily for applying coatings, paint, finishes, sealants and other materials, and for curing and drying of dispensed material.",Industrials,US,3/18/1980,Nordson,Stock,"['Industrials', 'Diversified Industrials', 'Industrial Products']","['ASTE', 'TAYD', 'DOV', 'GGG', 'ITW']",202.24,11736897500.0,Nordson Corp,$,0,Nordson,False,Nordson,nordson,"$90,000,000,011,736,800,000.00 ",,Nordson,0.0,562,N
562.0,10751.0,NEM,Newmont Corp.,USD,NYSE,Gold,"Newmont Corp. is a gold producer, which engages in the production of gold. The company is headquartered in Greenwood Village, Colorado and currently employs 12,400 full-time employees. The company is primarily a gold producer with operations and/or assets in the United States, Australia, Peru, Ghana and Suriname. The firm's segments include North America, South America, Asia Pacific and Africa. Its North America segment consists primarily of Carlin, Phoenix, Twin Creeks and Long Canyon in the state of Nevada, and Cripple Creek &Victor (CC&V) in the state of Colorado, in the United States. Its South America segment consists primarily of Yanacocha in Peru and Merian in Suriname. Its Asia Pacific segment consists primarily of Boddington, Tanami and Kalgoorlie in Australia. The firm's Africa segment consists primarily of Ahafo and Akyem in Ghana. As of December 31, 2016, it had gold reserves of 68.5 million ounces and an aggregate land position of approximately 23,000 square miles (59,000 square kilometers).",Basic Materials,US,1/27/1940,Newmont Mining,Stock,"['Basic Materials', 'Gold', 'Metals & Mining']","['ABX', 'AEM', 'RGLD', 'GG', 'FCX', 'BVN', 'GFI', 'AU', 'SBGL', 'AA']",65.63,52724384000.0,Newmont Corporation,$,0,Newmont Mining,False,Newmont Mining,newmont-mining,"$90,000,000,052,724,300,000.00 ",,Newmont Mining,0.0,563,N
563.0,1781.0,NET,Cloudflare Inc,USD,NYSE,Software Infrastructure,"Cloudflare, Inc. engages in the provision of cloud-based services to secure websites. The company is headquartered in San Francisco, California and currently employs 1,069 full-time employees. The firm has built a global cloud platform that delivers a range of network services to businesses of all sizes and geographies. The firm provides businesses a unified control plane to deliver security, performance, and reliability across their on-premise, hybrid, cloud, and Software-as-a-Service (SaaS) applications. The Company’s product offerings are classified under performance and reliability, advanced security, Cloudflare for Developers, video streaming and delivery, and domain registration. The firm serves various industries including gaming, SaaS, eCommerce, media and entertainment, public sector, public interest groups, and state and local government.",Technology,US,9/13/2019,Cloudflare Inc,Stock,,,66.0,20263913500.0,Cloudflare Inc,$,Cloudflare,Cloudflare,False,Cloudflare,cloudflare,"$90,000,000,020,263,900,000.00 ",,Cloudflare,0.0,564,N
564.0,12529.0,NGG,National Grid Transco PLC PLC ADR,USD,NYSE,Utilities Diversified,,Utilities,GB,,National Grid Transco,Stock,"['Utilities', 'Utilities - Diversified', 'Utilities - Regulated']","['TRP', 'DTE', 'NI', 'ED', 'SRE', 'SCG', 'AGR', 'XLU']",63.33,43771163000.0,National Grid Transco PLC PLC (NEW) American Depositary Shares,$,0,National Grid Transco,False,National Grid Transco,national-grid,"$90,000,000,043,771,100,000.00 ",,National Grid Transco,0.0,565,N
565.0,10104.0,NICE,NICE Ltd,USD,NASDAQ,Software Application,,Technology,,,NICE,Stock,"['Technology', 'Software - Application', 'Application Software']","['PEGA', 'LPSN', 'VRNT', 'ACIW', 'FICO', 'IBM', 'XLK']",246.0,15582623700.0,NICE Ltd,$,0,NICE,False,NICE,nice,"$90,000,000,015,582,600,000.00 ",,NICE,0.0,566,N
566.0,80.0,NIO,"Nuveen Municipal Opportunity Fund,",CNY,NYSE,Auto Manufacturers,"NIO, Inc. (China) is a holding company, which engages in the design, manufacture, and sale of electric vehicles, driving innovations in next generation technologies in connectivity, autonomous driving and artificial intelligence. The company is headquartered in Shanghai, Shanghai and currently employs 9,834 full-time employees. The company manufactures autonomous driving electric vehicles integrated with next generation technologies and artificial intelligence. The company manufactures ES8, which is a seven-seated all aluminum alloy body electric sports utility vehicle (SUV). The company is equipped with e-propulsion system which is capable of accelerating from zero to 100 km per hour in 4.4 seconds and delivering a New European Driving Cycle driving range of up to 355 Kilometers (km) and a maximum range of up to 500 km in a single charge. The company is also focused on providing vehicle charging solutions, which include Power Home, Power Swap, Power Mobile and Power Express service. The company also offers various value-added services to its users, such as statutory and third-party liability insurance and car damage insurance through third-party insurers, repair and routine maintenance services, courtesy car during lengthy repairs and maintenance and roadside assistance.",Consumer Cyclical,CN,9/12/2018,NIO Inc,Stock,[],[],43.08,58682716000.0,"Nuveen Municipal Opportunity Fund,",CNY,NIO,NIO,False,NIO,nio,"$90,000,000,058,682,700,000.00 ",,NIO,0.0,567,N
567.0,5163.0,NLOK,NortonLifeLock Inc,USD,NASDAQ,Software Infrastructure,"NortonLifeLock, Inc. engages in the provision of security, storage, and systems management solutions. The company is headquartered in Tempe, Arizona and currently employs 11,900 full-time employees. The firm focuses on allowing customers to be productive and protected at home and at work. Its Norton-branded services provide multi-layer security and identity protection on desktop and mobile operating systems, to defend against online threats to individuals, families and small businesses. Norton products help customers protect against threats and address the need for identity protection, while also managing the increase in mobile and digital data, such as personal financial records, photos, music and videos. Its products include Norton AntiVirus Plus, Norton 360 Standard, Norton 360 Deluxe, Norton 360 with LifeLock Select, Norton 360 with LifeLock Advantage, Norton 360 with LifeLock Ultimate Plus, Norton Secure virtual private network (VPN), Norton Privacy Manager, Norton Family Premier, Norton Mobile Security for Android, Norton Utilities Premium and Norton Small Business.",Technology,US,6/23/1989,NortonLifeLock Inc,Stock,,,20.09,11890668500.0,NortonLifeLock Inc,$,NortonLifeLock,NortonLifeLock,False,NortonLifeLock,nortonlifelock,"$90,000,000,011,890,600,000.00 ",,NortonLifeLock,0.0,568,N
568.0,8197.0,NLY,Annaly Capital Management Inc,USD,NYSE,REIT Mortgage,"Annaly Capital Management, Inc. engages in the investment and financing of residential and commercial assets. The company is headquartered in New York City, New York and currently employs 8 full-time employees. The firm owns a portfolio of real estate related investments. Its investment groups primarily consist of Agency, which invests primarily in various types of Agency mortgage-backed securities and related derivatives to hedge these investments; Residential credit, which invests primarily in non-Agency mortgage-backed assets within securitized products and residential mortgage loan markets; Commercial real estate, which originates and invests in commercial mortgage loans, securities, and other commercial real estate investments, and Middle market, which provides customized debt financing to middle-market businesses. Its business operations consist of Annaly Commercial Real Estate Group, Inc., which is its subsidiary that specializes in originating or acquiring, financing and managing commercial loans and other commercial real estate debt; Annaly Middle Market Lending LLC, and RCap Securities, Inc.",Real Estate,US,10/8/1997,Annaly Capital Management,Stock,"['Real Estate', 'REIT - Diversified', 'REITs']","['NYMT', 'RWT', 'DX', 'IVR', 'PMT', 'CIM']",7.4,10346902500.0,Annaly Capital Management Inc,$,0,Annaly Capital Management,False,Annaly Capital Management,annaly-capital,"$90,000,000,010,346,900,000.00 ",,Annaly Capital Management,0.0,569,N
569.0,12480.0,NMR,Nomura Holdings Inc ADR ADR,USD,NYSE,Capital Markets,,Financial Services,JP,,Nomura Holdings Inc ADR,Stock,"['Financial Services', 'Capital Markets', 'Brokers & Exchanges']","['DB', 'MUFG', 'IX', 'MFG']",5.12,15328255000.0,Nomura Holdings Inc ADR American Depositary Shares,$,0,Nomura Holdings Inc ADR,False,Nomura Holdings  ADR,nomura-inc-adr,"$90,000,000,015,328,200,000.00 ",,Nomura Holdings  ADR,0.0,570,N
570.0,10637.0,NOC,Northrop Grumman Corp,USD,NYSE,Aerospace & Defense,"Northrop Grumman Corp. engages in the provision of security businesses. The company is headquartered in Falls Church, Virginia and currently employs 85,000 full-time employees. The firm provides products, systems and solutions in autonomous systems; cyber; command, control, communications and computers, intelligence, surveillance and reconnaissance (C4ISR); strike, and logistics and modernization. The firm's segments include Aerospace Systems, Mission Systems and Technology Services. The firm's Aerospace Systems segment is engaged in the design, development, integration and production of manned aircraft, autonomous systems, spacecraft, high-energy laser systems, microelectronics and other systems/subsystems. The Mission Systems segment offers mission solutions and multifunction systems for Department of Defense (DoD), intelligence community, international, federal civil and commercial customers. The Technology Services segment provides logistics solutions supporting the full life cycle of platforms and systems for global defense and federal-civil customers.",Industrials,US,12/10/1951,Northrop Grumman,Stock,"['Industrials', 'Aerospace & Defense']","['KTOS', 'LMT', 'BA', 'GD', 'HRS', 'UTX', 'RTN', 'COL', 'LLL']",309.96,51675292000.0,Northrop Grumman Corp,$,0,Northrop Grumman,False,Northrop Grumman,northrop-grumman,"$90,000,000,051,675,200,000.00 ",,Northrop Grumman,0.0,571,N
571.0,12522.0,NOK,Nokia Corporation Sponsored ADR,USD,NYSE,Communication Equipment,,Technology,FI,,Nokia Sponsored,Stock,"['Technology', 'Communication Equipment']","['CSCO', 'MSFT', 'AMZN', 'AAPL', 'ERIC', 'MSI', 'BB', 'XLK']",3.75,21116024800.0,Nokia Corporation Sponsored American Depositary Shares,$,0,Nokia Sponsored,False,Nokia Sponsored,nokia-sponsored,"$90,000,000,021,116,000,000.00 ",,Nokia Sponsored,0.0,572,N
572.0,9610.0,NOW,ServiceNow Inc,USD,NYSE,Software Application,"ServiceNow, Inc. engages in the provision of enterprise cloud computing solutions. The company is headquartered in Santa Clara, California and currently employs 9,929 full-time employees. The firm offers a set of cloud-based services that automate workflow within and between departments in an enterprise. The company provides workflow solutions, and focuses on service management for customer support, human resources, security operations and other enterprise departments. The platform also enables customers to create, by themselves or with its partners, their own service-oriented business applications throughout the enterprise. The firm delivers its software through the Internet as a service. The company markets its services to enterprises in a range of industries, including financial services, consumer products, information technology services, healthcare, government, education and technology. The company operates data centers in Australia, Brazil, Canada, Hong Kong, the Netherlands, Singapore, Switzerland, the United Kingdom and the United States.",Technology,US,6/29/2012,ServiceNow,Stock,"['Technology', 'Software - Application', 'Application Software']","['MSFT', 'QCOM', 'RHT', 'FICO', 'IBM', 'ZEN', 'HPQ', 'XLK']",503.36,98205532000.0,ServiceNow Inc,$,ServiceNow,ServiceNow,False,ServiceNow,servicenow,"$90,000,000,098,205,500,000.00 ",,ServiceNow,0.0,573,N
573.0,10636.0,NSC,Norfolk Southern Corp,USD,NYSE,Railroads,"Norfolk Southern Corp. is a transportation company, which owns a freight railroad. The company is headquartered in Norfolk, Virginia and currently employs 26,662 full-time employees. As of December 31, 2016, the Company operated approximately 19,500 miles of road primarily in the East and Midwest. The firm is engaged in the rail transportation of raw materials, intermediate products and finished goods primarily in the Southeast, East and Midwest. The Company, through interchange with rail carriers, to and from the rest of the United States. The firm also transports overseas freight through various Atlantic and Gulf Coast ports. The company provides logistics services and offers the intermodal network in the eastern half of the United States. The firm's system reaches various manufacturing plants, electric generating facilities, mines, distribution centers and other businesses located in its service area. The firm's intermodal market group consists of shipments moving in trailers, domestic and international containers, and RoadRailer equipment.",Industrials,US,6/2/1982,Norfolk Southern,Stock,"['Industrials', 'Railroads', 'Transportation & Logistics']","['CNI', 'CP', 'GWR', 'UNP', 'KSU', 'CSX']",233.09,59201360000.0,Norfolk Southern Corp,$,0,Norfolk Southern,False,Norfolk Southern,norfolk-southern,"$90,000,000,059,201,300,000.00 ",,Norfolk Southern,0.0,574,N
574.0,9988.0,NTAP,NetApp Inc,USD,NASDAQ,Computer Hardware,"NetApp, Inc. provides software, systems, and services to manage and share data on-premises, and private and public clouds worldwide. The company is headquartered in Sunnyvale, California and currently employs 10,500 full-time employees. The firm enables enterprises, service providers, governmental organizations, and partners to envision, deploy and evolve their information technology (IT) environments. The firm offers a portfolio of products and services that satisfy a range of customer workloads across different data types and deployment models. Its data management and storage offerings help manage business productivity, performance and profitability, while providing investment protection and asset utilization. The firm's FlexPod portfolio includes FlexPod Datacenter for core enterprise data centers and service providers, FlexPod Express for medium-sized businesses and branch offices, and FlexPod Select for data-intensive workloads. The portfolio is validated with hypervisors, operating systems, systems management tools and cloud management platforms.",Technology,US,11/21/1995,NetApp,Stock,"['Technology', 'Data Storage', 'Computer Hardware']","['STX', 'TDC', 'WDC', 'HPQ', 'QTM', 'SMCI', 'XLK']",49.27,10938185700.0,NetApp Inc,$,0,NetApp,False,NetApp,netapp,"$90,000,000,010,938,100,000.00 ",,NetApp,0.0,575,N
575.0,5050.0,NTCO,Natura &Co Holding S.A.,USD,NYSE,Household & Personal Products,,Consumer Defensive,BR,,Natura &Co Holding S.A.,Stock,,,18.21,12295737300.0,Natura &Co Holding S.A.,$,NATURA,NATURA,False,NATURA,natura,"$90,000,000,012,295,700,000.00 ",,NATURA,0.0,576,N
576.0,11096.0,NTES,NetEase Inc.,USD,NASDAQ,Internet Content & Information,,Communication Services,CN,,NetEase,Stock,"['Technology', 'Internet Content & Information', 'Online Media']",['XLK'],89.59,62428459000.0,NetEase Inc.,$,0,NetEase,False,NetEase,netease,"$90,000,000,062,428,400,000.00 ",,NetEase,0.0,577,N
577.0,9878.0,NTR,Nutrien Ltd,USD,NYSE,Agricultural Inputs,"Nutrien Ltd. is a crop nutrient company, which engages in the production and distribution of products for agricultural, industrial, and feed customer. The company is headquartered in Saskatoon, Saskatchewan and currently employs 20,300 full-time employees. The firm is focused on retail, potash, nitrogen and phosphate mining and processing operations. The firm's retail operations serve growers in a number of countries across the United States, Canada, South Africa, Australia and South America. The firm operates six potash mines in Saskatchewan and has a mine in New Brunswick in care-and-maintenance mode. The firm operates integrated phosphate mining and processing facilities, as well as a number of smaller upgrading plants in the United States.",Basic Materials,CA,1/2/2018,Nutrien,Stock,"['Basic Materials', 'Agricultural Inputs', 'Agriculture']",[],42.46,24215191600.0,Nutrien Ltd,$,0,Nutrien,False,Nutrien,nutrien,"$90,000,000,024,215,100,000.00 ",,Nutrien,0.0,578,N
