Column1,index,symbol,long name,currency,exchange,industry,description,sector,country,ipo date,shorter name,Type,Industries,Similar Companies,price,mktCap,name raw,currency symbol,robinhood name,short name,Warrant,shortest name,url name, smart_order ,random csv equations,pure name,shortest - pure diff,order,first_letter
3902.0,8133.0,NSSC,NAPCO Security Technologies Inc,USD,NASDAQ,Security & Protection Services,"Napco Security Technologies, Inc. engages in the development, manufacture, and distribution of security products. The company is headquartered in Amityville, New York and currently employs 1,076 full-time employees. These products are used for commercial, residential, institutional, industrial and governmental applications, and are sold across the world principally to independent distributors, dealers and installers of security equipment. The firm manufactures and markets various products for alarm systems, which include automatic communicators, control panels, combination control panels/digital communicators and digital keypad systems, fire alarm control panel and area detectors. The company manufactures a range of door locking devices, including microprocessor-based electronic door locks with push button, card reader and bio-metric operation, door alarms, mechanical door locks and simple dead bolt locks. The company also markets peripheral and related equipment manufactured by other companies.",Industrials,US,12/29/1981,NAPCO Security Technologies,Stock,"['Industrials', 'Security & Protection Services', 'Consulting & Outsourcing']","['MAGS', 'UUU', 'HON', 'UTX']",29.46,540514370.0,NAPCO Security Technologies Inc,$,NAPCO,NAPCO,False,NAPCO,napco,"$900,000,000,540,514,000.00 ",,NAPCO,0.0,3903,N
3903.0,9872.0,NTGR,NETGEAR Inc,USD,NASDAQ,Communication Equipment,"NETGEAR, Inc. engages in the provision of Internet connected products to consumers, businesses, and service providers. The company is headquartered in San Jose, California and currently employs 281 full-time employees. The firm's product line consists of devices, such as network attached storage, Internet protocol (IP) security cameras, and home automation devices and services. The firm's segments include retail, commercial and service provider. The retail business unit is focused on individual consumers and consists of whole home wireless fidelity (WiFi) networking solutions and Smart connected products. The commercial business unit is focused on small and medium-sized businesses and consists of business networking, storage and security solutions. The service provider business unit is focused on the service provider market and consists of made-to-order and retail-proven whole home networking hardware and software solutions, including fourth-generation (4G) long term evolution (LTE) hotspots sold to service providers for sale to their subscribers.",Technology,US,7/31/2003,NETGEAR,Stock,"['Technology', 'Communication Equipment']","['CSCO', 'ADTN', 'AAPL', 'FTNT', 'MSI', 'WDC', 'HPQ', 'ARRS', 'XLK']",30.35,919061760.0,NETGEAR Inc,$,Netgear,Netgear,False,Netgear,netgear,"$900,000,000,919,061,000.00 ",,Netgear,0.0,3904,N
3904.0,9052.0,NTP,Nam Tai Property Inc,USD,NYSE,Real Estate Services,"Nam Tai Property, Inc. is a holding company, which engages in the provision of electronics manufacture and design services. The company is headquartered in Shenzhen, Guangdong and currently employs 99 full-time employees. The firm is a property development and management company. The firm focuses on redevelopment of on two parcels of land in Gushu and Guangming, Shenzhen, China, into high-end commercial complexes. Its property development project in Guangming, Shenzhen, is named as Namtai Inno Park, and its property development project in Gushu, Shenzhen, is named as Namtai Inno City. The firm's Namtai Inno Park is a mixed development consisting of office buildings, a retail area, and apartment complexes. The firm's subsidiaries include Nam Tai Electronic & Electrical Products Limited, Nam Tai Holdings Limited (NTHL), Namtai Investment (Shenzhen) Co., Ltd. and Zastron Electronic (Shenzhen) Co., Ltd.",Real Estate,CN,4/2/1996,Nam Tai Property,Stock,"['Real Estate', 'Real Estate Services']","['CLS', 'ARE', 'SANM', 'BXMT']",4.74,185798512.0,Nam Tai Property Inc,$,0,Nam Tai Property,False,Nam Tai Property,nam-tai-property,"$900,000,000,185,798,000.00 ",,Nam Tai Property,0.0,3905,N
3905.0,5052.0,NTUS,Natus Medical Inc,USD,NASDAQ,Medical Devices,"Natus Medical, Inc. provides medical device solutions focuses on the diagnosis and treatment of central nervous and sensory system disorders for patients of all ages. The company is headquartered in Pleasanton, California and currently employs 1,729 full-time employees. The firm's product offerings include computerized neurodiagnostic systems for audiology, neurology, polysomnography, and neonatology, as well as newborn care products, such as hearing screening systems, phototherapy devices for the treatment of newborn jaundice, head-cooling products for the treatment of brain injury in newborns, incubators to control the newborn's environment, and software systems for managing and tracking disorders and diseases for public health laboratories. The firm is organized into three strategic business units: Neurology, Newborn Care and Otometrics.",Healthcare,US,7/20/2001,Natus Medical Inc,Stock,,,20.47,693269760.0,Natus Medical Inc,$,Natus Medical,Natus Medical,False,Natus Medical,natus-medical,"$900,000,000,693,269,000.00 ",,Natus Medical,0.0,3906,N
3906.0,5242.0,NUZE,"NuZee, Inc.",USD,NASDAQ,,,0,,,"NuZee, Inc.",Stock,,,11.59,168870944.0,"NuZee, Inc.",$,Nuzee,Nuzee,False,Nuzee,nuzee,"$900,000,000,168,870,000.00 ",,Nuzee,0.0,3907,N
3907.0,11277.0,NVEC,NVE Corp,USD,NASDAQ,Semiconductors,"NVE Corp. engages in the development and sale of devices that use spintronics, a nanotechnology that relies on electron spin rather than electron charge to acquire, store, and transmit information. The company is headquartered in Eden Prairie, Minnesota and currently employs 48 full-time employees. The firm manufactures spintronic products, including sensors and couplers that are used to acquire and transmit data. The firm has also licensed its spintronic magnetoresistive random access memory technology (MRAM). Its parts are found in industrial, scientific, and medical applications. The firm's products include sensors, couplers and MRAM products. Its sensor products detect the strength or gradient of magnetic fields and are used to determine position or speed. Its spintronic couplers combine a GMR sensor element and an IsoLoop integrated microscopic coil. MRAM uses spintronics to store data. The company combines the speed of static random-access memory (SRAM), the density of dynamic random-access memory (DRAM) and the nonvolatility of flash memory. Data is stored in the spin of the electrons in thin metal alloy films.",Technology,US,9/26/1983,NVE,Stock,"['Technology', 'Semiconductors']","['CY', 'MXIM', 'SLAB', 'VSH', 'TXN', 'ADI', 'XLK']",51.24,247654720.0,NVE Corp,$,0,NVE,False,NVE,nve,"$900,000,000,247,654,000.00 ",,NVE,0.0,3908,N
3908.0,9592.0,NVEE,NV5 Global Inc,USD,NASDAQ,Engineering & Construction,"NV5 Global, Inc. engages in the provision of professional and technical consulting and certification solutions for public and private sector. The company is headquartered in Hollywood, Florida and currently employs 2,384 full-time employees. The company offers its solutions to public and private sector clients in the energy, transportation, water, government, hospitality, education, healthcare, commercial and residential markets. The company provides a wide range of services, includes construction quality assurance, surveying and mapping, design, consulting, program and construction management, permitting, planning, forensic engineering, litigation support, condition assessment and compliance certification. Its offered services are focused on five business verticals: infrastructure, engineering, and support services; construction quality assurance, testing and inspection; program management; energy services and environmental services. Its operated segments are Infrastructure (INF) and Building, Technology and Sciences (BTS).",Industrials,US,3/27/2013,NV5 Global,Stock,"['Industrials', 'Engineering & Construction']",['FC'],64.65,854298050.0,NV5 Global Inc,$,0,NV5 Global,False,NV5 Global,nv5-global,"$900,000,000,854,298,000.00 ",,NV5 Global,0.0,3909,N
3909.0,8856.0,NVGS,Navigator Holdings Ltd,USD,NYSE,Oil & Gas Midstream,"Navigator Holdings Ltd. owns and operates a fleet of handysize liquefied gas carriers. The firm provides international and regional seaborne transportation services of liquefied petroleum gas (LPG), petrochemical gases and ammonia. As of December 31, 2016, it had 33 semi- or fully-refrigerated handysize liquefied gas carriers. Its handysize liquefied gas carriers are liquefied gas carriers with capabilities between 15,000 and 24,999 cubic meter (cbm). Its handysize liquefied gas carriers can accommodate medium- and long-haul routes. In addition, it had four midsize 37,300 cbm ethylene-capable semi-refrigerated liquefied gas carriers as of December 31, 2016. Its midsize ethylene-capable semi-refrigerated gas carriers enable long-haul transportation of ethane/ethylene. As of December 31, 2016, it also had one 38,000 cbm fully refrigerated gas carrier. The firm carries LPG for international energy companies, state-owned utilities and commodities traders.",Energy,GB,11/21/2013,Navigator Holdings,Stock,"['Industrials', 'Shipping & Ports', 'Transportation & Logistics']","['GLNG', 'CUK', 'GSL', 'KNOP']",7.94,443888096.0,Navigator Holdings Ltd,$,Navigator Holdings,Navigator Holdings,False,Navigator Holdings,navigator,"$900,000,000,443,888,000.00 ",,Navigator Holdings,0.0,3910,N
3910.0,10583.0,NWFL,Norwood Financial Corp,USD,NASDAQ,Banks Regional,"Norwood Financial Corp. operates as a bank holding company. The company is headquartered in Honesdale, Pennsylvania and currently employs 203 full-time employees. The firm operates through its subsidiary, Wayne Bank (the Bank). The Bank is a chartered bank and trust company. The Bank is an independent community bank that operates over five offices in the Wayne County, approximately three offices in Pike County, four offices in Monroe County and over three offices in Lackawanna County. The Bank offers various personal and business credit services, trust and investment products, and real estate settlement services to the consumers, businesses, nonprofit organizations and municipalities in each of the communities that the Bank serves. The Bank primarily serves the Pennsylvania counties of Wayne, Pike, Monroe and Lackawanna, as well as the Susquehanna County. In addition, the Bank operates approximately 20 automated teller machines. The Bank operates a Wealth Management/Trust Department, which provides estate planning, investment management and financial planning to customers.",Financial Services,US,1/2/1997,Norwood Financial,Stock,"['Financial Services', 'Banks - Regional - US', 'Banks']","['CZNC', 'ORRF', 'FRBK', 'BMTC', 'CCNE', 'STBA', 'UVSP', 'ACNB', 'TSC', 'CUBI']",28.99,237750752.0,Norwood Financial Corp,$,0,Norwood Financial,False,Norwood Financial,norwood-financial,"$900,000,000,237,750,000.00 ",,Norwood Financial,0.0,3911,N
3911.0,11580.0,NWLI,National Western Life Group Inc,USD,NASDAQ,Insurance Life,"National Western Life Group, Inc. is a holding company, which engages in the provision of life insurance services. The company is headquartered in Austin, Texas and currently employs 276 full-time employees. The firm's segments include Domestic Life Insurance, International Life Insurance, Annuities and All Others. The firm is licensed to do business in all states and the District of Columbia, except for New York. The firm's products marketed include annuities, universal life insurance and traditional life insurance, which include both term and whole life products. The firm markets and distributes its domestic products primarily through independent national marketing organizations. Its international operations focus on foreign nationals in upper socioeconomic classes. The company offers a portfolio of individual whole life, universal life and term insurance plans, and annuities, including supplementary riders. Its life products provide protection for the life of the insured. Its product offerings include universal life insurance, interest-sensitive whole life and traditional products, such as term insurance coverage.",Financial Services,US,9/16/1966,National Western Life,Stock,"['Financial Services', 'Insurance - Life']","['AAME', 'CIA', 'LNC', 'TMK', 'AEL', 'PRI', 'FFG']",199.75,726294980.0,National Western Life Group Inc,$,0,National Western Life,False,National Western Life,national-western,"$900,000,000,726,294,000.00 ",,National Western Life,0.0,3912,N
3912.0,7794.0,NWPX,Northwest Pipe Co,USD,NASDAQ,Metal Fabrication,"Northwest Pipe Co. operates as a manufacturer of engineered steel pipe water systems in North America. The company is headquartered in Vancouver Washington, Washington and currently employs 691 full-time employees. The firm produces steel pipeline systems for use in drinking water infrastructure, and has approximately eight manufacturing facilities, located in Portland, Oregon; Denver, Colorado; Adelanto, California; Parkersburg, West Virginia; Saginaw, Texas; St. Louis, Missouri; Salt Lake City, Utah, and Monterrey, Mexico. The Company, through Water Transmission Group, produces engineered welded steel pipe products for use in water transmission applications. The firm's solutions-based products are used in water transmission, plant piping, tunnels and river crossings applications. The firm also provides bar-wrapped concrete cylinder pipe, reinforced concrete pipe and T-Lock, a proprietary polyvinyl chloride (PVC) lining for concrete pipe sewer applications.",Industrials,US,11/30/1995,Northwest Pipe,Stock,"['Industrials', 'Metal Fabrication', 'Industrial Products']","['IIIN', 'SYNL', 'ROCK', 'OFLX', 'NOV', 'VMI', 'X', 'TS', 'MWA', 'PPIH']",28.15,276023136.0,Northwest Pipe Co,$,Northwest Pipe,Northwest Pipe,False,Northwest Pipe,northwest-pipe,"$900,000,000,276,023,000.00 ",,Northwest Pipe,0.0,3913,N
3913.0,5103.0,NWY,New York & Company Inc.,USD,NYSE,Retail Apparel & Specialty,,Consumer Cyclical,,,New York & Company Inc.,Stock,,,3.5,224189000.0,New York & Company Inc.,$,0,New York & Company Inc.,False,New York & Company .,new-york-company,"$900,000,000,224,189,000.00 ",,New York & Company,2.0,3914,N
3914.0,10324.0,NX,Quanex Building Products Corp,USD,NYSE,Building Products & Equipment,"Quanex Building Products Corp. engages in the manufacture of components sold to original equipment manufacturers in the building products industry. The company is headquartered in Houston, Texas and currently employs 3,632 full-time employees. The firm's components can be categorized as window and door (fenestration) components, and kitchen and bath cabinet components. The firm operates through three segments: North American Engineered Components (NA Engineered Components), which consists of four operating segments primarily focused on the fenestration market in North America manufacturing vinyl profiles, insulating glass (IG) spacers, screens and other fenestration components; European Engineered Components (EU Engineered Components), which consists of the United Kingdom-based vinyl extrusion business, manufacturing vinyl profiles and conservatories, and the European insulating glass business manufacturing IG spacers, and North American Cabinet Components (NA Cabinet Components), which consists of the North American cabinet door and components business.",Industrials,US,3/17/1980,Quanex Building Products,Stock,"['Basic Materials', 'Building Materials']","['BLDR', 'KALU', 'SSD', 'VMI', 'NCS', 'DOOR', 'AA', 'PGTI']",19.79,649218880.0,Quanex Building Products Corp,$,0,Quanex Building Products,False,Quanex Building Products,quanex-building,"$900,000,000,649,218,000.00 ",,Quanex Building Products,0.0,3915,N
3915.0,10692.0,NXEO,Nexeo Solutions Inc.,USD,NASDAQ,Chemicals,,Basic Materials,,,Nexeo Solutions,Stock,"['Basic Materials', 'Chemicals']","['AGFS', 'INSE']",9.97,767690000.0,Nexeo Solutions Inc.,$,0,Nexeo Solutions,False,Nexeo Solutions,nexeo-solutions,"$900,000,000,767,690,000.00 ",,Nexeo Solutions,0.0,3916,N
3916.0,484.0,NXQ,Nuveen Select Tax Free Income Portfolio II,USD,NYSE,Asset Management,"Nuveen Select Tax-Free Income Portfolio 2 is a diversified closed-end management investment company. The Fund's investment objective is that it seeks to provide current income and stable dividends, exempt from regular federal and designated state income taxes, where applicable, consistent with the preservation of capital by investing primarily in a portfolio of municipal obligations. The Fund's portfolio composition includes various sectors, such as tax obligation/limited, tax obligation/general, healthcare, transportation, consumer staples, the United States guaranteed and Other. The Fund's portfolio spans various states and territories, including California, Illinois, Texas, New Jersey, Colorado, Washington, Florida, Virginia, New York, Missouri, Iowa, Michigan, Minnesota, Nevada and Other. The Fund's investment advisor is Nuveen Fund Advisors, LLC, which is a subsidiary of Nuveen Investments, Inc. (Nuveen).",Financial Services,US,5/21/1992,Nuveen Select Tax-Free Income Portfolio 2,Stock,"['Financial Services', 'Asset Management']",[],15.22,270313280.0,Nuveen Select Tax Free Income Portfolio II,$,Nuveen Select Tax-Free Income Portfolio 2,Nuveen Select Tax-Free Income Portfolio 2,False,Nuveen Select Tax-Free ome Portfolio 2,nuveen-select-tax,"$900,000,000,270,313,000.00 ",,Nuveen Select Tax-Free ome Portfolio 2,0.0,3917,N
3917.0,454.0,NXR,Nuveen Select Tax Free Income Portfolio III,USD,NYSE,Asset Management,"Nuveen Select Tax-Free Income Portfolio 3 is a diversified closed-end management investment company. The Fund's investment objective is that it seeks to provide current income and stable dividends, exempt from regular federal and designated state income taxes, where applicable, consistent with the preservation of capital by investing primarily in a portfolio of municipal obligations. The Fund's portfolio composition includes various sectors, such as tax obligation/limited, tax obligation/general, healthcare, transportation, consumer staples, the United States guaranteed and Other. The Fund's portfolio spans various states and territories, including California, Illinois, Texas, New Jersey, Colorado, Washington, Florida, Virginia, New York, Missouri, Iowa, Michigan, Minnesota, Nevada and Other. The Fund's investment advisor is Nuveen Fund Advisors, LLC, which is a subsidiary of Nuveen Investments, Inc. (Nuveen).",Financial Services,US,7/24/1992,Nuveen Select Tax Free Income Portfolio 3,Stock,"['Financial Services', 'Asset Management']",[],16.55,215904672.0,Nuveen Select Tax Free Income Portfolio III,$,Nuveen Select Tax-Free Income Portfolio 3,Nuveen Select Tax-Free Income Portfolio 3,False,Nuveen Select Tax-Free ome Portfolio 3,nuveen-select-tax,"$900,000,000,215,904,000.00 ",,Nuveen Select Tax-Free ome Portfolio 3,0.0,3918,N
3918.0,5125.0,NXTC,NextCure Inc,USD,NASDAQ,Biotechnology,"NextCure, Inc. is a clinical-stage biopharmaceutical company, which engages in discovering and developing immunomedicines to treat cancer and other immune-related diseases. The company is headquartered in Beltsville, Maryland and currently employs 44 full-time employees. The firm uses its functional integrated nextcure discovery in immune oncology (FIND-IO) technology to functional screening approaches for the identification of targets from multiple therapeutic areas, including autoimmunity and neurology, enabling immunomedicine to treat unmet medical needs. Its product pipelines include NC318, a immunotherapeutic against a immunomodulatory target found on a restricted set of myeloid and tumor cells, and NC410, a immunomedicine designed to block an immune regulator expressed on T cells and suppressive antigen-presenting cell populations, including dendritic cell subpopulations.",Healthcare,US,5/9/2019,NextCure Inc,Stock,,,10.85,298951136.0,NextCure Inc,$,NextCure,NextCure,False,NextCure,nextcure,"$900,000,000,298,951,000.00 ",,NextCure,0.0,3919,N
3919.0,10458.0,NYMX,Nymox Pharmaceutical Corp,USD,NASDAQ,Biotechnology,"Nymox Pharmaceutical Corp. operates as a biopharmaceutical company, which engages in the research and development on products for the aging population. The company is headquartered in Saint-Laurent, Quebec and currently employs 5 full-time employees. The firm is focused on developing its drug candidate, NX-1207, for the treatment of benign prostatic hyperplasia (BPH) and the treatment of low-grade localized prostate cancer. The firm operates through the research and development of products for the aging population segment. The firm markets NicAlert and TobacAlert tests that use urine or saliva to detect use of tobacco products. The firm also owns rights for its marketed products, its investigational drug, as well as other therapeutic and diagnostic indications. The firm also has the rights for the use of statin drugs for the treatment and prevention of Alzheimer's disease. The firm's subsidiaries include Nymox Corporation and Serex, Inc. Nymox Corporation conducts research and development, while Serex, Inc. conducts research and development, and manufacturing of NicAlert and TobacAlert.",Healthcare,CA,11/26/1997,Nymox Pharmaceutical,Stock,"['Healthcare', 'Biotechnology']","['DGX', 'ABT', 'JNJ', 'LLY', 'PFE', 'SPHS', 'XLV']",2.0,157187200.0,Nymox Pharmaceutical Corp,$,0,Nymox Pharmaceutical,False,Nymox Pharmaceutical,nymox-pharmaceutical,"$900,000,000,157,187,000.00 ",,Nymox Pharmaceutical,0.0,3920,N
3920.0,10732.0,NYNY,Empire Resorts Inc.,USD,NASDAQ,Travel & Leisure,,Consumer Cyclical,,,Empire Resorts,Stock,"['Consumer Cyclical', 'Resorts & Casinos', 'Travel & Leisure']","['PENN', 'CNTY', 'CPHC', 'CHDN', 'DDE', 'UWN', 'CZR', 'FLL', 'ERI', 'GDEN']",9.75,335750016.0,Empire Resorts Inc.,$,0,Empire Resorts,False,Empire Resorts,empire-resorts,"$900,000,000,335,750,000.00 ",,Empire Resorts,0.0,3921,N
3921.0,10805.0,NYRT,New York REIT Inc.,USD,NYSE,REITs,,Real Estate,,,New York REIT,Stock,"['Real Estate', 'REIT - Office', 'REITs']",[],14.15,226400000.0,New York REIT Inc.,$,0,New York REIT,False,New York REIT,new-york-reit,"$900,000,000,226,400,000.00 ",,New York REIT,0.0,3922,N
5174.0,7976.0,NAII,Natural Alternatives International Inc,USD,NASDAQ,Packaged Foods,"Natural Alternatives International, Inc. engages in formulating, manufacturing, and marketing of nutritional supplements. The company is headquartered in Carlsbad, California and currently employs 186 full-time employees. The firm operates through three segments: private-label contract manufacturing, patent and trademark licensing, and branded products. The private-label contract manufacturing segment primarily relates to the provision of private-label contract manufacturing services to companies that market and distribute nutritional supplements and other healthcare products. The patent and trademark licensing segment primarily includes direct raw material sales and royalty income from its license and supply agreements associated with the sale and use of beta-alanine under its CarnosSyn trade name. The branded products segment relates to the marketing and distribution of branded nutritional supplements and consists primarily of the products sold under its Pathway to Healing product line.",Consumer Defensive,US,1/13/1997,Natural Alternatives International,Stock,"['Consumer Defensive', 'Household & Personal Products', 'Consumer Packaged Goods']","['ACET', 'CYAN', 'ABT', 'CBM', 'MTEX']",9.6,62233060.0,Natural Alternatives International Inc,$,0,Natural Alternatives International,False,Natural Alternatives ,natural-alternatives,"$90,000,000,062,233,000.00 ",,Natural Alternatives,1.0,5175,N
5175.0,8959.0,NAKD,Naked Brand Group Ltd,NZD,NASDAQ,Manufacturing Apparel & Furniture,"Naked Brand Group Ltd. operates as an apparel and swimwear company. The company employs 260 full-time employees The firm designs, manufactures and markets a portfolio of brands, catering to a broad cross-section of consumers and market segments. Its Brands include Naked, Bendon, Bendon Man, Davenport, Evollove, Fayreform, Hickory, Lovable, Pleasure State, Heidi Klum Intimates, Heidi Klum Man, and Heidi Klum Swim. The Company’s products are available in over 44 countries worldwide through around 6,000 retail doors. The Company’s brands are distributed through department stores, specialty stores, independent boutiques and third-party e-commerce sites globally, including Macy’s, Nordstrom, Saks Fifth Avenue, Harrods, Selfridges, and Amazon.",Consumer Cyclical,NZ,6/20/2018,Naked Brand Group,Stock,"['Consumer Cyclical', 'Apparel Manufacturing', 'Manufacturing - Apparel & Furniture']",[],0.0724,16941746.0,Naked Brand Group Ltd,NZD,Naked Brand,Naked Brand,False,Naked Brand,naked-brand,"$90,000,000,016,941,700.00 ",,Naked Brand,0.0,5176,N
5176.0,12270.0,NAO,Nordic Amern Offshore Ltd,USD,NYSE,Transportation & Logistics,,Industrials,,,Nordic Amern Offshore,Stock,"['Industrials', 'Shipping & Ports', 'Transportation & Logistics']","['CKH', 'NAT', 'TK', 'HOS', 'TOO', 'ERA', 'TDW']",3.16,19791377.0,Nordic Amern Offshore Ltd (Bermuda),$,0,Nordic Amern Offshore,False,Nordic Amern Offshore,nordic-amern,"$90,000,000,019,791,300.00 ",,Nordic Amern Offshore,0.0,5177,N
