Unnamed: 0,index,symbol,long name,currency,exchange,industry,description,sector,country,ipo date,shorter name,Type,Industries,Similar Companies,price,mktCap,name raw,currency symbol,robinhood name,short name,Warrant,shortest name,url name, smart_order ,random csv equations,pure name,shortest - pure diff,first_letter
,,1767.HK,TS Wonders Holding Ltd,HKD,HKSE,"Food, Beverage & Tobacco","TS Wonders Holding Limited is a Singapore-based snacks company. The Company is primarily focused on producing, packaging and selling of nuts and chips. The Company owns and operates its business mainly through two categories, such as nuts and chips. The Company manufactures a range of nuts and beans including peanuts, cashews, pistachios, almonds, macadamia nuts, USA walnuts, broad beans and green peas. It produces two types of nuts products, such as the oil-roasted nuts and oven-roasted nuts. Its chips products include potato chips and cassava chips. The cassava chips are made from cassava roots and flavored with original, hot and spicy or grill barbecue seasoning. It markets nuts products under two core brands, such as TAI SUN and NATURE’S WONDERS, and chips products under two core brands, such as TREATZ and UCA.",Food Products,SG,1/14/2019,TS Wonders Holding Ltd,,,,0.42,420000000.0,TS Wonders Holding Ltd,HKD,TS Wonders Holding Ltd,TS Wonders Holding Ltd,,TS Wonders Holding Ltd,1767.hk,,,TS Wonders Holding Ltd,,1
,,1769.HK,Scholar Education Group,HKD,HKSE,Consumer Services,"Scholar Education Group provides K-12 after-school education services in the People's Republic of China. The company offers a suite of after-school education services through its academic preparation program and early primary education program. It delivers academic preparation program under the Sheng Xue brand, which offers classes to students in grade one through grade 12 in school academic subjects; and early primary education program under the Le Xue brand that provides childhood education courses and hobby courses, such as languages and performing arts to students from grade one to grade three. As at 31 December 2019, the company operated 100 learning centers across seven cities in Guangdong and Fujian provinces. It also engages in the Internet and software technology development and services. The company was founded in 2012 and is headquartered in Shenzhen, the People's Republic of China.",Diversified Consumer Services,CN,6/21/2019,Scholar Education Group,,,,10.52,5845963800.0,Scholar Education Group,HKD,Scholar Education Group,Scholar Education Group,,Scholar Education Group,1769.hk,,,Scholar Education Group,,1
,,1771.HK,Sunfonda Group Holdings Ltd,HKD,HKSE,Retailing,"Sunfonda Group Holdings Limited, an investment holding company, engages in the sale and service of motor vehicles in Mainland China. The company sells imported and domestically manufactured luxury and ultra-luxury automobiles. It also offers after-sales services comprising maintenance and repair services, sale of spare parts, and automobile detailing services; and other value-added services, such as automobile insurance agency, automobile financing, automobile licensing, and automobile survey services. In addition, the company provides logistics and storage services; technology development and Internet services; and sale and service of second-hand cars. The company was founded in 2000 and is headquartered in Xi'an, the People's Republic of China. Sunfonda Group Holdings Limited is a subsidiary of Top Wheel Limited.",Retail,CN,5/15/2014,Sunfonda Group Holdings Ltd,,,,1.45,870000000.0,Sunfonda Group Holdings Ltd,HKD,Sunfonda Group Holdings Ltd,Sunfonda Group Holdings Ltd,,Sunfonda Group Holdings Ltd,1771.hk,,,Sunfonda Group Holdings Ltd,,1
,,1773.HK,Tianli Education International Holdings Ltd,HKD,HKSE,Consumer Services,"Tianli Education International Holdings Limited, an investment holding company, provides private education services in China. The company offers K-12 education services; and tutoring services for K-12 students and pre-kindergarten children, as well as provides management services. As of December 31, 2019, it had a network of 24 K-12 schools, which administered 13 high school programs, 17 middle school programs, 19 elementary school programs, and 7 kindergarten programs; 10 tutorial centers; and 5 early childhood education centers. Tianli Education International Holdings Limited was founded in 2002 and is headquartered in Chengdu, the People's Republic of China.",Diversified Consumer Services,CN,7/12/2018,Tianli Education International Holdings Ltd,,,,9.94,21530040300.0,Tianli Education International Holdings Ltd,HKD,Tianli Education International Holdings Ltd,Tianli Education International Holdings Ltd,,Tianli Education International Holdings Ltd,1773.hk,,,Tianli Education International Holdings Ltd,,1
,,1775.HK,Bexcellent Group Holdings Ltd,HKD,HKSE,Consumer Services,"BExcellent Group Holdings Limited, an investment holding company, provides private supplementary secondary school education in Hong Kong. It operates private supplementary secondary school education services for students from secondary 1 to secondary 6 under the Beacon College brand; and private secondary day school services to secondary 4, 5, and 6 level students under the Beacon Day School brand. The company also provides various ancillary education services and products, including interview preparation, language and supplementary primary school education, and tutorial and consultation services under our Diverse Learning Club, Beacon Childhood, BeConfident, Glocal Education, and Mathgic brands; mock examination, VIP self-study, and online course scheduling and management services; IELTS, general interest, and foreign language courses under the Beacon BExcellent brand; higher national diploma in business under the Beacon CAPE brand; other education services Ascent Prep brand name; overseas study consultation services under GES brand; and online retail business under Beacon Living brand name. In addition, it offers childhood education services; and information technology services, as well as operates advertising agency. As at 31 July 2020, it operated 17 teaching centers with a total of 131 classrooms. The company was founded in 1989 and is headquartered in Tsuen Wan, Hong Kong. BExcellent Group Holdings Limited is a subsidiary of Beacon Enterprise Limited.",Diversified Consumer Services,HK,7/13/2018,Bexcellent Group Holdings Ltd,,,,0.44,220000000.0,Bexcellent Group Holdings Ltd,HKD,Bexcellent Group Holdings Ltd,Bexcellent Group Holdings Ltd,,Bexcellent Group Holdings Ltd,1775.hk,,,Bexcellent Group Holdings Ltd,,1
,,1777.HK,Fantasia Holdings Group Co Ltd,HKD,HKSE,Real Estate,"Fantasia Holdings Group Co., Limited, an investment holding company, invests in, develops, sells, and leases commercial and residential properties primarily in the People's Republic of China. It operates through six segments: Property Development, Property Investment, Property Agency Services, Property Operation Services, Hotel Operation, and Others. The company engages in the development of urban complexes, upscale boutique residences, and mid-to-high end residence projects; the provision of hotel accommodation, property management, value-added, engineering, and travel agency services; and manufacture and sale of fuel pumps. It also provides community services through online platform; and wealth management, finance lease, petty loans, P2P, funds and factoring, consumer finance, insurance, payment services, etc. for enterprises and individuals, as well as operates and manages various city complexes, shopping centers, etc. In addition, the company operates golfs, high-end city clubs, private clubs, theme parks, art museums, etc.; and develops various home-based care service stations, daytime care centers, and senior citizen apartments, which provide home care, health care, rehabilitation therapy, nutrition catering, and spiritual solace, as well as education services. The company was founded in 1996 and is headquartered in Shenzhen, the People's Republic of China. Fantasia Holdings Group Co., Limited is a subsidiary of Fantasy Pearl International Limited.",Real Estate,CN,11/25/2009,Fantasia Holdings Group Co Ltd,,,,1.17,6749050900.0,Fantasia Holdings Group Co Ltd,HKD,Fantasia Holdings Group Co Ltd,Fantasia Holdings Group Co Ltd,,Fantasia Holdings Group Co Ltd,1777.hk,,,Fantasia Holdings Group Co Ltd,,1
,,1778.HK,Colour Life Services Group Co Ltd,HKD,HKSE,Real Estate,"Colour Life Services Group Co., Limited, an investment holding company, provides property management and community services through an online platform in the People's Republic of China. It offers services to communities under commission and lump sum basis; pre-sale services to property developers; and consultancy services to property management companies. The company also provides community leasing, sale, and other value-added services, which primarily include the provision of online promotion, sales and rental assistance, and others. In addition, it offers engineering services, such as the provision of equipment installation, repair and maintenance, automation and other equipment upgradation, and energy-saving services. The company was founded in 2002 and is headquartered in Shenzhen, the People's Republic of China. Colour Life Services Group Co., Limited is a subsidiary of Fantasia Holdings Group Co., Limited.",Real Estate,CN,6/30/2014,Colour Life Services Group Co Ltd,,,,3.55,5164788700.0,Colour Life Services Group Co Ltd,HKD,Colour Life Services Group Co Ltd,Colour Life Services Group Co Ltd,,Colour Life Services Group Co Ltd,1778.hk,,,Colour Life Services Group Co Ltd,,1
,,1780.HK,B & D Strategic Holdings Ltd,HKD,HKSE,Capital Goods,"B & D Strategic Holdings Limited, an investment holding company, operates as a contractor that specializes in alteration and addition, and civil engineering works in Hong Kong. Its alteration and addition works include new structural works, fitting-out works, changes in facilities configuration, constructing a new extension to existing building, and conversion of an existing building to various types, as well as fabrication, modification, removal, or installation of hardware and equipment; erection, relocation, or removal of partitions, doors, and windows; and changes in type of finishes and flooring materials. The company's civil engineering works comprise site formation and foundation works. It primarily serves property asset management companies, property developers, and contractors. The company was founded in 1995 and is headquartered in Kwai Chung, Hong Kong. B & D Strategic Holdings Limited is a subsidiary of Sky Winner Holdings Limited.",Construction,HK,4/30/2019,B & D Strategic Holdings Ltd,,,,0.395,244900000.0,B & D Strategic Holdings Ltd,HKD,B & D Strategic Holdings Ltd,B & D Strategic Holdings Ltd,,B & D Strategic Holdings Ltd,1780.hk,,,B & D Strategic Holdings Ltd,,1
,,1781.HK,Sun Cheong Creative Development Holdings Ltd,HKD,HKSE,Materials,"Sun Cheong Creative Development Holdings Limited designs, develops, manufactures, and sells plastic household products. It offers plastic, glass, and ceramic storage containers under the clipfresh brand. The company sells its products through direct sales to chain supermarkets, department stores, and household product retailers; and importers/exporters. It operates in Australia, Hong Kong, the United Kingdom, the United States, New Zealand, Germany, and internationally. Sun Cheong Creative Development Holdings Limited was founded in 1979 and is headquartered in Wan Chai, Hong Kong.",Packaging,HK,10/4/2018,Sun Cheong Creative Development Holdings Ltd,,,,0.183,98820000.0,Sun Cheong Creative Development Holdings Ltd,HKD,Sun Cheong Creative Development Holdings Ltd,Sun Cheong Creative Development Holdings Ltd,,Sun Cheong Creative Development Holdings Ltd,1781.hk,,,Sun Cheong Creative Development Holdings Ltd,,1
,,1782.HK,Vixtel Technologies Holdings Ltd,HKD,HKSE,Software & Services,"Vixtel Technologies Holdings Limited, an investment holding company, provides Internet and Web application performance management (APM) products and services to telecommunication operators and large enterprises in Hong Kong and mainland China. The company offers Loglyst analysis platform, which collects, searches, analyzes, monitors, and visualizes unstructured data; APM Vista SaaS Platform, which provides network performance monitoring and mobility performance management services, as well as CDN performance monitoring, diagnosis, and evaluation; and NetVista, an intelligent IP network-oriented performance management and quality monitoring platform; cloud monitoring systems. It also provides IPTV/OTT video security and quality monitoring system, including program content, business, and transmission quality monitoring systems, as well as safety broadcast monitoring and multi-picture surveillance systems; and Trade QoS Monitoring, a precise analysis tool for transaction speed, delay, and algorithm for securities, futures, and other financial transaction systems. In addition, the company offers technical services, such as operational support, system maintenance, network analysis and optimization of a chain of Internet applications, and research study of specific topics on application and network performance. Further, it provides software development services; and sells embedded hardware and APM software. Vixtel Technologies Holdings Limited was founded in 2006 and is headquartered in Beijing, the People's Republic of China.",Technology,CN,12/15/2016,Vixtel Technologies Holdings Ltd,,,,0.48,243840000.0,Vixtel Technologies Holdings Ltd,HKD,Vixtel Technologies Holdings Ltd,Vixtel Technologies Holdings Ltd,,Vixtel Technologies Holdings Ltd,1782.hk,,,Vixtel Technologies Holdings Ltd,,1
,,1783.HK,Golden Ponder Holdings Ltd,HKD,HKSE,Capital Goods,"Golden Ponder Holdings Limited, an investment holding company, provides superstructure building and repair, maintenance, alteration, and addition (RMAA) works services as a contractor in Hong Kong. Its superstructure building works include building works in relation to the parts of the structure above the ground level primarily development projects for residential and commercial buildings; and RMAA works comprise repair, maintenance, alteration, and addition works for existing structures. The company was founded in 1985 and is headquartered in Kowloon, Hong Kong. Golden Ponder Holdings Limited is a subsidiary of Shiny Golden Limited.",Construction,HK,8/22/2018,Golden Ponder Holdings Ltd,,,,0.127,101600000.0,Golden Ponder Holdings Ltd,HKD,Golden Ponder Holdings Ltd,Golden Ponder Holdings Ltd,,Golden Ponder Holdings Ltd,1783.hk,,,Golden Ponder Holdings Ltd,,1
,,1785.HK,Chengdu Expressway Co Ltd,HKD,HKSE,Transportation,"Chengdu Expressway Co., Ltd. engages in the operation, management, and development of expressways located in Chengdu, Sichuan province, China. It operates five expressways, which include the Chengguan Expressway, Chengwenqiong Expressway, Chengpeng Expressway, Chengdu Airport Expressway and Qiongming Expressway, and Chengbei Exit Expressway with a total length of 202.37 kilometers. The company was formerly known as Chengdu Chengguan Expressway Co., Ltd. and changed its name to Chengdu Expressway Co., Ltd. in 2016. Chengdu Expressway Co., Ltd. was founded in 1998 and is headquartered in Chengdu, China. Chengdu Expressway Co., Ltd. is a subsidiary of Chengdu Expressway Construction and Development Co., Ltd.",Transportation Infrastructure,CN,1/15/2019,Chengdu Expressway Co Ltd,,,,2.15,3560615170.0,Chengdu Expressway Co Ltd,HKD,Chengdu Expressway Co Ltd,Chengdu Expressway Co Ltd,,Chengdu Expressway Co Ltd,1785.hk,,,Chengdu Expressway Co Ltd,,1
,,1786.HK,Crcc High-Tech Equipment Corp Ltd,HKD,HKSE,Capital Goods,"CRCC High-Tech Equipment Corporation Limited researches, develops, manufactures, and sells large railway track maintenance machinery in Mainland China and internationally. Its railway track maintenance machines include tamping machines; ballast cleaning machines; stabilization machines; ballast regulators; materials logistics machines; and rail processing machines; as well as other machines, such as catenary inspection and maintenance machines, catenary installation machines, and other large railway track maintenance machines. The company also manufactures, purchases, and sells various parts and components comprising bogies, electrical control systems, working devices, wheelsets, transmissions, pumps, valves, motors, and drive shafts. In addition, it provides overhaul services, including repairs, upgradation, and remanufacturing services; and railway lines maintenance services for newly built and existing railway lines. The company was formerly known as Kunming China Railway Large Maintenance Machinery Group Co., Ltd. and changed its name to CRCC High-Tech Equipment Corporation Limited in June 2015. The company was founded in 1954 and is headquartered in Kunming, China. CRCC High-Tech Equipment Corporation Limited is a subsidiary of China Railway Construction Corporation Limited.",Machinery,CN,12/16/2015,Crcc High-Tech Equipment Corp Ltd,,,,1.1,1671867900.0,Crcc High-Tech Equipment Corp Ltd,HKD,Crcc High-Tech Equipment Corp Ltd,Crcc High-Tech Equipment Corp Ltd,,Crcc High-Tech Equipment Corp Ltd,1786.hk,,,Crcc High-Tech Equipment Corp Ltd,,1
,,1788.HK,Guotai Junan International Holdings Ltd,HKD,HKSE,Diversified Financials,"Guotai Junan International Holdings Limited, an investment holding company, provides wealth management, brokerage, corporate finance, asset management, loans and financing, financial products, and market making and investment services in Hong Kong and internationally. The company's Brokerage segment is involved in securities, futures, options, and leveraged foreign exchange dealing and brokerage; and the provision of insurance brokerage services. Its Corporate Finance segment provides advisory services; and placing and underwriting services of debt and equity securities. The company's Asset Management segment offers asset management services comprising fund management and investment advisory services. Its Loans and Financing segment provides margin financing products, securities borrowing and lending to margin customers, initial public offering loans, other loans to customers, and bank deposits. The company's Financial Products, Market Making and Investments segment offers funds, fixed income securities, and equity investments, as well as structuring of financial products; and trades in and markets debt securities, exchange traded funds, and derivatives. Its Other segment provides information channel services. The company was founded in 1995 and is based in Central, Hong Kong. Guotai Junan International Holdings Limited is a subsidiary of Guotai Junan Holdings Limited.",Financial Services,HK,7/8/2010,Guotai Junan International Holdings Ltd,,,,1.37,13172399100.0,Guotai Junan International Holdings Ltd,HKD,Guotai Junan International Holdings Ltd,Guotai Junan International Holdings Ltd,,Guotai Junan International Holdings Ltd,1788.hk,,,Guotai Junan International Holdings Ltd,,1
,,1789.HK,AK Medical Holdings Ltd,HKD,HKSE,Health Care Equipment & Services,"AK Medical Holdings Limited, an investment holding company, designs, develops, produces, and markets orthopedic joint implants and related products under the AK Medical brand in China and internationally. It offers knee, hip, and spine replacement implants; and 3D-printed products, such as 3D-printed hip replacement implants, 3D-printed artificial vertebral bodies, and 3D-printed spinal interbody cages. The company also distributes third party orthopedic products; and manufactures surgical instruments and medical irrigators. Its principal customers include distributors, hospitals, physicians and surgeons, and patients. The company was founded in 2003 and is headquartered in Beijing, the People's Republic of China. AK Medical Holdings Limited is a subsidiary of Ximalaya Limited.",Health Care,CN,12/20/2017,AK Medical Holdings Ltd,,,,14.0,15595720700.0,AK Medical Holdings Ltd,HKD,AK Medical Holdings Ltd,AK Medical Holdings Ltd,,AK Medical Holdings Ltd,1789.hk,,,AK Medical Holdings Ltd,,1
,,1790.HK,TIL Enviro Ltd,HKD,HKSE,Commercial  & Professional Services,"TIL Enviro Limited provides wastewater treatment services in Ningxia, the People's Republic of China. The company also supplies recycled water to power plants and public institutions; and provides consultancy services. It operates four wastewater treatment facilities located in Yinchuan on transfer-operate-transfer basis. The company was founded in 2011 and is headquartered in Guangzhou, the People's Republic of China. TIL Enviro Limited is a subsidiary of Sparkle Century Group Limited.",Commercial Services & Supplies,CN,11/19/2018,TIL Enviro Ltd,,,,0.4,400000000.0,TIL Enviro Ltd,HKD,TIL Enviro Ltd,TIL Enviro Ltd,,TIL Enviro Ltd,1790.hk,,,TIL Enviro Ltd,,1
,,1796.HK,Yield Go Holdings Ltd,HKD,HKSE,Capital Goods,"Yield Go Holdings Ltd., an investment holding company, provides fitting-out contract services for residential and commercial properties in Hong Kong. The company's fitting-out services include fitting-out works conducted on new buildings, such as ceiling, metal, and glass works, as well as installation of built-in furniture, timber flooring, kitchen cabinetries, and timber doors; surveying and administration; and interior renovation works on existing buildings that comprise upgrades, makeovers, and demolition of existing works. It also supplies fitting-out materials, such as timber products. The company was founded in 1995 and is headquartered in Tsuen Wan, Hong Kong. Yield Go Holdings Ltd. is a subsidiary of Hoi Lang Holdings Ltd.",Construction,HK,12/31/2018,Yield Go Holdings Ltd,,,,0.46,220800000.0,Yield Go Holdings Ltd,HKD,Yield Go Holdings Ltd,Yield Go Holdings Ltd,,Yield Go Holdings Ltd,1796.hk,,,Yield Go Holdings Ltd,,1
,,1797.HK,Koolearn Technology Holding Ltd,HKD,HKSE,Consumer Services,"Koolearn Technology Holding Limited provides online extracurricular education services in China. It operates through three segments: College Education, K12 Education, and Pre-school Education. The College Education segment offers college test preparation and overseas test preparation courses to college students and working professionals. The K12 Education segment provides after-school tutoring courses and preparation courses for high school and national college entrance exams. The Pre-school Education segment offers online educational content delivered through its Donut English-learning and child education apps and Donut live online English classroom courses. The company provides pre-recorded online education packages to institutional customers, including universities, public libraries, telecom operators, and online video streaming service providers. It also provides software and technology, and education advisory services. The company was founded in 2005 and is headquartered in Beijing, China.",Diversified Consumer Services,CN,3/28/2019,Koolearn Technology Holding Ltd,,,,25.8,25791666200.0,Koolearn Technology Holding Ltd,HKD,Koolearn Technology Holding Ltd,Koolearn Technology Holding Ltd,,Koolearn Technology Holding Ltd,1797.hk,,,Koolearn Technology Holding Ltd,,1
,,1798.HK,China Datang Corp Renewable Power Co Ltd,HKD,HKSE,Utilities,"China Datang Corporation Renewable Power Co., Limited, together with its subsidiaries, generates and sells wind power and other renewable power in the People's Republic of China. The company develops, invests in, constructs, and manages wind power and other renewable energy sources, including solar power and biomass. It also engages in the research and development, application, and promotion of low carbon technology; research, sale, testing, and maintenance of renewable energy-related equipment; power generation; and design, construction and installation, repair, and maintenance of domestic and international power projects. In addition, the company provides import and export services for renewable energy equipment and technologies; foreign investments; and renewable energy-related consulting services. As of December 31, 2019, it had consolidated installed capacity of 9,961 megawatts. The company was formerly known as Datang Chifeng Saihanba Wind Power Generation Co., Ltd. and changed its name to China Datang Corporation Renewable Power Co., Limited in March 2009. The company was founded in 2004 and is headquartered in Beijing, the People's Republic of China. China Datang Corporation Renewable Power Co., Limited is a subsidiary of China Datang Corporation Ltd.",Utilities,CN,12/17/2010,China Datang Corp Renewable Power Co Ltd,,,,1.99,14474662900.0,China Datang Corp Renewable Power Co Ltd,HKD,China Datang Corp Renewable Power Co Ltd,China Datang Corp Renewable Power Co Ltd,,China Datang Corp Renewable Power Co Ltd,1798.hk,,,China Datang Corp Renewable Power Co Ltd,,1
,,1799.HK,Xinte Energy Co Ltd,HKD,HKSE,Capital Goods,"Xinte Energy Co., Ltd., together with its subsidiaries, provides engineering and construction contracting services and systems for solar and wind power plants in the People's Republic of China and internationally. It also produces polysilicon products; and operates solar and wind power plants. In addition, the company produces inverter and static var generator products. Further, it offers consulting, design, research, and development services; and sells electricity. The company was founded in 2008 and is headquartered in Urumqi, the People's Republic of China. Xinte Energy Co., Ltd. is a subsidiary of TBEA Co., Ltd.",Construction,CN,12/30/2015,Xinte Energy Co Ltd,,,,27.8,33359999000.0,Xinte Energy Co Ltd,HKD,Xinte Energy Co Ltd,Xinte Energy Co Ltd,,Xinte Energy Co Ltd,1799.hk,,,Xinte Energy Co Ltd,,1
