Column1,index,symbol,long name,currency,exchange,industry,description,sector,country,ipo date,shorter name,Type,Industries,Similar Companies,price,mktCap,name raw,currency symbol,robinhood name,short name,Warrant,shortest name,url name, smart_order ,random csv equations,pure name,shortest - pure diff,order,first_letter
3648.0,10628.0,KRNY,Kearny Financial Corp,USD,NASDAQ,Banks Regional,"Kearny Financial Corp. operates as a holding company, which engages in the ownership and operation of the bank. The company is headquartered in Fairfield, New Jersey and currently employs 524 full-time employees. The Bank is a federally chartered stock savings bank. The firm is a unitary savings and loan holding company. The firm's primary business is the ownership and operation of the Bank. The Bank is principally engaged in the business of attracting deposits from the general public in New Jersey and New York and using these deposits, together with other funds, to originate or purchase loans for its portfolio and invest in securities. As of June 30, 2016, the Company's primary market area included the counties in which it operates branches, including Bergen, Essex, Hudson, Middlesex, Monmouth, Morris, Ocean, Passaic and Union counties in New Jersey and Kings (Brooklyn) and Richmond (Staten Island) counties in New York. Its loan portfolio primarily consists of loans collateralized by commercial and residential real estate augmented by secured and unsecured loans to businesses and consumers.",Financial Services,US,2/24/2005,Kearny Financial,Stock,"['Financial Services', 'Savings & Cooperative Banks', 'Banks']","['OCFC', 'MGYR', 'ORIT', 'PFS', 'NFBK', 'MSBF']",9.56,855719490.0,Kearny Financial Corp,$,0,Kearny Financial,False,Kearny Financial,kearny-financial,"$900,000,000,855,719,000.00 ",,Kearny Financial,0.0,3649,K
3649.0,52.0,KRP,Kimbell Royalty Partners LP,USD,NYSE,Oil & Gas E&P,"Kimbell Royalty Partners LP engages in owning and acquiring mineral and royalty interests in oil and natural gas properties. The company is headquartered in Fort Worth, Texas and currently employs 17 full-time employees. The firm owns mineral and royalty interests in approximately 13 million gross acres. The firm's mineral and royalty interests are located in over 28 states and in every onshore basin across the continental United States and includes ownership in more than 94,000 gross producing wells, including over 40,000 wells in the Permian Basin. The firm's properties include Permian Basin, Mid-Continent, Terryville/Cotton Valley/Haynesville, Eagle Ford, Barnett Shale/Fort Worth Basin, Bakken/Williston Basin, San Juan Basin, Onshore California, DJ Basin/Rockies/Niobrara, Illinois Basin and others.",Energy,US,2/3/2017,Kimbell Royalty Partners,Stock,"['Energy', 'Oil & Gas E&P', 'Oil & Gas - E&P']","['NRT', 'QTRH']",6.97,416302752.0,Kimbell Royalty Partners Representing Limited Partner Interests,$,Kimbell Royalty,Kimbell Royalty,False,Kimbell Royalty,kimbell-royalty,"$900,000,000,416,302,000.00 ",,Kimbell Royalty,0.0,3650,K
3650.0,4589.0,KRUS,Kura Sushi USA Inc,USD,NASDAQ,Restaurants,"Kura Sushi USA, Inc. engages in the operation of Japanese restaurant concept. The company is headquartered in Irvine, California and currently employs 1,400 full-time employees. The firm offers nigiri, roll, hand roll, gunkan and desserts. Its nigiri includes dashi olive salmon, red snapper with yuzu pepper, soy sake marinated salmon, umami oil seared beef, seared scallop Japanese mayo, squid, conch, tuna, shrimp, toro, yellowtail and salmon. Its rolls include spicy garlic popcorn shrimp roll, tekka maki, spicy tuna roll, kura roll, rainbow roll, volcano roll, spicy popcorn shrimp roll, tempura Philadelphia roll, caterpillar roll, shrimp avocado roll, golden crunchy roll, baked eel avocado roll, kappa maki and salmon skin roll. The Company’s hand rolls include negitoro hand roll, cucumber hand roll, real crab California hand roll, crunchy hand roll, spicy scallop hand roll, spicy tuna hand roll, spider hand roll and spicy salmon hand roll. The firm operates in approximately 21 restaurants in four states, including California, Texas, Georgia and Illinois.",Consumer Cyclical,US,8/1/2019,Kura Sushi USA Inc,Stock,,,16.76,139811584.0,Kura Sushi USA Inc,$,Kura Sushi,Kura Sushi,False,Kura Sushi,kura-sushi,"$900,000,000,139,811,000.00 ",,Kura Sushi,0.0,3651,K
3651.0,9145.0,KRYS,Krystal Biotech Inc,USD,NASDAQ,Biotechnology,"Krystal Biotech, Inc. is a gene therapy company, which engages in developing and commercializing treatment for patients suffering from dermatological diseases. The company is headquartered in Pittsburgh, Pennsylvania and currently employs 37 full-time employees. The firm is engaged in developing and commercializing novel treatments for patients suffering from dermatological diseases. The firm has developed a Skin TARgeted Delivery platform, or STAR-D platform, that consists of a patent pending engineered viral vector based on herpes simplex virus 1, or HSV-1, and skin-optimized gene transfer technology, to develop off-the-shelf treatments for dermatological diseases. The Company’s products include KB103 and KB104.The Company's KB103 is in preclinical development to treat dystrophic epidermolysis bullosa, or DEB, a rare and severe genetic disease. The firm's KB104 is to treat Netherton Syndrome, a severe form of ichthyosis, which is a family of genetic skin disorders associated with thickened scaly skin and characterized by chronic skin inflammation, itchiness and dehydration.",Healthcare,US,9/20/2017,Krystal Biotech,Stock,"['Healthcare', 'Biotechnology']",['XLV'],41.95,826733820.0,Krystal Biotech Inc,$,0,Krystal Biotech,False,Krystal Biotech,krystal-biotech,"$900,000,000,826,733,000.00 ",,Krystal Biotech,0.0,3652,K
3652.0,9257.0,KVHI,KVH Industries Inc,USD,NASDAQ,Communication Equipment,"KVH Industries, Inc. engages in the provision of internet, television, and voice services via satellite to mobile users at sea and on land. The company is headquartered in Middletown, Rhode Island and currently employs 630 full-time employees. The firm also provides commercially licensed entertainment, including news, sports, music and movies, to commercial and leisure customers in the maritime, hotel and retail markets. The company operates in two geographic segments, in the mobile communications, navigation and guidance and stabilization equipment industry. The firm develops and distributes training films and e-learning computer-based training courses to commercial maritime customers. The company is also a manufacturer of navigational sensors and integrated inertial systems for defense and commercial guidance and stabilization applications. The company designs, develops, manufactures and markets mobile communications products and services for the marine and land mobile markets, and navigation, guidance and stabilization products for both the commercial and defense markets.",Technology,US,4/2/1996,KVH Industries,Stock,"['Technology', 'Communication Equipment']","['VSAT', 'CMTL', 'FEIM', 'DISH', 'IRDM', 'HRS', 'HON', 'NYT', 'NWSA', 'GSAT', 'XLK']",9.39,171862352.0,KVH Industries Inc,$,0,KVH Industries,False,KVH Industries,kvh-industries,"$900,000,000,171,862,000.00 ",,KVH Industries,0.0,3653,K
3653.0,4501.0,KXIN,Kaixin Auto Holdings,USD,NASDAQ,Shell Companies,"Kaixin Auto Holdings operates as a holding company, whose subsidiaries operate as used car dealers. The company is headquartered in Beijing, Beijing and currently employs 2 full-time employees. The company is formed for the purpose of entering into a merger, share exchange, asset acquisition, share purchase, recapitalization, reorganization and similar business combination with one or more businesses or entities.",Financial Services,CN,10/26/2017,Kaixin Auto Holdings,Stock,,,2.98,192740736.0,Kaixin Auto Holdings,$,0,Kaixin Auto Holdings,False,Kaixin Auto Holdings,kaixin-auto,"$900,000,000,192,740,000.00 ",,Kaixin Auto Holdings,0.0,3654,K
3654.0,391.0,KYN,Kayne Anderson MLP/Midstream Investment Company,USD,NYSE,Asset Management,"Kayne Anderson MLP/Midstream Investment Company (the Fund), formerly Kayne Anderson MLP Investment Company, is a non-diversified, closed-end management investment company. The Company's investment objective is to obtain a high after-tax total return by investing at least 85% of its total assets in energy-related master limited partnerships and their affiliates (MLPs) and in other companies that operate assets used in the gathering, transporting, processing, storing, refining, distributing, mining or marketing of natural gas, natural gas liquids, crude oil, refined petroleum products or coal. Its investments are principally in equity securities issued by MLPs, but it also may invest in debt securities of MLPs and equity/debt securities of other midstream energy companies. The Fund's investment advisor is KA Fund Advisors, LLC.",Financial Services,US,9/28/2004,Kayne Anderson MLP/Midstream Investment Co,Stock,"['Financial Services', 'Asset Management']",[],5.24,662587520.0,Kayne Anderson MLP/Midstream Investment Company,$,Kayne Anderson Energy Infrastructure Fund,Kayne Anderson Energy Infrastructure Fund,False,Kayne Anderson Energy Infrastructure Fund,kayne-anderson,"$900,000,000,662,587,000.00 ",,Kayne Anderson Energy Infrastructure Fund,0.0,3655,K
3655.0,4534.0,KZR,Kezar Life Sciences Inc,USD,NASDAQ,Biotechnology,"Kezar Life Sciences, Inc. is a clinical-stage biotechnology company, which engages in the development of novel small molecule therapeutics to treat autoimmunity and cancer in South San Francisco, California. The company is headquartered in South San Francisco, California and currently employs 24 full-time employees. The firm is engaged in developing novel small molecule therapeutics to treat autoimmune disorders, cancer, and malignant diseases. Its therapies target protein homeostasis. Its lead development program is KZR-616. KZR-616 is a selective small molecule inhibitor of the immunoproteasome. Its second program focuses on small-molecule modulators of the protein secretion pathway. Its protein secretion program is focused on the areas of oncology, inflammation and immune-oncology.",Healthcare,US,6/21/2018,Kezar Life Sciences Inc,Stock,,,5.63,260490528.0,Kezar Life Sciences Inc,$,Kezar Life Sciences,Kezar Life Sciences,False,Kezar Life Sciences,kezar-life-sciences,"$900,000,000,260,490,000.00 ",,Kezar Life Sciences,0.0,3656,K
5076.0,11394.0,KBLM,KBL Merger Corp. IV,USD,NASDAQ,Shell Companies,,Financial Services,US,,KBL Merger IV,Stock,"['Industrials', 'Conglomerates']",[],4.99,27315758.0,KBL Merger Corp. IV,$,0,KBL Merger IV,False,KBL Merger IV,kbl-merger-iv,"$90,000,000,027,315,700.00 ",,KBL Merger IV,0.0,5077,K
5077.0,4518.0,KBLMU,KBL Merger Corp IV,USD,NASDAQ,Shell Companies,"KBL Merger Corp. IV. is a blank check company. The Company is formed for the purpose of effecting merger, capital stock exchange, stock purchase, asset acquisition or other similar business combination with one or more operating businesses. The Company intend to focus on acquiring an operating company in the healthcare and related wellness industry. The Company has not generated any revenue.",Financial Services,US,6/27/2017,KBL Merger IV Unit,Stock,"['Industrials', 'Conglomerates']",[],8.38,35021948.0,KBL Merger Corp IV,$,0,KBL Merger IV Unit,False,KBL Merger IV Unit,kbl-merger-iv-unit,"$90,000,000,035,021,900.00 ",,KBL Merger IV Unit,0.0,5078,K
5078.0,10489.0,KEQU,Kewaunee Scientific Corp,USD,NASDAQ,"Furnishings, Fixtures & Appliances","Kewaunee Scientific Corp. engages in the design, manufacture, and installation of laboratory, healthcare, technical furniture, and infrastructure products. The company is headquartered in Statesville, North Carolina and currently employs 856 full-time employees. The firm's products include steel, wood and laminate furniture, fume hoods, biological safety cabinets, laminar flow and ductless hoods, adaptable modular and column systems, moveable workstations and carts, epoxy resin worksurfaces, sinks, and accessories and related design services. The company operates through two segments: Domestic and International. The Domestic business segment designs, manufactures, and installs scientific and technical furniture, including steel and wood laboratory cabinetry, fume hoods, laminate casework, flexible systems, worksurfaces, workstations, workbenches, and computer enclosures. The International business segment provides facility design, engineering, construction and project management from the planning stage through testing and commissioning of laboratories.",Consumer Cyclical,US,3/17/1980,Kewaunee Scientific,Stock,"['Industrials', 'Business Equipment', 'Industrial Products']","['MLHR', 'VIRC', 'SCS', 'HNI', 'KNL', 'KOOL']",8.51,23474920.0,Kewaunee Scientific Corp,$,0,Kewaunee Scientific,False,Kewaunee Scientific,kewaunee-scientific,"$90,000,000,023,474,900.00 ",,Kewaunee Scientific,0.0,5079,K
5079.0,703.0,KERN,Akerna Corp,USD,NASDAQ,Health Information Services,"Akerna Corp. is cannabis compliance, inventory tracking technology company. The company is headquartered in Denver, Colorado and currently employs 93 full-time employees. Its products enable cannabis businesses and government agencies across multiple industries and geographies to compliantly manage the cannabis supply chain from seed-to-sale and collect and synthesize valuable data to enable visibility and operations management at scale. The firm provides its regulatory software platform, Leaf Data Systems, to state government regulatory agencies, and its business software platform, MJ Platform, to state-licensed businesses. Its core products, Leaf Data Systems and MJ Platform, are versatile platforms that provide its clients with a central data management system for tracking regulated products from seed to initial plant growth to product throughout the complete supply chain. Its platforms also provide clients with integrated security, transparency and scalability capabilities.",Healthcare,US,2/21/2018,Akerna Corp,Stock,,,3.13,61616868.0,Akerna Corp,$,0,Akerna Corp,False,Akerna Corp,akerna,"$90,000,000,061,616,800.00 ",,Akerna Corp,0.0,5080,K
5080.0,4524.0,KFFB,Kentucky First Federal Bancorp,USD,NASDAQ,Banks Regional,"Kentucky First Federal Bancorp is a mid-tier holding company, which engages in the provision of banking products and services through its subsidiaries, First Federal Savings Bank of Frankfort, First Federal Savings, and Loan of Hazard. The company is headquartered in Hazard, Kentucky and currently employs 61 full-time employees. The firm's subsidiaries include First Federal Savings and Loan Association of Hazard (First Federal of Hazard) and Frankfort First Bancorp, Inc. (Frankfort First Bancorp). Frankfort First Bancorp has one subsidiary, First Federal Savings Bank of Kentucky, Frankfort, Kentucky (First Federal of Frankfort). The firm operates First Federal of Hazard and First Federal of Frankfort as two independent, community-oriented savings institutions. As June 30, 2016, residential mortgage loans totaled $204.5 million, construction loans totaled $2.8 million, multi-family loans totaled $15.6 million, nonresidential totaled $27.1 million, commercial non-mortgage loans totaled $1.8 million and consumer loan balance totaled $8.6 million. As of June 30, 2016, First Federal of Hazard and First Federal of Frankfort were authorized to invest up to $2.2 million and $6.9 million, respectively, in the stock of or loans to subsidiaries.",Financial Services,US,3/3/2005,Kentucky First Federal Bancorp,Stock,"['Financial Services', 'Savings & Cooperative Banks', 'Banks']","['HFBC', 'HBCP', 'PBSK']",6.26,51658900.0,Kentucky First Federal Bancorp,$,Kentucky First Federal Bancorp,Kentucky First Federal Bancorp,False,Kentucky First Federal Bancorp,kentucky-first,"$90,000,000,051,658,900.00 ",,Kentucky First Federal Bancorp,0.0,5081,K
5081.0,8131.0,KFS,Kingsway Financial Services Inc,USD,NYSE,Auto & Truck Dealerships,"Kingsway Financial Services, Inc. is a holding company, which engages in the provision of financial services. The company is headquartered in Itasca, Illinois and currently employs 309 full-time employees. The firm owns or operates subsidiaries in the extended warranty, asset management and real estate industries. The company operates through two segments: Extended Warranty and Leased Real Estate. Its Extended Warranty segment includes the operations of its subsidiaries, such as IWS Acquisition Corporation's (IWS), Trinity Warranty Solutions LLC's and Professional Warranty Service Corporation. Leased Real Estate includes the Company's subsidiary, CMC Industries, Inc. (CMC). IWS is a licensed motor vehicle service agreement company and is a provider of after-market vehicle protection services distributed by credit unions in 23 states and the District of Columbia to their members. CMC owns a parcel of real property consisting of approximately 192 acres located in the State of Texas (the Real Property) that is leased to a third party.",Consumer Cyclical,US,7/11/2001,Kingsway Financial Services,Stock,"['Financial Services', 'Insurance - Property & Casualty']","['ALL', 'MCY', 'PGR', 'AFH']",3.2,72675520.0,Kingsway Financial Services Inc,$,0,Kingsway Financial Services,False,Kingsway Financial Services,kingsway-financial,"$90,000,000,072,675,500.00 ",,Kingsway Financial Services,0.0,5082,K
5082.0,8743.0,KINS,Kingstone Companies Inc,USD,NASDAQ,Insurance Property & Casualty,"Kingstone Cos., Inc. operates as a holding company, which engages in the provision of property and casualty insurance policies to individuals and small businesses through its wholly owned subsidiary, Kingstone Insurance Company. The company is headquartered in Kingston, New York and currently employs 101 full-time employees. The firm offers these products through its subsidiary, Kingstone Insurance Company (KICO). KICO is a licensed property and casualty insurance company. The firm operates through property and casualty insurances segment, which offers a range of property and casualty policies to its producers. The firm underwrites its business utilizing the CLUE industry claims database, insurance scoring reports, physical inspection of risks and other individual risk underwriting tools. The company writes homeowners and dwelling fire business in New York City and Long Island. The firm's product lines include personal lines, commercial liability, commercial automobile, livery physical damage and other. Its personal lines consist of homeowners, dwelling fire, renters, equipment breakdown and service line endorsements and personal umbrella policies.",Financial Services,US,4/11/1994,Kingstone Companies,Stock,"['Financial Services', 'Insurance Brokers', 'Brokers & Exchanges']","['ERIE', 'STFC', 'DGICA', 'ALL', 'MKL', 'RLI', 'WTM']",6.09,65011968.0,Kingstone Companies Inc,$,Kingstone,Kingstone,False,Kingstone,kingstone,"$90,000,000,065,011,900.00 ",,Kingstone,0.0,5083,K
5083.0,4556.0,KLXE,KLX Energy Services Holdings Inc,USD,NASDAQ,Oil & Gas Equipment & Services,"KLX Energy Services Holdings, Inc. engages in the provision of completion, intervention and production services and products to onshore oil and gas producing regions. The company is headquartered in Wellington Florida, Florida and currently employs 1,400 full-time employees. The firm operates in three segments determined on a geographic basis: the Southwest Region (the Permian Basin and Eagle Ford Shale), the Rocky Mountains Region (the Bakken formation, Williston, DJ, Uinta and Piceance Basins and Niobrara Shale) and the Northeast Region (the Marcellus and Utica Shales as well as the Mid-Continent STACK and SCOOP and Haynesville). The firm offers a range of differentiated, complementary technical services and related tools and equipment. The firm serve range of companies engaged in the exploration and development of North American onshore conventional and unconventional oil and natural gas reserves.",Energy,US,8/29/2018,KLX Energy Services Holdings Inc,Stock,,,4.87,40915304.0,KLX Energy Services Holdings Inc,$,KLX Energy,KLX Energy,False,KLX Energy,klx-energy,"$90,000,000,040,915,300.00 ",,KLX Energy,0.0,5084,K
5084.0,9764.0,KMPH,KemPharm Inc,USD,NASDAQ,Biotechnology,"KemPharm, Inc. is a clinical-stage specialty pharmaceutical company, which engages in the discovery and development of proprietary prodrugs. The company is headquartered in Celebration, Florida and currently employs 33 full-time employees. The firm is engaged in the discovery and development of prodrugs. The firm uses its Ligand Activated Therapy (LAT) platform technology to create prodrugs. The firm's product candidate, KP201/APAP, consists of KP201, its prodrug of hydrocodone, which is combined with acetaminophen (APAP). The firm is developing KP201/APAP as an immediate release (IR), a product candidate for the short-term, or no longer than 14 days for the management of acute pain. The firm has designed KP201/APAP with abuse-deterrent properties to address the epidemic of opioid abuse in the United States. The firm also focuses on developing the pipeline of additional prodrug product candidates that targets pain and attention deficit hyperactivity disorder (ADHD). The firm's products include KP201/IR (APAP-free), KP511/ER, KP415, KP606/IR and KP746.",Healthcare,US,4/16/2015,KemPharm,Stock,"['Healthcare', 'Biotechnology']","['JAZZ', 'AGRX', 'TBPH', 'COLL', 'XLV']",0.59165,42921132.0,KemPharm Inc,$,0,KemPharm,False,KemPharm,kempharm,"$90,000,000,042,921,100.00 ",,KemPharm,0.0,5085,K
5085.0,4544.0,KONE,Kingtone Wirelessinfo Solution Holding Ltd,USD,NASDAQ,Communication Services,,Communication Services,,,Kingtone Wirelessinfo Solution Holding Ltd,Stock,,,7.33,10298650.0,Kingtone Wirelessinfo Solution Holding Ltd,$,0,Kingtone Wirelessinfo Solution Holding Ltd,False,Kingtone Wirelessinfo Solution Holding ,kingtone-wirelessinfo,"$90,000,000,010,298,600.00 ",,Kingtone Wirelessinfo Solution Holding,1.0,5086,K
5086.0,10518.0,KOOL,Cesca Therapeutics Inc.,USD,NASDAQ,Medical Devices,,Healthcare,,,Cesca Therapeutics,Stock,"['Healthcare', 'Medical Devices']","['CERS', 'KEQU', 'HAE', 'SYK', 'XLV']",2.81,51739987.0,Cesca Therapeutics Inc.,$,0,Cesca Therapeutics,False,Cesca Therapeutics,cesca-therapeutics,"$90,000,000,051,739,900.00 ",,Cesca Therapeutics,0.0,5087,K
5087.0,11249.0,KOSS,Koss Corp,USD,NASDAQ,Consumer Electronics,"Koss Corp. engages in the design, manufacture, and sale of stereo headphones and accessories. The company is headquartered in Milwaukee, Wisconsin and currently employs 54 full-time employees. The firm operates in the audio/video industry segment of the home entertainment industry. The company markets a line of headphones, wireless Bluetooth headphones, wireless Bluetooth speakers, computer headsets, telecommunications headsets, active noise canceling headphones, and compact disc recordings of American Symphony Orchestras on the Koss Classics label. The company markets products used by consumers to listen to music, digital versatile discs (DVDs) in vehicles, sound bytes on computer systems, and other audio related media. The firm's products are sold through retailers, distributors, audio specialty stores, the Internet, direct mail catalogs, regional department store chains, discount department stores, grocery stores, electronics retailers, military exchanges and prisons. The company has a manufacturing facility in Milwaukee, Wisconsin. Koss U.K. Limited is its subsidiary.",Technology,US,3/17/1980,Koss,Stock,"['Technology', 'Consumer Electronics', 'Computer Hardware']","['UEIC', 'IIN', 'LRAD', 'MSN', 'VOXX', 'XLK']",2.12,15698239.0,Koss Corp,$,0,Koss,False,Koss,koss,"$90,000,000,015,698,200.00 ",,Koss,0.0,5088,K
5088.0,10933.0,KTCC,Key Tronic Corp,USD,NASDAQ,Computer Hardware,"Key Tronic Corp. engages in the provision of electronics manufacturing services. The company is headquartered in Spokane Valley, Washington and currently employs 4,067 full-time employees. The firm provides electronic manufacturing services (EMS) and solutions to original equipment manufacturers (OEMs) of a range of products. The firm provides engineering services, procurement and distribution, materials management, manufacturing and assembly services, in-house testing, and customer service. The firm provides EMS services, such as product design, surface mount technologies (SMT) and pin through hole capability for printed circuit board assembly (PCBA), tool making, precision plastic molding, sheet metal fabrication, liquid injection molding, complex assembly, automated tape winding, prototype design and full product assembly. The firm's manufacturing operations are located in Oakdale, Minnesota; Fayetteville, Arkansas; Corinth, Mississippi; Harrodsburg, Kentucky, and foreign manufacturing operations in Juarez, Mexico, and Shanghai, China.",Technology,US,6/23/1983,Key Tronic,Stock,"['Technology', 'Computer Systems', 'Computer Hardware']","['NSYS', 'SGMA', 'MRCY', 'PLXS', 'IMMR', 'IEC', 'JBL', 'BHE', 'SANM', 'XLK']",7.6,81773720.0,Key Tronic Corp,$,0,Key Tronic,False,Key Tronic,key-tronic,"$90,000,000,081,773,700.00 ",,Key Tronic,0.0,5089,K
5089.0,10845.0,KTOV,Kitov Pharma Ltd.,USD,NASDAQ,Biotechnology,,Healthcare,IE,,Kitov Pharma,Stock,"['Healthcare', 'Biotechnology']",['XLV'],4.35,74768672.0,Kitov Pharma Ltd.,$,0,Kitov Pharma,False,Kitov Pharma,kitov-pharma,"$90,000,000,074,768,600.00 ",,Kitov Pharma,0.0,5090,K
5090.0,11482.0,KZIA,Kazia Therapeutics Limited,USD,NASDAQ,Biotechnology,,Healthcare,AU,,Kazia Therapeutics,Stock,"['Healthcare', 'Biotechnology']","['ADM', 'PRAN', 'XLV']",6.61,64243384.0,Kazia Therapeutics Limited,$,0,Kazia Therapeutics,False,Kazia Therapeutics,kazia-therapeutics,"$90,000,000,064,243,300.00 ",,Kazia Therapeutics,0.0,5091,K
