Unnamed: 0,index,symbol,long name,currency,exchange,industry,description,sector,country,ipo date,shorter name,Type,Industries,Similar Companies,price,mktCap,name raw,currency symbol,robinhood name,short name,Warrant,shortest name,url name, smart_order ,random csv equations,pure name,shortest - pure diff,first_letter
,,3816.HK,KFM Kingdom Holdings Ltd,HKD,HKSE,Capital Goods,"KFM Kingdom Holdings Limited, an investment holding company, manufactures and sells precision metal stamping and metal lathing products in the People's Republic of China, North America, Europe, Japan, Singapore, and internationally. It also manufactures and sells fine metal products; sells and rents kiosks; manufactures and trades in senor products; trades in medical products; and provides management services. In addition, the company offers integrated services, including design engineering solutions; prototyping, computer numerical control (CNC) laser cutting, CNC tooling design and tooling mold design, and lathing or machining parts; hard tooling and soft tooling services; secondary processing services comprising laser welding or robotic argon welding, riveting, tapping, drilling, polishing, sand blasting, etc.; and post-treatment processing services, such as silk screening printing, heat treatment, plating, coating, etc., as well as product assembly and quality testing services. Additionally, it provides packaging solutions. It serves medical and test equipment, finance equipment, consumer electronics, network/data storage, and office automation industries. The company was founded in 1987 and is headquartered in Tsuen Wan, Hong Kong. KFM Kingdom Holdings Limited is a subsidiary of Massive Force Limited.",Machinery,HK,10/15/2012,KFM Kingdom Holdings Ltd,,,,0.21,126000000.0,KFM Kingdom Holdings Ltd,HKD,KFM Kingdom Holdings Ltd,KFM Kingdom Holdings Ltd,,KFM Kingdom Holdings Ltd,3816.hk,,,KFM Kingdom Holdings Ltd,,3
,,3818.HK,China Dongxiang (Group) Co Ltd,HKD,HKSE,Consumer Durables & Apparel,"China Dongxiang (Group) Co., Ltd., together with its subsidiaries, designs, develops, markets, and sells sport-related apparel, footwear, and accessories in the People's Republic of China, Japan, and internationally. The company offers its products under the Kappa, Phenix, X-NIX, and INHABITANT brands. It is also involved in the retail sale of sportswear through a network of retail shops and outlets, as well as online. In addition, the company invests in various financial assets and treasury products issued by commercial banks; and designs, purchases, and sells children's clothing products, as well as engages in the import and export, and purchasing and selling of company activities. As of March 31, 2020, it had 1,372 Kappa retail stores, including 243 Kappa Kid's stores. China Dongxiang (Group) Co., Ltd. was founded in 2002 and is headquartered in Beijing, the People's Republic of China.","Textiles, Apparel & Luxury Goods",CN,10/10/2007,China Dongxiang (Group) Co Ltd,,,,0.9,5297507800.0,China Dongxiang (Group) Co Ltd,HKD,China Dongxiang (Group) Co Ltd,China Dongxiang (Group) Co Ltd,,China Dongxiang (Group) Co Ltd,3818.hk,,,China Dongxiang (Group) Co Ltd,,3
,,3822.HK,Sam Woo Construction Group Ltd,HKD,HKSE,Capital Goods,"Sam Woo Construction Group Limited, an investment holding company, primarily provides foundation works and ancillary services in Hong Kong. The company undertakes the construction of bored piles and rock socketed H-piles; and excavation and lateral support works. It is also involved in the site investigation and removal of installed piles businesses; and trading and leasing of machinery and equipment. The company was incorporated in 2012 and is headquartered in Tsim Sha Tsui, Hong Kong. Sam Woo Construction Group Limited is a subsidiary of Actiease Assets Limited.",Construction,HK,10/16/2014,Sam Woo Construction Group Ltd,,,,0.1,168000000.0,Sam Woo Construction Group Ltd,HKD,Sam Woo Construction Group Ltd,Sam Woo Construction Group Ltd,,Sam Woo Construction Group Ltd,3822.hk,,,Sam Woo Construction Group Ltd,,3
,,3828.HK,Ming Fai International Holdings Ltd,HKD,HKSE,Household & Personal Products,"Ming Fai International Holdings Limited, an investment holding company, manufactures and trades in hospitality supplies and trades in operating supplies and equipment. The company operates through Hospitality Supplies Business, Operating Supplies and Equipment Business, and Others segments. It provides bath mats, acrylic hotel supplies, leather and resin collections, cables, umbrellas, compact mirrors, and other guest room collections; and safe deposit boxes, digital bathroom scales, flashlights, mini refrigerators, electric kettles, telephones, hairdryers/irons, digital clocks, and other electronic supplies. The company also offers lobby supplies comprising message boards and signs, luggage and housekeeping carts, hotel railing stands, ashtrays, outdoor trushbins, podiums, umbrella and luggage stands, garment and hat stands, beverage carts, signage and equipment, and others; and janitorial supplies, such as cleaning equipment and tools, trash bins, cleaning detergents, and others. In addition, it provides glassware products; kitchenware products consisting of Western kitchen and tableware, knife and forks, buffet collections, and kitchen appliances; melamine tableware; child care cribs; dispenser and bath products; and towels, beddings, table linens, shoes, bathrobes, accessories, and mattresses. Further, the company offers ceramic collections, plates, bowls, ceramic soup tureen, coffee and tea porcelain, color glazed porcelain, Japan and Korea porcelain, sand and stone pots, coarse pottery, and other ceramic and porcelain products. It operates in North America, Europe, the People's Republic of China, Australia, other Asia Pacific regions, and internationally. The company was incorporated in 2007 and is headquartered in Tsuen Wan, Hong Kong.",Consumer products,HK,11/2/2007,Ming Fai International Holdings Ltd,,,,0.71,521326688.0,Ming Fai International Holdings Ltd,HKD,Ming Fai International Holdings Ltd,Ming Fai International Holdings Ltd,,Ming Fai International Holdings Ltd,3828.hk,,,Ming Fai International Holdings Ltd,,3
,,3830.HK,Kiddieland International Ltd,HKD,HKSE,Consumer Durables & Apparel,"Kiddieland International Limited, an investment holding company, manufactures, sells, imports, and exports plastic toy products targeting the toddlers' age group in the United States, Europe, the Asia Pacific and Oceania, and Africa. The company operates in two segments, Outdoor-and-Sports Toy and Infant-and-Preschool Toy. The Outdoor-and-Sports Toy segment manufactures and distributes ride-ons, rockers, trikes, scooters, and walkers. The Infant-and-Preschool Toy segment manufactures and distributes interactive playsets, activity toys, musical toys, and action vehicles. The company also provides design services for various graphic design requirements in production of toys, as well as merchandises production materials for toys. Kiddieland International Limited was founded in 1998 and is headquartered in Central, Hong Kong.",Leisure Products,HK,9/21/2017,Kiddieland International Ltd,,,,0.2,200000000.0,Kiddieland International Ltd,HKD,Kiddieland International Ltd,Kiddieland International Ltd,,Kiddieland International Ltd,3830.hk,,,Kiddieland International Ltd,,3
,,3833.HK,Xinjiang Xinxin Mining Industry Co Ltd,HKD,HKSE,Materials,"Xinjiang Xinxin Mining Industry Co., Ltd., together with its subsidiaries, engages in mining, ore processing, smelting, refining, and selling nickel, copper, and other nonferrous metals. It provides nickel cathode, as well as other products, including copper cathode, cobalt products, gold, silver, platinum, and palladium. The company holds a 100% interest in the Kalatongke nickel-copper mine located in Fuyun County, Xinjiang; and the Huangshandong, Huangshan, and Xiangshan nickel-copper mines situated in Hami, Xinjiang. It also has interests in two vanadium mines located in Shangnan, Shaanxi. Xinjiang Xinxin Mining Industry Co., Ltd. was founded in 1950 and is based in Urumqi, the People's Republic of China.",Metals & Mining,CN,10/12/2007,Xinjiang Xinxin Mining Industry Co Ltd,,,,0.77,1701699840.0,Xinjiang Xinxin Mining Industry Co Ltd,HKD,Xinjiang Xinxin Mining Industry Co Ltd,Xinjiang Xinxin Mining Industry Co Ltd,,Xinjiang Xinxin Mining Industry Co Ltd,3833.hk,,,Xinjiang Xinxin Mining Industry Co Ltd,,3
,,3836.HK,China Harmony Auto Holding Ltd,HKD,HKSE,Retailing,"China Harmony Auto Holding Limited, an investment holding company, engages in the sale and service of motor vehicles in Mainland China. The company sells luxury and ultra-luxury passenger vehicles under the BMW, MINI, Audi, Volvo, Land Rover, Lexus, Jaguar, Lincoln, Zinoro, Alfa Romeo, Rolls Royce, Bentley, Ferrari, and Maserati brands through its 72 dealership outlets. It also offers finance leasing; sells pre-owned motor vehicles, as well as imports vehicles; and offers insurance agency services. The company was formerly known as China Harmony New Energy Auto Holding Limited and changed its name to China Harmony Auto Holding Limited in July 2020. China Harmony Auto Holding Limited was founded in 2002 and is headquartered in Zhengzhou, the People's Republic of China.",Retail,CN,6/13/2013,China Harmony Auto Holding Ltd,,,,3.46,5454413300.0,China Harmony Auto Holding Ltd,HKD,China Harmony Auto Holding Ltd,China Harmony Auto Holding Ltd,,China Harmony Auto Holding Ltd,3836.hk,,,China Harmony Auto Holding Ltd,,3
,,3838.HK,China Starch Holdings Ltd,HKD,HKSE,"Food, Beverage & Tobacco","China Starch Holdings Limited, an investment holding company, manufactures and sells cornstarch, lysine, starch-based sweetener, modified starch, and ancillary corn-based and corn-refined products in the People's Republic of China. The company operates through two segments, Upstream Products, and Fermented and Downstream Products. It also researches, develops, manufactures, and sells food additives, feeds, amino acids, and related products; and glucose, maltose, dextrin, animal feed additives, food-grade enzymes, biobased materials, and related products. The company was incorporated in 2006 and is headquartered in Causeway Bay, Hong Kong. China Starch Holdings Limited is a subsidiary of Merry Boom Group Limited.",Food Products,HK,9/27/2007,China Starch Holdings Ltd,,,,0.171,1024996220.0,China Starch Holdings Ltd,HKD,China Starch Holdings Ltd,China Starch Holdings Ltd,,China Starch Holdings Ltd,3838.hk,,,China Starch Holdings Ltd,,3
,,3839.HK,Chia Tai Enterprises International Ltd,HKD,HKSE,"Food, Beverage & Tobacco","Chia Tai Enterprises International Limited manufactures and sells chlortetracycline (CTC) products in Mainland China, the Asia Pacific, North America, Europe, and internationally. It operates through two segments, Biochemical and Industrial. The Biochemical segment manufactures and sells CTC premix and CTC hydrochloride products, which are used as feed additives to promote growth of livestock, prevent or cure animal diseases, and enhance feed efficiency under the Shihao and Citifac brands. The Industrial segment engages in the sale, leasing, and servicing of caterpillar machinery equipment, including excavators, power generators, bulldozers, and compactors, as well as spare parts; and manufacture and sale of carburetors and automotive parts for automobile and motorcycle manufacturers. The company is based in Central, Hong Kong. Chia Tai Enterprises International Limited is a subsidiary of Charoen Pokphand Foods Public Company Limited.",Food Products,HK,7/3/2015,Chia Tai Enterprises International Ltd,,,,1.4,337005184.0,Chia Tai Enterprises International Ltd,HKD,Chia Tai Enterprises International Ltd,Chia Tai Enterprises International Ltd,,Chia Tai Enterprises International Ltd,3839.hk,,,Chia Tai Enterprises International Ltd,,3
,,3848.HK,Wealthy Way Group Ltd,HKD,HKSE,Diversified Financials,"Wealthy Way Group Limited, an investment holding company, provides financial leasing, factoring, and advisory services to individual and companies in the People's Republic of China and Hong Kong. The company operates through Money Lending and Securities Dealing segments. It offers small loans and related loan facilitation, asset management, investment management and advisory, and securities dealing and broking, as well as money lending services. The company also offers sale-leaseback services. It serves airline companies, health care service providers, and energy saving equipment providers. The company was founded in 2012 and is headquartered in Wanchai, Hong Kong. Wealthy Way Group Limited is a subsidiary of Wealthy Rise Investment Limited.",Financial Services,HK,7/21/2017,Wealthy Way Group Ltd,,,,7.46,1160201600.0,Wealthy Way Group Ltd,HKD,Wealthy Way Group Ltd,Wealthy Way Group Ltd,,Wealthy Way Group Ltd,3848.hk,,,Wealthy Way Group Ltd,,3
,,3860.HK,Speed Apparel Holding Ltd,HKD,HKSE,Consumer Durables & Apparel,"Speed Apparel Holding Limited operates as an apparel supply chain management services provider in Japan, the United States, Europe, Hong Kong, and internationally. The company offers knitwear products comprising women's wear, men's wear, and kid's wear; and apparel supply chain management solutions for its customers ranging from fashion trend analysis, product design and development, sourcing and procurement of materials, production management, quality control, and logistics services. It also provides design and customers account services. It serves owners or sourcing agents of apparel retail brands. The company was founded in 1999 and is headquartered in Hung Hom, Hong Kong. Speed Apparel Holding Limited is a subsidiary of Speed Development Co. Ltd.","Textiles, Apparel & Luxury Goods",HK,5/31/2017,Speed Apparel Holding Ltd,,,,0.53,264999984.0,Speed Apparel Holding Ltd,HKD,Speed Apparel Holding Ltd,Speed Apparel Holding Ltd,,Speed Apparel Holding Ltd,3860.hk,,,Speed Apparel Holding Ltd,,3
,,3868.HK,Xinyi Energy Holdings Ltd,HKD,HKSE,Utilities,"Xinyi Energy Holdings Limited, an investment holding company, owns, operates, and manages solar farms in the People's Republic of China. The company operates approximately 15 solar farms with an installed capacity of 1,494 megawatts. It sells electricity to the State grid companies. The company was incorporated in 2015 and is based in Wuhu, the People's Republic of China. Xinyi Energy Holdings Limited is a subsidiary of Xinyi Solar Holdings Limited.",Utilities,CN,5/28/2019,Xinyi Energy Holdings Ltd,,,,5.36,38109602000.0,Xinyi Energy Holdings Ltd,HKD,Xinyi Energy Holdings Ltd,Xinyi Energy Holdings Ltd,,Xinyi Energy Holdings Ltd,3868.hk,,,Xinyi Energy Holdings Ltd,,3
,,3869.HK,Hospital Corporation of China Ltd,HKD,HKSE,Health Care Equipment & Services,"Hospital Corporation of China Limited, an investment holding company, engages in the operation and management of hospitals in the People's Republic of China. It offers hospital management and consulting services to Yangsi Hospital, Cixi Hospital, and Jinhua Hospital; and general hospital services. The company also engages in the wholesale of pharmaceutical products. The company was founded in 2014 and is headquartered in Beijing, the People's Republic of China. Hospital Corporation of China Limited is a subsidiary of Vanguard Glory Limited.",Health Care,CN,3/16/2017,Hospital Corporation of China Ltd,,,,10.0,1381939970.0,Hospital Corporation of China Ltd,HKD,Hospital Corporation of China Ltd,Hospital Corporation of China Ltd,,Hospital Corporation of China Ltd,3869.hk,,,Hospital Corporation of China Ltd,,3
,,3877.HK,CSSC Hong Kong Shipping Co Ltd,HKD,HKSE,Diversified Financials,"CSSC (Hong Kong) Shipping Company Limited operates as a shipyard-affiliated leasing company in People Republic of China, Asia, the United States, and Europe. It operates through Leasing Services, Shipbroking Services, and Loan Borrowings segments. The company provides leasing services, such as finance and operating lease. It also offers shipbroking services; and loan services comprising pre-delivery loan, secured loan, and factoring services. As of December 31, 2019, the company had 117 vessels, including 81 vessels were operating and 36 vessels were under construction. The company was founded in 2012 and is headquartered in Central, Hong Kong.",Financial Services,HK,6/17/2019,CSSC Hong Kong Shipping Co Ltd,,,,1.16,7117841400.0,CSSC Hong Kong Shipping Co Ltd,HKD,CSSC Hong Kong Shipping Co Ltd,CSSC Hong Kong Shipping Co Ltd,,CSSC Hong Kong Shipping Co Ltd,3877.hk,,,CSSC Hong Kong Shipping Co Ltd,,3
,,3878.HK,Vicon Holdings Ltd,HKD,HKSE,Capital Goods,"Vicon Holdings Limited, an investment holding company, provides foundation works and related services in Hong Kong and Macau. The company undertakes piling construction, ELS, and pile cap construction works, as well as general building works. It serves property developers, and project owners and their contractors, as well as public sectors. Vicon Holdings Limited was incorporated in 2016 and is headquartered in Cheung Sha Wan, Hong Kong.",Construction,HK,12/22/2017,Vicon Holdings Ltd,,,,0.26,104000000.0,Vicon Holdings Ltd,HKD,Vicon Holdings Ltd,Vicon Holdings Ltd,,Vicon Holdings Ltd,3878.hk,,,Vicon Holdings Ltd,,3
,,3882.HK,SKY Light Holdings Ltd,HKD,HKSE,Consumer Durables & Apparel,"Sky Light Holdings Limited, an investment holding company, develops, manufactures, and distributes home surveillance cameras, 360-degree cameras, and other digital imaging products for the home surveillance camera industry. The company operates in two segments, ODM/JDM and ION360. It offers digital imaging products, such as 360 VR, dash, body worn, and action cameras; and home imaging products, including smart IP cameras, video doorbells, and smart baby monitors, as well as facial recognition, baby sleep care, baby smile detection, and people detection and route tracking solutions. The company also provides joint design manufacturing (JDM) and original design manufacturing (ODM) solutions. It operates in Mainland China, the European Union, Hong Kong, and internationally. Sky Light Holdings Limited was founded in 2000 and is headquartered in Shenzhen, the People's Republic of China.",Consumer products,CN,7/2/2015,SKY Light Holdings Ltd,,,,0.205,195311488.0,SKY Light Holdings Ltd,HKD,SKY Light Holdings Ltd,SKY Light Holdings Ltd,,SKY Light Holdings Ltd,3882.hk,,,SKY Light Holdings Ltd,,3
,,3883.HK,China Aoyuan Group Ltd,HKD,HKSE,Real Estate,"China Aoyuan Group Limited engages in the development of commercial real estate properties in Mainland China, Hong Kong, Australia, and Canada. The company operates through Property Development, Property Investment, and Others segments. It also acquires and develops various real estate projects; and develops and operates cultural tourism, hotel management, sports development, and healthy resort projects. In addition, the company imports and export goods, such as maternal and child care products, cosmetics and skin care products, clothing and bags, food and beverages, household goods, and parallel imported vehicles. Further, it provides medical service platform combining online and offline services; consultancy services; construction services; and financing services. The company was formerly known as China Aoyuan Property Group Limited and changed its name to China Aoyuan Group Limited in November 2018. China Aoyuan Group Limited was founded in 1996 and is headquartered in Guangzhou, the People's Republic of China. The company is a subsidiary of Ace Rise Profits.",Real Estate,CN,10/9/2007,China Aoyuan Group Ltd,,,,7.15,19275542500.0,China Aoyuan Group Ltd,HKD,China Aoyuan Group Ltd,China Aoyuan Group Ltd,,China Aoyuan Group Ltd,3883.hk,,,China Aoyuan Group Ltd,,3
,,3888.HK,Kingsoft Corp Ltd,HKD,HKSE,Software & Services,"Kingsoft Corporation Limited, an investment holding company, operates as a software and Internet service company in Mainland China, Hong Kong, and internationally. It operates through three segments: Entertainment Software; Cloud Services; and Office Software and Services and Others. The Entertainment Software segment engages in the research and development of games; and provision of online games, mobile games, and casual game services. The Cloud Services segment provides cloud computing, storage and delivery, and comprehensive cloud-based solutions. The Office Software and Services and Others segment designs, researches and develops, sells, and markets office software products and services of WPS Office. It also engages in the operation and distribution of games; marketing and operation of SMS, and wireless service of online games and application software; sale and operation of office application software; marketing and operation of entertainment software products; and research, development, and distribution of consumer application software. Kingsoft Corporation Limited was founded in 1988 and is based in Beijing, the People's Republic of China.",Technology,CN,10/9/2007,Kingsoft Corp Ltd,,,,77.7,106000000000.0,Kingsoft Corp Ltd,HKD,Kingsoft Corp Ltd,Kingsoft Corp Ltd,,Kingsoft Corp Ltd,3888.hk,,,Kingsoft Corp Ltd,,3
,,3889.HK,GLOBAL Sweeteners Holdings Ltd,HKD,HKSE,"Food, Beverage & Tobacco","Global Sweeteners Holdings Limited, an investment holding company, manufactures and sells corn refined products and corn sweeteners in the People's Republic of China and internationally. It operates in two segments: Corn Refined Products and Corn Sweeteners. The Corn Refined Products segment manufactures and sells corn starch, gluten meal, corn oil, and other corn refined products. The Corn Sweeteners segment manufactures and sells glucose, maltose, and high fructose corn syrups, as well as maltodextrin, a corn syrup solid. The company also offers general administration services. It serves customers in various sectors, such as food and beverage, confectionary, daily products, fermentation, and chemical industries, as well as cosmetics and pharmaceutical industries. The company was founded in 1998 and is headquartered in Tsim Sha Tsui, Hong Kong. Global Sweeteners Holdings Limited is a subsidiary of Global Corn Bio-chem Technology Company Limited.",Food Products,HK,9/20/2007,GLOBAL Sweeteners Holdings Ltd,,,,0.13,198586688.0,GLOBAL Sweeteners Holdings Ltd,HKD,GLOBAL Sweeteners Holdings Ltd,GLOBAL Sweeteners Holdings Ltd,,GLOBAL Sweeteners Holdings Ltd,3889.hk,,,GLOBAL Sweeteners Holdings Ltd,,3
,,3893.HK,CROSSTEC Group Holdings Ltd,HKD,HKSE,Consumer Services,"Crosstec Group Holdings Limited, an investment holding company, provides various interior design solutions for jewelry and fashion brand retail stores in the People's Republic of China, the United States, Europe, the Middle East, and other Asian countries. Its interior design solutions include fit-out construction services, millworks provision, facade development and fabrication services, maintenance and interior solutions, and design and project consultancy services. The company also offers labour and management services; marketing and liaising services to the inter-group companies; and trades in millworks and furniture, and facade fabrication products. Crosstec Group Holdings Limited was founded in 1999 and is headquartered in North Point, Hong Kong. Crosstec Group Holdings Limited is a subsidiary of CGH (BVI) Limited.",Diversified Consumer Services,HK,9/12/2016,CROSSTEC Group Holdings Ltd,,,,0.19,136800000.0,CROSSTEC Group Holdings Ltd,HKD,CROSSTEC Group Holdings Ltd,CROSSTEC Group Holdings Ltd,,CROSSTEC Group Holdings Ltd,3893.hk,,,CROSSTEC Group Holdings Ltd,,3
,,3898.HK,Zhuzhou CRRC Times Electric Co Ltd,HKD,HKSE,Capital Goods,"Zhuzhou CRRC Times Electric Co., Ltd., together with its subsidiaries, manufactures and sells train-borne electrical systems and electrical components primarily in Mainland China and internationally. The company researches, develops, manufactures, and sells locomotive train power converters, control systems, urban railway train electrical systems, and other train-borne electrical systems; and electric components for the railway industry, urban railway industry, and non-railway purposes. Its products for rolling stock and railways include EMU, locomotive, and mass transit systems; and components products consist of semiconductors, resistors, reactors, radiators, sensors, power capacitors, heatsinks, and oil dampers. The company's energy and industrial products comprise marine engineering, electric vehicle, and inverter and converter systems, as well as provides railway maintenance and construction machines. The company was formerly known as Zhuzhou CSR Times Electric Co., Ltd. and changed its name to Zhuzhou CRRC Times Electric Co., Ltd. in March 2016. The company was founded in 2005 and is based in Wanchai, Hong Kong. Zhuzhou CRRC Times Electric Co., Ltd. is a subsidiary of CRRC Zhuzhou Institute Co., Ltd.",Electrical Equipment,CN,12/20/2006,Zhuzhou CRRC Times Electric Co Ltd,,,,36.7,43140121000.0,Zhuzhou CRRC Times Electric Co Ltd,HKD,Zhuzhou CRRC Times Electric Co Ltd,Zhuzhou CRRC Times Electric Co Ltd,,Zhuzhou CRRC Times Electric Co Ltd,3898.hk,,,Zhuzhou CRRC Times Electric Co Ltd,,3
