Unnamed: 0,index,symbol,long name,currency,exchange,industry,description,sector,country,ipo date,shorter name,Type,Industries,Similar Companies,price,mktCap,name raw,currency symbol,robinhood name,short name,Warrant,shortest name,url name, smart_order ,random csv equations,pure name,shortest - pure diff,first_letter
,,8120.HK,China Demeter Financial Investments Ltd,HKD,HKSE,"Food, Beverage & Tobacco","China Demeter Financial Investments Limited, an investment holding company, engages in the development, manufacturing, and distribution of feedstock products in the People's Republic of China. The company operates through Agricultural, Money Lending, Financial Services, Securities Investment, Food and Beverage, Alcoholic Beverage Distribution, and Children education segments. It offers loan financing services to individuals and companies; advises and deals in securities; provides asset management services; and invests in listed and unlisted securities. In addition, the company distributes craft beer in Hong Kong and the Peoples Republic of China; and operates twelve restaurants in Hong Kong and Singapore. Additionally, it offers kindergarten and pre-school education services, as well as operates child care center. The company was formerly known as China Demeter Investments Limited and changed its name to China Demeter Financial Investments Limited in December 2016. China Demeter Financial Investments Limited was incorporated in 2000 and is headquartered in Central, Hong Kong.",Food Products,HK,4/10/2001,China Demeter Financial Investments Ltd,,,,0.159,24331608.0,China Demeter Financial Investments Ltd,HKD,China Demeter Financial Investments Ltd,China Demeter Financial Investments Ltd,,China Demeter Financial Investments Ltd,8120.hk,,,China Demeter Financial Investments Ltd,,8
,,8121.HK,Guru Online (Holdings) Ltd,HKD,HKSE,Media & Entertainment,"Guru Online (Holdings) Limited, an investment holding company, provides integrated digital marketing services in Hong Kong and the People's Republic of China. The company operates through Digital Advertisement Placement Services, Social Media Management Services, and Creative and Technology Services segments. It offers advertisement placement services through digital media; and set-up, maintenance, and monitor services on corporate profile pages through the social media platforms, as well as operates internet marketing platform for the travel industry. The company is also involved in the design and copywriting of digital advertisements; production of corporate profile pages, and website and apps, as well as provision of related consultancy services; and provision of marketing services. Guru Online (Holdings) Limited was founded in 2007 and is headquartered in Kwun Tong, Hong Kong.",Media,HK,5/29/2015,Guru Online (Holdings) Ltd,,,,0.021,35011200.0,Guru Online (Holdings) Ltd,HKD,Guru Online (Holdings) Ltd,Guru Online (Holdings) Ltd,,Guru Online (Holdings) Ltd,8121.hk,,,Guru Online (Holdings) Ltd,,8
,,8123.HK,Sinofortune Financial Holdings Ltd,HKD,HKSE,Retailing,"Sinofortune Financial Holdings Ltd. is an investment holding company, which engages in the provision of financial services. The company employs 101 full-time employees Along with subsidiaries, it operates its business through six segments: the Sales of Motor Vehicles and Provision of Agency Services segment, the Trading of Electronic Student Cards and School Safety Products segment, the Brokerage and Securities Margin Financing Services segment, the Provision of Stock Information and Research Services segment, and the Precious Metals Spot Trading and Brokerage segment. The Sales of Motor Vehicles and Provision of Agency Services segment is involved in sales of motor vehicles, motor vehicle parts and motor vehicle products; motor vehicles rental; and import and export businesses. The company also provides international freight forwarding services; motor vehicles information consultancy services; as well as motor vehicles repair and maintenance services, among others.",Retail,HK,1/11/2002,Sinofortune Financial Holdings Ltd,,,,0.016,123983368.0,Sinofortune Financial Holdings Ltd,HKD,Sinofortune Financial Holdings Ltd,Sinofortune Financial Holdings Ltd,,Sinofortune Financial Holdings Ltd,8123.hk,,,Sinofortune Financial Holdings Ltd,,8
,,8125.HK,Royal Century Resources Holdings Ltd,HKD,HKSE,Commercial  & Professional Services,"Royal Century Resources Holdings Limited, an investment holding company, provides design and fitting-out services in Hong Kong. The company also engages in the design and procurement of furnishings and decorative materials; and property investment and money lending businesses. In addition, it is involved in sourcing, merchandising, and trading of wines, spirits, furniture, and marbles; advising on securities and securities dealing and brokerage activities; provision of asset management services; and leasing of construction equipment. Further, the company offers interior design and decoration services. The company was formerly known as Kate China Holdings Limited and changed its name to Royal Century Resources Holdings Limited in February 2017. Royal Century Resources Holdings Limited was founded in 2004 and is headquartered in Wan Chai, Hong Kong.",Professional Services,HK,7/18/2014,Royal Century Resources Holdings Ltd,,,,1.03,161483392.0,Royal Century Resources Holdings Ltd,HKD,Royal Century Resources Holdings Ltd,Royal Century Resources Holdings Ltd,,Royal Century Resources Holdings Ltd,8125.hk,,,Royal Century Resources Holdings Ltd,,8
,,8126.HK,G.A. Holdings LTD,HKD,HKSE,Retailing,"G.A. Holdings Limited, an investment holding company, sells of motor vehicles and provides car-related technical services in Singapore and the People's Republic of China. The company operates through two segments, Motor Vehicle Sales and Services Business, and Car Rental Business. It distributes a range of luxury and ultra-luxury motor vehicles of various brands, such as BMW, Mini, Ferrari, and Maserati. The company is also involved in the wholesale and retail of original auto parts and accessories of BMW, Mini Cooper, Ferrari, and Maserati, as well as operates as an authorized distributor of AC Schnitzer. In addition, it operates authorized service centers that offers repair and maintenance services for high-end automobiles; and as a licensee of the Hertz car rental services. Further, the company engages in automobile dealership and motor vehicles exhibition businesses. G.A. Holdings Limited was founded in 1993 and is headquartered in Singapore.",Distributors,SG,6/17/2002,G.A. Holdings LTD,,,,0.24,114312000.0,G.A. Holdings LTD,HKD,G.A. Holdings LTD,G.A. Holdings LTD,,G.A. Holdings LTD,8126.hk,,,G.A. Holdings LTD,,8
,,8128.HK,China Geothermal Industry Development Group Ltd,HKD,HKSE,Commercial  & Professional Services,"China Geothermal Industry Development Group Limited, an investment holding company, engages in the research, exploration, and development of geothermal energy as alternative energy for building heating in Mainland China. The company operates through four segments: Shallow Geothermal Energy, Air Conditioning/Shallow Geothermal Heat Pump, Properties Investment and Development, and Securities Investment and Trading. The Shallow Geothermal Energy segment engages in the provision, installation, and maintenance of shallow geothermal energy utilization systems. The Air Conditioning/Shallow Geothermal Heat Pump segment trades in air conditioning/shallow geothermal heat pump products. The Properties Investment and Development segment invests in properties for rental income. The Securities Investment and Trading segment engages in the trading of securities and other types of investments. China Geothermal Industry Development Group Limited also provides property management and technical support services; and installs energy systems. The company was formerly known as China Ground Source Energy Industry Group Limited and changed its name to China Geothermal Industry Development Group Limited in May 2018. China Geothermal Industry Development Group Limited was incorporated in 1999 and is headquartered in Central, Hong Kong.",Commercial Services & Supplies,HK,11/30/2001,China Geothermal Industry Development Group Ltd,,,,0.083,375735168.0,China Geothermal Industry Development Group Ltd,HKD,China Geothermal Industry Development Group Ltd,China Geothermal Industry Development Group Ltd,,China Geothermal Industry Development Group Ltd,8128.hk,,,China Geothermal Industry Development Group Ltd,,8
,,8130.HK,Dadi International Group Ltd,HKD,HKSE,Media & Entertainment,"Dadi International Group Ltd. is an investment company, which engages in the provision of medical information digitalization and media related services. The company employs 47 full-time employees Along with subsidiaries, the Company operates its business through two segments. The Advertising and Media Related Services segment is engaged in designing, production, acting as agency and placement of advertisements, information consulting and marketing planning in the People’s Republic of China (PRC). The Financial Leasing and Other Financial Services segment is engaged in the provision of financial leasing and other financial services in the PRC. In addition, the Company is also engaged in fund based environmental industry investment businesses.",Media,HK,8/26/2002,Dadi International Group Ltd,,,,0.085,309453568.0,Dadi International Group Ltd,HKD,Dadi International Group Ltd,Dadi International Group Ltd,,Dadi International Group Ltd,8130.hk,,,Dadi International Group Ltd,,8
,,8131.HK,Abc Multiactive Ltd,HKD,HKSE,Software & Services,"abc Multiactive Limited, through its subsidiaries, designs and sells computer software in Hong Kong. It operates through two segments, Financial Solutions and Fintech Resources. The company offers OCTOSTP, a trading software package that is used for front and back-office trading in brokerages and securities divisions of banks. It also provides front office trading system, which include order management system, multi-markets handling services, and risk management system; back office trading system comprises order processing, master setting/e-FRR, corporate actions, and settlement services; and multi-asset class management, real-time risk management, and comprehensive order type services. In addition, the company offers Fintech resources services including, IT professional secondment services; and Fintech professional recruitment services. Further, it provides OCTOSTP that supports multi-markets and integrates with front and back office system. Additionally, the company offers professional and maintenance services; software rental and related services; and sells computer hardware products. It also provides FinCAD, a risk analytics and derivatives risk management software; Curtain, a document security system; and high frequency trading engine to support high frequency trade of brokerage houses. The company was incorporated in 2000 and is headquartered in Central, Hong Kong. abc Multiactive Limited is a subsidiary of Maximizer International Limited.",Technology,HK,1/31/2001,Abc Multiactive Ltd,,,,0.06,18066480.0,Abc Multiactive Ltd,HKD,Abc Multiactive Ltd,Abc Multiactive Ltd,,Abc Multiactive Ltd,8131.hk,,,Abc Multiactive Ltd,,8
,,8135.HK,ZMFY Automobile Glass Services Ltd,HKD,HKSE,Retailing,"ZMFY Automobile Glass Services Limited, an investment holding company, engages in the sale of automobile glass with installation/repair services for private and public motor vehicles in the People's Republic of China. The company operates through four segments: Automobile Glass, Photovoltaic System, Business Consultancy Services, and Finance Leasing Services. It also trades in automobile glass to industry peers and the traders of automobile glass; and provides photovoltaic system installation, business consultancy, and finance leasing services. The company primarily serves insurance companies, and corporate and individual customers. It operates 29 service centers. ZMFY Automobile Glass Services Limited was founded in 1999 and is headquartered in Beijing, the People's Republic of China.",Retail,CN,9/3/2013,ZMFY Automobile Glass Services Ltd,,,,0.3,237960016.0,ZMFY Automobile Glass Services Ltd,HKD,ZMFY Automobile Glass Services Ltd,ZMFY Automobile Glass Services Ltd,,ZMFY Automobile Glass Services Ltd,8135.hk,,,ZMFY Automobile Glass Services Ltd,,8
,,8136.HK,IMS Group Holdings Ltd,HKD,HKSE,Capital Goods,"IMS Group Holdings Limited, an investment holding company, designs and sells light-emitting diode (LED) lighting products for retail stores of luxury brands in Hong Kong, the People's Republic of China, rest of Asia, Europe, and internationally. The company offers LED lighting fixtures; integrated LED lighting solution services, such as LED lighting system design; LED lighting system consultation and maintenance services; after-delivery maintenance and enhancement services; and on-site project management services, as well as project consultancy services. It also sells visual-audio systems, including audio/video conference, projection, public address, sound masking, and central controlling systems. IMS Group Holdings Limited was founded in 1998 and is headquartered in North Point, Hong Kong.",Electrical Equipment,HK,1/25/2018,IMS Group Holdings Ltd,,,,0.065,64999996.0,IMS Group Holdings Ltd,HKD,IMS Group Holdings Ltd,IMS Group Holdings Ltd,,IMS Group Holdings Ltd,8136.hk,,,IMS Group Holdings Ltd,,8
,,8137.HK,Honbridge Holdings Ltd,HKD,HKSE,Capital Goods,"Honbridge Holdings Limited, an investment holding company, engages in the research, development, production, and sale of lithium battery in the People's Republic of China, Belgium, and Sweden. It operates through Mineral Resources Exploration and Trading; Lithium Battery Production; and Battery Swapping Service segments. The company also researches and explores mineral resources; trades in copper and steel; and provides power exchange services. In addition, the company researches and explores for iron ores in Brazil. The company is headquartered in Wanchai, Hong Kong. Honbridge Holdings Limited is a subsidiary of Hong Bridge Capital Limited.",Electrical Equipment,HK,1/8/2002,Honbridge Holdings Ltd,,,,0.6,5912717800.0,Honbridge Holdings Ltd,HKD,Honbridge Holdings Ltd,Honbridge Holdings Ltd,,Honbridge Holdings Ltd,8137.hk,,,Honbridge Holdings Ltd,,8
,,8139.HK,Zhejiang ChangAn Renheng Technology Co Ltd,HKD,HKSE,Materials,"Zhejiang Chang'an Renheng Technology Co., Ltd., together with its subsidiaries, develops, produces, and sells bentonite fine chemicals in the People's Republic of China. The company offers papermaking chemicals; inorganic gel; bentonite products for metallurgy pellets; quality calcium-bentonite products; organic bentonite products; and other chemicals, such as flocculating agents that are primarily used in the coating preparation industry. It is also involved in the mining and processing of clay; and wholesale and retail of chemicals and equipment. The company was formerly known as Changxing Renheng Fine Bentonite Co., Ltd. and changed its name to Zhejiang Chang'an Renheng Technology Co., Ltd. in December 2008. Zhejiang Chang'an Renheng Technology Co., Ltd. was founded in 2000 and is headquartered in Changxing, the People's Republic of China.",Chemicals,CN,1/16/2015,Zhejiang ChangAn Renheng Technology Co Ltd,,,,1.98,76032000.0,Zhejiang ChangAn Renheng Technology Co Ltd,HKD,Zhejiang ChangAn Renheng Technology Co Ltd,Zhejiang ChangAn Renheng Technology Co Ltd,,Zhejiang ChangAn Renheng Technology Co Ltd,8139.hk,,,Zhejiang ChangAn Renheng Technology Co Ltd,,8
,,8140.HK,Bosa Technology Holdings Ltd,HKD,HKSE,Commercial  & Professional Services,"BOSA Technology Holdings Limited, an investment holding company, provides mechanical splicing services to the reinforced concrete construction industry in Hong Kong. It is involved in processing reinforcing bars, including cutting, crimping, chamfering, and threading of reinforcing bars at its premises or at the premises of customers; and connecting reinforcing bars by couplers. The company serves various contractors and subcontractors. BOSA Technology Holdings Limited was founded in 2012 and is headquartered in Kwun Tong, Hong Kong.",Commercial Services & Supplies,HK,7/12/2018,Bosa Technology Holdings Ltd,,,,0.184,147200000.0,Bosa Technology Holdings Ltd,HKD,Bosa Technology Holdings Ltd,Bosa Technology Holdings Ltd,,Bosa Technology Holdings Ltd,8140.hk,,,Bosa Technology Holdings Ltd,,8
,,8142.HK,Tak Lee Machinery Holdings Ltd,HKD,HKSE,Capital Goods,"Tak Lee Machinery Holdings Ltd. is an investment company, which engages in the sale of heavy equipment and spare parts. The company employs 117 full-time employees The firm's product portfolio consists of various types of earthmoving equipment, including heavy vehicles and earthmoving attachments, as well as their spare parts. The firm's business segments are sales of heavy equipment and spare parts, leasing of heavy equipment, and maintenance and ancillary services. Its other products include other heavy equipment, such as high reach equipment, and power and energy equipment. The firm offers a range of heave equipment, such as excavators, bulldozers, soil compactor, wheel loader, vibratory roller, crawler drill and crawler loader. The firm is an authorized dealer of Hitachi brand heavy equipment in Hong Kong and Macau. The firm distributes heavy equipment of Labounty brand in Hong Kong and Macao, and Ramfos brand in Hong Kong, Macao and the People's Republic of China (PRC).",Trading Companies & Distributors,HK,7/27/2017,Tak Lee Machinery Holdings Ltd,,,,0.28,280000000.0,Tak Lee Machinery Holdings Ltd,HKD,Tak Lee Machinery Holdings Ltd,Tak Lee Machinery Holdings Ltd,,Tak Lee Machinery Holdings Ltd,8142.hk,,,Tak Lee Machinery Holdings Ltd,,8
,,8143.HK,Good Fellow Healthcare Holdings Ltd,HKD,HKSE,Health Care Equipment & Services,"Good Fellow Healthcare Holdings Limited, formerly Hua Xia Healthcare Holdings Limited, is an investment holding company principally engaged in the operation of hospitals. The Company’s general hospital services mainly include the provision of medical wards, surgical wards, cosmetic surgery, dermatology and medical checkup and examination services, among others.",Health Care,HK,5/10/2002,Good Fellow Healthcare Holdings Ltd,,,,0.043,121184752.0,Good Fellow Healthcare Holdings Ltd,HKD,Good Fellow Healthcare Holdings Ltd,Good Fellow Healthcare Holdings Ltd,,Good Fellow Healthcare Holdings Ltd,8143.hk,,,Good Fellow Healthcare Holdings Ltd,,8
,,8147.HK,Millennium Pacific Group Holdings Ltd,HKD,HKSE,Consumer Durables & Apparel,"Millennium Pacific Group Holdings Limited, an investment holding company, engages in the research, development, manufacture, and sale of consumer electronic products in the People's Republic of China and Hong Kong. The company offers fitness bracelets, GPS personal navigation devices, mobile internet devices, and TV set-top boxes. It also trades in electronic devices; provides data management services; and develops and sells software applications. In addition, the company provides design, prototyping/sampling, manufacturing, assembling, and packaging services to customers' products. Millennium Pacific Group Holdings Limited was founded in 2004 and is headquartered in Shenzhen, the People's Republic of China.",Consumer products,CN,7/18/2014,Millennium Pacific Group Holdings Ltd,,,,0.046,47414040.0,Millennium Pacific Group Holdings Ltd,HKD,Millennium Pacific Group Holdings Ltd,Millennium Pacific Group Holdings Ltd,,Millennium Pacific Group Holdings Ltd,8147.hk,,,Millennium Pacific Group Holdings Ltd,,8
,,8148.HK,Aurum Pacific (China) Group Ltd,HKD,HKSE,Software & Services,"Aurum Pacific (China) Group Limited, an investment holding company, engages in the development and marketing of server based technology, and provision of communications software platform and software related services in Hong Kong, Mainland China, and internationally. The company operates through Software Platform, Money Lending, and Mobile Gaming segments. Its information technology solutions facilitate government departments and corporations to communicate with their clients via websites, telephones, and mobile phones using interactive voice response system and mobile applications. The company also engages in the money lending business. In addition, it is involved in development and publishing of mobile games and applications, and related intellectual property and platform; development of mobile data solutions and related services; and provision of IT related solutions. In addition, it offers custom-made software development services. The company was formerly known as S & D International Development Group Limited and changed its name to Aurum Pacific (China) Group Limited in November 2008. Aurum Pacific (China) Group Limited is headquartered in Wanchai, Hong Kong.",Technology,HK,7/21/2009,Aurum Pacific (China) Group Ltd,,,,0.019,22907540.0,Aurum Pacific (China) Group Ltd,HKD,Aurum Pacific (China) Group Ltd,Aurum Pacific (China) Group Ltd,,Aurum Pacific (China) Group Ltd,8148.hk,,,Aurum Pacific (China) Group Ltd,,8
,,8149.HK,Altus Holdings Ltd,HKD,HKSE,Diversified Financials,"Altus Holdings Limited provides corporate finance and property investment services in Hong Kong and Japan. The company operates through Corporate Finance Services and Property Investment. It offers corporate finance services, including sponsorship, financial advisory, and compliance advisory services. The company also leases investment properties for residential and commercial use; and provides administrative services. Altus Holdings Limited was founded in 2000 and is headquartered in Central, Hong Kong. Altus Holdings Limited is a subsidiary of Kinley-Hecico Holdings Limited.",Financial Services,HK,10/17/2016,Altus Holdings Ltd,,,,0.218,175132480.0,Altus Holdings Ltd,HKD,Altus Holdings Ltd,Altus Holdings Ltd,,Altus Holdings Ltd,8149.hk,,,Altus Holdings Ltd,,8
,,8150.HK,Seamless Green China (Holdings) Ltd,HKD,HKSE,Semiconductors & Semiconductor Equipment,"Seamless Green China (Holdings) Limited, an investment holding company, manufactures and trades in LED and related products in the People's Republic of China, Hong Kong, and the Philippines. The company operates through LED, Optoelectronic, Liquor, and Sapphire segments. It supplies optoelectronic products and watch crystals for use in the watch products. The company also engages in the trading of wine and optoelectronic products; and property investment activities. Seamless Green China (Holdings) Limited was incorporated in 2001 and is headquartered in Sheung Wan, Hong Kong.",Semiconductors,HK,8/10/2001,Seamless Green China (Holdings) Ltd,,,,0.084,133664152.0,Seamless Green China (Holdings) Ltd,HKD,Seamless Green China (Holdings) Ltd,Seamless Green China (Holdings) Ltd,,Seamless Green China (Holdings) Ltd,8150.hk,,,Seamless Green China (Holdings) Ltd,,8
,,8151.HK,Bao Shen Holdings Ltd,HKD,HKSE,Consumer Durables & Apparel,"Bao Shen Holdings Limited engages in manufacturing and processing of plastic and steel components for white goods in the People's Republic of China. It offers stamping components and peripheral components that are used in white goods, including home washing machines and home refrigerators. The company is also involved in processing of spray-painting components and powder-coating components. It primarily sells its products to component processors and white goods manufacturers. The company was founded in 2010 and is headquartered in Chuzhou, the Peoples Republic of China. Bao Shen Holdings Limited is a subsidiary of Wang Mao Investments Limited.",Consumer products,CN,4/23/2018,Bao Shen Holdings Ltd,,,,0.071,29820000.0,Bao Shen Holdings Ltd,HKD,Bao Shen Holdings Ltd,Bao Shen Holdings Ltd,,Bao Shen Holdings Ltd,8151.hk,,,Bao Shen Holdings Ltd,,8
,,8152.HK,M&L Holdings Group Ltd,HKD,HKSE,Capital Goods,"M&L Holdings Group Limited, an investment holding company, engages in the trading and leasing of construction machinery and spare parts in Hong Kong, the People's Republic of China, Singapore, and internationally. The company operates through two segments, Tunnelling and Foundation. It supplies specialized cutting tools and parts for tunnelling equipment manufacturers and microtunnelling equipment, as well as specialized construction equipment. The company also provides fabricated construction steel works and equipment; and repair and maintenance services. In addition, it is involved in the property investment business. M&L Holdings Group Limited was founded in 1994 and is headquartered in Tsimshatsui, Hong Kong. M&L Holdings Group Limited is a subsidiary of JAT United Company Limited.",Trading Companies & Distributors,HK,7/21/2017,M&L Holdings Group Ltd,,,,0.084,50400000.0,M&L Holdings Group Ltd,HKD,M&L Holdings Group Ltd,M&L Holdings Group Ltd,,M&L Holdings Group Ltd,8152.hk,,,M&L Holdings Group Ltd,,8
,,8153.HK,Farnova Group Holdings Ltd,HKD,HKSE,Media & Entertainment,"Farnova Group Holdings Ltd, formerly Code Agriculture Holding Ltd, is an investment holding company principally engaged in the provision of digital television broadcasting and advertising. The Company operates its business through three segments. The Digital Television segment provides digital television broadcasting and advertising services. The Money Lending segment engages in the provision of mortgage loans and short term loans. The Securities Investments segment engages in the investments and trading of securities.",Media,HK,3/30/2001,Farnova Group Holdings Ltd,,,,0.094,671293440.0,Farnova Group Holdings Ltd,HKD,Farnova Group Holdings Ltd,Farnova Group Holdings Ltd,,Farnova Group Holdings Ltd,8153.hk,,,Farnova Group Holdings Ltd,,8
