Column1,index,symbol,long name,currency,exchange,industry,description,sector,country,ipo date,shorter name,Type,Industries,Similar Companies,price,mktCap,name raw,currency symbol,robinhood name,short name,Warrant,shortest name,url name, smart_order ,random csv equations,pure name,shortest - pure diff,order,first_letter
47.0,7828.0,KO,Coca-Cola Co,USD,NYSE,Beverages Non-Alcoholic,"The Coca-Cola Co. is the nonalcoholic beverage company, which engages in the manufacture, market, and sale of non-alcoholic beverages which include sparkling soft drinks, water, enhanced water and sports drinks, juice, dairy and plant-based beverages, tea and coffee and energy drinks. The company is headquartered in Atlanta, Georgia and currently employs 62,600 full-time employees. The firm owns or licenses and markets non-alcoholic beverage brands, primarily sparkling beverages and a range of still beverages, such as waters, flavored waters and enhanced waters, juices and juice drinks, ready-to-drink teas and coffees, sports drinks, dairy and energy drinks. The firm's segments include Europe, Middle East and Africa; Latin America; North America; Asia Pacific; Bottling Investments, and Corporate. The firm owns and markets a range of non-alcoholic sparkling beverage brands, including Coca-Cola, Diet Coke, Fanta and Sprite. The firm owns or licenses and markets over 500 non-alcoholic beverage brands. The firm markets, manufactures and sells beverage concentrates, which are referred to as beverage bases, and syrups, including fountain syrups, and finished sparkling and still beverages.",Consumer Defensive,US,9/5/1919,Coca-Cola,Stock,"['Consumer Defensive', 'Beverages - Soft Drinks', 'Beverages - Non-Alcoholic']","['COT', 'FIZZ', 'KOF', 'REED', 'MNST', 'CCEP', 'PEP']",53.58,230000000000.0,Coca-Cola Co,$,Coca-Cola,Coca-Cola,False,Coca-Cola,coca-cola,"$900,000,000,230,000,000,000.00 ",,Coca-Cola,0.0,48,K
468.0,7847.0,K,Kellogg Co,USD,NYSE,Packaged Foods,"Kellogg Co. engages in the manufacturing, marketing, and distribution of ready-to-eat cereal and convenience foods. The company is headquartered in Battle Creek, Michigan and currently employs 34,000 full-time employees. The firm's principal products are ready-to-eat cereals and convenience foods, such as cookies, crackers, savory snacks, toaster pastries, cereal bars, fruit-flavored snacks, frozen waffles and veggie foods. Its segments include U.S. Morning Foods, which includes cereal, toaster pastries, health and wellness bars, and beverages; U.S. Snacks, which includes cookies, crackers, cereal bars, savory snacks and fruit-flavored snacks; U.S. Specialty, which represents food away from home channels, including food service, convenience, vending, Girl Scouts and food manufacturing; North America Other, which includes the U.S. Frozen, Kashi and Canada operating segments; Europe, which consists of European countries; Latin America, which consists of Central and South America and includes Mexico, and Asia Pacific, which consists of Sub-Saharan Africa, Australia and other Asian and Pacific markets.",Consumer Defensive,US,1/9/1952,Kellogg,Stock,"['Consumer Defensive', 'Packaged Foods', 'Consumer Packaged Goods']","['HAIN', 'GIS', 'TSN', 'FLO', 'THS', 'POST', 'MDLZ', 'PEP']",65.6,22547572700.0,Kellogg Co,$,Kellogg,Kellogg,False,Kellogg,kellogg,"$90,000,000,022,547,500,000.00 ",,Kellogg,0.0,469,K
469.0,11657.0,KB,KB Financial Group Inc,USD,NYSE,Banks Regional,,Financial Services,KR,,KB Financial,Stock,"['Financial Services', 'Banks - Regional - Asia', 'Banks']","['IBN', 'SHG', 'MUFG', 'BK', 'MFG', 'WF']",42.18,16425821200.0,KB Financial Group Inc,$,0,KB Financial,False,KB Financial,kb-financial,"$90,000,000,016,425,800,000.00 ",,KB Financial,0.0,470,K
470.0,4529.0,KDP,Keurig Dr Pepper Inc,USD,NYSE,Beverages Non-Alcoholic,"Keurig Dr Pepper, Inc. engages in the production and marketing of non-alcoholic beverages. The company is headquartered in Burlington, Massachusetts and currently employs 25,500 full-time employees. The firm offers a diverse portfolio of flavored (non-cola) carbonated soft drinks (CSDs) and non-carbonated beverages (NCBs), including ready-to-drink teas, juices, juice drinks, water and mixers. The firm's segments include Beverage Concentrates, Packaged Beverages and Latin America Beverages. The firm's brand portfolio includes CSD brands, such as Dr Pepper, Canada Dry, Penafiel, Squirt, 7UP, Crush, A&W, Sunkist soda and Schweppes, and NCB brands, such as Snapple, Hawaiian Punch, Mott's and Clamato. The firm's NCB brands include Snapple, Hawaiian Punch, Mott's, FIJI mineral water, Clamato, Yoo-Hoo, Deja Blue, Bai Brands, ReaLemon, AriZona tea, Vita Coco coconut water, Mr and Mrs T mixers, BodyArmor, Nantucket Nectars, Garden Cocktail, Mistic and Rose's.",Consumer Defensive,US,4/28/2008,Keurig Dr Pepper Inc,Stock,,,29.4,41371681000.0,Keurig Dr Pepper Inc,$,Keurig Dr Pepper,Keurig Dr Pepper,False,Keurig Dr Pepper,keurig-dr-pepper,"$90,000,000,041,371,600,000.00 ",,Keurig Dr Pepper,0.0,471,K
471.0,10490.0,KEG,Key Energy Services Inc.,USD,NYSE,Oil & Gas Services,,Energy,,,Key Energy Services,Stock,"['Energy', 'Oil & Gas Equipment & Services', 'Oil & Gas - Services']",['PUMP'],104.14,35159642000.0,Key Energy Services Inc.,$,0,Key Energy Services,False,Key Energy Services,key-energy-services,"$90,000,000,035,159,600,000.00 ",,Key Energy Services,0.0,472,K
472.0,11836.0,KEP,Korea Electric Power Corp.,USD,NYSE,Utilities Regulated Electric,,Utilities,KR,,Korea Electric Power,Stock,"['Utilities', 'Utilities - Regulated Electric', 'Utilities - Regulated']","['ENIA', 'SCG', 'XLU']",9.35,12024755200.0,Korea Electric Power Corporation,$,0,Korea Electric Power,False,Korea Electric Power,korea-electric-power,"$90,000,000,012,024,700,000.00 ",,Korea Electric Power,0.0,473,K
473.0,4530.0,KEY,KeyCorp,USD,NYSE,Banks Regional,"KeyCorp operates as bank holding company. The company is headquartered in Cleveland, Ohio and currently employs 2,360 full-time employees. The firm is a bank-based financial services company. The firm operates through its subsidiary, KeyBank National Association (KeyBank), which is engaged in providing banking services. Through KeyBank and other subsidiaries, it provides a range of retail and commercial banking, commercial leasing, investment management, consumer finance, and investment banking products and services to individual, corporate and institutional clients. Its segments include Key Community Bank and Key Corporate Bank. Key Community Bank serves individuals and small to mid-sized businesses by offering a range of deposit, investment, lending, credit card, and personalized wealth management products and business advisory services. Key Corporate Bank is a full-service corporate and investment bank focused on serving the needs of middle market clients in industry sectors, which include consumer, energy, healthcare, industrial, public sector, real estate and technology.",Financial Services,US,9/1/1992,KeyCorp,Stock,"['Financial Services', 'Banks - Regional - US', 'Banks']","['WSBC', 'ZION', 'NRIM', 'CMA', 'CFR', 'PNC', 'WFC', 'STI', 'JPM', 'BHLB']",15.02,14666625000.0,KeyCorp,$,KeyBank,KeyBank,False,KeyBank,keybank,"$90,000,000,014,666,600,000.00 ",,KeyBank,0.0,474,K
474.0,8542.0,KEYS,Keysight Technologies Inc,USD,NYSE,Scientific & Technical Instruments,"Keysight Technologies, Inc. engages in the provision of electronic design and test solutions that are used in the design, development, manufacture, installation, deployment, validation, optimization and secure operation of electronics systems to communications, networking and electronics industries. The company is headquartered in Santa Rosa California, California and currently employs 13,600 full-time employees. The firm provides electronic design and test instruments and systems and related software, software design tools and related services that are used in the design, development, manufacture, installation, deployment and operation of electronics equipment. The firm operates through three segments: Communications Solutions Group (CSG), Electronic Industrial Solutions Group (EISG) and Services Solutions Group (SSG). The CSG and EISG segments provide electronic design and test software, instruments, and systems used in the simulation, design, validation, manufacturing, installation and optimization of electronic equipment. The SSG segment provides integrated service solutions, including repair and calibration services, professional services and remanufactured equipment.",Technology,US,10/20/2014,Keysight Technologies,Stock,"['Technology', 'Scientific & Technical Instruments', 'Computer Hardware']","['FARO', 'ITRI', 'MTSC', 'BRKR', 'XLK']",115.44,21603328000.0,Keysight Technologies Inc,$,Keysight Technologies,Keysight Technologies,False,Keysight Tech,keysight-tech,"$90,000,000,021,603,300,000.00 ",,Keysight Tech,0.0,475,K
475.0,468.0,KHC,The Kraft Heinz,USD,NASDAQ,Consumer Packaged Goods,"The Kraft Heinz Co. engages in the manufacture and market of food and beverage products. The company is headquartered in Pittsburgh, Pennsylvania and currently employs 38,000 full-time employees. The firm is engaged in the manufacturing and marketing of food and beverage products, including condiments and sauces, cheese and dairy, meals, meats, refreshment beverages, coffee and other grocery products. The firm's segments include the United States, Canada and Europe. The firm's remaining businesses are combined as Rest of World. The Rest of World consists of Latin America and Asia, Middle East and Africa (AMEA). The firm provides products for various occasions whether at home, in restaurants or on the go. The firm's brands include Heinz, Kraft, Oscar Mayer, Philadelphia, Planters, Velveeta, Lunchables, Maxwell House, Capri Sun, and Ore-Ida. The firm's products are sold through its own sales organizations and through independent brokers, agents and distributors to chain, wholesale, cooperative and independent grocery accounts, convenience stores, drug stores, value stores, bakeries and pharmacies.",Consumer Defensive,US,7/6/2015,Kraft Heinz Co,Stock,"['Consumer Defensive', 'Packaged Foods', 'Consumer Packaged Goods']","['HAIN', 'GIS', 'TSN', 'SJM', 'THS', 'MDLZ', 'PEP']",31.35,38329139000.0,The Kraft Heinz,$,Kraft Foods,Kraft Foods,False,Kraft Foods,kraft-foods,"$90,000,000,038,329,100,000.00 ",,Kraft Foods,0.0,476,K
476.0,11531.0,KKR,KKR & Co Inc,USD,NYSE,Asset Management,"KKR & Co., Inc. engages in the provision of investment and private equity asset management services. The company is headquartered in New York City, New York and currently employs 1,301 full-time employees. The company offers a range of investment management services to its fund investors, and provides capital markets services to its firm, its portfolio companies and third parties. The firm conducts its business with offices across the world, providing it with a global platform for sourcing transactions, raising capital and carrying out capital markets activities. The firm operates through four segments: Private Markets, Public Markets, Capital Markets and Principal Activities. The company operates and reports its combined credit and hedge funds businesses through the Public Markets segment. The Capital Markets segment consists primarily of its global capital markets business. Through its Principal Activities segment, it manages the firm's assets and deploys capital.",Financial Services,US,7/15/2010,KKR,Stock,"['Financial Services', 'Asset Management']",[],36.72,20900620300.0,KKR & Co Inc,$,0,KKR,False,KKR,kkr,"$90,000,000,020,900,600,000.00 ",,KKR,0.0,477,K
477.0,8842.0,KL,Kirkland Lake Gold Ltd,USD,NYSE,Gold,"Kirkland Lake Gold Ltd. engages in the mining, development, and exploration of gold properties. The company is headquartered in Toronto, Ontario and currently employs 1,729 full-time employees. The company has a diversified portfolio of assets located in the stable mining jurisdictions of Canada and Australia. The Company’s main gold mines are: the Macassa Mine located in northeastern Ontario and the Fosterville Gold Mine located in the State of Victoria, Australia. In addition, the Company owns the Holt Mine and the Taylor Mine, which are situated along the Porcupine-Destor Fault Zone, in northeastern Ontario, the Cosmo Gold Mine located in the Northern Territory, Australia and the Stawell Gold Mine located in the State of Victoria, Australia. The Company’s subsidiaries are: Crocodile Gold Inc and Franc-Or Resources Peru SA, among others.",Basic Materials,CA,5/31/1994,Kirkland Lake Gold,Stock,"['Basic Materials', 'Gold', 'Metals & Mining']","['XPL', 'PVG']",44.56,12185778200.0,Kirkland Lake Gold Ltd,$,Kirkland Lake Gold,Kirkland Lake Gold,False,Kirkland Lake Gold,kirkland-lake-gold,"$90,000,000,012,185,700,000.00 ",,Kirkland Lake Gold,0.0,478,K
478.0,444.0,KLAC,KLA-Tencor,USD,NASDAQ,Semiconductor Equipment & Materials,"KLA Corp. engages in the supply of process control and yield management solutions for the semiconductor and related nano-electronics industries. The company is headquartered in Milpitas, California and currently employs 10,020 full-time employees. The firm's products are also used in a number of other high technology industries, including the packaging, light emitting diode (LED), power devices, compound semiconductor, and data storage industries, as well as general materials research. Its products and services are used by bare wafer, integrated circuit (IC), lithography reticle (reticle or mask) and disk manufacturers around the world. Its inspection and metrology products and related offerings are categorized in various groups, including Chip and Wafer Manufacturing, Reticle Manufacturing, Packaging Manufacturing, Compound Semiconductor, Power Device, LED and microelectromechanical systems (MEMS)Manufacturing, General Purpose/Lab Applications, K-T Pro and K-T Services. The company provides refurbished KLA tools as service and support for its products.",Technology,US,10/8/1980,KLA Corp,Stock,"['Technology', 'Semiconductor Equipment & Materials', 'Semiconductors']","['AMAT', 'AEIS', 'ASYS', 'LRCX', 'NANO', 'NVMI', 'CAMT', 'ASML', 'RTEC', 'XLK']",233.51,36067955000.0,KLA-Tencor,$,KLA,KLA,False,KLA,kla,"$90,000,000,036,067,900,000.00 ",,KLA,0.0,479,K
479.0,10743.0,KMB,Kimberly-Clark Corp,USD,NYSE,Household & Personal Products,"Kimberly-Clark Corp. engages in the manufacture and marketing of products made from natural or synthetic fibers. The company is headquartered in Irving, Texas and currently employs 41,000 full-time employees. The firm's segments include Personal Care, Consumer Tissue, K-C Professional and Corporate & Other. The firm's Personal Care segment offers various solutions and products, such as disposable diapers, training and youth pants, swimpants, baby wipes, feminine and incontinence care products, and other related products. The firm's Consumer Tissue segment offers products, such as facial and bathroom tissue, paper towels, napkins and related products. The firm's K-C Professional segment offers solutions and supporting products, such as wipers, tissue, towels, apparel, soaps and sanitizers. The firm's business outside North America includes Developing and Emerging Markets (D&E) and Developed Markets. The company sells its products to supermarkets, mass merchandisers, drugstores, warehouse clubs and other retail outlets.",Consumer Defensive,US,5/9/1929,Kimberly-Clark,Stock,"['Consumer Defensive', 'Household & Personal Products', 'Consumer Packaged Goods']",[],137.78,46864073000.0,Kimberly-Clark Corp,$,0,Kimberly-Clark,False,Kimberly-Clark,kimberly-clark,"$90,000,000,046,864,000,000.00 ",,Kimberly-Clark,0.0,480,K
480.0,9337.0,KMI,Kinder Morgan Inc,USD,NYSE,Oil & Gas Midstream,"Kinder Morgan, Inc. is an energy infrastructure company, which engages in the operation of pipelines and terminals that transport natural gas; gasoline; crude oil; carbon dioxide (CO2) and other products and stores petroleum products chemicals; and handles bulk materials like ethanol, coal, petroleum coke and steel. The company is headquartered in Houston, Texas and currently employs 11,012 full-time employees. The company operates through four segments. Its Natural Gas Pipelines segment is engaged in the ownership and operation of interstate and intrastate natural gas pipeline and storage systems, and liquefied natural gas facilities, among others. Its CO2 segment is engaged in the production, transportation and marketing of carbon dioxide (CO2) to oil fields, and the ownership and operation of a crude oil pipeline system. Its Terminals segment is engaged in the ownership and/or operation of liquids and bulk terminal facilities located throughout the United States and portions of Canada, and Jones Act tankers. Its Products Pipelines segment is engaged in the ownership and operation of refined petroleum products, natural gas liquids and crude oil and condensate pipelines.",Energy,US,2/11/2011,Kinder Morgan,Stock,"['Energy', 'Oil & Gas Midstream', 'Oil & Gas - Midstream']","['XOM', 'EPD', 'SEP', 'AMID', 'SXE']",13.03,29497184300.0,Kinder Morgan Inc,$,Kinder Morgan,Kinder Morgan,False,Kinder Morgan,kinder-morgan,"$90,000,000,029,497,100,000.00 ",,Kinder Morgan,0.0,481,K
481.0,9939.0,KMX,Carmax Inc,USD,NYSE,Auto & Truck Dealerships,"CarMax, Inc. is a holding company, which engages in the retail of used vehicles and wholesale vehicle auction operator. The company is headquartered in Richmond, Virginia and currently employs 25,946 full-time employees. The firm is a retailer of used vehicles. The firm operates through two segments: CarMax Sales Operations and CarMax Auto Finance (CAF). The firm's CarMax Sales Operations segment consists of all aspects of its auto merchandising and service operations, excluding financing provided by CAF. The firm's CAF segment consists of its own finance operation that provides vehicle financing through CarMax stores. The firm operates approximately 160 used car stores in over 70 metropolitan markets. The firm's products and services include retail merchandising, wholesale auctions, extended protection plans (EPPs), reconditioning and service, and customer credit. The firm's CarMax Sales Operations segment sells used vehicles, purchases used vehicles from customers and other sources, sells related products and services, and arranges financing options for customers. CAF operates in the auto finance sector of the consumer finance market.",Consumer Cyclical,US,2/7/1997,CarMax,Stock,"['Consumer Cyclical', 'Auto & Truck Dealerships', 'Autos']","['CPRT', 'CRMT', 'RUSHA', 'AN', 'GPI', 'PAG', 'KAR']",93.42,15329007600.0,Carmax Inc,$,0,CarMax,False,CarMax,carmax,"$90,000,000,015,329,000,000.00 ",,CarMax,0.0,482,K
482.0,7861.0,KR,Kroger Co,USD,NYSE,Grocery Stores,"The Kroger Co. engages in the operation of supermarkets and multi-department stores. The company is headquartered in Cincinnati, Ohio and currently employs 453,000 full-time employees. The firm operates supermarkets, multi-department stores, jewelry stores and convenience stores throughout the United States. As of February 3, 2018, it had operated approximately 3,900 owned or leased supermarkets, convenience stores, fine jewelry stores, distribution warehouses and food production plants through divisions, subsidiaries or affiliates. These facilities are located throughout the United States. As of February 3, 2018, Kroger operated, either directly or through its subsidiaries, 2,782 supermarkets under a range of local banner names, of which 2,268 had pharmacies and 1,489 had fuel centers. As of February 3, 2018, the Company offered ClickList and Harris Teeter ExpressLane, personalized, order online, pick up at the store services at 1,056 of its supermarkets. P$$T, Check This Out and Heritage Farm are the three brands. Its other brands include Simple Truth and Simple Truth Organic.",Consumer Defensive,US,1/26/1928,Kroger,Stock,"['Consumer Defensive', 'Grocery Stores', 'Retail - Defensive']","['IMKTA', 'WMT', 'SFM']",32.09,24848089100.0,Kroger Co,$,Kroger,Kroger,False,Kroger,kroger,"$90,000,000,024,848,000,000.00 ",,Kroger,0.0,483,K
483.0,4505.0,KSU,Kansas City Southern,USD,NYSE,Railroads,"Kansas City Southern is a transportation holding company. The company is headquartered in Kansas City, Missouri and currently employs 7,200 full-time employees. The firm has domestic and international rail operations in North America that are focused on the north/south freight corridor connecting commercial and industrial markets in the central United States with industrial cities in Mexico. The firm's subsidiaries include The Kansas City Southern Railway Company (KCSR) and Kansas City Southern de Mexico, S.A. de C.V. (KCSM). KCSR serves a 10-state region in the midwest and southeast regions of the United States and has the north/south rail route between Kansas City, Missouri and various ports along the Gulf of Mexico in Alabama, Louisiana, Mississippi and Texas. KCSM operates a corridor of the Mexican railroad system. KCSM's rail lines provide rail access to the United States and Mexico border crossing at Nuevo Laredo, Tamaulipas. KCSM also provides rail access to the Port of Lazaro Cardenas on the Pacific Ocean.",Industrials,US,11/1/1962,Kansas City Southern,Stock,"['Industrials', 'Railroads', 'Transportation & Logistics']","['CNI', 'CP', 'GWR', 'NSC', 'UNP', 'CSX']",188.02,17598974000.0,Kansas City Southern,$,Kansas City Southern,Kansas City Southern,False,Kansas City Southern,kansas-city-southern,"$90,000,000,017,598,900,000.00 ",,Kansas City Southern,0.0,484,K
484.0,4590.0,KYO,Kyocera Corp.,USD,NYSE,Computer Hardware,,Technology,,,Kyocera Corp.,Stock,,,55.22,20319120000.0,Kyocera Corporation,$,0,Kyocera Corp.,False,Kyocera ,kyocera,"$90,000,000,020,319,100,000.00 ",,Kyocera,1.0,485,K
1699.0,9971.0,KAI,Kadant Inc,USD,NYSE,Specialty Industrial Machinery,"Kadant, Inc. engages in designing and manufacturing products used in industries ranging from paper to plastics and textiles to tires. The company is headquartered in Westford, Massachusetts and currently employs 2,500 full-time employees. In addition, the Company manufactures granules made from papermaking by-products. Its segments include Papermaking Systems and Wood Processing Systems. The firm has a customer base, which includes paper and oriented strand board (OSB) manufacturers. Papermaking Systems segment is engaged in developing, manufacturing, and marketing equipment for the global papermaking and paper recycling industries. Its Papermaking Systems segment consists of product lines, including Stock-Preparation; Doctoring, Cleaning, & Filtration, and Fluid-Handling. The firm develops, manufactures and markets stranders and related equipment used in the production of OSB.",Industrials,US,11/3/1992,Kadant,Stock,"['Industrials', 'Diversified Industrials', 'Industrial Products']","['CMCO', 'JAKK', 'AIN', 'ITW']",131.94,1518576640.0,Kadant Inc,$,0,Kadant,False,Kadant,kadant,"$9,000,000,001,518,570,000.00 ",,Kadant,0.0,1700,K
1700.0,10681.0,KALU,Kaiser Aluminum Corp,USD,NASDAQ,Aluminum,"Kaiser Aluminum Corp. engages in the manufacture and sale of semi-fabricated specialty aluminum products. The company is headquartered in Foothill Ranch, California and currently employs 2,850 full-time employees. The firm operates in the Fabricated Products segment. The firm's Fabricated Products segment focuses on producing rolled, extruded and drawn aluminum products used principally for aerospace and defense, automotive and general engineering products that include consumer durables, electronics, electrical and machinery and equipment applications. The firm offers its products for various end market applications, such as aerospace and high strength (Aero/HS products); automotive (Automotive Extrusions); general engineering (GE products), and other industrial (Other products). The firm's fabricated aluminum mill products include flat-rolled (plate and sheet), extruded (rod, bar, hollows and shapes), drawn (rod, bar, pipe and tube) and cast aluminum products.",Basic Materials,US,7/11/1991,Kaiser Aluminum,Stock,"['Basic Materials', 'Aluminum', 'Metals & Mining']","['CENX', 'ACH', 'CSTM', 'AA']",74.95,1185124350.0,Kaiser Aluminum Corp,$,0,Kaiser Aluminum,False,Kaiser Aluminum,kaiser-aluminum,"$9,000,000,001,185,120,000.00 ",,Kaiser Aluminum,0.0,1701,K
1701.0,11220.0,KAMN,Kaman Corp,USD,NYSE,Aerospace & Defense,"Kaman Corp. engages in the design, manufacture and distribution of aircrafts, aircraft parts and components. The company is headquartered in Bloomfield, Connecticut and currently employs 5,100 full-time employees. The firm operates through its Aerospace segment. The firm's brands include KAflex, KAron and K-MAX. Aerospace segment produces and markets aircraft bearings and components; super precision, miniature ball bearings; metallic and composite aerostructures for commercial, military and general aviation fixed and rotary wing aircraft, and safe and arming solutions for missile and bomb systems for the United States and allied militaries. The segment also markets the design and supply of aftermarket parts to businesses performing MRO in aerospace markets; performs helicopter subcontract work; restores, modifies and supports its SH-2G Super Seasprite maritime helicopters; manufactures and supports its K-MAX manned and unmanned medium-to-heavy lift helicopters, and provides engineering design, analysis and certification services.",Industrials,US,3/17/1980,Kaman,Stock,"['Industrials', 'Aerospace & Defense']","['NNBR', 'ROLL', 'LMT', 'GPC', 'PH', 'TKR', 'RXN', 'DNOW']",50.79,1405735170.0,Kaman Corp,$,0,Kaman,False,Kaman,kaman,"$9,000,000,001,405,730,000.00 ",,Kaman,0.0,1702,K
