Unnamed: 0,index,symbol,long name,currency,exchange,industry,description,sector,country,ipo date,shorter name,Type,Industries,Similar Companies,price,mktCap,name raw,currency symbol,robinhood name,short name,Warrant,shortest name,url name, smart_order ,random csv equations,pure name,shortest - pure diff,first_letter
,,1640.HK,Ruicheng China Media Group Ltd,HKD,HKSE,Media & Entertainment,"Ruicheng (China) Media Group Limited, an investment holding company, provides various advertising services primarily in the People's Republic of China. The company offers television, online, outdoor, and other advertising services. It serves advertising companies and advertising agents. The company was founded in 2003 and is headquartered in Beijing, China.",Media,CN,11/12/2019,Ruicheng China Media Group Ltd,,,,0.255,102000000.0,Ruicheng China Media Group Ltd,HKD,Ruicheng China Media Group Ltd,Ruicheng China Media Group Ltd,,Ruicheng China Media Group Ltd,1640.hk,,,Ruicheng China Media Group Ltd,,1
,,1582.HK,CR Construction Group Holdings Ltd,HKD,HKSE,Capital Goods,"CR Construction Group Holdings Limited, an investment holding company, operates as a building contractor in Hong Kong. The company provides building construction, as well as repair, maintenance, addition, and alteration work services. It serves public and private sectors. The company was founded in 1967 and is headquartered in Kwun Tong, Hong Kong. CR Construction Group Holdings Limited is a subsidiary of CR Construction Investments Limited.",Construction,HK,10/16/2019,CR Construction Group Holdings Ltd,,,,0.57,285000000.0,CR Construction Group Holdings Ltd,HKD,CR Construction Group Holdings Ltd,CR Construction Group Holdings Ltd,,CR Construction Group Holdings Ltd,1582.hk,,,CR Construction Group Holdings Ltd,,1
,,1591.HK,Shun Wo Group Holdings Ltd,HKD,HKSE,Capital Goods,"Shun Wo Group Holdings Limited, an investment holding company, engages in undertaking foundation works in Hong Kong. It undertakes excavation and lateral support, socketed H-piling and mini-piling, and pile caps construction works. The company was founded in 1995 and is headquartered in Sai Wan Ho, Hong Kong. Shun Wo Group Holdings Limited is a subsidiary of May City Holdings Limited.",Construction,HK,9/28/2016,Shun Wo Group Holdings Ltd,,,,0.022,88000000.0,Shun Wo Group Holdings Ltd,HKD,Shun Wo Group Holdings Ltd,Shun Wo Group Holdings Ltd,,Shun Wo Group Holdings Ltd,1591.hk,,,Shun Wo Group Holdings Ltd,,1
,,1601.HK,Zhongguancun Science Tech Leasing Co Ltd,HKD,HKSE,Diversified Financials,"Zhongguancun Science-Tech Leasing Co., Ltd. provides financial leasing solutions and diversified consulting services for technology and new economy companies. The company was founded in 2012 and is based in Beijing, China.",Financial Services,CN,1/21/2020,Zhongguancun Science Tech Leasing Co Ltd,,,,0.96,1279996800.0,Zhongguancun Science Tech Leasing Co Ltd,HKD,Zhongguancun Science Tech Leasing Co Ltd,Zhongguancun Science Tech Leasing Co Ltd,,Zhongguancun Science Tech Leasing Co Ltd,1601.hk,,,Zhongguancun Science Tech Leasing Co Ltd,,1
,,1393.HK,Hidili Industry International Development Ltd,HKD,HKSE,Energy,"Hidili Industry International Development Limited, an investment holding company, engages in the coal mining, and manufacture and sale of raw coal and clean coal in the People's Republic of China. It also provides clean coal washing services. The company was incorporated in 2006 and is headquartered in Panzhihua, the People's Republic of China. Hidili Industry International Development Limited is a subsidiary of Sanlian Investment Holding Limited.",Energy ,CN,9/21/2007,Hidili Industry International Development Ltd,,,,0.24,490944000.0,Hidili Industry International Development Ltd,HKD,Hidili Industry International Development Ltd,Hidili Industry International Development Ltd,,Hidili Industry International Development Ltd,1393.hk,,,Hidili Industry International Development Ltd,,1
,,1655.HK,Okura Holdings Ltd,HKD,HKSE,Consumer Services,"Okura Holdings Limited, an investment holding company, operates pachinko and pachislot halls in Japan. As of June 30, 2020, the company operated 17 pachinko halls under the Big Apple, K's Plaza, Big Apple, YOUPARK, and Monaco names in the Kyushu, Kanto, Kansai, and Chugoku regions. It also invests in and rents real estate properties; and provides business consulting services. The company was founded in 1968 and is headquartered in Nagasaki, Japan.","Hotels, Restaurants & Leisure",JP,5/15/2017,Okura Holdings Ltd,,,,0.68,340000000.0,Okura Holdings Ltd,HKD,Okura Holdings Ltd,Okura Holdings Ltd,,Okura Holdings Ltd,1655.hk,,,Okura Holdings Ltd,,1
,,1756.HK,Huali University Group Ltd,HKD,HKSE,Consumer Services,"Huali University Group Limited, an investment holding company, provides private higher education and vocational education services in the People's Republic of China. The company offers applied science-focused and practice-oriented programs. It also provides student accommodation services. As of February 29, 2020, it had approximately 45,617 students enrolled at its 3 schools. The company was founded in 2000 and is headquartered in Guangzhou, the People's Republic of China.",Diversified Consumer Services,CN,11/25/2019,Huali University Group Ltd,,,,2.9,3480000000.0,Huali University Group Ltd,HKD,Huali University Group Ltd,Huali University Group Ltd,,Huali University Group Ltd,1756.hk,,,Huali University Group Ltd,,1
,,1793.HK,Wecon Holdings Ltd,HKD,HKSE,Capital Goods,"Wecon Holdings Limited, an investment holding company, operates as a construction contractor in Hong Kong. The company operates in two segments, Construction Contracts; and Repair, Maintenance, Alteration and Addition (RMAA) Works Services. It offers building construction services for residential, commercial, and industrial buildings; RMAA works services, such as general upkeep, maintenance, improvement, refurbishment, alteration, and addition of existing facilities and components of buildings and their surroundings. The company was founded in 1974 and is headquartered in Central, Hong Kong.",Construction,HK,2/27/2019,Wecon Holdings Ltd,,,,0.245,196000000.0,Wecon Holdings Ltd,HKD,Wecon Holdings Ltd,Wecon Holdings Ltd,,Wecon Holdings Ltd,1793.hk,,,Wecon Holdings Ltd,,1
,,1795.HK,YADONG GROUP,HKD,HKSE,Textile Manufacturing,"Yadong Group Holdings Limited engages in the design, processing, and sale of textile fabric products to garment manufacturers and trading companies. Its products include plain weave fabrics and corduroy fabrics. The company sells and distributes its products in China, Japan, Taiwan, Vietnam, Bangladesh, and Indonesia. Yadong Group Holdings Limited was founded in 2011 and is headquartered in Hong Kong, Hong Kong.",Consumer Cyclical,HK,11/6/2020,YADONG GROUP,,,,0.64,384000000.0,YADONG GROUP,HKD,YADONG GROUP,YADONG GROUP,,YADONG GROUP,1795.hk,,,YADONG GROUP,,1
,,1500.HK,IN Construction Holdings Ltd,HKD,HKSE,Capital Goods,"In Construction Holdings Limited, an investment holding company, engages in construction and engineering activities in Hong Kong. The company undertakes foundation works and related works, including demolition, site formation, ground investigation field, and general building works. It serves building and construction industries. The company was formerly known as Crownland Construction Limited. In Construction Holdings Limited was founded in 1996 and is headquartered in Causeway Bay, Hong Kong.",Construction,HK,4/16/2015,IN Construction Holdings Ltd,,,,0.194,161020000.0,IN Construction Holdings Ltd,HKD,IN Construction Holdings Ltd,IN Construction Holdings Ltd,,IN Construction Holdings Ltd,1500.hk,,,IN Construction Holdings Ltd,,1
,,1027.HK,China Jicheng Holdings Ltd,HKD,HKSE,Consumer Durables & Apparel,"China Jicheng Holdings Ltd. is an investment holding company principally engaged in the manufacture and sales of polyolefin elastomer (POE) umbrellas and nylon umbrellas. The Company is also engaged in the manufacture and sales of umbrella parts such as plastic cloth and shaft. The Company’s production site locates in Dongshi Town and Yonghe Town of Jinjiang City in Fujian province of China. The Company mainly exports its products to customers in Japan, Hong Kong, South Korea, Taiwan, France and Cambodia.","Textiles, Apparel & Luxury Goods",CN,2/13/2015,China Jicheng Holdings Ltd,,,,0.71,215044800.0,China Jicheng Holdings Ltd,HKD,China Jicheng Holdings Ltd,China Jicheng Holdings Ltd,,China Jicheng Holdings Ltd,1027.hk,,,China Jicheng Holdings Ltd,,1
,,1000.HK,Beijing Media Corp Ltd,HKD,HKSE,Media & Entertainment,"Beijing Media Corporation Limited, together with its subsidiaries, provides newspaper, magazine, and outdoor advertising services in the People's Republic of China. The company operates through Advertising, Printing, Trading of Print-Related Material, and Distribution segments. The Advertising segment sells advertising spaces and outdoor advertising of media. The Printing segment provides printing services. The Trading of Print-Related Material segment sells papers, inks, lubricants, films, pre-coating photosensitive liquid plates, and rubber plates used for printing and other print-related materials. The Distribution segment engages in the distribution of newspapers that are primarily published by Chongqing Youth Daily. In addition, it is involved in the provision of logistics and warehousing services; investment management, travel rental and services, and game development businesses; and the provision of commerce related services. The company was incorporated in 2001 and is based in Central, Hong Kong. Beijing Media Corporation Limited is a subsidiary of Beijing Youth Daily Agency.",Media,CN,12/22/2004,Beijing Media Corp Ltd,,,,0.88,173632800.0,Beijing Media Corp Ltd,HKD,Beijing Media Corp Ltd,Beijing Media Corp Ltd,,Beijing Media Corp Ltd,1000.hk,,,Beijing Media Corp Ltd,,1
,,1001.HK,Hong Kong Shanghai Alliance Holdings Ltd,HKD,HKSE,Capital Goods,"Hong Kong Shanghai Alliance Holdings Limited, together with its subsidiaries, engages in the distribution and processing of construction materials in Hong Kong and Mainland China. It operates through four segments: Construction Materials Business, Building and Design Solution Business, Engineering Plastics Business, and Property Investment and Project Management. The company distributes construction materials, such as reinforcing steel, sheet piles, plates, and H-piles/H-beams; and cut and bent reinforcement and rebar couplers, as well as offers integrated rebar processing, rebars threading/coupling, traceability, and supply chain services. It also provides surface critical coils, such as cold roll, hot roll, electro galvanized, galvanized, and silicon steel products, as well as slitting, cut to length, and stamping services for the automotive, home appliance, and construction industries. In addition, the company engages in property investment and holding, and project management businesses; and trades in sanitary wares, kitchen cabinets, and engineering plastics. Further, it installs kitchen cabinets; operates land situated in Tsing Yi; and provides fund management, management, investment advisory, asset and investment management, property agency, and investment consultancy services, as well as stockholding activities. Additionally, the company offers design, installation, inventory management, and logistics services, as well as technical support for sanitary wares, and fittings and kitchen. It serves the commercial, government, hospitality, infrastructure, and residential industries. The company was formerly known as Van Shung Chong Holdings Limited and changed its name to Hong Kong Shanghai Alliance Holdings Limited in December 2015. Hong Kong Shanghai Alliance Holdings Limited was founded in 1961 and is headquartered in Wanchai, Hong Kong.",Trading Companies & Distributors,HK,2/18/1994,Hong Kong Shanghai Alliance Holdings Ltd,,,,0.25,160308000.0,Hong Kong Shanghai Alliance Holdings Ltd,HKD,Hong Kong Shanghai Alliance Holdings Ltd,Hong Kong Shanghai Alliance Holdings Ltd,,Hong Kong Shanghai Alliance Holdings Ltd,1001.hk,,,Hong Kong Shanghai Alliance Holdings Ltd,,1
,,1002.HK,VS International Group Ltd,HKD,HKSE,Capital Goods,"V.S. International Group Limited, an investment holding company, manufactures and sells plastic molded products and parts. It operates through three segments: Plastic Injection and Moulding, Assembling of Electronic Products, and Mould Design and Fabrication. The company also manufactures, assembles, trades in, and sells electronic products, parts, and components; and manufactures and sells plastic injection molds, as well as engages in the operation and management of rooftop solar plants. It operates in Mainland China, Hong Kong, Southeast Asia, Europe, the United States, and internationally. The company was founded in 1997 and is headquartered in Central, Hong Kong. V.S. International Group Limited is a subsidiary of V.S. Industry Berhad.",Machinery,HK,2/8/2002,VS International Group Ltd,,,,0.161,371509120.0,VS International Group Ltd,HKD,VS International Group Ltd,VS International Group Ltd,,VS International Group Ltd,1002.hk,,,VS International Group Ltd,,1
,,1003.HK,Huanxi Media Group Ltd,HKD,HKSE,Media & Entertainment,"Huanxi Media Group Limited, an investment holding company, engages in the media and entertainment, and related businesses in the People's Republic of China. The company develops and/or invests in films and television drama series; and provides property agency, project consulting, and related services. It also develops an online streaming platform; and offers securities trading and investment, as well as Internet audio-visual programs services. The company was formerly known as 21 Holdings Limited and changed its name to Huanxi Media Group Limited in October 2015. Huanxi Media Group Limited is headquartered in Admiralty, Hong Kong.",Media,HK,2/21/1994,Huanxi Media Group Ltd,,,,1.67,5797388300.0,Huanxi Media Group Ltd,HKD,Huanxi Media Group Ltd,Huanxi Media Group Ltd,,Huanxi Media Group Ltd,1003.hk,,,Huanxi Media Group Ltd,,1
,,1004.HK,China Smarter Energy Group Holdings Ltd,HKD,HKSE,Utilities,"China Smarter Energy Group Holdings Limited, an investment holding company, engages in the solar energy business in the People's Republic of China. The company operates through four segments: Clean Energy, Trading in Securities, Investments, and Trading of Bulk Commodities. It operates solar power plants and distributed solar power stations. As of December 31, 2019, the company had generated electricity volume of 356,940 megawatt hours. It also trades in listed equity securities; and invests in unlisted equities. In addition, the company trades in solid, liquid, and gaseous fuels, as well as other related products; and bulk commodities derivatives. The company was formerly known as Rising Development Holdings Limited and changed its name to China Smarter Energy Group Holdings Limited in February 2015. China Smarter Energy Group Holdings Limited was incorporated in 1997 and is headquartered in Wan Chai, Hong Kong.",Utilities,HK,10/9/1997,China Smarter Energy Group Holdings Ltd,,,,0.088,824942850.0,China Smarter Energy Group Holdings Ltd,HKD,China Smarter Energy Group Holdings Ltd,China Smarter Energy Group Holdings Ltd,,China Smarter Energy Group Holdings Ltd,1004.hk,,,China Smarter Energy Group Holdings Ltd,,1
,,1005.HK,Matrix Holdings Ltd,HKD,HKSE,Consumer Durables & Apparel,"Matrix Holdings Limited, an investment holding company, manufactures and trades in toys and lighting products. It offers plastic, die-cast, and plush toys. The company also engages in the purchase and trading of toys; trading of lighting products; import and wholesale distribution of toys, and sale of accessories connected with its products; and provision of management services. It has operations in the United States, Europe, Canada, Mexico, South America, Australia, New Zealand, and internationally. The company was founded in 1979 and is headquartered in Kowloon, Hong Kong. Matrix Holdings Limited is a subsidiary of Smart Forest Limited.",Leisure Products,HK,2/18/1994,Matrix Holdings Ltd,,,,2.18,1648522620.0,Matrix Holdings Ltd,HKD,Matrix Holdings Ltd,Matrix Holdings Ltd,,Matrix Holdings Ltd,1005.hk,,,Matrix Holdings Ltd,,1
,,1006.HK,Changshouhua Food Co Ltd,HKD,HKSE,"Food, Beverage & Tobacco","Changshouhua Food Company Limited, an investment holding company, produces and sells branded and non-branded corn oil primarily in the People's Republic of China. It operates through Own Brand Products, Non-Branded Products, and Corn Meal segments. The company also offers refined edible sunflower seed oil, olive oil, peanut oil, and rice germ oil; and crude sunflower seed oil and corn meal. In addition, it offers condiment products, including soy sauce, cooking wine, vinegar, sesame oil, and soybean paste, as well as rice and noodle products, mixed grains and cereals, and wheat flour. The company markets its products, principally under the Longevity Flower brand. As of December 31, 2019, it served customers through a network of approximately 1,410 wholesale distributors and 150 retailers. The company was formerly known as China Corn Oil Company Limited and changed its name to Changshouhua Food Company Limited in June 2012. The company was incorporated in 2009 and is headquartered in Central, Hong Kong. Changshouhua Food Company Limited is a subsidiary of Zouping Sanxing Grease Industry Company Limited.",Food Products,HK,12/18/2009,Changshouhua Food Co Ltd,,,,4.17,2391745280.0,Changshouhua Food Co Ltd,HKD,Changshouhua Food Co Ltd,Changshouhua Food Co Ltd,,Changshouhua Food Co Ltd,1006.hk,,,Changshouhua Food Co Ltd,,1
,,1007.HK,Longhui International Holdings Ltd,HKD,HKSE,Consumer Services,"Longhui International Holdings Limited, an investment holding company, primarily engages in the hotpot restaurant business in the People's Republic of China. The company owns three brands, including Faigo, Xiao Faigo Hotpot, and Hong Yuanwai. It also offers food and beverage service. As of December 31, 2019, it owned and operated 77 restaurants in the People's Republic of China. Longhui International Holdings Limited is based in Central, Hong Kong.","Hotels, Restaurants & Leisure",CN,10/28/2010,Longhui International Holdings Ltd,,,,0.157,52701132.0,Longhui International Holdings Ltd,HKD,Longhui International Holdings Ltd,Longhui International Holdings Ltd,,Longhui International Holdings Ltd,1007.hk,,,Longhui International Holdings Ltd,,1
,,1008.HK,Brilliant Circle Holdings International Ltd,HKD,HKSE,Commercial  & Professional Services,"Brilliant Circle Holdings International Limited, an investment holding company, operates in the printing and packaging industry in the People's Republic of China. It operates in three segments: Printing and Manufacturing of Cigarette Packages and Related Materials; Manufacturing of Laminated Papers; and Sales of RFID Products. It is involved in the manufacturing of paper packaging materials, laminated papers, and radio frequency identification products; printing of packages and decoration matters; research and development on printing technology; and wholesale, import, and export of the packaging products and other related services. The company was founded in 1990 and is headquartered in Wan Chai, Hong Kong.",Commercial Services & Supplies,CN,3/30/2009,Brilliant Circle Holdings International Ltd,,,,0.39,611473150.0,Brilliant Circle Holdings International Ltd,HKD,Brilliant Circle Holdings International Ltd,Brilliant Circle Holdings International Ltd,,Brilliant Circle Holdings International Ltd,1008.hk,,,Brilliant Circle Holdings International Ltd,,1
,,1009.HK,International Entertainment Corp,HKD,HKSE,Real Estate,"International Entertainment Corporation, an investment holding company, leases investment properties equipped with entertainment equipment in the Philippines, the United Kingdom, and internationally. The company operates through Hotel, Leasing, and Live Events segments. It also operates hotels in Metro Manila that includes restaurants, business centers, conference rooms, swimming pool, music bar, and fitness centers; and live poker events. The company was formerly known as Cyber On-Air Group Company Limited and changed its name to International Entertainment Corporation in December 2004. The company was founded in 1998 and is headquartered in Central, Hong Kong. International Entertainment Corporation is a subsidiary of Brighten Path Limited.",Real Estate,HK,7/31/2000,International Entertainment Corp,,,,0.41,561355580.0,International Entertainment Corp,HKD,International Entertainment Corp,International Entertainment Corp,,International Entertainment Corp,1009.hk,,,International Entertainment Corp,,1
,,1010.HK,PacRay International Holdings Ltd,HKD,HKSE,Semiconductors & Semiconductor Equipment,"PacRay International Holdings Limited, an investment holding company, designs, distributes, and trades in integrated circuits and semiconductor parts. The company offers agency services related to integrated circuits and semiconductor parts. Its integrated circuits are used in industrial and household measuring tools and display products. In addition, the company offers finance leasing and money lending services; aircraft business management and yacht management services; and distributes and sells construction materials. It has operations in the People's Republic of China, Hong Kong, and Taiwan. The company was formerly known as PacMOS Technologies Holdings Limited and changed its name to PacRay International Holdings Limited in December 2015. PacRay International Holdings Limited is based in Central, Hong Kong.",Semiconductors,HK,2/18/1994,PacRay International Holdings Ltd,,,,1.34,496128288.0,PacRay International Holdings Ltd,HKD,PacRay International Holdings Ltd,PacRay International Holdings Ltd,,PacRay International Holdings Ltd,1010.hk,,,PacRay International Holdings Ltd,,1
,,1011.HK,China NT Pharma Group Company Ltd,HKD,HKSE,"Pharmaceuticals, Biotechnology & Life Sciences","China NT Pharma Group Company Limited, together with its subsidiaries, researches and develops, manufactures, sells, and distributes pharmaceutical products in the People's Republic of China and internationally. It operates through two segments, Proprietary Products Production and Sales, and Miacalcic. The Proprietary Products Production and Sales segment is involved in the production and sale of NT branded products and generic drugs. The Miacalcic segment engages in selling and marketing Miacalcic brand products for the treatment of bone pains caused by osteolysis and lower bone mass, osteoporosis, Paget's disease, hypercalcemia, and reflex sympathetic dystrophy syndrome. This segment also sub-licenses intellectual property and distribution rights of Miacalcic Injection and Miacalcic Nasal Spray. The company is also involved in the trading of prescription medicines; provision of logistics and consulting services; and marketing and promotion services. China NT Pharma Group Company Limited was founded in 1995 and is headquartered in Shanghai, the People's Republic of China.",Pharmaceuticals,CN,4/20/2011,China NT Pharma Group Company Ltd,,,,0.128,243793936.0,China NT Pharma Group Company Ltd,HKD,China NT Pharma Group Company Ltd,China NT Pharma Group Company Ltd,,China NT Pharma Group Company Ltd,1011.hk,,,China NT Pharma Group Company Ltd,,1
,,1013.HK,Wai Chun Group Holdings Ltd,HKD,HKSE,Technology Hardware & Equipment,"Wai Chun Group Holdings Limited, an investment holding company, engages in the sale and service, and provision of integration services of computer and communication systems in the People's Republic of China and Hong Kong. The company operates through three segments: Sales and Integration Services, Services Income, and General Trading. It is also involved in the design, consultation, and production of information system software; and the provision of management training services. In addition, it engages in the real estate investment and development business; provision of software solutions and services; and trading of mobiles, electronic components, plastic resins, and chemicals. The company was formerly known as Wai Chun Group Limited and changed its name to Wai Chun Group Holdings Limited in November 2008.The company was incorporated in 1996 and is headquartered in Admiralty, Hong Kong. Wai Chun Group Holdings Limited is a subsidiary of Ka Chun Holdings Limited.",Electrical Equipment,HK,2/3/1997,Wai Chun Group Holdings Ltd,,,,0.112,239581440.0,Wai Chun Group Holdings Ltd,HKD,Wai Chun Group Holdings Ltd,Wai Chun Group Holdings Ltd,,Wai Chun Group Holdings Ltd,1013.hk,,,Wai Chun Group Holdings Ltd,,1
,,1020.HK,Cybernaut International Holdings Co Ltd,HKD,HKSE,Materials,"Cybernaut International Holdings Company Limited, an investment holding company, manufactures and sells paper converting equipment and other relating equipment in the People's Republic of China, Europe, North America, Hong Kong, and the rest of Asia. The company provides money lending and Internet education services; and e-commerce solutions and related support services. In addition, it is involved in the sale of information technology products. The company was formerly known as Sinoref Holdings Limited and changed its name to Cybernaut International Holdings Company Limited in May 2017. Cybernaut International Holdings Company Limited was founded in 2005 and is headquartered in Wanchai, the People's Republic of China.",Metals & Mining,CN,7/7/2010,Cybernaut International Holdings Co Ltd,,,,0.094,373692288.0,Cybernaut International Holdings Co Ltd,HKD,Cybernaut International Holdings Co Ltd,Cybernaut International Holdings Co Ltd,,Cybernaut International Holdings Co Ltd,1020.hk,,,Cybernaut International Holdings Co Ltd,,1
