Unnamed: 0,index,symbol,long name,currency,exchange,industry,description,sector,country,ipo date,shorter name,Type,Industries,Similar Companies,price,mktCap,name raw,currency symbol,robinhood name,short name,Warrant,shortest name,url name, smart_order ,random csv equations,pure name,shortest - pure diff,first_letter
,,8366.HK,Zhejiang United Investment Holdings Group Ltd,HKD,HKSE,Capital Goods,"Zhejiang United Investment Holdings Group Limited, an investment holding company, undertakes slope works, foundation works, and other general building works in Hong Kong. The company provides consultancy services related to the management of projects, as well as develops 5G communication and related services. It serves government departments, such as civil engineering and development department, lands department, and architectural services department; other statutory bodies, including housing authorities; and private corporations and other entities in the private sector. The company was formerly known as Fraser Holdings Limited and changed its name to Zhejiang United Investment Holdings Group Limited in September 2017. Zhejiang United Investment Holdings Group Limited was incorporated in 2015 and is headquartered in Admiralty, Hong Kong.",Construction,HK,11/2/2015,Zhejiang United Investment Holdings Group Ltd,,,,0.175,276009984.0,Zhejiang United Investment Holdings Group Ltd,HKD,Zhejiang United Investment Holdings Group Ltd,Zhejiang United Investment Holdings Group Ltd,,Zhejiang United Investment Holdings Group Ltd,8366.hk,,,Zhejiang United Investment Holdings Group Ltd,,8
,,8367.HK,Simplicity Holding Ltd,HKD,HKSE,Consumer Services,"Simplicity Holding Limited, an investment holding company, operates casual dining full service restaurants in Hong Kong. It also engages in the property investment activities. As of March 31, 2020, the company operated 5 Marsino restaurants, 4 Grand Avenue restaurants, and 3 Baba Nyonya restaurants. The company was founded in 2003 and is headquartered in Kwai Chung, Hong Kong. Simplicity Holding Limited is a subsidiary of Marvel Jumbo Limited.","Hotels, Restaurants & Leisure",HK,2/26/2018,Simplicity Holding Ltd,,,,0.1,96000000.0,Simplicity Holding Ltd,HKD,Simplicity Holding Ltd,Simplicity Holding Ltd,,Simplicity Holding Ltd,8367.hk,,,Simplicity Holding Ltd,,8
,,8368.HK,Creative China Holdings Ltd,HKD,HKSE,Media & Entertainment,"Creative China Holdings Limited, an investment holding company, primarily provides traditional television program production, serial program rights distribution and licensing, and related services in the People's Republic of China. The company operates through Program Production; Concert and Event Organisation; Mobile Live Broadcasting and E-commerce; and Artist Management segments. It also offers concert and event organization services, such as music concerts, prize presentation ceremony, automobile shows, university alumni, and other performance events. In addition, the company provides an electronic platform for entertainment contents consumption and e-commerce services, such as an online store; and online program production and related services. Further, it offers agency services for the artists for arranging various performance activities. The company was founded in 2002 and is headquartered in Beijing, the People's Republic of China.",Media,CN,11/18/2015,Creative China Holdings Ltd,,,,0.084,132852720.0,Creative China Holdings Ltd,HKD,Creative China Holdings Ltd,Creative China Holdings Ltd,,Creative China Holdings Ltd,8368.hk,,,Creative China Holdings Ltd,,8
,,8370.HK,Zhi Sheng Group Holdings Ltd,HKD,HKSE,Commercial  & Professional Services,"Zhi Sheng Group Holdings Limited, an investment holding company, primarily manufactures and sells office furniture products in the People's Republic of China. It trades in carpets, curtains and drapes, wallpapers, floorboards, and panels. The company also engages in the data center business. It serves governmental departments, financial institutions, and other entities. The company was formerly known as Smart Raise International Holdings Limited and changed its name to Zhi Sheng Group Holdings Limited in April 2016. The company was founded in 1996 and is headquartered in Chengdu, the People's Republic of China.",Commercial Services & Supplies,CN,1/20/2017,Zhi Sheng Group Holdings Ltd,,,,0.29,263126560.0,Zhi Sheng Group Holdings Ltd,HKD,Zhi Sheng Group Holdings Ltd,Zhi Sheng Group Holdings Ltd,,Zhi Sheng Group Holdings Ltd,8370.hk,,,Zhi Sheng Group Holdings Ltd,,8
,,8371.HK,Taste Gourmet Group Ltd,HKD,HKSE,Consumer Services,"Taste Gourmet Group Limited, an investment holding company, operates restaurants in Hong Kong. The company operates 30 restaurants under the La'taste, Nabe Urawa, Dab-Pa, Say Cheese, Sweetology, Urawa, Sweetology Takano Ramen, Tirpse, and Rakuraku Ramen, Parkview, The Pho, and Madam Saigon brands. It offers Vietnamese, Japanese, Chinese, and Western cuisines. The company also provides management services. It serves customers in mid-to-high-end market segment. The company was incorporated in 2017 and is headquartered in Sheung Wan, Hong Kong. Taste Gourmet Group Limited is a subsidiary of IKEAB Limited.","Hotels, Restaurants & Leisure",HK,1/15/2018,Taste Gourmet Group Ltd,,,,1.2,464318432.0,Taste Gourmet Group Ltd,HKD,Taste Gourmet Group Ltd,Taste Gourmet Group Ltd,,Taste Gourmet Group Ltd,8371.hk,,,Taste Gourmet Group Ltd,,8
,,8372.HK,Grand Brilliance Group Holdings Ltd,HKD,HKSE,Health Care Equipment & Services,"Grand Brilliance Group Holdings Limited, an investment holding company, engages in supplying of medical devices in Hong Kong. The company offers medical consumables; medical instruments; and medical equipment, as well as develops healthcare products. In addition, it provides medical device solutions, such as market trend analysis, sourcing of medical devices, after-sale services, technical support and training services, medical devices leasing services, and quality assurance services; and holds trademarks, as well as provides maintenance services. Grand Brilliance Group Holdings Limited sells its products to various private hospitals, public hospitals, private clinics, non-profit organizations, universities, and individual end-users. The company was founded in 1997 and is based in Tsuen Wan, Hong Kong. Grand Brilliance Group Holdings Limited is a subsidiary of B&A Success Limited.",Health Care,HK,3/29/2018,Grand Brilliance Group Holdings Ltd,,,,0.072,57599996.0,Grand Brilliance Group Holdings Ltd,HKD,Grand Brilliance Group Holdings Ltd,Grand Brilliance Group Holdings Ltd,,Grand Brilliance Group Holdings Ltd,8372.hk,,,Grand Brilliance Group Holdings Ltd,,8
,,8373.HK,Indigo Star Holdings Ltd,HKD,HKSE,Capital Goods,"Indigo Star Holdings Limited, an investment holding company, operates as a subcontractor for structural reinforced and concrete works in Singapore. It undertakes reinforced concrete works, including steel reinforced, formwork erection, and concrete works of general building and civil engineering projects. The company was founded in 1996 and is headquartered in Singapore. Indigo Star Holdings Limited is a subsidiary of Amber Capital Holdings Limited.",Construction,SG,11/16/2017,Indigo Star Holdings Ltd,,,,0.3,120000008.0,Indigo Star Holdings Ltd,HKD,Indigo Star Holdings Ltd,Indigo Star Holdings Ltd,,Indigo Star Holdings Ltd,8373.hk,,,Indigo Star Holdings Ltd,,8
,,8375.HK,Vertical International Holdings Ltd,HKD,HKSE,Technology Hardware & Equipment,"VERTICAL INTERNATIONAL HOLDINGS LIMITED is a company principally engaged in the manufacture and distribution of chip type and radial lead type aluminum electrolytic capacitors. The Company's core business is also complemented by the trading of a wider range of electronic components including integrated circuits and semi-conductors such as diodes and transistors; and Light emitting diode (LED) and LED lighting products. The aluminum electrolytic capacitors that Company manufactures are used in a variety of electronic products ranging from household appliances, audio/visual equipment, personal computers, automotive electronic products, communications equipment and toys.",Electrical Equipment,HK,11/13/2017,Vertical International Holdings Ltd,,,,0.062,49600000.0,Vertical International Holdings Ltd,HKD,Vertical International Holdings Ltd,Vertical International Holdings Ltd,,Vertical International Holdings Ltd,8375.hk,,,Vertical International Holdings Ltd,,8
,,8377.HK,Shen You Holdings Ltd,HKD,HKSE,Consumer Durables & Apparel,"Shen You Holdings Ltd. is an investment company which engages in the manufacture and sale of sewing threads. The company employs 175 full-time employees The Company’s products include 100% spun polyester sewing threads, textured polyester series, elastic filament sewing threads and weft yarn. 100% spun polyester sewing threads is Company’s core product for sale. This type of sewing threads has high strength and elongation, excellent chemical resistance, good color fastness, abrasion and UV resistance. The firm provides polyester sewing threads to customers in the China, Hong Kong and overseas countries, including United Arab Emirates, Mauritius, Australia, Germany and the United Kingdom. The Company’s customers are mainly garment manufacturers and wholesalers.","Textiles, Apparel & Luxury Goods",HK,12/15/2017,Shen You Holdings Ltd,,,,0.34,104530272.0,Shen You Holdings Ltd,HKD,Shen You Holdings Ltd,Shen You Holdings Ltd,,Shen You Holdings Ltd,8377.hk,,,Shen You Holdings Ltd,,8
,,8379.HK,Prime Intelligence Solutions Group Ltd,HKD,HKSE,Technology Hardware & Equipment,"Prime Intelligence Solutions Group Limited, an investment holding company, distributes biometrics identification devices and security products in Hong Kong, Macau, and the People's Republic of China. Its biometrics identification device functions include face identification, fingerprint identification, finger vein identification, hand geometry identification, and iris identification. The company also provides other devices and accessories; and auxiliary and other services, including maintenance, installation, and solution services. In addition, it offers application software, and repair and maintenance services; and engages in software licensing activities. The company was founded in 1999 and is headquartered in Kwai Chung, Hong Kong.",Electrical Equipment,HK,2/14/2018,Prime Intelligence Solutions Group Ltd,,,,0.052,41600000.0,Prime Intelligence Solutions Group Ltd,HKD,Prime Intelligence Solutions Group Ltd,Prime Intelligence Solutions Group Ltd,,Prime Intelligence Solutions Group Ltd,8379.hk,,,Prime Intelligence Solutions Group Ltd,,8
,,8383.HK,Linocraft Holdings Ltd,HKD,HKSE,Commercial  & Professional Services,"Linocraft Holdings Limited, an investment holding company, provides integrated offset printing and packaging solutions to direct customers and contract manufacturers in Malaysia, Singapore, and the Philippines. Its products include packaging boxes, rigid boxes, paper-board inserts, instruction manuals and books, and printed labels, as well as blister packs and box fillers, folding cartons, and case covers. The company was founded in 1972 and is headquartered in Johor Bahru, Malaysia. Linocraft Holdings Limited is a subsidiary of Linocraft Investment Pte Limited.",Commercial Services & Supplies,MY,9/15/2017,Linocraft Holdings Ltd,,,,0.178,143199936.0,Linocraft Holdings Ltd,HKD,Linocraft Holdings Ltd,Linocraft Holdings Ltd,,Linocraft Holdings Ltd,8383.hk,,,Linocraft Holdings Ltd,,8
,,8385.HK,Prosperous Printing Co Ltd,HKD,HKSE,Commercial  & Professional Services,"Prosperous Printing Company Limited, together with its subsidiaries, produces and sells books and paper products to print brokers and publishers in Hong Kong, the United States, the United Kingdom, Australia, and other European countries. The company offers case and soft bound book; saddle stitch book, handcraft products, silk screening, finishing, and cut and stamp products, as well as offers accessories and others. It is also involved in the property investment activities. The company offers its products through sales representatives. The company was founded in 1992 and is headquartered in Chai Wan, Hong Kong. Prosperous Printing Company Limited is a subsidiary of First Tech Inc.",Commercial Services & Supplies,HK,12/13/2017,Prosperous Printing Co Ltd,,,,0.185,148000000.0,Prosperous Printing Co Ltd,HKD,Prosperous Printing Co Ltd,Prosperous Printing Co Ltd,,Prosperous Printing Co Ltd,8385.hk,,,Prosperous Printing Co Ltd,,8
,,8391.HK,Elegance Commercial and Financial Printing Group Ltd,HKD,HKSE,Commercial  & Professional Services,"Elegance Commercial and Financial Printing Group Limited, an investment holding company, provides printing, typesetting, and translation services in Hong Kong. It offers commercial printing, financial printing, secured data printing, lettershopping and direct mailing, digital printing, and book printing services, as well as document solutions. The company prints direct mailing materials, promotional and marketing materials, textbooks and related publication materials, financial reporting documents, compliance documents, initial public offerings prospectuses, and application forms. It also provides ad hoc design and/or translation, marketing and media, courier, and machineries subletting services; and sells paper and accessories. Elegance Commercial and Financial Printing Group Limited offers its services to banks, insurance companies, corporate customers, and their advertising agents and fund houses; listed companies and listing applicants; and book publishers. The company was founded in 1980 and is headquartered in Central, Hong Kong. As of November 19, 2019, Elegance Commercial and Financial Printing Group Limited operates as a subsidiary of Global Fortune Global Limited.",Commercial Services & Supplies,HK,5/11/2018,Elegance Commercial and Financial Printing Group Ltd,,,,0.62,328702944.0,Elegance Commercial and Financial Printing Group Ltd,HKD,Elegance Commercial and Financial Printing Group Ltd,Elegance Commercial and Financial Printing Group Ltd,,Elegance Commercial and Financial Printing Group Ltd,8391.hk,,,Elegance Commercial and Financial Printing Group Ltd,,8
,,8501.HK,Sanbase Corporation Ltd,HKD,HKSE,Capital Goods,"Sanbase Corporation Limited, an investment holding company, provides interior fit-out solutions in Hong Kong and the People's Republic of China. It undertakes bare shell fit-out, restacking, reinstatement, design, churn works, and maintenance and other services. The company was founded in 2009 and is headquartered in Central, Hong Kong. Sanbase Corporation Limited is a subsidiary of Madison Square International Investment Limited.",Construction,HK,1/4/2018,Sanbase Corporation Ltd,,,,0.58,116000000.0,Sanbase Corporation Ltd,HKD,Sanbase Corporation Ltd,Sanbase Corporation Ltd,,Sanbase Corporation Ltd,8501.hk,,,Sanbase Corporation Ltd,,8
,,8400.HK,Asia Pioneer Entertainment Holdings Ltd,HKD,HKSE,Capital Goods,"Asia Pioneer Entertainment Holdings Limited, an investment holding company, procures, distributes, installs, and repairs electronic gaming equipment (EGM) and its spare parts for casino operators in Macau special administrative region, Cambodia, the Philippines, and internationally. The company provides regulatory, product design and content, localization, and on-site consultancy services to manufacturers of electronic gaming equipment, as well as technical services. It also sells refurbished EGMs, as well as leases electronic gaming equipment. The company was founded in 2005 and is headquartered in Macau. Asia Pioneer Entertainment Holdings Limited is a subsidiary of APE HAT Holdings Limited.",Trading Companies & Distributors,MO,11/15/2017,Asia Pioneer Entertainment Holdings Ltd,,,,0.039,39000000.0,Asia Pioneer Entertainment Holdings Ltd,HKD,Asia Pioneer Entertainment Holdings Ltd,Asia Pioneer Entertainment Holdings Ltd,,Asia Pioneer Entertainment Holdings Ltd,8400.hk,,,Asia Pioneer Entertainment Holdings Ltd,,8
,,8401.HK,Stream Ideas Group Ltd,HKD,HKSE,Media & Entertainment,"Stream Ideas Group Limited, a digital media company, provides online advertising services to brand owners and advertising agencies. Its online advertising services include social viral, engager, and mass blogging services. The company provides its services in Hong Kong, Taiwan, Malaysia, and Singapore. Stream Ideas Group Limited was founded in 2010 and is headquartered in Kwun Tong, Hong Kong. Stream Ideas Group Limited is a subsidiary of Jag United Company Limited.",Media,HK,3/28/2018,Stream Ideas Group Ltd,,,,2.9,580000000.0,Stream Ideas Group Ltd,HKD,Stream Ideas Group Ltd,Stream Ideas Group Ltd,,Stream Ideas Group Ltd,8401.hk,,,Stream Ideas Group Ltd,,8
,,8402.HK,GT Steel Construction Group Ltd,HKD,HKSE,Capital Goods,"GT Steel Construction Group Limited, an investment holding company, designs, supplies, fabricates, and erects structural steel works in Singapore and Malaysia. The company offers steel structures for the construction of buildings, including technological plants, industrial buildings, commercial buildings, government institutions, residential buildings, data centers, and aerospace, as well as energy, newater, water treatment, metal recovery, and cement plants. It also provides pre-fabricated steel structures or on-site installation services, as well as auxiliary services for structural steel works projects. The company was founded in 2003 and is headquartered in Singapore.",Construction,SG,11/17/2017,GT Steel Construction Group Ltd,,,,0.6,288000000.0,GT Steel Construction Group Ltd,HKD,GT Steel Construction Group Ltd,GT Steel Construction Group Ltd,,GT Steel Construction Group Ltd,8402.hk,,,GT Steel Construction Group Ltd,,8
,,8403.HK,Dowway Holdings Ltd,HKD,HKSE,Media & Entertainment,"Dowway Holdings Limited, an investment holding company, operates as an integrated exhibition and event management company in the People's Republic of China. The company is involved in the design, planning, coordination, and management of exhibitions and events. It provides integrated exhibition and event management services to domestic and overseas automobile brands, primarily for facilitating showcases, promotion, and/or sales of their branded cars; and undertakes projects related to automobile exhibitions and events from non-automobile companies. Dowway Holdings Limited was founded in 2002 and is headquartered in Beijing, China.",Media,CN,6/12/2018,Dowway Holdings Ltd,,,,0.041,82000000.0,Dowway Holdings Ltd,HKD,Dowway Holdings Ltd,Dowway Holdings Ltd,,Dowway Holdings Ltd,8403.hk,,,Dowway Holdings Ltd,,8
,,8405.HK,Hang Chi Holdings Ltd,HKD,HKSE,Health Care Equipment & Services,"Hang Chi Holdings Limited, an investment holding company, operates elderly residential care homes under the Shui On, Shui Hing, Shui Jun, and Guardian Home brand names in Hong Kong. It offers residential care home services to elderly residents, including the provision of accommodation with dietician-managed meal plans, 24-hour nursing, and caretaking assistance, as well as professional services comprising regular medical consultation, physiotherapy, occupational therapy, psychological, and social care services. The company also sells healthcare and medical consumable products, such as adult nappies, nutritional milk, other medical consumable products, and daily supplies; and provides customizable add-on healthcare services to the elderly residents. It operates 1,085 residential care places. The company is headquartered in Kowloon Bay, Hong Kong. Hang Chi Holdings Limited is a subsidiary of Shui Wah Limited.",Health Care,HK,7/12/2017,Hang Chi Holdings Ltd,,,,0.96,384000000.0,Hang Chi Holdings Ltd,HKD,Hang Chi Holdings Ltd,Hang Chi Holdings Ltd,,Hang Chi Holdings Ltd,8405.hk,,,Hang Chi Holdings Ltd,,8
,,8406.HK,Alpha Era International Holdings Ltd,HKD,HKSE,Consumer Durables & Apparel,"ALPHA ERA INTERNATIONAL HOLDINGS LIMITED is an investment holding company. The Company and its subsidiaries are principally engaged in the manufacturing and sales of inflatable products and related accessories. The Company’s main products include inflatable playgrounds with air blowers, mini inflatable playgrounds, inflatable tents, inflatable ball pools, polyvinyl chloride (PVC) laminated oxford, plastic nails and other accessories. Through its subsidiaries, the Company is also engaged in subcontracting work, which includes cutting of materials and sewing work performed by the Company for other manufacturers.",Leisure Products,CN,12/7/2017,Alpha Era International Holdings Ltd,,,,0.238,190400000.0,Alpha Era International Holdings Ltd,HKD,Alpha Era International Holdings Ltd,Alpha Era International Holdings Ltd,,Alpha Era International Holdings Ltd,8406.hk,,,Alpha Era International Holdings Ltd,,8
,,8411.HK,K W Nelson Interior Design and Contracting Group Ltd,HKD,HKSE,Consumer Services,"K W Nelson Interior Design and Contracting Group Limited provides interior design and project management services, and fitting-out works for office and retail spaces in the People's Republic of China. It offers pre-lease advisory, space planning, construction, maintenance for tailor made sections, and after sales services. The company offers services for design and decoration projects; and other interior design and fitting-out services. It serves multi-national companies from various industries, such as banking, retail, healthcare, legal services, catering, education, energy, insurance, telecommunications, property management, and logistics management. The company was formerly known as K W Nelson Interior Architect Group Limited and changed its name to K W Nelson Interior Design and Contracting Group Limited in August 2017. K W Nelson Interior Design and Contracting Group Limited was founded in 2009 and is headquartered in Quarry Bay, Hong Kong.",Diversified Consumer Services,HK,12/8/2016,K W Nelson Interior Design and Contracting Group Ltd,,,,0.2,200000000.0,K W Nelson Interior Design and Contracting Group Ltd,HKD,K W Nelson Interior Design and Contracting Group Ltd,K W Nelson Interior Design and Contracting Group Ltd,,K W Nelson Interior Design and Contracting Group Ltd,8411.hk,,,K W Nelson Interior Design and Contracting Group Ltd,,8
,,8413.HK,Asia Grocery Distribution Ltd,HKD,HKSE,Food & Staples Retailing,"Asia Grocery Distribution Limited, an investment holding company, trades in and distributes food and beverage groceries in Hong Kong. The company offers commodities and cereal products, such as rice, wheat flour, noodle products, edible oil, sugar, and salt; and packaged food products, including meat and vegetables in preserved, canned, frozen, and other forms, as well as snacks and pre-packaged food items. It also provides sauces and condiments; dairy products and eggs; beverages and wines; and kitchen products comprising cling films, baking sheets, foils, detergents, bleach products, liquid soaps, tissue papers, toothpicks, and towels. In addition, the company offers product sourcing, repackaging, quality assurance, warehousing and storage, transportation, and other value-added services. Its customers include restaurants, non-commercial dining establishments, hotels and private clubs, food processing operators, and wholesalers. The company was founded in 1975 and is headquartered in Kowloon, Hong Kong. Asia Grocery Distribution Limited is a subsidiary of Sky Alpha Investments Limited.",Retail,HK,4/13/2017,Asia Grocery Distribution Ltd,,,,0.285,331169984.0,Asia Grocery Distribution Ltd,HKD,Asia Grocery Distribution Ltd,Asia Grocery Distribution Ltd,,Asia Grocery Distribution Ltd,8413.hk,,,Asia Grocery Distribution Ltd,,8
,,8416.HK,HM International Holdings Ltd,HKD,HKSE,Commercial  & Professional Services,"HM International Holdings Limited, an investment holding company, provides integrated printing services for corporate clients in the financial and capital markets in Hong Kong. It offers concept creation and artwork design, IT, and languages services, as well as procurement and translation services. The company also provides value-added media services, such as website design, video production, e-book and APP production, and electronic marketing presentation material production. It serves corporations and multinational financial institutions, such as fund houses and insurance companies, education organizations, and private companies in hospitality, marketing and advertising, and legal sectors. HM International Holdings Limited was founded in 2000 and is headquartered in Central, Hong Kong. HM International Holdings Limited is a subsidiary of HM Ultimate Holdings Limited.",Commercial Services & Supplies,HK,1/11/2017,HM International Holdings Ltd,,,,0.09,36000000.0,HM International Holdings Ltd,HKD,HM International Holdings Ltd,HM International Holdings Ltd,,HM International Holdings Ltd,8416.hk,,,HM International Holdings Ltd,,8
,,8417.HK,Dadi Education Holdings Ltd,HKD,HKSE,Consumer Services,"Dadi Education Holdings Limited, an investment holding company, provides overseas studies consultancy services in Hong Kong. The company also provides education information technology services. It serves students seeking secondary and higher education studies in the United Kingdom, Australia, Canada, New Zealand, the United States, and internationally. The company was founded in 1990 and is headquartered in Mong Kok, Hong Kong. Dadi Education Holdings Limited is a subsidiary of Grand Courage Investments Limited.",Diversified Consumer Services,HK,2/16/2017,Dadi Education Holdings Ltd,,,,0.035,61264000.0,Dadi Education Holdings Ltd,HKD,Dadi Education Holdings Ltd,Dadi Education Holdings Ltd,,Dadi Education Holdings Ltd,8417.hk,,,Dadi Education Holdings Ltd,,8
