Unnamed: 0,index,symbol,long name,currency,exchange,industry,description,sector,country,ipo date,shorter name,Type,Industries,Similar Companies,price,mktCap,name raw,currency symbol,robinhood name,short name,Warrant,shortest name,url name, smart_order ,random csv equations,pure name,shortest - pure diff,first_letter
,,1200.HK,Midland Holdings Ltd,HKD,HKSE,Real Estate,"Midland Holdings Limited, an investment holding company, provides property agency services in the Hong Kong, Macau, and the People's Republic of China. The company offers residential property agency services; and money lending, project planning, commercial property management, and marketing and sales planning services, as well as surveying, leasing, and property management services. It also provides immigration consultancy services; surveying consultancy services, including valuation advisory, development study, sales, marketing, tender, and auction for projects; and operates internet website. In addition, the company offers property investment services; and overseas property projects' marketing and referral services in Hong Kong. Midland Holdings Limited was founded in 1973 and is headquartered in Central, Hong Kong.",Real Estate,HK,6/8/1995,Midland Holdings Ltd,,,,0.86,617519620.0,Midland Holdings Ltd,HKD,Midland Holdings Ltd,Midland Holdings Ltd,,Midland Holdings Ltd,1200.hk,,,Midland Holdings Ltd,,1
,,1201.HK,Tesson Holdings Ltd,HKD,HKSE,Capital Goods,"Tesson Holdings Limited, an investment holding company, engages in the lithium-ion motive battery business in the People's Republic of China. It operates through Lithium Ion Motive Battery Business, and Property and Cultural Business. The company manufactures, sells, and trades in lithium-ion motive batteries, lithium-ion battery modules, battery charging devices, and battery material machines and production lines. It also provides new energy solutions and related equipment, such as electric passenger car power battery, electric logistics vehicle power battery, electric passenger car power battery, electric tool power battery, garden tool power battery, industrial energy storage, and home energy storage systems for the use in new energy vehicles, energy storage, aerospace, military equipment, electric motorcycle and special vehicle, and electric equipment applications. In addition, the company is involved in the sale of equipment; import and export trading activities; and operation of research and development center. Further, it engages in the planning and organization of cultural events, performance creativity and execution, creation and shooting of documentary film and TV works, museum creative planning, design and construction, execution of the combination of cultural, business, and tourism, etc., as well as event production and themed museums, and architectural design and engineering businesses; property holding activities; and property development activities comprising industrial residential projects. The company was formerly known as Kith Holdings Limited and changed its name to Tesson Holdings Limited in June 2015. Tesson Holdings Limited was founded in 1982 and is headquartered in Tsim Sha Tsui, Hong Kong. Tesson Holdings Limited is a subsidiary of Double Key International Limited.",Electrical Equipment,HK,6/23/1998,Tesson Holdings Ltd,,,,0.42,502525792.0,Tesson Holdings Ltd,HKD,Tesson Holdings Ltd,Tesson Holdings Ltd,,Tesson Holdings Ltd,1201.hk,,,Tesson Holdings Ltd,,1
,,1210.HK,Christine International Holdings Ltd,HKD,HKSE,Food & Staples Retailing,"Christine International Holdings Limited, an investment holding company, operates a chain of bakeries in the People's Republic of China. It produces and sells bakery products, including breads and cakes, moon cakes, pastries, and other products. The company operates a multi-channel retail network that comprises neighbor stores, subway stores, flagship stores, and European style fresh-bake stores. It operates approximately 476 stores. The company was founded in 1993 and is headquartered in Shanghai, the People's Republic of China.",Retail,CN,2/23/2012,Christine International Holdings Ltd,,,,0.191,192946288.0,Christine International Holdings Ltd,HKD,Christine International Holdings Ltd,Christine International Holdings Ltd,,Christine International Holdings Ltd,1210.hk,,,Christine International Holdings Ltd,,1
,,1203.HK,GDH Guangnan Holdings Ltd,HKD,HKSE,Materials,"GDH Guangnan (Holdings) Limited, an investment holding company, manufactures and sells tinplates and related products primarily in Hong Kong and Mainland China. It operates through three divisions: Tinplating, Fresh and Live Foodstuffs, and Property Leasing. The Tinplating division offers tinplates and tin-free steel; and processed products, such as coated/printed tinplate/tin-free steel, as well as cold-rolled steel plates. Its tinplate and tin-free steel products are used in food, light, and chemical industries. It is also involved in the research and development, production, and sale of tinplated steel sheets, chrome-plated steel sheets, and other processed products. The Fresh and Live Foodstuffs division is involved in the distribution of livestock and poultry, such as cattle and chicken; sale of live pigs; wholesale of poultry; and trading of foodstuffs, including chilled poultry and pork, frozen poultry, and rice and starch. The Property Leasing division leases offices and factory buildings. The company was formerly known as Guangnan (Holdings) Limited and changed its name to GDH Guangnan (Holdings) Limited in June 2020. GDH Guangnan (Holdings) Limited was incorporated in 1982 and is based in Wan Chai, Hong Kong. GDH Guangnan (Holdings) Limited is a subsidiary of GDH Limited.",Metals & Mining,HK,12/9/1994,GDH Guangnan Holdings Ltd,,,,0.7,635315140.0,GDH Guangnan Holdings Ltd,HKD,GDH Guangnan Holdings Ltd,GDH Guangnan Holdings Ltd,,GDH Guangnan Holdings Ltd,1203.hk,,,GDH Guangnan Holdings Ltd,,1
,,1205.HK,CITIC Resources Holdings Ltd,HKD,HKSE,Capital Goods,"CITIC Resources Holdings Limited, an investment holding company, engages in the exploration, development, and production of oil and coal. It operates in four segments: Aluminum Smelting, Coal, Import and Export of Commodities, and Crude Oil. The Aluminum smelting segment operates Portland aluminum smelter, which sources alumina and produces aluminum ingots in Australia. The Coal segment mines and sells coal in Australia. The Import and Export of Commodities segment exports various commodity products, such as aluminum ingots, coal, iron ore, alumina, and copper; and imports other commodities and manufactured goods, including steel, vehicle and industrial batteries, and tires in Australia. The Crude Oil segment explores, develops, and operates oilfields, as well as engages in the sale of oil in Indonesia and China. The company also engages in financing; oil technology development; and property holding activities, as well as provides consulting and management services. In addition, it is involved in the import of construction and building materials. The company was incorporated in 1997 and is headquartered in Kowloon, Hong Kong. CITIC Resources Holdings Limited operates as a subsidiary of CITIC Corporation Limited.",Trading Companies & Distributors,HK,9/8/1997,CITIC Resources Holdings Ltd,,,,0.335,2632339710.0,CITIC Resources Holdings Ltd,HKD,CITIC Resources Holdings Ltd,CITIC Resources Holdings Ltd,,CITIC Resources Holdings Ltd,1205.hk,,,CITIC Resources Holdings Ltd,,1
,,1206.HK,Technovator International Ltd,HKD,HKSE,Technology Hardware & Equipment,"Technovator International Limited, together with its subsidiaries, provides smart energy management products, solutions, and integrated services primarily in the People's Republic of China. The company's Smart Transportation segment offers a series of proprietary software and hardware products, and integrated supervision and control system for rail transit; and building automation systems for use in rail transit and safety door systems, as well as provides integrated solutions comprising planning, procurement, installation, commissioning, and aftersales services. Its Smart Building and Complex segment provides integrated intelligence solutions and efficiency management services, including integrated energy consumption monitoring, energy-saving consultation, and reformation services, as well as full life-cycle services; and supplies and integrates intelligence systems for buildings. The company's Smart Energy segment offers regional energy planning, integrated utilization of industrial waste heat recovery, heat pump, independent temperature and humidity control, and variable air rate technologies for energy cascade utilization, as well as optimization and transformation of energy systems. This segment also provides urban heating network technologies, including distributed variable frequency heating, cooling and heating network balancing, and combined multi-heat sources heating, as well as heating network and source monitoring, and optimal regulation technologies. The company also offers digital video urban surveillance systems for multi-level remote surveillance in the finance, electricity, security, and road traffic industries; and fire alarm systems, which offers online fire control solutions for city authorities and commercial users. The company was formerly known as Technovator Int Private Ltd. and changed its name to Technovator International Limited in September 2011. Technovator International Limited was founded in 2005 and is headquartered in Singapore.",Electrical Equipment,SG,10/27/2011,Technovator International Ltd,,,,0.71,555356290.0,Technovator International Ltd,HKD,Technovator International Ltd,Technovator International Ltd,,Technovator International Ltd,1206.hk,,,Technovator International Ltd,,1
,,1207.HK,SRE Group Ltd,HKD,HKSE,Real Estate,"SRE Group Limited, together with its subsidiaries, engages in the real estate development and investment activities primarily in Mainland China. The company's Property Development segment develops and sells residential and commercial properties. Its Property Leasing segment leases offices and commercial properties. The company is also involved in hospital operations; and the provision of real estate agency, factoring, property management, and construction and procurement management services, as well as the development of technology for housing. SRE Group Limited was founded in 1993 and is based in Admiralty, Hong Kong.",Real Estate,HK,12/10/1999,SRE Group Ltd,,,,0.044,904846780.0,SRE Group Ltd,HKD,SRE Group Ltd,SRE Group Ltd,,SRE Group Ltd,1207.hk,,,SRE Group Ltd,,1
,,1208.HK,MMG Ltd,HKD,HKSE,Materials,"MMG Limited, an investment holding company, engages in the exploration, development, and mining of copper, zinc, gold, silver, nickel, and lead deposits in Australia and internationally. It operates through Las Bambas, Kinsevere, Dugald River, Rosebery, and Other segments. The company operates the Las Bambas open-pit copper and molybdenum mine located in Cotabambas, Apurimac region of Peru; and the Kinsevere open-pit copper mine in the Katanga province of the Democratic Republic of the Congo. It also operates the Dugald River underground zinc mine located near Cloncurry in North West Queensland; and the Rosebery underground polymetallic base metal mine located on Tasmania's west coast. The company was formerly known as Minmetals Resources Limited and changed its name to MMG Limited in September 2012. MMG Limited was incorporated in 1988 and is headquartered in Southbank, Australia.",Metals & Mining,AU,12/15/1994,MMG Ltd,,,,4.41,35560653000.0,MMG Ltd,HKD,MMG Ltd,MMG Ltd,,MMG Ltd,1208.hk,,,MMG Ltd,,1
,,1275.HK,New Century Real Estate Investment Trust,HKD,HKSE,Real Estate,New Century Real Estate Investment Trust is a real estate investment trust externally managed by New Century Asset Management Ltd. It invests in the real estate properties of China. The firm mainly invests in the hospitality sector. New Century Real Estate Investment Trust is based in Hong Kong.,Real Estate,HK,7/10/2013,New Century Real Estate Investment Trust,,,,1.97,1946377860.0,New Century Real Estate Investment Trust,HKD,New Century Real Estate Investment Trust,New Century Real Estate Investment Trust,,New Century Real Estate Investment Trust,1275.hk,,,New Century Real Estate Investment Trust,,1
,,1211.HK,BYD Company Limited,HKD,HKSE,Auto Manufacturers,"BYD Company Limited, together with its subsidiaries, engages in the rechargeable battery and photovoltaic, handset components and assembly, and automobile businesses worldwide. It operates through three segments: Rechargeable Battery and Photovoltaic Products; Mobile Handset Components and Assembly Service; and Automobiles and Related Products. The company manufactures and sells lithium-ion and nickel batteries, photovoltaic products, and iron batteries primarily for mobile phones, electric tools, and other portable electronic instruments; mobile handset components, such as housings and keypads; and automobiles, and auto-related molds and components, as well as provides assembly, and automobiles leasing and after sales services. In addition, it offers passenger vehicles, taxis, buses, coaches, logistics vehicles, and construction and sanitation vehicles; vehicles for warehousing, port, airport, and mining operations; rail transit equipment; consumer electronics; and solar batteries and arrays. Additionally, the company develops, sells, and leases residential properties, as well as provides property management services. BYD Company Limited was founded in 1995 and is headquartered in Shenzhen, China.",Consumer Cyclical,CN,,BYD Company Limited,,,,265.0,860000000000.0,BYD Company Limited,HKD,BYD Company Limited,BYD Company Limited,,BYD Company Limited,1211.hk,,,BYD Company Limited,,1
,,1212.HK,Lifestyle International Holdings Ltd,HKD,HKSE,Retailing,"Lifestyle International Holdings Limited, an investment holding company, operates mid to upper-end department stores and other retailing formats in Hong Kong. The company operates its stores under the SOGO brand. It owns and operates two SOGO department stores that offer daily necessities and luxury products, as well as personal care services. The company is also involved in the provision of property development, investment, and management, as well as hotel investment services; and restaurant and club operation, advertising, and financing activities. Lifestyle International Holdings Limited was founded in 1985 and is headquartered in Causeway Bay, Hong Kong.",Retail,HK,4/15/2004,Lifestyle International Holdings Ltd,,,,5.99,8996500500.0,Lifestyle International Holdings Ltd,HKD,Lifestyle International Holdings Ltd,Lifestyle International Holdings Ltd,,Lifestyle International Holdings Ltd,1212.hk,,,Lifestyle International Holdings Ltd,,1
,,1213.HK,Mobicon Group Ltd,HKD,HKSE,Technology Hardware & Equipment,"Mobicon Group Limited, an investment holding company, trades in and distributes electronic components, automation parts, and equipment in Hong Kong and other Asia-Pacific countries, South Africa, Europe, and internationally. The company operates through three segments: Electronic Trading Business, Computer Business, and Cosmetic and Online Retail Business. It is also involved in the trading and distribution, and retail of computer products, smartphone accessories, and consumer products; and provision of information technology outsourcing and solution services. In addition, the company trades in, distributes, and retails cosmetic products through a network of 10 retail shops, as well as online channels. Mobicon Group Limited offers its products under the brand name of MOBICON, VideoCom, APower, and wishh brand names. Mobicon Group Limited was founded in 1983 and is based in San Po Kong, Hong Kong.",Electrical Equipment,HK,5/7/2001,Mobicon Group Ltd,,,,0.53,106990560.0,Mobicon Group Ltd,HKD,Mobicon Group Ltd,Mobicon Group Ltd,,Mobicon Group Ltd,1213.hk,,,Mobicon Group Ltd,,1
,,1215.HK,Kai Yuan Holdings Ltd,HKD,HKSE,Consumer Services,"Kai Yuan Holdings Limited, an investment holding company, owns and operates hotels in Hong Kong and France. It is also involved in the money lending business. Kai Yuan Holdings Limited is based in Wanchai, Hong Kong.","Hotels, Restaurants & Leisure",HK,1/17/1997,Kai Yuan Holdings Ltd,,,,0.044,562271620.0,Kai Yuan Holdings Ltd,HKD,Kai Yuan Holdings Ltd,Kai Yuan Holdings Ltd,,Kai Yuan Holdings Ltd,1215.hk,,,Kai Yuan Holdings Ltd,,1
,,1216.HK,Zhongyuan Bank Co Ltd,HKD,HKSE,Banks,"Zhongyuan Bank Co., Ltd. provides corporate and personal deposits, loans and advances, settlement, financial market and leasing, and other financial services in the Asia Pacific, North America, and internationally. It operates through Corporate Banking, Retail Banking, Financial Markets Business, and Others segments. The Corporate Banking segment provides corporate loans and advances, trade financing and deposit taking, agency, consulting and advisory, remittance and settlement, and guarantee services to corporations, government agencies, and financial institutions. The Retail Banking segment offers a range of financial products and services, including personal loans, deposits, bank cards, personal wealth management services, and remittance services to retail customers. The Financial Markets Business segment offers inter-bank money market transactions, repurchase transactions, investments, trading in debt securities, and issuance of debts services. As of December 31, 2019, it operated 18 branches, 2 direct sub-branches, and 467 total outlets, 295 urban branches, 122 county-level branches, and 50 township-level sub-branches, as well as 5,373 farmers-benefiting payment service outlets and financial service stations. The company was founded in 2014 and is headquartered in Zhengzhou, the People's Republic of China.",Banking,CN,7/19/2017,Zhongyuan Bank Co Ltd,,,,1.05,21078749200.0,Zhongyuan Bank Co Ltd,HKD,Zhongyuan Bank Co Ltd,Zhongyuan Bank Co Ltd,,Zhongyuan Bank Co Ltd,1216.hk,,,Zhongyuan Bank Co Ltd,,1
,,1217.HK,China Innovation Investment Ltd,HKD,HKSE,Diversified Financials,"China Innovation Investment Limited invests in equity-related securities and debt instruments in listed and unlisted companies in Hong Kong and the People's Republic of China. It also engages in transactions comprising options and futures that are traded on recognized securities or futures exchanges and for the purpose of hedging. The company invests in information technology, telecommunications, manufacturing, service, property, infrastructure, life science, and environmental sectors. China Innovation Investment Limited, formerly nown as Sino Technology Investments Company Limited, was incorporated in 2002 and is based in Sheung Wan, Hong Kong.",Financial Services,HK,8/28/2002,China Innovation Investment Ltd,,,,0.012,153619200.0,China Innovation Investment Ltd,HKD,China Innovation Investment Ltd,China Innovation Investment Ltd,,China Innovation Investment Ltd,1217.hk,,,China Innovation Investment Ltd,,1
,,1222.HK,Wang On Group Ltd,HKD,HKSE,Real Estate,"Wang On Group Limited, an investment holding company, primarily engages in the property development and investment activities in Hong Kong, Mainland China, Macau, and internationally. It operates through five segments: Property Development, Property Investment, Fresh Markets, Pharmaceutical, and Treasury Management. The company invests in industrial and commercial premises, and residential units for rental or for sale; and invests in debt and other securities. It is also involved in the management and sub-licensing of fresh markets; butchery business, which includes management and sale of properties in agricultural produce exchange markets; and production and sale of Chinese and Western pharmaceutical, health food, and personal care products under the Wai Yuen Tong and Madame Pearl's brand names. In addition, the company provides financial services, such as mortgages and personal loans; management services; and sells fresh pork. The company was founded in 1987 and is headquartered in Kowloon Bay, Hong Kong.",Real Estate,HK,2/28/1995,Wang On Group Ltd,,,,0.067,1116052480.0,Wang On Group Ltd,HKD,Wang On Group Ltd,Wang On Group Ltd,,Wang On Group Ltd,1222.hk,,,Wang On Group Ltd,,1
,,1223.HK,Symphony Holdings Ltd,HKD,HKSE,Retailing,"Symphony Holdings Limited, an investment holding company, primarily operates as a retailing company. The company is involved in the retailing and provision of sourcing services for branded apparel, swimwear, and accessories; manufacturing and trading of healthcare products; and development and management of PONY and SKINS trademarks. It also manages and operates outlet malls, duty free shops, and fashion stores; and provides financial services, including securities brokerage, margin financing, underwriting and placing, financial consulting, and money lending services. In addition, the company offers information, technology, corporate, and portfolio management services; accountancy, legal, secretarial, and cruiser services; and online trading platform support services. Further, it engages in the trading, retailing, and distribution of swimming apparel and accessories; property investment and holding activities; holding of club debentures; sub-licensing of trademark rights; and trading and wholesaling of sportswear. Symphony Holdings Limited operates in the People's Republic of China, Hong Kong, other Asian countries, the United States, and internationally. The company was formerly known as Liang Shing (Holdings) Limited and changed its name to Symphony Holdings Limited in 1997. Symphony Holdings Limited was founded in 1990 and is base in North Point, Hong Kong.",Retail,HK,3/1/1995,Symphony Holdings Ltd,,,,0.93,2766033920.0,Symphony Holdings Ltd,HKD,Symphony Holdings Ltd,Symphony Holdings Ltd,,Symphony Holdings Ltd,1223.hk,,,Symphony Holdings Ltd,,1
,,1224.HK,C C Land Holdings Ltd,HKD,HKSE,Real Estate,"C C Land Holdings Limited, an investment holding company, invests in and develops properties in the United Kingdom, Australia, Hong Kong, and Mainland China. The company operates through two segments, Property Development and Investment; and Treasury Investment. It also invests in securities and notes receivable; and provides financial services, as well as engages in yacht investment activity. The company was formerly known as Qualipak International Holdings Limited and changed its name to C C Land Holdings Limited in January 2007. C C Land Holdings Limited was incorporated in 1998 and is headquartered in Wanchai, Hong Kong.",Real Estate,HK,4/30/1999,C C Land Holdings Ltd,,,,1.79,6949370900.0,C C Land Holdings Ltd,HKD,C C Land Holdings Ltd,C C Land Holdings Ltd,,C C Land Holdings Ltd,1224.hk,,,C C Land Holdings Ltd,,1
,,1226.HK,China Investment and Finance Group Ltd,HKD,HKSE,Diversified Financials,"China Investment & Finance Group Ltd. is investment holding company, which through its subsidiaries, engages in the securities trading. The company employs 10 full-time employees Its principal investment objective is to achieve capital appreciation, interest income and dividend income by investing in listed and unlisted entities in the People’s Republic of China (the PRC).Its primary subsidiaries include Rich Fortune Investment Limited, Garron Consultancy Limited, China Investment and Financing Limited, New Express Investment Limited and Jetland Global Investments Limited.",Financial Services,HK,9/19/2002,China Investment and Finance Group Ltd,,,,0.365,98884704.0,China Investment and Finance Group Ltd,HKD,China Investment and Finance Group Ltd,China Investment and Finance Group Ltd,,China Investment and Finance Group Ltd,1226.hk,,,China Investment and Finance Group Ltd,,1
,,1227.HK,National Investments Fund Ltd,HKD,HKSE,Diversified Financials,"National Investments Fund Limited is an equity mutual fund launched and managed by Enerchine Investment Management Limited. It invests in equity markets. The fund seeks to invest in stocks of companies operating across diversified sectors. It primarily invests in a diversified portfolio of listed and unlisted companies. The fund benchmarks the performance of its portfolio against the Hang Seng Index. National Investments Fund Limited was formed on June 28, 2002 and is domiciled in the Cayman Islands.",Financial Services,HK,9/27/2002,National Investments Fund Ltd,,,,0.023,37734032.0,National Investments Fund Ltd,HKD,National Investments Fund Ltd,National Investments Fund Ltd,,National Investments Fund Ltd,1227.hk,,,National Investments Fund Ltd,,1
,,1229.HK,Nan Nan Resources Enterprise Ltd,HKD,HKSE,Energy,"Nan Nan Resources Enterprise Limited, an investment holding company, mines, sells, and distributes coal in the People's Republic of China, Hong Kong, Singapore, the United Kingdom, and Malaysia. The company operates through three segments: Coal Mining Business, Renewable Energy Business, and Information Technology Services Business. It owns mining right in the Kaiyuan Open Pit Coal Mine and an exploration right in the Zexu Open Pit Coal Mine in Xinjiang. The company also provides renewable energy solutions and solar farm development services in Malaysia. In addition, it provides information technology outsourcing, consultancy, and technical services in Hong Kong. The company was formerly known as International Resources Enterprise Limited and changed its name to Nan Nan Resources Enterprise Limited in September 2011. Nan Nan Resources Enterprise Limited was incorporated in 1995 and is headquartered in Admiralty, Hong Kong. Nan Nan Resources Enterprise Limited is a subsidiary of Ascent Goal Investments Limited.",Energy ,HK,4/13/1995,Nan Nan Resources Enterprise Ltd,,,,0.095,72710528.0,Nan Nan Resources Enterprise Ltd,HKD,Nan Nan Resources Enterprise Ltd,Nan Nan Resources Enterprise Ltd,,Nan Nan Resources Enterprise Ltd,1229.hk,,,Nan Nan Resources Enterprise Ltd,,1
