Column1,index,symbol,long name,currency,exchange,industry,description,sector,country,ipo date,shorter name,Type,Industries,Similar Companies,price,mktCap,name raw,currency symbol,robinhood name,short name,Warrant,shortest name,url name, smart_order ,random csv equations,pure name,shortest - pure diff,order,first_letter
,,NAB.AX,National Australia Bank Ltd,AUD,ASX,Banks,"National Australia Bank Limited provides financial services to individuals and businesses in Australia, New Zealand, and internationally. It operates through Business and Private Banking, Personal Banking, Corporate and Institutional Banking, and New Zealand Banking segments. It operates through Business and Private Banking; Personal Banking; Corporate and Institutional Banking; New Zealand Banking; Corporate Functions and Other; and MLC Wealth segments. The company accepts transaction accounts, savings accounts, deposit accounts, and term deposits; and specialized accounts, such as foreign currency, business interest, statutory trust, community free saver, farm management, and project bank accounts, as well as farm management deposits. National Australia Bank Limited also provides home loans; personal loans; business loans; vehicle and equipment finance; and trade and invoice finance, as well as business overdrafts and bank guarantees. In addition, the company offers insurance products consisting of car, home and content, landlord, travel, caravan and trailer, life, and business insurance products; and pension, superannuation, self-managed super funds, cash management, and financial planning and advisory services. Further, it provides investment products; credit, debit, and business cards; payments and merchant services; travel services; online and internet banking services; small business services; international and foreign exchange solutions; and industry specific banking services. National Australia Bank Limited was founded in 1834 and is based in Docklands, Australia.",Banking,AU,1/1/1974,National Australia Bank Ltd,,,,24.93,164000000000.0,National Australia Bank Ltd,A$,National Australia Bank Ltd,National Australia Bank Ltd,,National Australia Bank Ltd,nab.ax,,,National Australia Bank Ltd,,16412,N
,,NAC,Nuveen California Quality Municipal Income Fund,USD,NYSE,Asset Management,"Nuveen California Quality Municipal Income Fund, formerly Nuveen California Dividend Advantage Municipal Fund, is a closed-ended fund. The Fund provides investment solutions designed to help secure the long-term goals of individual investors and the advisors who serve them. It seeks current income exempt from both regular federal income taxes and California personal income tax and its secondary investment objective is the enhancement of portfolio value. It invests in municipal securities that are exempt from federal and California state income taxes. The Fund invests at least 80% of its managed assets in securities rated, at the time of investment, investment grade or, if they are unrated, are judged by the manager to be of comparable quality. The Fund invests in sectors, including tax obligation/general, tax obligation/limited, healthcare, the United States guaranteed, water and sewer, transportation, consumer staples, education and civic organizations, and housing/multifamily.",Financial Services,US,5/26/1999,Nuveen California Quality Municipal Income Fund,,,,15.21,2201419520.0,Nuveen California Quality Municipal Income Fund,$,Nuveen California Quality Municipal Income Fund,Nuveen California Quality Municipal Income Fund,,Nuveen California Quality Municipal Income Fund,nac,,,Nuveen California Quality Municipal Income Fund,,16413,N
,,NAC.AX,NAOS Ex-50 Opportunities Company Ltd,AUD,ASX,,NAOS Ex-50 Opportunities Company Limited is a listed investment company launched and managed by NAOS Asset Management Limited. It seeks to invest in the public equity markets across the globe with a focus on Australia. It invests in the value stocks of small and mid-cap companies. NAOS Ex-50 Opportunities Company Limited is domiciled in Australia.,,AU,11/12/2014,NAOS Ex-50 Opportunities Company Ltd,,,,1.02,48125028.0,NAOS Ex-50 Opportunities Company Ltd,A$,NAOS Ex-50 Opportunities Company Ltd,NAOS Ex-50 Opportunities Company Ltd,,NAOS Ex-50 Opportunities Company Ltd,nac.ax,,,NAOS Ex-50 Opportunities Company Ltd,,16414,N
,,NACLIND.NS,NACL Industries Ltd,INR,NSE,Materials,"NACL Industries Limited manufactures and sells agrochemicals in India. The company offers a range of technicals, including myclobutanil, propiconazole, profenofos, tricyclazole, and pretilachlors; and formulations, such as insecticides, fungicides, herbicides, and plant growth regulators and nematicides, as well as pesticides and acaricides. It also provides toll manufacturing services for various multinational companies. The company also exports its products to approximately 30 countries worldwide. It markets and sells its products through a network of retail dealers. The company was formerly known as Nagarjuna Agrichem Limited and changed its name to NACL Industries Limited in September 2017. The company was incorporated in 1986 and is based in Hyderabad, India. NACL Industries Limited is a subsidiary of KLR Products Limited.",Chemicals,IN,4/7/2017,NACL Industries Ltd,,,,37.95,7456036900.0,NACL Industries Ltd,?,NACL Industries Ltd,NACL Industries Ltd,,NACL Industries Ltd,naclind.ns,,,NACL Industries Ltd,,16415,N
,,NACON.PA,Nacon S.A.,EUR,EURONEXT,Electronic Gaming & Multimedia,"Nacon S.A. designs and distributes gaming accessories in France and internationally. The company offers accessories, including headsets, microphones, controllers, racing wheels, gaming chairs, keyboards, mice, mats, audio accessories, and console accessories. It also develops and publishes video games in various categories, such as action-adventure, racing, sport, and simulation. The company was founded in 2019 and is based in Fretin, France. Nacon S.A. is a subsidiary of BigBen Interactive SA.",Communication Services,FR,,Nacon S.A.,,,,8.28,702730180.0,Nacon S.A.,,Nacon S.A.,Nacon S.A.,,Nacon S.A.,nacon.pa,,,Nacon S.A.,,16416,N
,,NAD,Nuveen Quality Municipal Income Fund,USD,NYSE,Banks,"Nuveen Quality Municipal Income Fund is a diversified, closed-end management investment company. The Fund seeks to provide current income exempt from regular federal income tax and to enhance portfolio value. The Fund invests in municipal securities that are exempt from federal income taxes. The Fund's portfolio of investments includes investments in various sectors, such as transportation, healthcare, tax obligation/limited, the United States guaranteed, tax obligation/general, utilities, education and civic organizations, water and sewer, consumer staples, industrials and other. It has investments in areas, including New York, Florida, New Jersey, South Carolina, Massachusetts, Louisiana, Michigan, Nevada and Washington. Nuveen Fund Advisors, LLC is the Fund's investment advisor. Nuveen Asset Management, LLC serves as sub-advisor and provides discretionary investment advisory services of the Fund.",Financial Services,US,5/26/1999,Nuveen Quality Municipal Income Fund,,,,15.4,3259394300.0,Nuveen Quality Municipal Income Fund,$,Nuveen Quality Municipal Income Fund,Nuveen Quality Municipal Income Fund,,Nuveen Quality Municipal Income Fund,nad,,,Nuveen Quality Municipal Income Fund,,16417,N
,,NAGAFERT.NS,Nagarjuna Fertilizers and Chemicals Ltd,INR,NSE,Materials,"Nagarjuna Fertilizers and Chemicals Limited manufactures and markets fertilizers and micro irrigation equipment in India and internationally. It manufactures urea and anhydrous ammonia; and markets diammonium phosphate, muriate of potash, zinc sulphate heptahydrate, zinc sulphate mono-hydrate, chelated zinc, di-sodium octa borate tetra hydrate, and specialty fertilizers. The company also provides micro irrigation products and services, including head control units, water carrier system components, and water distribution system components that ensure slow, regular, and precise delivery of water and agricultural inputs to the crop; and operation, maintenance, project management, and other specialist services for the management of chemical process plants. In addition, it offers services to facilitate farm yield and profitability enhancement through agricultural technology transfer and critical information dissemination online and offline. Nagarjuna Fertilizers and Chemicals Limited was founded in 1985 and is based in Hyderabad, India.",Chemicals,IN,1/24/1991,Nagarjuna Fertilizers and Chemicals Ltd,,,,5.25,3145820930.0,Nagarjuna Fertilizers and Chemicals Ltd,?,Nagarjuna Fertilizers and Chemicals Ltd,Nagarjuna Fertilizers and Chemicals Ltd,,Nagarjuna Fertilizers and Chemicals Ltd,nagafert.ns,,,Nagarjuna Fertilizers and Chemicals Ltd,,16418,N
,,NAG.AX,Nagambie Resources Ltd,AUD,ASX,Materials,"Nagambie Resources Limited engages in the exploration and development of gold and associated minerals, and construction materials in Australia. The company has a total area of 3,600 square kilometers of exploration licenses in Waranga Province. It is also involved in the investigation and development of waste handling assets, as well as property owning activities. The company was formerly known as Nagambie Mining Limited and changed its name to Nagambie Resources Limited in November 2015. Nagambie Resources Limited was incorporated in 2004 and is headquartered in Nagambie, Australia.",Metals & Mining,AU,6/23/2006,Nagambie Resources Ltd,,,,0.062,30995784.0,Nagambie Resources Ltd,A$,Nagambie Resources Ltd,Nagambie Resources Ltd,,Nagambie Resources Ltd,nag.ax,,,Nagambie Resources Ltd,,16419,N
,,NAGREEKCAP.NS,Nagreeka Capital & Infrastructure Ltd,INR,NSE,Diversified Financials,"Nagreeka Capital & Infrastructure Ltd. is a publicly owned investment manager. The firm invests in equity markets, private equity, mutual funds, real estate, and renewable energy. The firm was founded Nagreeka Securities Ltd. and changed its name to Nagreeka Software Technologies Limited in September 2001. Nagreeka Software Technologies Limited further changed its name to Nagreeka Capital & Infrastructure Ltd. in July 2006. Nagreeka Capital & Infrastructure Ltd. was founded in 1953 is based in Mumbai, India with an additional office in Kolkata, India. Nagreeka Capital & Infrastructure Ltd. operates independently of Nagreeka Exports Ltd. as of September 18, 2007.",Financial Services,IN,9/18/2007,Nagreeka Capital & Infrastructure Ltd,,,,6.15,84079728.0,Nagreeka Capital & Infrastructure Ltd,?,Nagreeka Capital & Infrastructure Ltd,Nagreeka Capital & Infrastructure Ltd,,Nagreeka Capital & Infrastructure Ltd,nagreekcap.ns,,,Nagreeka Capital & Infrastructure Ltd,,16420,N
,,NAGREEKEXP.NS,Nagreeka Exports Ltd,INR,NSE,Consumer Durables & Apparel,"Nagreeka Exports Limited engages in manufacturing and selling cotton yarns and other various merchandise in India and internationally. The company also trades in cotton yarns and various commodities. In addition, it offers specialty yarns, such as organic, slub, normal and reverse twists, core spun, chenille, dyed/gassed/mercerized, high twist, viscose, and polyester spun yarns, as well as poly viscose, polyester cotton, and viscose cotton blends; and raw, printed, and finished fabrics. The company exports its products. Nagreeka Exports Limited was incorporated in 1989 and is headquartered in Mumbai, India.","Textiles, Apparel & Luxury Goods",IN,1/10/1994,Nagreeka Exports Ltd,,,,18.15,229363360.0,Nagreeka Exports Ltd,?,Nagreeka Exports Ltd,Nagreeka Exports Ltd,,Nagreeka Exports Ltd,nagreekexp.ns,,,Nagreeka Exports Ltd,,16421,N
,,NAHARCAP.NS,Nahar Capital and Financial Services Ltd,INR,NSE,Diversified Financials,"Nahar Capital and Financial Services Limited, a non-deposit taking non-banking financial company, engages in investment/financial activities. The company invests in various financial securities, including equity, bonds, debentures, commodity, term deposits, and securities of various kind issued by companies, banks, mutual funds, and other authorities, as well as central, state, municipal, and local bodies. It also provides lending services against liquid securities, such as shares, government bonds, gold, property, and other assets. In addition, the company is involved in the real estate business, including the purchase and sale of residential and/or commercial land with trading perspective; dealing in real estate, the development of land, and the construction of building for commercial and residential purpose; leasing, hiring, or acquiring various real estate assets; and leasing of flats and buildings. Nahar Capital and Financial Services Limited was incorporated in 2006 and is based in Ludhiana, India.",Financial Services,IN,3/11/2008,Nahar Capital and Financial Services Ltd,,,,94.0,1584238340.0,Nahar Capital and Financial Services Ltd,?,Nahar Capital and Financial Services Ltd,Nahar Capital and Financial Services Ltd,,Nahar Capital and Financial Services Ltd,naharcap.ns,,,Nahar Capital and Financial Services Ltd,,16422,N
,,NAHARINDUS.NS,Nahar Industrial Enterprises Ltd,INR,NSE,Consumer Durables & Apparel,"Nahar Industrial Enterprises Limited, an integrated textile manufacturer, engages in spinning, weaving, processing, and selling textiles in India. It operates in two segments, Textile and Sugar. The company offers cotton, dyed cotton, compact spun, blended, polyester, industrial, open end, open end slub, TFO, specialized, Eli twist, core spun, and vortex yarns. It also provides various fabrics, including piece dyed, yarn dyed, and printed fabrics, as well as specialty and performance fabrics, and indigo yarn dyed shirting for use in apparels and home furnishings. In addition, the company produces various types and grades of sugar and allied products; and operates biomass/multi-fuel cogeneration power plants at Lalru and Amloh, Punjab. It also exports its products. The company was formerly known as Oswal Fats & Oils Limited and changed its name to Nahar Industrial Enterprises Limited in 1994. Nahar Industrial Enterprises Limited was incorporated in 1983 and is based in Ludhiana, India.","Textiles, Apparel & Luxury Goods",IN,1/19/1995,Nahar Industrial Enterprises Ltd,,,,43.85,1758428800.0,Nahar Industrial Enterprises Ltd,?,Nahar Industrial Enterprises Ltd,Nahar Industrial Enterprises Ltd,,Nahar Industrial Enterprises Ltd,naharindus.ns,,,Nahar Industrial Enterprises Ltd,,16423,N
,,NAHARSPING.NS,Nahar Spinning Mills Ltd,INR,NSE,Consumer Durables & Apparel,"Nahar Spinning Mills Ltd manufactures and sells yarns and knitted garments in India. The company offers raw white combed, raw white carded/open end, dyed, organic cotton, fair trade cotton, better cotton initiative, melange, gassed/mercerized, compact spun, blended, synthetic/man-made fiber, and cleaner yarns, as well as grindle, space dyed, slub, core spun, high twist, reverse twist, and elitwist yarns. It also provides woolen/cotton hosiery knit-wears and woolen textiles; and T-shirts. The company also exports its products primarily to the United States, the United Kingdom, France, Brazil, Bangladesh, Mauritius, Honduras, Argentina, Colombia, Peru, Chile, the Netherlands, Japan, Canada, Korea, Taiwan, Hong Kong, Singapore, Egypt, and Russia. Nahar Spinning Mills Ltd was incorporated in 1980 and is based in Ludhiana, India.","Textiles, Apparel & Luxury Goods",IN,11/21/1994,Nahar Spinning Mills Ltd,,,,79.2,2840317700.0,Nahar Spinning Mills Ltd,?,Nahar Spinning Mills Ltd,Nahar Spinning Mills Ltd,,Nahar Spinning Mills Ltd,naharsping.ns,,,Nahar Spinning Mills Ltd,,16424,N
,,NAHD,"New Asia Holdings, Inc.",USD,PNK,Software,"New Asia Holdings, Inc. develops and provides neural trading models for the financial community. The company offers algorithm trading software solutions to clients on the basis of Software as a Service licensing and delivery models with licensed users availing themselves of service-based contractual arrangements. It serves broker-dealers, banks, funds, and other clients. The company was formerly known as DM Products, Inc. and changed its name to New Asia Holdings, Inc. in January 2015. New Asia Holdings, Inc. was incorporated in 2001 and is headquartered in Singapore.",Technology,SG,,"New Asia Holdings, Inc.",,,,0.173,13024945.0,"New Asia Holdings, Inc.",$,"New Asia Holdings, Inc.","New Asia Holdings, Inc.",,"New Asia Holdings, Inc.",nahd,,,"New Asia Holdings, Inc.",,16425,N
,,NAH.L,NAHL Group PLC,GBP,LSE,Media & Entertainment,"NAHL Group plc, together with its subsidiaries, engages in the marketing and services business focusing on the consumer legal services market in the United Kingdom. The company operates through Personal Injury, Critical Care, and Residential Property divisions. The Personal Injury division offers outsourced marketing services and products to law firms; and claims processing services to individuals. The Critical Care division provides specialist services in the catastrophic and serious injury market to claimants and defendants. Its services include expert witness quantum reports and nursing liability reports; immediate needs assessments; case management services for short or long term needs; vocational rehabilitation services; and behavior assessment and management services for children and young people. The Residential Property division offers marketing services to law firms and conveyancers, as well as surveys process services. NAHL Group plc was founded in 1993 and is based in Kettering, the United Kingdom.",Media,GB,5/29/2014,NAHL Group PLC,,,,42.5,19652084.0,NAHL Group PLC,,NAHL Group PLC,NAHL Group PLC,,NAHL Group PLC,nah.l,,,NAHL Group PLC,,16426,N
,,NAIT.L,North American Income Trust PLC,GBP,LSE,,"The North American Income Trust plc is an investment trust. The Company's objective is to provide investors with above average dividend income and long-term capital growth through active management of a portfolio consisting of S&P 500 United States equities. It may also invest in Canadian stocks and United States mid and small capitalization companies to provide for diversified sources of income. The Company may invest approximately 20% of its gross assets in fixed income investments, which may include non-investment grade debt. The Company may borrow up to an amount equal to approximately 20% of its net assets. The Company may invest in open-ended collective investment schemes and closed-ended funds that invest in the North American region. It invests in sectors, such as financials, consumer staples, materials, energy, information technology, industrials, healthcare, telecommunications, utilities and consumer discretionary. Its investment manager is Aberdeen Asset Managers Inc.",,GB,1/2/1986,North American Income Trust PLC,,,,235.0,336118144.0,North American Income Trust PLC,,North American Income Trust PLC,North American Income Trust PLC,,North American Income Trust PLC,nait.l,,,North American Income Trust PLC,,16427,N
,,NAK.L,Nakama Group PLC,GBP,LSE,Commercial  & Professional Services,"Nakama Group plc, together with its subsidiaries, provides recruitment consultancy services for digital technology and interactive media industries under the Nakama name in the Asia Pacific, the United Kingdom, Europe, and the United States. The company also provides technology and business information recruitment consultancy services to insurance and investment management industries under Highams brand name. Its recruitment services include permanent, contract, freelance, and search and project management services. The company was formerly known as Highams Systems Services Group plc. Nakama Group PLC was founded in 1983 and is headquartered in Caterham, the United Kingdom.",Professional Services,GB,12/18/1996,Nakama Group PLC,,,,1.225,1442939.0,Nakama Group PLC,,Nakama Group PLC,Nakama Group PLC,,Nakama Group PLC,nak.l,,,Nakama Group PLC,,16428,N
,,NAM.AX,Namoi Cotton Ltd,AUD,ASX,Commercial  & Professional Services,"Namoi Cotton Limited, together with its subsidiaries, engages in the ginning and marketing of cotton in Australia and Asia. The company operates 12 cotton gins in New South Wales and Queensland. It is also involved in the purchase of lint cotton from growers through various forward contracts; and trading and marketing of cottonseeds. In addition, the company procures various grain and pulse crops from growers, and sells into various markets in Australia and internationally; and provides cotton classing services to the cotton industry. Further, it engages in the sale and logistics of plastic waste from ginning activities. The company was formerly known as Namoi Cotton Co-operative Ltd and changed its name to Namoi Cotton Limited in October 2017. Namoi Cotton Limited was founded in 1962 and is based in Toowoomba, Australia.",Commercial Services & Supplies,AU,4/6/1998,Namoi Cotton Ltd,,,,0.31,44222428.0,Namoi Cotton Ltd,A$,Namoi Cotton Ltd,Namoi Cotton Ltd,,Namoi Cotton Ltd,nam.ax,,,Namoi Cotton Ltd,,16429,N
,,NAM-INDIA.NS,Nippon Life India Asset Management Ltd,INR,NSE,Diversified Financials,"Nippon Life Asset Management Limited is a publicly owned investment manager. The firm launches and manages equity and fixed income mutual funds for its clients. It also manages exchange traded funds for its clients. The firm invests in the public equity, fixed income and commodity markets. Nippon Life Asset Management Limited was previously known as Reliance Nippon Life Asset Management Limited. Nippon Life Asset Management Limited was founded on February 24, 1995 and is based in Mumbai, India.",Financial Services,IN,11/6/2017,Nippon Life India Asset Management Ltd,,,,325.25,199000000000.0,Nippon Life India Asset Management Ltd,?,Nippon Life India Asset Management Ltd,Nippon Life India Asset Management Ltd,,Nippon Life India Asset Management Ltd,nam-india.ns,,,Nippon Life India Asset Management Ltd,,16430,N
,,NAN.AX,Nanosonics Ltd,AUD,ASX,Health Care Equipment & Services,"Nanosonics Limited, together with its subsidiaries, engages in the research, development, and commercialization of infection control and decontamination products and related technologies. The company manufactures and distributes the trophon ultrasound probe disinfector, and its associated consumables and accessories for reducing cross-contamination between patients and the spread of healthcare acquired infections. It also provides trophon2, an ultrasound probe high level disinfection device; and trophon EPR, a device designed to disinfect intracavity and surface ultrasound probes. In addition, the company offers trophon EPR and trophon2 consumables and accessories, including NanoNebulant, a proprietary disinfectant liquid; trophon chemical indicators; trophon AcuTrace operator cards, medical instrument tags, printers, printer USB cables, printer label rolls, and logbooks; trophon wall mounts, printer wall mounts, carts, and printer cart mounts; trophon companion drying wipes and companion wipes wall mounts; clean ultrasound probe covers; and trophon AcuTrace PLUS activation cards. It operates in North America, Europe, the Middle East, and the Asia Pacific. The company was incorporated in 2000 and is headquartered in Lane Cove, Australia.",Health Care,AU,5/17/2007,Nanosonics Ltd,,,,6.87,2068199680.0,Nanosonics Ltd,A$,Nanosonics Ltd,Nanosonics Ltd,,Nanosonics Ltd,nan.ax,,,Nanosonics Ltd,,16431,N
,,NANO.L,Nanoco Group PLC,GBP,LSE,Semiconductors & Semiconductor Equipment,"Nanoco Group plc, together with its subsidiaries, engages in the research, development, manufacture, and licensing of cadmium and heavy-metal-free quantum dots (CFQD), and semiconductor nanomaterials for use in various commercial applications. The company offers cadmium free quantum dots, CFQD quantum dot films, copper indium gallium di-selenide/sulfide nanoparticles, and copper indium di-selenide/sulfide nanoparticles. Its products are used in LCD, LED lighting, solar cells, and biological imaging applications. The company has operations in the United Kingdom, other European countries, Asia, and the United States. Nanoco Group plc was founded in 2001 and is headquartered in Manchester, the United Kingdom.",Semiconductors,GB,5/1/2009,Nanoco Group PLC,,,,16.42,50195780.0,Nanoco Group PLC,,Nanoco Group PLC,Nanoco Group PLC,,Nanoco Group PLC,nano.l,,,Nanoco Group PLC,,16432,N
,,NANO.OL,Nordic Nanovector ASA,NOK,OSE,"Pharmaceuticals, Biotechnology & Life Sciences","Nordic Nanovector ASA, a biopharmaceutical company, develops and commercializes therapeutics for haematological cancers. The company's lead product candidate is Betalutin, an antibody-radionuclide-conjugate, which has completed Phase I/IIa clinical trial for the treatment of patients with non-hodgkin lymphoma, a life-threatening blood cancer. Nordic Nanovector ASA has collaboration agreements with Paul Scherrer Institute; Areva Med; LegoChemBio; and Heidelberg Pharma. The company was formerly known as Nordic Nanovector AS and changed its name to Nordic Nanovector ASA in 2014. Nordic Nanovector ASA was founded in 2009 and is headquartered in Oslo, Norway.",Biotechnology,NO,,Nordic Nanovector ASA,,,,14.27,1132903940.0,Nordic Nanovector ASA,NOK,Nordic Nanovector ASA,Nordic Nanovector ASA,,Nordic Nanovector ASA,nano.ol,,,Nordic Nanovector ASA,,16433,N
