Column1,index,symbol,long name,currency,exchange,industry,description,sector,country,ipo date,shorter name,Type,Industries,Similar Companies,price,mktCap,name raw,currency symbol,robinhood name,short name,Warrant,shortest name,url name, smart_order ,random csv equations,pure name,shortest - pure diff,order,first_letter
,,KOHINOOR.NS,Kohinoor Foods Ltd,INR,NSE,"Food, Beverage & Tobacco","Kohinoor Foods Limited manufactures and sells food products under the Kohinoor and Monsoon brand names in India. It offers basmati rice and non-basmati rice; packaged food products, such as ready to eat food, ready to cook, frozen ready to eat food, dairy products, namkeen savories, sweets, biscuits and cookies, and dry fruits, as well as olive, rice brain, and canola oil products; cooking pastes, chutney's, spices, seasonings, frozen breads, snacks, and simmer sauces; organic lentils and beans; and healthy grains. Kohinoor Foods Limited also exports its products to approximately 60 countries. The company was formerly known as Satnam Overseas Limited and changed its name to Kohinoor Foods Limited in 1989. Kohinoor Foods Limited was founded in 1976 and is based in Faridabad, India.",Food Products,IN,1/31/1994,Kohinoor Foods Ltd,,,,7.65,288045440.0,Kohinoor Foods Ltd,?,Kohinoor Foods Ltd,Kohinoor Foods Ltd,,Kohinoor Foods Ltd,kohinoor.ns,,,Kohinoor Foods Ltd,,15493,K
,,KOKUYOCMLN.NS,Kokuyo Camlin Ltd,INR,NSE,Commercial  & Professional Services,"Kokuyo Camlin Limited manufactures and trades in stationery products, hobby art materials, and scholastic products in India. It provides adhesives, brush pens, clay and dough products, color pencils, color pen pencils, drawing books, fountain pens and ink products, gel crayons, geometry boxes and accessories, gift sets and kits, mechanical pencils and leads, notebooks, oil pastels, pencils and pals, pens, plastic crayons, sketch pens, student poster colors, students' water color cakes, students' water color tubes, technical instruments, washable crayons, and wax crayons for students and parents. The company also offers correction pens, gum and paste products, markers and marker inks, and office products accessories for office professionals; and acrylic sprays, art materials, artist's pastels, artist's water colors, artist's acrylic colors, artist's oil colors, brushes, canvas, drawing inks, drawing pencils/charcoals, other art materials, painting mediums, premium color and bi-color pencils, premium poster colors, students' oil colors, and water color pencils for artists and designers. In addition, it provides 3D glitters, colors, cone-liners, fluid acrylic colors, hobby brushes, hobby mediums, and sparkle colors for hobbyists. The company markets its products under the Camel and Camlin brands. It also exports its products primarily to SAARC countries, the Middle East, and Japan. The company was formerly known as Camlin Limited and changed its name to Kokuyo Camlin Limited in 2012. The company was founded in 1931 and is based in Mumbai, India. Kokuyo Camlin Limited operates as a subsidiary of Kokuyo Co., Ltd.",Commercial Services & Supplies,IN,7/28/2008,Kokuyo Camlin Ltd,,,,62.95,6329181700.0,Kokuyo Camlin Ltd,?,Kokuyo Camlin Ltd,Kokuyo Camlin Ltd,,Kokuyo Camlin Ltd,kokuyocmln.ns,,,Kokuyo Camlin Ltd,,15494,K
,,KOLTEPATIL.NS,Kolte-Patil Developers Ltd,INR,NSE,Real Estate,"Kolte-Patil Developers Limited operates as a real estate company in India. It constructs and develops residential projects, commercial and retail projects, IT parks, and integrated townships; rents immovable properties; and provides project management services for managing and developing real estate projects. The company markets its projects under the Kolte-Patil and 24K brands. Kolte-Patil Developers Limited was founded in 1991 and is based in Pune, India.",Real Estate,IN,12/7/2007,Kolte-Patil Developers Ltd,,,,247.05,18791759900.0,Kolte-Patil Developers Ltd,?,Kolte-Patil Developers Ltd,Kolte-Patil Developers Ltd,,Kolte-Patil Developers Ltd,koltepatil.ns,,,Kolte-Patil Developers Ltd,,15495,K
,,KOMN.SW,Komax Holding AG,CHF,SIX,Capital Goods,"Komax Holding AG, together with its subsidiaries, engages in the automated wire processing business. The company offers electrical, rotary, and coaxial wire strippers, as well as rotary jacket strippers; wire crimpers for semiautomatic machine; cutting and stripping machines; crimp to crimp wire processing machines for processing single conductors and double-crimp connections; wire twisting machines; and harness manufacturing machines for automatic block loading and wire harness manufacturing. It also provides wire-handling machines for preliminary wire processing; marking systems; process modules for economical production; quality tools; software solutions for automatic crimping machines; and a range of accessories. In addition, the company offers stripping crimping, and shield preparation and taping machines; flexible benchtop crimping platform for individual processing; flexible platform for specific customers; automated rotary table for time saving in double-sided processing; customer-specific platforms; and test systems. Further, it provides digital services; consulting and installation services comprising inspection, production analysis, feasibility testing, installation, and acceptance testing services; and technical support and maintenance services, including helpdesk, production and ramp-up support, emergency planning, relocation, repair, and service and maintenance contracting services, as well as spare and wear parts. Additionally, the company offers upgrades and services; and online and onsite training services. It serves automotive, aerospace, datacom/telecom, and industrial market segments. The company operates in Switzerland and rest of Europe, North and South America, Africa, and the Asia Pacific. It primarily operates under the TSK and Komax brand names. Komax Holding AG was founded in 1975 and is headquartered in Dierikon, Switzerland.",Machinery,CH,5/24/2000,Komax Holding AG,,,,238.2,915374020.0,Komax Holding AG,CHF,Komax Holding AG,Komax Holding AG,,Komax Holding AG,komn.sw,,,Komax Holding AG,,15496,K
,,KOMP.OL,Komplett Bank ASA,NOK,OSE,Banks,"Komplett Bank ASA provides unsecured financing to private individuals in the Norwegian, Sweden, Finland, and German markets. It offers deposit products, consumer loans, credit cards, and point of sale finance products. The company was formerly known as AlfaB Prosjekt ASA and changed its name to Komplett Bank ASA in 2014. Komplett Bank ASA was founded in 2012 and is headquartered in Lysaker, Norway.",Banking,NO,,Komplett Bank ASA,,,,8.14,1519038080.0,Komplett Bank ASA,NOK,Komplett Bank ASA,Komplett Bank ASA,,Komplett Bank ASA,komp.ol,,,Komplett Bank ASA,,15497,K
,,KOPRAN.NS,Kopran Ltd,INR,NSE,"Pharmaceuticals, Biotechnology & Life Sciences","Kopran Limited, an integrated pharmaceutical company, manufactures and sells active pharmaceutical ingredients and finished dosage forms in India and internationally. The company offers finished dosage forms, including tablets, capsules, dry powder, suspension, and injectable in various therapeutic areas comprising cardiovascular, gastrointestinal, pain management, oncology, anti-allergic, central nervous system, erectile dysfunction, and others, as well as antibiotics, anti-diabetic, respiratory, anthelmentics, antiprotozoals, and antipeptic ulcer and gut. It also provides active pharmaceutical ingredients in the categories of anti-hypertensive, macrolide, neuromodulator, sterile cephalosporins, carbapenems, anti-acne, anti-ulcerant, anti-depressent, anti-infective, urological, and anti-thrombotic. The company was incorporated in 1958 and is headquartered in Mumbai, India.",Pharmaceuticals,IN,11/17/1992,Kopran Ltd,,,,125.95,5443382800.0,Kopran Ltd,?,Kopran Ltd,Kopran Ltd,,Kopran Ltd,kopran.ns,,,Kopran Ltd,,15498,K
,,KOR.AX,Korab Resources Ltd,AUD,ASX,Materials,"Korab Resources Limited engages in the exploration and evaluation of mineral properties. The company explores for gold, silver, phosphate rock, magnesium, tin, iron ore, copper, nickel, cobalt, lead, zinc, lithium, and rare earth metals. Its projects include the Bobrikovo project located in Ukraine; the Winchester magnesium carbonate and the Geolsec Phosphate projects located in Darwin, Northern Territory; the Batchelor and the Green Alligator projects located in Batchelor, Northern Territory; and the Mt. Elephant project located in Western Australia. The company was founded in 1998 and is based in West Perth, Australia.",Metals & Mining,AU,8/31/2005,Korab Resources Ltd,,,,0.018,5984873.0,Korab Resources Ltd,A$,Korab Resources Ltd,Korab Resources Ltd,,Korab Resources Ltd,kor.ax,,,Korab Resources Ltd,,15499,K
,,KOS.L,Kosmos Energy Ltd,GBP,LSE,Energy,"Kosmos Energy Ltd., a deepwater independent oil and gas exploration and production company, focuses along the Atlantic Margins. The company's primary assets include production offshore Ghana, Equatorial Guinea, and U.S. Gulf of Mexico, as well as a gas development offshore Mauritania and Senegal. It also maintains an exploration program balanced between proven basin infrastructure-led exploration, emerging basins, and frontier basins. The company was founded in 2003 and is headquartered in Dallas, Texas.",Energy ,US,5/11/2011,Kosmos Energy Ltd,,,,194.5,838814340.0,Kosmos Energy Ltd,,Kosmos Energy Ltd,Kosmos Energy Ltd,,Kosmos Energy Ltd,kos.l,,,Kosmos Energy Ltd,,15500,K
,,KO.SW,Coca-Cola Co,CHF,SIX,"Food, Beverage & Tobacco","The Coca-Cola Company, a beverage company, manufactures, markets, and sells various nonalcoholic beverages worldwide. The company provides sparkling soft drinks; water, enhanced water, and sports drinks; juice, dairy, and plant?based beverages; tea and coffee; and energy drinks. It also offers beverage concentrates and syrups, as well as fountain syrups to fountain retailers, such as restaurants and convenience stores. The company sells its products under the Coca-Cola, Diet Coke/Coca-Cola Light, Coca-Cola Zero Sugar, Fanta, Fresca, Schweppes, Sprite, Thums Up, Aquarius, Ciel, Dasani, glacéau smartwater, glacéau vitaminwater, Ice Dew, I LOHAS, Powerade, Topo Chico, AdeS, Del Valle, fairlife, innocent, Minute Maid, Minute Maid Pulpy, Simply, ZICO, Ayataka, Costa, dogadan, FUZE TEA, Georgia, Gold Peak, HONEST TEA, and Kochakaden brands. It operates through a network of company-owned or controlled bottling and distribution operators, as well as through independent bottling partners, distributors, wholesalers, and retailers. The company was founded in 1886 and is headquartered in Atlanta, Georgia.",Beverages,US,9/5/1919,Coca-Cola Co,,,,49.63,192000000000.0,Coca-Cola Co,CHF,Coca-Cola Co,Coca-Cola Co,,Coca-Cola Co,ko.sw,,,Coca-Cola Co,,15502,K
,,KOTAKBANK.NS,Kotak Mahindra Bank Ltd,INR,NSE,Banks,"Kotak Mahindra Bank Limited, provides banking and financial services to corporate and individual customers in India. It operates through Treasury, BMU, and Corporate Centre; Retail Banking; Corporate/Wholesale Banking; Vehicle Financing; Other Lending Activities; Broking; Advisory and Transactional Services; Asset Management; and Insurance segments. The Treasury, BMU and Corporate Centre segment engages in dealing in debt, equity, money and forex market, derivatives, and investments; and the primary dealership of government securities and balance sheet management unit (BMU) responsible for asset liability management. The Retail Banking segment offers commercial vehicle finance, personal, home, and other loans/services, and agriculture finance services. This segment also provides savings, current, and term deposit accounts; branch banking network and services, including distribution of financial products; and credit cards. The Corporate/Wholesale Banking segment offers wholesale borrowings and lending, and other related services to the corporate sector. Its Vehicle Financing segment provides retail vehicle and wholesale trade finance to auto dealers. The Other Lending Activities segment offers financing against securities, securitization, and other loans/services. Its Broking segment provides brokerage income on market transactions and delayed payments interest; and distributes financial products. The Advisory and Transactional Services segment offers mergers and acquisition advice, and equity/debt issue management services. Its Asset Management segment engages in the management of funds and investments on behalf of clients and funds. The Insurance segment provides life insurance and general insurance products. As of March 31, 2020, it had a network of 1,600 branches and 2,519 ATMs; and branches in GIFT City and DIFC, Dubai. Kotak Mahindra Bank Limited was founded in 1985 and is based in Mumbai, India.",Banking,IN,11/3/1994,Kotak Mahindra Bank Ltd,,,,1951.05,3870000000000.0,Kotak Mahindra Bank Ltd,?,Kotak Mahindra Bank Ltd,Kotak Mahindra Bank Ltd,,Kotak Mahindra Bank Ltd,kotakbank.ns,,,Kotak Mahindra Bank Ltd,,15503,K
,,KOTARISUG.NS,Kothari Sugars and Chemicals Ltd,INR,NSE,"Food, Beverage & Tobacco","Kothari Sugars and Chemicals Limited manufactures and sells sugar and its by-products in India and rest of Asia. The company operates in the Sugar, Cogeneration, and Distillery segments. It also engages in the co-generation of power from bagasse and coal; production of industrial alcohol from molasses; and bio-compost from press mud and distillery effluents. In addition, the company provides liquid hand sanitizers; polyisobutylene products; and packaged drinking water, as well as rents safe deposit lockers. The company was incorporated in 1960 and is headquartered in Chennai, India. Kothari Sugars and Chemicals Limited is a subsidiary of Parvathi Trading & Finance Co. Pvt. Ltd.",Food Products,IN,1/11/1995,Kothari Sugars and Chemicals Ltd,,,,22.7,1881571330.0,Kothari Sugars and Chemicals Ltd,?,Kothari Sugars and Chemicals Ltd,Kothari Sugars and Chemicals Ltd,,Kothari Sugars and Chemicals Ltd,kotarisug.ns,,,Kothari Sugars and Chemicals Ltd,,15504,K
,,KOTHARIPET.NS,Kothari Petrochemicals Ltd,INR,NSE,Materials,"Kothari Petrochemicals Limited produces and sells chemicals in India and internationally. It offers polyisobutylene, a linear polymer used in lubricants, adhesives, stretch/silage/cling wrap, sealants and caulks, coatings, polymer modification, asphalt and rubber, electrical cable insulation, and other applications under the KVIS brand; and C4 rafinate. The company was founded in 1989 and is headquartered in Chennai, India. Kothari Petrochemicals Limited is a subsidiary of BHK Trading LLP.",Chemicals,IN,8/19/1996,Kothari Petrochemicals Ltd,,,,24.05,1415255940.0,Kothari Petrochemicals Ltd,?,Kothari Petrochemicals Ltd,Kothari Petrochemicals Ltd,,Kothari Petrochemicals Ltd,kotharipet.ns,,,Kothari Petrochemicals Ltd,,15505,K
,,KOTHARIPRO.NS,Kothari Products Ltd,INR,NSE,Capital Goods,"Kothari Products Limited, together with its subsidiaries, engages in international trade and real estate activities in India. It operates through two segments, Trading and Real Estate. The company is involved in the import, export, and trade of various products/commodities, including agro based commodities, minerals, metals, petroleum products and coal, tiles, notebooks, computer storage devices, computer hardware products, electronic components, transformers, copier papers, steel products, scrap and PVC products, etc. It also develops land, commercial, retail, mall, hotel, and service apartment projects, as well as leases commercial buildings; operates a hotel, as well as senior secondary schools; and invests in stocks and mutual funds. Kothari Products Limited was incorporated in 1983 and is based in Kanpur, India.",Trading Companies & Distributors,IN,3/7/1995,Kothari Products Ltd,,,,71.05,2100032000.0,Kothari Products Ltd,?,Kothari Products Ltd,Kothari Products Ltd,,Kothari Products Ltd,kotharipro.ns,,,Kothari Products Ltd,,15506,K
,,KOV.AX,Korvest Ltd,AUD,ASX,Capital Goods,"Korvest Ltd, together with its subsidiaries, manufacturers and supplies cable and pipe support systems, galvanising services, and access systems for large mobile equipment in Australia. It operates in two segments, Industrial Products and Production. The Industrial Products segment manufactures electrical and cable support systems, and steel fabrication and access systems. This segment also sells, hires, and repairs high torque tools, such as hydraulic torque wrenches, pneumatic continuous torque wrenches, electronic continuous torque wrenches, huck tools, and power rigs. It conducts its business under the EzyStrut, Power Step and Titan Technologies names. The Production segment provides hot dip galvanising services. It serves infrastructure, commercial, utilities, mining, food processing, oil and gas, power stations, health, and industrial sectors. The company was founded in 1970 and is based in Kilburn, Australia.",Machinery,AU,8/16/1982,Korvest Ltd,,,,4.95,56064192.0,Korvest Ltd,A$,Korvest Ltd,Korvest Ltd,,Korvest Ltd,kov.ax,,,Korvest Ltd,,15507,K
,,KP2.L,Kore Potash PLC,GBP,LSE,Materials,"Kore Potash plc engages in the exploration and development of potash minerals in the Republic of Congo. Its flagship property is the 97%-owned Sintoukola potash project that comprises the Kola sylvinite and carnallite deposits located to the north of the city of Pointe Noire. The company was incorporated in 2017 and is headquartered in London, the United Kingdom.",Metals & Mining,GB,3/29/2018,Kore Potash PLC,,,,1.0,24517702.0,Kore Potash PLC,,Kore Potash PLC,Kore Potash PLC,,Kore Potash PLC,kp2.l,,,Kore Potash PLC,,15508,K
,,KPAY,KinerjaPay Corp.,USD,PNK,Software,"KinerjaPay Corp. operates an e-commerce platform in Indonesia. The company's platform, KinerjaPay IP, an e-wallet service for bill transfers and online shopping; and allows top-up phone credit for users. It also provides KMALL, a virtual marketplace for B2B and B2C online transactions; and KGAMES that develops games. The company was formerly known as Solarflex Corp and changed its name to KinerjaPay Corp on February 2016. KinerjaPay Corp. was founded in 2010 and is based in Medan, Indonesia.",Technology,ID,,KinerjaPay Corp.,,,,0.00555,8401978.0,KinerjaPay Corp.,$,KinerjaPay Corp.,KinerjaPay Corp.,,KinerjaPay Corp.,kpay,,,KinerjaPay Corp.,,15509,K
,,KPG.AX,Kelly Partners Group Holdings Ltd,AUD,ASX,Commercial  & Professional Services,"Kelly Partners Group Holdings Limited provides chartered accounting and other professional services to private businesses and clients, owners, families, and high net worth individuals in Australia. The company operates in two segments, Accounting and Other Services. It offers audits; business, and personal and investment structures; cloud accounting; corporate and management; estate planning and management; family law assistance; accounting; immigration support; outsourced CFO; payroll; philanthropic; strata accounting and tax; ATO investigation and dispute; and taxation advice and compliance services. The company also provides tax services, including ATO audits, disclosures, and investigations and tax disputes; capital inflows and outflows; mergers and acquisitions; funds management and managed; investment trusts; structuring, negotiation, and tax legal advices; international tax for inbound and outbound investment; cross-border transactions; tax structuring; trust structures and joint ventures; and solutions, succession planning, and family offices. In addition, it provides private wealth investment; property; finance services; and insurance services. Further, the company offers estate services that include assessment and ongoing performance reviews of investment managers; administrative functions, such as bookkeeping, bill paying, and mail management; financial oversight of illiquid financial assets; monthly report of family/estate activities; critical document management; daily management of liquid financial assets; facilitation of estate planning; family governance structures, education, and intergenerational planning; and philanthropy advisory. Additionally, it provides corporate secretarial, corporate advisory, and all other non-accounting services. The company was founded in 2006 and is headquartered in North Sydney, Australia.",Professional Services,AU,6/21/2017,Kelly Partners Group Holdings Ltd,,,,2.16,98064000.0,Kelly Partners Group Holdings Ltd,A$,Kelly Partners Group Holdings Ltd,Kelly Partners Group Holdings Ltd,,Kelly Partners Group Holdings Ltd,kpg.ax,,,Kelly Partners Group Holdings Ltd,,15510,K
,,KPITTECH.NS,KPIT Technologies Ltd,INR,NSE,Software & Services,"KPIT Technologies Limited, a technology company, provides engineering, embedded software, artificial intelligence, and digital solutions for automobile and mobility industries in the Americas, the United Kingdom, Europe, and internationally. The company offers autonomous driving and ADAS solutions, including system engineering, functional safety, multicore engineering, feature development, annotation and labeling, semantic segmentation, multi sensor, data analytics, feature validation, and virtual and closed loop simulation solutions; and electric and conventional powertrain solutions comprising production software/function development, model based system engineering, and verification and validation solutions. It also operates vehicle infotainment platform and infotainment connectivity platform for connected vehicles; and K-DCP engineering toolchain and K-DCP aftersales suite to provide vehicle diagnostic solutions, as well as K-DCP connected diagnostics solutions. In addition, the company offers integration, and verification and validation services; MCAL and complex device driver development services; and micro controllers supported services, as well as operates AUTOSAR platform. Further, it provides mechatronics solutions, including new product development for NDP/sub systems ownerships, wiring harness, and mechatronics/smart interiors; epowertain solutions for battery packaging, thermal management, and E&E packaging; and knowledge based engineering solutions for design automation-mechanical and electrical, and digital process automation. The company was formerly known as KPIT Engineering Limited and changed its name to KPIT Technologies Limited in March 2019. The company was incorporated in 2018 and is headquartered in Pune, India.",Technology,IN,4/22/2019,KPIT Technologies Ltd,,,,135.65,37173793000.0,KPIT Technologies Ltd,?,KPIT Technologies Ltd,KPIT Technologies Ltd,,KPIT Technologies Ltd,kpittech.ns,,,KPIT Technologies Ltd,,15511,K
,,KPO.AX,Kalina Power Ltd,AUD,ASX,Utilities,"Kalina Power Limited operates as a power company in the United States, Australia, China, and the United Kingdom. It generates power primarily from waste heat, and geothermal and solar thermal sources using its Kalina Cycle technology. The company was formerly known as Enhanced Systems Technologies Limited and changed its name to Kalina Power Limited in June 2015. Kalina Power Limited is headquartered in Hawthorn, Australia.",Utilities,AU,8/2/1971,Kalina Power Ltd,,,,0.052,59468760.0,Kalina Power Ltd,A$,Kalina Power Ltd,Kalina Power Ltd,,Kalina Power Ltd,kpo.ax,,,Kalina Power Ltd,,15512,K
,,KPRMILL.NS,KPR Mill Ltd,INR,NSE,Consumer Durables & Apparel,"K.P.R. Mill Limited, together with its subsidiaries, operates as an integrated apparel manufacturing company in India and internationally. It operates through three segments: Textile, Sugar, and Others. The company offers yarn, and knitted fabrics; and readymade garments comprising casual, sports, active, sleep, and work wear for men and women, as well as kids wear, and men's innerwear products and athleisure products. It also produces sugar; ethanol; green energy through co-gen power; and wind power, as well as acts as a dealer for AUDI cars. The company also exports its products. K.P.R. Mill Limited was founded in 1984 and is based in Coimbatore, India.","Textiles, Apparel & Luxury Goods",IN,8/22/2007,KPR Mill Ltd,,,,918.5,63096910000.0,KPR Mill Ltd,?,KPR Mill Ltd,KPR Mill Ltd,,KPR Mill Ltd,kprmill.ns,,,KPR Mill Ltd,,15513,K
,,KPT.AX,Kangaroo Island Plantation Timbers Ltd,AUD,ASX,Materials,"Kangaroo Island Plantation Timbers Ltd. is engaged in management of forestry. The company is headquartered in Adelaide, South Australia and currently employs 10 full-time employees. The firm operates through forestry management segment, which primarily involves the management of timber plantations and milling operations. The firm owns approximately 8,000 hectares of productive Kangaroo Island land, approximately half of which is planted with either softwood (radiata pine) or hardwood (eucalyptus globulus and eucalyptus nitens) and over half of which is either cleared or contains native vegetation. The firm also owns Kangaroo Island's only sawmill and owns land at Smith Bay, which is suitable for the development of a log or chip export facility. The firm's subsidiaries include Cineria Pty Ltd and APR Pty Ltd.",Paper & Forest,AU,7/8/2002,Kangaroo Island Plantation Timbers Ltd,,,,1.025,57824860.0,Kangaroo Island Plantation Timbers Ltd,A$,Kangaroo Island Plantation Timbers Ltd,Kangaroo Island Plantation Timbers Ltd,,Kangaroo Island Plantation Timbers Ltd,kpt.ax,,,Kangaroo Island Plantation Timbers Ltd,,15514,K
