Column1,index,symbol,long name,currency,exchange,industry,description,sector,country,ipo date,shorter name,Type,Industries,Similar Companies,price,mktCap,name raw,currency symbol,robinhood name,short name,Warrant,shortest name,url name, smart_order ,random csv equations,pure name,shortest - pure diff,order,first_letter
,,NICL.L,Nichols PLC,GBP,LSE,"Food, Beverage & Tobacco","Nichols plc, together with its subsidiaries, supplies soft drinks to the retail, wholesale, catering, licensed, and leisure industries in the United Kingdom. The company operates through two segments, Still and Carbonate. It offers still, cordial, carbonated, post-mix, and frozen drinks categories under the Vimto, Feel Good, Levi Roots, Starslush, ICEE, and Sunkist brands. The company offers its products through supermarkets, discount retailers, cash and carries, pubs, clubs, bars, restaurants, and leisure outlets. It also exports its products to the Middle East, Africa, and internationally. The company was founded in 1908 and is headquartered in Newton-le-Willows, the United Kingdom.",Beverages,GB,1/9/1986,Nichols PLC,,,,1222.5,452839680.0,Nichols PLC,,Nichols PLC,Nichols PLC,,Nichols PLC,nicl.l,,,Nichols PLC,,16569,N
,,NID,Nuveen Intermediate Duration Municipal Term Fund,USD,NYSE,Asset Management,"Nuveen Intermediate Duration Municipal Term Fund is a diversified, closed-end management investment company. The Fund seeks to provide a high level of current income exempt from regular federal income tax with a secondary objective of seeking additional total return. The Fund also maintains a portfolio with an intermediate duration of between 3 and 10 years (including the effects of leverage). Under normal circumstances, the Fund will invest approximately 80% of its managed assets in municipal securities and other related investments, the income from which is exempt from regular federal income tax. The Fund will invest approximately 50% of its managed assets in investment grade municipal securities, and it also may invest in below investment grade securities. The Fund's portfolio of investments includes utilities, healthcare, transportation, and education and civic organizations. Its investment advisor is Nuveen Fund Advisors, LLC. Its sub-advisor is Nuveen Asset Management, LLC.",Financial Services,US,12/6/2012,Nuveen Intermediate Duration Municipal Term Fund,,,,14.19,665648640.0,Nuveen Intermediate Duration Municipal Term Fund,$,Nuveen Intermediate Duration Municipal Term Fund,Nuveen Intermediate Duration Municipal Term Fund,,Nuveen Intermediate Duration Municipal Term Fund,nid,,,Nuveen Intermediate Duration Municipal Term Fund,,16570,N
,,NIE,AllianzGI Equity & Convertible Income Fund,USD,NYSE,Asset Management,"AllianzGI Equity & Convertible Income Fund (the Fund) is a diversified closed-end management investment company. The Fund's primary investment objective is to seek total return consisting of capital appreciation, current income and gains. The Fund seeks to achieve its investment objective by investing in a combination of convertible securities, debt and other income-producing instruments and common stocks and other equity securities. The Fund may also write (sell) call options on the equity securities held by the Fund, as well as on equity indexes. The Fund invests in a range of industries, including aerospace and defense, automobiles, beverages, biotechnology, chemicals, computers and peripherals, communications equipment, electric utilities, food and staples retailing, healthcare equipment and supplies, diversified telecommunication services, Internet software and services, media and others. Allianz Global Investors Fund Management LLC is the investment manager of the Fund.",Financial Services,US,2/23/2007,AllianzGI Equity & Convertible Income Fund,,,,29.7,822957310.0,AllianzGI Equity & Convertible Income Fund,$,AllianzGI Equity & Convertible Income Fund,AllianzGI Equity & Convertible Income Fund,,AllianzGI Equity & Convertible Income Fund,nie,,,AllianzGI Equity & Convertible Income Fund,,16571,N
,,NIHK,"Video River Networks, Inc.",USD,PNK,Real Estate,"Video River Networks, Inc., a specialty real estate holding company, focuses on the acquisition, ownership, and management of specialized industrial properties. The company was formerly known as Nighthawk Systems, Inc. and changed its name to Video River Networks, Inc. in March 2011. Video River Networks, Inc. is based in Torrance, California.",Real Estate,US,,"Video River Networks, Inc.",,,,0.068,11554697.0,"Video River Networks, Inc.",$,"Video River Networks, Inc.","Video River Networks, Inc.",,"Video River Networks, Inc.",nihk,,,"Video River Networks, Inc.",,16572,N
,,NIIN.DE,Niiio Finance Group AG,EUR,XETRA,Software & Services,"niiio finance group AG provides software-as-a-service solutions for banks and financial service providers. It offers cloud services from portfolio management systems to robo-advisors, as well as banking API suite. The company is based in Görlitz, Germany.",Technology,DE,8/15/2017,Niiio Finance Group AG,,,,1.51,33637060.0,Niiio Finance Group AG,,Niiio Finance Group AG,Niiio Finance Group AG,,Niiio Finance Group AG,niin.de,,,Niiio Finance Group AG,,16573,N
,,NIITLTD.NS,NIIT Ltd,INR,NSE,Software & Services,"NIIT Limited provides training and development solutions to individuals, corporations, and institutions worldwide. The company offers managed training services, such as custom curriculum design and content development, learning administration and technology, learning delivery, strategic sourcing, and advisory services; and learning and talent development programs in banking, finance and insurance, retail sales enablement, management education, multi-sectoral vocational skills, digital media marketing, and programs in digital transformation technologies. Its brands portfolio comprises the training.com, a learning platform for career programs; Talent Pipeline as a Service, a just-in-time job ready talent for organization; NIIT.tv, a digital learning platform; NIIT international of finance banking and insurance training limited designed for banking, insurance, and financial services; NIIT Imperia, which provides management programs in marketing, sales, finance, operations, HR, law, brand and advertising, international and digital marketing and business, strategy, general management, taxation, and IT areas; and NIIT UNIQUA that offers outsourcing of training solutions for the BPM industry. The company's brands portfolio also includes NIIT NGuru that offers various learning solutions for schools comprising interactive classrooms for teachers, as well as math lab, mobile science labs, IT wizard programs, and learning labs for students; and Practice Plus, a platform for assessment solution of learning, as well as Quick School, an education resource planning solution. In addition, it provides StackRoute, which focuses on creating programmers; and DigiNxt that addresses the opportunities for digital transformation needs of the IT industry. The company was founded in 1981 and is headquartered in Gurugram, India.",Technology,IN,2/1/1993,NIIT Ltd,,,,192.8,27422910500.0,NIIT Ltd,?,NIIT Ltd,NIIT Ltd,,NIIT Ltd,niitltd.ns,,,NIIT Ltd,,16575,N
,,NIITTECH.NS,NIIT Technologies Ltd,INR,NSE,Software & Services,"NIIT Technologies Ltd. engages in the provision of computer programing and consultancy services. The company is headquartered in Noida, Uttar Pradesh and currently employs 9,207 full-time employees. The firm is engaged in application development and maintenance, managed services, cloud computing and business process outsourcing to organizations in several sectors such as banking and financial services, insurance, travel and transportation and logistics, manufacturing and distribution and government. The firm is combined with capabilities in data and analytics, automation, cloud and digital, is enabling to drive business transformation. The firm offers Tron intelligent automation, digital process transformation, application services, business process services, cyber security, among others. The company serves industries such as travel and transportation, insurance, banking and financial services and enterprise services.",Technology,IN,8/30/2004,NIIT Technologies Ltd,,,,2013.8,122000000000.0,NIIT Technologies Ltd,?,NIIT Technologies Ltd,NIIT Technologies Ltd,,NIIT Technologies Ltd,niittech.ns,,,NIIT Technologies Ltd,,16576,N
,,NILAINFRA.NS,Nila Infrastructures Ltd,INR,NSE,Capital Goods,"Nila Infrastructures Limited constructs and develops infrastructure and real estate projects in India. The company is involved in the construction of civic urban infrastructure projects, including bus stations, multilevel parking, medical college, bus port, office complex, community hall, and other projects. It also develops residential real estate properties, such as flats and apartments; and leases commercial properties. The company was incorporated in 1990 and is based in Ahmedabad, India.",Construction,IN,4/4/1995,Nila Infrastructures Ltd,,,,5.9,2308192260.0,Nila Infrastructures Ltd,?,Nila Infrastructures Ltd,Nila Infrastructures Ltd,,Nila Infrastructures Ltd,nilainfra.ns,,,Nila Infrastructures Ltd,,16577,N
,,NILASPACES.NS,Nila Spaces Ltd,INR,NSE,Real Estate,"Nila Spaces Limited engages in the real estate development activities. It is involved in the construction and development of buildings for sale and other real estate activities. The company was formerly known as Parmananday Superstructure Limited and changed its name to Nila Spaces Limited in November 2017. Nila Spaces Limited was incorporated in 2000 and is headquartered in Ahmedabad, India.",Real Estate,IN,12/28/2018,Nila Spaces Ltd,,,,1.75,673987970.0,Nila Spaces Ltd,?,Nila Spaces Ltd,Nila Spaces Ltd,,Nila Spaces Ltd,nilaspaces.ns,,,Nila Spaces Ltd,,16578,N
,,NILKAMAL.NS,Nilkamal Ltd,INR,NSE,Materials,"Nilkamal Limited, together with its subsidiaries, manufactures and sells plastic products primarily in India. It operates in two segments, Plastics; and Lifestyle Furniture, Furnishings and Accessories. The company offers various material handling products, including plastic crates and pallets, insulated ice boxes and fish tubs, waste management tools, road safety products, hospitality solutions, aquaculture fish cages, manhole chambers, ripening solutions, material handling equipment, and metal shelving and racking systems. It also provides home, office, education, health care, and CSR furniture in various materials, as well as upholstered products; plastic chairs and mattresses; and polyproplyne structured boards, which is used in construction, automotive, steelworks, furniture, F&B, advertising, décor, and logistics industries for protection, packaging, printing, and paneling. As of March 31, 2020, the company operated 26 retail stores under the @home brand name, as well as 40 Nilkamal furniture Ideas stores. The company sells its products through retail stores, dealers' outlets and institutions, and online shopping sites. It also exports its products to approximately 30 countries. Nilkamal Limited was founded in 1934 and is headquartered in Mumbai, India.",Packaging,IN,2/18/1991,Nilkamal Ltd,,,,1879.8,28064475100.0,Nilkamal Ltd,?,Nilkamal Ltd,Nilkamal Ltd,,Nilkamal Ltd,nilkamal.ns,,,Nilkamal Ltd,,16579,N
,,NIMU,"Non-Invasive Monitoring Systems, Inc.",USD,PNK,Shell Companies,"Non-Invasive Monitoring Systems, Inc. does not have significant operations. Previously, it was involved in the research, development, manufacture, marketing, and sales of non-invasive, motorized, and whole body periodic acceleration platforms. The company was incorporated in 1980 and is based in Miami, Florida.",Financial Services,US,,"Non-Invasive Monitoring Systems, Inc.",,,,0.05,7740550.0,"Non-Invasive Monitoring Systems, Inc.",$,"Non-Invasive Monitoring Systems, Inc.","Non-Invasive Monitoring Systems, Inc.",,"Non-Invasive Monitoring Systems, Inc.",nimu,,,"Non-Invasive Monitoring Systems, Inc.",,16580,N
,,NIOBF,NioCorp Developments Ltd.,USD,PNK,Other Industrial Metals & Mining,"NioCorp Developments Ltd. explores for and develops mineral deposits in North America. It owns and develops the Elk Creek niobium/scandium/titanium project located in Southeastern Nebraska. The company was formerly known as Quantum Rare Earth Developments Corp. and changed its name to NioCorp Developments Ltd. in March 2013. NioCorp Developments Ltd. was incorporated in 1987 and is headquartered in Centennial, Colorado.",Basic Materials,US,,NioCorp Developments Ltd.,,,,0.56,133626080.0,NioCorp Developments Ltd.,$,NioCorp Developments Ltd.,NioCorp Developments Ltd.,,NioCorp Developments Ltd.,niobf,,,NioCorp Developments Ltd.,,16581,N
,,NI-PB,NiSource Inc.,USD,NYSE,Utilities,"NiSource Inc., an energy holding company, operates as a regulated natural gas and electric utility company in the United States. The company operates through two segments, Gas Distribution Operations and Electric Operations. It provides natural gas service and transportation for residential, commercial, and industrial customers; generates, transmits, and distributes electricity; and wholesale and transmission transaction services. The company owns and operates two coal-fired electric generating stations with a capacity of 2,080 megawatts (MW); combined cycle gas turbine with a capacity of 571 MW; three gas-fired generating units with a capacity of 186 MW; and two hydroelectric generating plants with a capacity of 10 MW. It serves approximately 3.5 million natural gas customers in Ohio, Pennsylvania, Virginia, Kentucky, Maryland, and Massachusetts; and 476,000 electricity customers in the northern part of Indiana. The company was formerly known as NIPSCO Industries, Inc. and changed its name to NiSource Inc. in April 1999. NiSource Inc. was founded in 1847 and is headquartered in Merrillville, Indiana.",Utilities,US,,NiSource Inc.,,,,27.94,11506139100.0,NiSource Inc.,$,NiSource Inc.,NiSource Inc.,,NiSource Inc.,ni-pb,,,NiSource Inc.,,16582,N
,,NIPNF,NEC Corporation,JPY,PNK,Information Technology Services,"NEC Corporation operates as a provider of information and communication technology solutions in Japan and internationally. The company operates in six segments: Public Solutions, Public Infrastructure, Enterprise, Network Services, System Platform, and Global. It provides systems integration services, such as systems implementation and consulting; maintenance and support services; outsourcing and cloud services; and system equipment. The company also offers network infrastructure products, including core network equipment, mobile phone base stations, optical transmission systems, and routers and switches; wireless LAN routers; and enterprise network solutions comprising IP telephony systems, WAN/wireless access equipment, and LAN products. In addition, it provides hardware products, such as servers, mainframes, supercomputers, storage products, business and personal computers, point-of-sale systems, automatic teller machines, control equipment, and wireless LAN routers; software products, including integrated operation management, middleware, and security and database software; and maintenance services. Further, the company offers software services for service providers consisting of operation support system/business support system, software-defined networking, and network functions virtualization; submarine systems comprising submarine cable and ocean observation systems; wireless backhaul solutions; displays and projectors; and energy storage solutions. It serves aerospace, defense, media, manufacturing, retail, financial, and telecommunication industries, as well as government entities, medical institutions, and medium-sized enterprises. NEC Corporation has collaboration with Analog Devices, Inc. to provide 5G O-RAN Massive MIMO Radio for Rakuten Mobile. The company was formerly known as Nippon Electric Company, Limited and changed its name to NEC Corporation in April 1983. NEC Corporation was founded in 1899 and is headquartered in Tokyo, Japan.",Technology,JP,,NEC Corporation,,,,53.68,15466926080.0,NEC Corporation,JPY,NEC Corporation,NEC Corporation,,NEC Corporation,nipnf,,,NEC Corporation,,16583,N
,,NIPPOBATRY.NS,Indo National Ltd,INR,NSE,Capital Goods,"Indo National Limited, together with its subsidiaries, manufactures and distributes dry cell batteries and lighting products in India. It offers AA, AAA, C&D, alkaline, and 9V batteries; torches; and emergency power backup products, as well as mosquito bats. The company also provides square LED downlights, rechargeable bulb, pulsar linear, head lamp, LED tubelights, LED bulbs, LED flood lights, and grid based LED street lights. In addition, it offers razors and blades under DORCO brand, electrical accessories, and other FMCG products. The company was formerly known as Nippo Batteries Co. Ltd. and changed its name to Indo National Limited in April 2013. Indo National Limited was founded in 1972 and is headquartered in Chennai, India.",Electrical Equipment,IN,3/15/2002,Indo National Ltd,,,,703.25,2639571460.0,Indo National Ltd,?,Indo National Ltd,Indo National Ltd,,Indo National Ltd,nippobatry.ns,,,Indo National Ltd,,16584,N
,,NITCO.NS,Nitco Ltd,INR,NSE,Capital Goods,"NITCO Limited, together with its subsidiaries, manufactures and sells floor and wall solutions in India. The company operates through two segments, Tiles and Other Related Products; and Real Estate segments. It offers ceramic wall and floor tiles; polished and glazed vitrified tiles; and vitrified DCH, heavy duty, and SST tiles. The company sells its products through approximately 2,000 sub dealers and 500 direct dealers; and operates 11 display centers under the Le Studio brand name, as well as 95 showrooms as franchisees under the Le Studio Express and Nitco Look names. In addition, NITCO Limited exports its products to Nepal, South Africa, the United Arab Emirates, Belgium, Ireland, Thailand, Bahrain, Uganda, Seychelles, Botswana, Zambia, Maldives, Poland, Qatar, Australia, Bhutan, Kenya, Ethiopia, Singapore, Kuwait, Taiwan, Tanzania, Fiji, Canada, and internationally. Further, the company develops real estate projects. NITCO Limited was founded in 1953 and is headquartered in Mumbai, India.",Building,IN,4/14/2006,Nitco Ltd,,,,23.5,1685253120.0,Nitco Ltd,?,Nitco Ltd,Nitco Ltd,,Nitco Ltd,nitco.ns,,,Nitco Ltd,,16585,N
,,NITINFIRE.NS,Nitin Fire Protection Industries Ltd,INR,NSE,Capital Goods,"Nitin Fire Protection Industries Limited manufactures and sells firefighting equipment under the NITIE brand in India and internationally. The company provides ABC, DCP, CO2, clean agent, foam, automatic modular, water, and K type fire extinguishers; gaseous fire suppression systems; kitchen fire suppression systems; fire detection and alarm systems; fire sprinkler systems; vehicle protection systems; fire pumps; foam equipment and compounds; wet and dry riser systems; emergency luminaires; and special hazards systems. It also offers turnkey solutions, including procurement, design, system integration, commissioning, and installation of firefighting systems. The company exports its products to the United Arab Emirates, South Asia, and European countries. The company was formerly known as Nitin Industries and changed its name to Nitin Fire Protection Industries Limited in 1995. Nitin Fire Protection Industries Limited was founded in 1980 and is based in Mumbai, India.",Machinery,IN,6/5/2007,Nitin Fire Protection Industries Ltd,,,,0.6,181207200.0,Nitin Fire Protection Industries Ltd,?,Nitin Fire Protection Industries Ltd,Nitin Fire Protection Industries Ltd,,Nitin Fire Protection Industries Ltd,nitinfire.ns,,,Nitin Fire Protection Industries Ltd,,16586,N
,,NITINSPIN.NS,Nitin Spinners Ltd,INR,NSE,Consumer Durables & Apparel,"Nitin Spinners Limited manufactures and sells cotton yarns and knitted fabrics in India. The company offers open end, multifold open end, ring spun combed, multifold ring spun, compact ring spun combed, multi-fold compact ring spun, fancy slub, compact fancy slub, core spun, compact core Spun, S and Z twist, organic cotton, contamination free, zero and eli twist, and certified yarns, as well as dye able cheese/cones used in woven and knitted apparel, furnishing fabrics, denims, terry towel, medical fabrics, tea bags, and bed linen. It also provides single jersey, pique structured, interlock structured, rib structured, lycra blended, open width, and three thread fleece fabrics used in inner, sports, comfort, winter, and baby wears, as well as masks. In addition, the company offers finished and printed woven fabrics used in fashion and image, industrial and protective, and defense wears, as well as uniforms and health care and hotel apparels. It also exports its products in Europe, North America, South America, Africa, and Asia. The company was founded in 1992 and is headquartered in Bhilwara, India.","Textiles, Apparel & Luxury Goods",IN,1/27/2006,Nitin Spinners Ltd,,,,78.35,4414113800.0,Nitin Spinners Ltd,?,Nitin Spinners Ltd,Nitin Spinners Ltd,,Nitin Spinners Ltd,nitinspin.ns,,,Nitin Spinners Ltd,,16587,N
,,NJMC,New Jersey Mining Company,USD,PNK,Gold,"New Jersey Mining Company explores for, develops, and extracts gold, silver, and base metal resources in the Greater Coeur d'Alene Mining District of North Idaho and Western Montana. The company focuses on mining and milling of ore from its 100% owned the Golden Chest Mine that consists of 25 patented mining claims covering 280 acres and 90 unpatented claims mine covering 1,390 acres located in Murray, Idaho. New Jersey Mining Company was founded in 1996 and is headquartered in Coeur d'Alene, Idaho.",Basic Materials,US,,New Jersey Mining Company,,,,0.24,32879520.0,New Jersey Mining Company,$,New Jersey Mining Company,New Jersey Mining Company,,New Jersey Mining Company,njmc,,,New Jersey Mining Company,,16588,N
,,NKE.DE,Nike Inc,EUR,XETRA,Consumer Durables & Apparel,"NIKE, Inc., together with its subsidiaries, designs, develops, markets, and sells athletic footwear, apparel, equipment, and accessories worldwide. The company offers NIKE brand products in six categories, including running, NIKE basketball, the Jordan brand, football, training, and sportswear. It also markets products designed for kids, as well as for other athletic and recreational uses, such as American football, baseball, cricket, golf, lacrosse, skateboarding, tennis, volleyball, walking, wrestling, and other outdoor activities; and apparel with licensed college and professional team and league logos, as well as sells sports apparel. In addition, the company sells a line of performance equipment and accessories comprising bags, socks, sport balls, eyewear, timepieces, digital devices, bats, gloves, protective equipment, and other equipment for sports activities; and various plastic products to other manufacturers. Further, it provides athletic and casual footwear, apparel, and accessories under the Jumpman trademark; casual sneakers, apparel, and accessories under the Converse, Chuck Taylor, All Star, One Star, Star Chevron, and Jack Purcell trademarks; and action sports and youth lifestyle apparel and accessories under the Hurley trademark. Additionally, the company licenses agreements that permit unaffiliated parties to manufacture and sell apparel, digital devices, and applications and other equipment for sports activities under NIKE-owned trademarks. It sells its products to footwear stores; sporting goods stores; athletic specialty stores; department stores; skate, tennis, and golf shops; and other retail accounts through NIKE-owned retail stores, digital platforms, independent distributors, licensees, and sales representatives. The company was formerly known as Blue Ribbon Sports, Inc. and changed its name to NIKE, Inc. in 1971. NIKE, Inc. was founded in 1964 and is headquartered in Beaverton, Oregon.","Textiles, Apparel & Luxury Goods",US,10/17/1990,Nike Inc,,,,117.48,185000000000.0,Nike Inc,,Nike Inc,Nike Inc,,Nike Inc,nke.de,,,Nike Inc,,16589,N
,,NKHP.ME,Novorossiyskiy Kombinat Khleboproduktov PAO,RUB,MCX,Transportation,"Public Joint Stock Company Novorossyisk Grain Plant owns and operates grain terminals in Russia. The company provides grain cargo transshipment, warehouse, and berthing services. It also engages in processing wheat flour. The company is based in Novorossiysk, Russia.",Transportation Infrastructure,RU,11/13/2015,Novorossiyskiy Kombinat Khleboproduktov PAO,,,,369.0,24943292400.0,Novorossiyskiy Kombinat Khleboproduktov PAO,RUB,Novorossiyskiy Kombinat Khleboproduktov PAO,Novorossiyskiy Kombinat Khleboproduktov PAO,,Novorossiyskiy Kombinat Khleboproduktov PAO,nkhp.me,,,Novorossiyskiy Kombinat Khleboproduktov PAO,,16590,N
,,NKIND.NS,N K Industries Ltd,INR,NSE,"Food, Beverage & Tobacco","N.K Industries Limited manufactures, sells, and trades in castor oil and its derivatives in India. Its products include commercial grade castor oil, cold pressed castor oil, castor oil British Pharma 93 grade, castor Hi protein, first pressed degummed castor oil, pale pressed grade, sodium sulphate anhydrous, refined castor oil, crude glycerin, de oiled cakes-castor meals, 12-hydroxy stearic acid, ricinoleic acid, hydrogenated castor oil flakes/powder, and high protein castor meal. The company also serves customers in Asia, Africa, Europe, the United States, and South America. N.K Industries Limited was incorporated in 1987 and is based in Ahmedabad, India.",Food Products,IN,8/8/1994,N K Industries Ltd,,,,17.85,102113608.0,N K Industries Ltd,?,N K Industries Ltd,N K Industries Ltd,,N K Industries Ltd,nkind.ns,,,N K Industries Ltd,,16591,N
